id,observed_on,time_observed_at,time_zone,user_id,user_name,created_at,updated_at,quality_grade,license,image_url,tag_list,description,num_identification_agreements,num_identification_disagreements,captive_cultivated,oauth_application_id,place_guess,latitude,longitude,positional_accuracy,private_place_guess,private_latitude,private_longitude,public_positional_accuracy,geoprivacy,taxon_geoprivacy,positioning_device,species_guess,scientific_name,common_name,iconic_taxon_name,taxon_id
124513,8/8/09,2009-08-08 21:50:00 UTC,Pacific Time (US & Canada),8641,John Brew,2012-09-18 02:24:50 UTC,2022-04-24 15:01:07 UTC,research,CC-BY,https://inaturalist-open-data.s3.amazonaws.com/photos/176714/medium.jpg,,"Larches at Headlight Basin

i090909 338",2,0,FALSE,,"Washington, United States",47.467528,-120.940589,,,,,,,open,,Subalpine larch,Larix lyallii,subalpine larch,Plantae,69848
828808,8/9/14,2014-08-09 21:23:37 UTC,Pacific Time (US & Canada),14665,,2014-08-13 00:08:51 UTC,2023-03-08 23:08:08 UTC,research,CC-BY-NC,https://inaturalist-open-data.s3.amazonaws.com/photos/1046104/medium.jpg,,,2,0,FALSE,3,"North Cascades National Park, Skagit County, North Cascades National Park Service Complex, US-WA, US",48.572009,-120.845493,5,,,,5,,open,,subalpine larch,Larix lyallii,subalpine larch,Plantae,69848
895936,9/19/14,2014-09-19 19:45:34 UTC,Eastern Time (US & Canada),4062,Christopher B.,2014-09-26 17:15:17 UTC,2024-06-27 06:20:27 UTC,research,CC-BY,https://static.inaturalist.org/photos/1139834/medium.JPG,,Larch tree overlooking Lake Louise,1,0,FALSE,,"The Beehive, Banff National Park, Alberta, Canada",51.412899,-116.243237,41,,,,41,,,,subalpine larch,Larix lyallii,subalpine larch,Plantae,69848
895950,9/19/14,2014-09-19 19:55:12 UTC,Eastern Time (US & Canada),4062,Christopher B.,2014-09-26 17:30:54 UTC,2024-06-27 06:20:13 UTC,research,CC-BY,https://static.inaturalist.org/photos/1139855/medium.JPG,,,1,0,FALSE,,"Lake Agnes, Banff National Park, Alberta, Canada",51.412852,-116.246451,20,,,,20,,,,subalpine larch,Larix lyallii,subalpine larch,Plantae,69848
1397296,9/9/14,2014-09-09 18:18:56 UTC,Pacific Time (US & Canada),81291,Steve Tuckerman,2015-04-16 03:55:52 UTC,2017-09-21 16:41:24 UTC,research,CC-BY,https://inaturalist-open-data.s3.amazonaws.com/photos/1727631/medium.JPG,,OLYMPUS DIGITAL CAMERA         ,1,0,FALSE,,"Chelan County, US-WA, US",48.507592,-120.672197,88,,,,88,,,,Subalpine larch,Larix lyallii,subalpine larch,Plantae,69848
1470242,9/9/14,2014-09-09 17:40:11 UTC,Pacific Time (US & Canada),81291,Steve Tuckerman,2015-05-09 21:28:30 UTC,2019-07-20 23:29:34 UTC,research,CC-BY,https://inaturalist-open-data.s3.amazonaws.com/photos/1822640/medium.JPG,,Western Larch grove near Early Winter Spires in the North Cascades.,1,0,FALSE,,"Chelan County, US-WA, US",48.514899,-120.666618,175,,,,175,,open,,subalpine larch,Larix lyallii,subalpine larch,Plantae,69848
1662586,6/20/15,2015-06-20 23:54:32 UTC,Pacific Time (US & Canada),8641,John Brew,2015-06-22 05:12:58 UTC,2016-05-07 02:53:37 UTC,research,CC-BY,https://inaturalist-open-data.s3.amazonaws.com/photos/2032363/medium.jpg,,"A forest of subalpine larch (Larix lyallii) surround this tarn
Raven Ridge 2618 meters (8590 feet) overlooks the scene.
Elevation 2250 meters (7380 feet)
near a large tarn near Libby Lake Trail 415
Lake Chelan-Sawtooth Wilderness
IMG_20150620_165432",1,0,FALSE,,"Washington, United States",48.247433,-120.336242,,,,,,,,,Larix lyallii,Larix lyallii,subalpine larch,Plantae,69848
1686984,6/20/15,2015-06-20 16:58:53 UTC,Pacific Time (US & Canada),8641,John Brew,2015-06-25 01:43:42 UTC,2016-05-07 02:47:10 UTC,research,CC-BY,https://inaturalist-open-data.s3.amazonaws.com/photos/2044972/medium.jpg,,"Larix lyallii
Subalpine Larch
Elevation 2250 meters (7400 feet)
Libby Lake Trail 415
Lake Chelan-Sawtooth Wilderness
IMG_20150620_095853",1,0,FALSE,,"Washington, United States",48.252079,-120.333856,,,,,,,,,Subalpine larch,Larix lyallii,subalpine larch,Plantae,69848
1887241,8/15/15,,Auckland,58459,Katy Johns,2015-08-24 08:48:39 UTC,2018-10-04 15:24:46 UTC,research,CC-BY-NC,https://inaturalist-open-data.s3.amazonaws.com/photos/2301012/medium.JPG,,,1,0,FALSE,,"Cathedral Lakes, BC",49.056188,-120.207611,323,,,,323,,,,Subalpine larch,Larix lyallii,subalpine larch,Plantae,69848
1890161,8/15/15,,Auckland,58459,Katy Johns,2015-08-25 05:47:20 UTC,2022-01-12 01:59:31 UTC,research,CC-BY-NC,https://inaturalist-open-data.s3.amazonaws.com/photos/2305070/medium.JPG,,Small egg-shaped seed cones are reddish yellow when young with prominent bracts,1,0,FALSE,,"Cathedral Lakes, BC",49.056188,-120.207611,323,,,,323,,,,Subalpine larch,Larix lyallii,subalpine larch,Plantae,69848
2075615,10/3/15,,Pacific Time (US & Canada),104905,Joan Septembre,2015-10-05 04:03:59 UTC,2020-12-05 21:51:55 UTC,research,CC-BY-NC-ND,https://static.inaturalist.org/photos/2480679/medium.JPG,"larch, Manning Park, Larch Meadows, British Columbia, Frosty Mountain, Sub-alpine Larch, trees",Hiked up to Larch Meadows yesterday.  It is very beautiful in fall colors!! They say that some of the trees in this meadow are at least 2000 years old.  Pretty incredible.,6,0,FALSE,,"Manning Park, BC",49.014004,-120.833215,,,,,,,open,,subalpine larch,Larix lyallii,subalpine larch,Plantae,69848
3827588,8/3/16,2016-08-03 19:05:44 UTC,Hawaii,46945,T. Abe Lloyd,2016-08-07 22:32:28 UTC,2020-07-11 19:12:35 UTC,research,CC-BY-NC,https://inaturalist-open-data.s3.amazonaws.com/photos/4476506/medium.jpeg,Conifer,,3,1,FALSE,,"Whatcom County, US-WA, US",48.759207,-120.858027,43,,,,43,,open,,subalpine larch,Larix lyallii,subalpine larch,Plantae,69848
3851647,8/3/16,2016-08-03 17:00:00 UTC,Pacific Time (US & Canada),278871,,2016-08-10 16:18:01 UTC,2023-03-12 19:42:47 UTC,research,CC-BY-NC,https://inaturalist-open-data.s3.amazonaws.com/photos/4510849/medium.jpg,,,5,2,FALSE,,"Whatcom County, US-WA, US",48.76701,-120.856468,,,,,,,open,,subalpine larch,Larix lyallii,subalpine larch,Plantae,69848
3889930,8/3/16,2016-08-03 17:00:07 UTC,Pacific Time (US & Canada),280287,,2016-08-15 03:57:29 UTC,2023-03-15 06:43:34 UTC,research,CC-BY-NC,https://inaturalist-open-data.s3.amazonaws.com/photos/4567355/medium.jpg,,Found growing in an alpine parkland ecotone. There were a large number of larch's growing within the same area. ,5,2,FALSE,3,"Okanogan-Wenatchee National Forest, National Forest/Park, WA, US",48.76435415,-120.8557878,346,,,,346,,open,,subalpine larch,Larix lyallii,subalpine larch,Plantae,69848
4269053,10/2/16,2016-10-02 20:49:21 UTC,Pacific Time (US & Canada),51931,Zach Hawn,2016-10-04 17:16:54 UTC,2023-03-17 17:48:00 UTC,research,CC-BY-NC,https://inaturalist-open-data.s3.amazonaws.com/photos/5111516/medium.jpg,,,5,1,FALSE,,Lake Ingalls,47.46541,-120.941598,55,,,,55,,open,manual,western larch,Larix lyallii,subalpine larch,Plantae,69848
4293329,9/28/16,2016-09-28 04:23:00 UTC,Wellington,151532,Danilo Hegg,2016-10-07 21:59:53 UTC,2016-10-13 18:09:57 UTC,research,,https://static.inaturalist.org/photos/5149404/medium.jpg,"Company Creek, Devore Peak, Lake Chelan National Recreation Area, Larix lyallii, USA, United States, Washington State, alpine larch, flora, larch, subalpine larch","Subalpine larch (Larix lyallii) displaying fall colours. Devore Peak, Lake Chelan National Recreation Area, WA.",1,0,FALSE,,"Devore Peak, WA, USA",48.28173667,-120.7723617,,,,,,,,,Subalpine larch,Larix lyallii,subalpine larch,Plantae,69848
7267712,7/16/17,,Pacific Time (US & Canada),323802,judith holm,2017-07-29 22:11:07 UTC,2017-09-25 00:11:41 UTC,research,CC-BY-NC-ND,https://inaturalist-open-data.s3.amazonaws.com/photos/9393585/medium.jpeg,,,1,0,FALSE,,"Cathedral Provincial Park,British Columbia, CA",49.06145,-120.205107,348,,,,348,,,,Subalpine larch,Larix lyallii,subalpine larch,Plantae,69848
7383032,6/4/17,2017-06-04 19:32:00 UTC,Mountain Time (US & Canada),449500,Blake Weis,2017-08-06 22:22:44 UTC,2018-10-04 16:50:38 UTC,research,CC-BY-NC,https://inaturalist-open-data.s3.amazonaws.com/photos/9580644/medium.jpg,,,1,0,FALSE,,"Division No. 15, AB, Canada",50.93668817,-115.2940893,374,,,,374,,,,subalpine larch,Larix lyallii,subalpine larch,Plantae,69848
7447916,8/3/17,2017-08-03 18:36:51 UTC,Pacific Time (US & Canada),548599,Leanne Elizabeth Young,2017-08-11 15:47:12 UTC,2023-03-08 23:08:33 UTC,research,,https://static.inaturalist.org/photos/9685438/medium.jpeg,,,2,0,FALSE,2,"NF-374, Winthrop, WA 98862, USA",48.74961429,-120.8787217,11007,,,,11007,,open,gps,subalpine larch,Larix lyallii,subalpine larch,Plantae,69848
7479344,8/3/17,2017-08-03 18:29:31 UTC,Pacific Time (US & Canada),534288,Jonathan Flynn,2017-08-13 18:52:43 UTC,2023-03-08 23:08:34 UTC,research,,https://static.inaturalist.org/photos/9737188/medium.jpg,,,2,0,FALSE,3,"Okanogan-Wenatchee National Forest, National Forest/Park, WA, US",48.75884454,-120.8584681,40,,,,40,,open,,subalpine larch,Larix lyallii,subalpine larch,Plantae,69848
7488152,8/3/17,2017-08-03 18:28:00 UTC,Pacific Time (US & Canada),548590,Gina O'Kelley,2017-08-14 04:21:47 UTC,2023-03-12 18:23:12 UTC,research,CC-BY-NC,https://inaturalist-open-data.s3.amazonaws.com/photos/9748121/medium.jpeg,,Several individuals about 30ft tall growing above trees of other species on a west facing slope. ,3,1,FALSE,,"Whatcom County, WA, USA",48.76401002,-120.8554834,8,,,,8,,open,,subalpine larch,Larix lyallii,subalpine larch,Plantae,69848
7495164,8/3/17,2017-08-03 18:29:39 UTC,Pacific Time (US & Canada),547217,,2017-08-14 18:43:42 UTC,2024-07-04 02:35:40 UTC,research,,https://static.inaturalist.org/photos/9763606/medium.jpg,,"Growing along western slope in small group, ~30 ft tall",5,2,FALSE,3,"Okanogan-Wenatchee National Forest, National Forest/Park, WA, US",48.75933,-120.8581083,,,,,,,open,,subalpine larch,Larix lyallii,subalpine larch,Plantae,69848
7551180,7/16/17,2017-07-16 20:51:02 UTC,Mountain Time (US & Canada),504473,,2017-08-19 03:04:30 UTC,2021-02-28 03:17:54 UTC,research,CC0,https://static.inaturalist.org/photos/9855696/medium.jpeg,,There are a number of large dead alpine larch including one with a dead top. What could be killing them?  NE aspect.  Thompson Seaton  Trail.,1,0,FALSE,2,"Flathead County, US-MT, US",48.86151608,-114.6534983,13,,,,13,,,,subalpine larch,Larix lyallii,subalpine larch,Plantae,69848
7656948,8/23/17,2017-08-23 22:46:14 UTC,Pacific Time (US & Canada),462170,,2017-08-26 14:07:21 UTC,2023-03-12 09:10:00 UTC,research,,https://static.inaturalist.org/photos/10021800/medium.jpg,,,3,1,FALSE,3,"Okanogan-Wenatchee National Forest, Riverside, WA, US",48.67853667,-119.9274967,,,,,,,open,,subalpine larch,Larix lyallii,subalpine larch,Plantae,69848
9010013,9/30/11,,Pacific Time (US & Canada),707757,,2017-12-01 20:48:52 UTC,2018-02-07 04:38:28 UTC,research,CC-BY-NC,https://inaturalist-open-data.s3.amazonaws.com/photos/12147345/medium.jpg,,,1,0,FALSE,,"Ravalli County, MT, USA",46.65423788,-114.3215096,31,,,,31,,,,subalpine larch,Larix lyallii,subalpine larch,Plantae,69848
9010014,7/24/09,2009-07-24 07:28:00 UTC,Pacific Time (US & Canada),707757,,2017-12-01 20:48:52 UTC,2020-10-12 03:30:50 UTC,research,CC-BY-NC,https://inaturalist-open-data.s3.amazonaws.com/photos/12147357/medium.jpg,,,1,0,FALSE,,"Grave Peak, Idaho County, ID, USA",46.39921038,-114.7355674,31,,,,31,,open,,subalpine larch,Larix lyallii,subalpine larch,Plantae,69848
9010015,7/24/09,2009-07-24 07:29:00 UTC,Pacific Time (US & Canada),707757,,2017-12-01 20:48:52 UTC,2018-10-04 15:23:16 UTC,research,CC-BY-NC,https://inaturalist-open-data.s3.amazonaws.com/photos/12147364/medium.jpg,,,1,0,FALSE,,"Grave Peak, Idaho County, ID, USA",46.39539652,-114.7277891,15,,,,15,,,,subalpine larch,Larix lyallii,subalpine larch,Plantae,69848
9010017,7/15/09,2009-07-15 12:58:00 UTC,Pacific Time (US & Canada),707757,,2017-12-01 20:48:53 UTC,2018-10-04 15:22:05 UTC,research,CC-BY-NC,https://inaturalist-open-data.s3.amazonaws.com/photos/12147374/medium.jpg,,,1,0,FALSE,,"Grave Peak, Idaho County, ID, USA",46.39774117,-114.7364042,61,,,,61,,,,subalpine larch,Larix lyallii,subalpine larch,Plantae,69848
9010018,7/15/09,2009-07-15 13:00:00 UTC,Pacific Time (US & Canada),707757,,2017-12-01 20:48:53 UTC,2022-01-04 22:13:46 UTC,research,CC-BY-NC,https://inaturalist-open-data.s3.amazonaws.com/photos/12147381/medium.jpg,,,1,0,FALSE,,"Grave Peak, Idaho County, ID, USA",46.39785838,-114.7362326,31,,,,31,,,,subalpine larch,Larix lyallii,subalpine larch,Plantae,69848
9010040,7/31/09,2009-07-31 15:28:00 UTC,Pacific Time (US & Canada),707757,,2017-12-01 20:52:28 UTC,2023-02-08 14:13:57 UTC,research,CC-BY-NC,https://inaturalist-open-data.s3.amazonaws.com/photos/12147618/medium.jpg,,,1,0,FALSE,,"Salmon Mountain, Idaho County, ID, USA",45.62587687,-114.8394868,144,,,,144,,open,,subalpine larch,Larix lyallii,subalpine larch,Plantae,69848
9010041,7/29/09,2009-07-29 09:35:00 UTC,Pacific Time (US & Canada),707757,,2017-12-01 20:52:29 UTC,2020-10-12 03:22:11 UTC,research,CC-BY-NC,https://inaturalist-open-data.s3.amazonaws.com/photos/12147623/medium.jpg,,,1,0,FALSE,,"Salmon Mountain, Idaho County, ID, USA",45.6177125,-114.8374968,8,,,,8,,open,,subalpine larch,Larix lyallii,subalpine larch,Plantae,69848
9010083,7/30/09,2009-07-31 01:08:00 UTC,Pacific Time (US & Canada),707757,,2017-12-01 20:59:16 UTC,2020-10-12 03:22:04 UTC,research,CC-BY-NC,https://inaturalist-open-data.s3.amazonaws.com/photos/12147712/medium.jpg,,,1,0,FALSE,,"Spread Creek Point, Idaho County, ID, USA",45.64445173,-115.023217,2,,,,2,,open,,subalpine larch,Larix lyallii,subalpine larch,Plantae,69848
9010084,7/15/09,2009-07-15 12:59:00 UTC,Pacific Time (US & Canada),707757,,2017-12-01 20:59:16 UTC,2020-10-12 03:31:01 UTC,research,CC-BY-NC,https://inaturalist-open-data.s3.amazonaws.com/photos/12147716/medium.jpg,,,1,0,FALSE,,"Walton Lakes Overlook, Idaho County, ID, USA",46.42825737,-114.7256753,61,,,,61,,open,,subalpine larch,Larix lyallii,subalpine larch,Plantae,69848
9019297,11/30/17,2017-11-30 19:52:00 UTC,Mountain Time (US & Canada),449500,Blake Weis,2017-12-02 19:18:53 UTC,2017-12-28 05:30:34 UTC,research,CC-BY-NC,https://inaturalist-open-data.s3.amazonaws.com/photos/12163251/medium.jpg,,,1,0,FALSE,,"Division No. 15, AB, Canada",50.59530654,-114.9618387,62,,,,62,,,,Subalpine larch,Larix lyallii,subalpine larch,Plantae,69848
9380262,10/3/16,2016-10-04 00:16:36 UTC,Pacific Time (US & Canada),242433,Tulipifera-ike,2018-01-06 08:09:57 UTC,2018-01-06 21:12:33 UTC,research,CC-BY-NC,https://static.inaturalist.org/photos/12740625/medium.jpg,Alpine larch near south pass,,1,0,FALSE,,"Washington, United States",48.413594,-120.646959,,,,,,,,,subalpine larch,Larix lyallii,subalpine larch,Plantae,69848
10359381,10/17/17,2017-10-17 21:53:00 UTC,Pacific Time (US & Canada),778312,Lee Merrill,2018-03-22 17:07:11 UTC,2018-03-27 17:34:27 UTC,research,,https://static.inaturalist.org/photos/14370099/medium.jpg,,We were lucky to see golden Subalpine Larch while lightly snowing.  The trail was closed soon after.,2,0,FALSE,,"Chelan County, WA, USA",48.50016268,-120.7710528,61,,,,61,,,,Subalpine Larch,Larix lyallii,subalpine larch,Plantae,69848
10630818,9/26/04,2004-09-27 01:11:40 UTC,Pacific Time (US & Canada),8641,John Brew,2018-04-05 05:03:46 UTC,2019-07-20 16:19:39 UTC,research,CC-BY,https://inaturalist-open-data.s3.amazonaws.com/photos/28900/medium.jpg,"Washington, hiking, North Cascades, Pinaceae, Larix, L., lyallii, Pinales, Pinopsida, Pinophyta, Plantae, tree, Larch, Subalpine Larch, taxonomy:family=Pinaceae, taxonomy:order=Pinales, taxonomy:class=Pinopsida, Subalpine Larch near Early Winters Spire","Larix lyallii,Subalpine Larch near Early Winters Spire

<a href=""http://en.wikipedia.org/wiki/Subalpine_Larch"" rel=""nofollow"">Larix lyallii</a> 
subalpine larch, alpine larch, Lyall's larch, tamarack




DSCN3056",1,0,FALSE,,"Washington, United States",48.51558,-120.653314,,,,,,,open,,subalpine larch,Larix lyallii,subalpine larch,Plantae,69848
13459617,10/9/09,2009-10-09 18:31:00 UTC,Eastern Time (US & Canada),744769,James J. Bond,2018-06-15 20:24:55 UTC,2018-12-19 05:36:18 UTC,research,CC-BY-NC,https://inaturalist-open-data.s3.amazonaws.com/photos/19758514/medium.jpeg,,,1,0,FALSE,,"Enchantments, Chelan County, WA, USA",47.48292798,-120.7850083,488,,,,488,,,,subalpine larch,Larix lyallii,subalpine larch,Plantae,69848
14000120,7/1/18,2018-07-01 19:14:45 UTC,Pacific Time (US & Canada),350245,Mark Robinson,2018-07-03 01:50:55 UTC,2018-07-04 23:07:14 UTC,research,CC-BY-NC,https://inaturalist-open-data.s3.amazonaws.com/photos/20706600/medium.jpg,,,1,0,FALSE,3,"Okanogan National Forest, Tonasket, WA, US",48.66210833,-119.9420783,5,,,,5,,,,subalpine larch,Larix lyallii,subalpine larch,Plantae,69848
14215511,7/7/18,2018-07-07 20:53:37 UTC,Pacific Time (US & Canada),350245,Mark Robinson,2018-07-10 00:23:57 UTC,2019-03-14 08:05:09 UTC,research,CC-BY-NC,https://inaturalist-open-data.s3.amazonaws.com/photos/21088478/medium.jpg,,,1,0,FALSE,3,"Okanogan National Forest, Deming, WA, US",48.73218833,-120.6752083,5,,,,5,,open,,subalpine larch,Larix lyallii,subalpine larch,Plantae,69848
14316210,7/13/18,2018-07-13 14:55:52 UTC,Mountain Time (US & Canada),729044,,2018-07-13 14:57:55 UTC,2021-01-27 21:06:35 UTC,research,,https://static.inaturalist.org/photos/21283918/medium.jpg,,,3,1,FALSE,3,"Mount Assiniboine Provincial Park, , BC, CA",51.06913135,-115.7870814,6,,,,6,,open,,subalpine larch,Larix lyallii,subalpine larch,Plantae,69848
14326572,7/13/18,2018-07-13 16:10:17 UTC,Mountain Time (US & Canada),729044,,2018-07-13 20:34:35 UTC,2020-12-03 14:12:44 UTC,research,,https://static.inaturalist.org/photos/21284001/medium.jpg,,,2,0,FALSE,3,"Mount Assiniboine, CA-BC-EK, CA-BC, CA",51.0615245,-115.7844787,8,,,,8,,open,,subalpine larch,Larix lyallii,subalpine larch,Plantae,69848
14371346,7/7/18,2018-07-07 18:45:00 UTC,Pacific Time (US & Canada),29310,Alex Woo,2018-07-15 03:01:52 UTC,2019-07-20 23:23:56 UTC,research,CC-BY-NC,https://inaturalist-open-data.s3.amazonaws.com/photos/21364621/medium.jpg,,,1,0,FALSE,,"Chelan, Washington, United States",48.50866,-120.672314,,,,,,,open,,subalpine larch,Larix lyallii,subalpine larch,Plantae,69848
14393137,7/7/18,2018-07-08 00:16:47 UTC,Pacific Time (US & Canada),773563,S Ehlers,2018-07-15 20:53:46 UTC,2019-02-23 08:02:38 UTC,research,,https://static.inaturalist.org/photos/21404914/medium.jpg,,"Some type of windswept larch trees were everywhere at this high, colder elevation. ",1,0,FALSE,3,"Wenatchee National Forest, Leavenworth, WA, US",47.47755,-120.79303,24,,,,24,,open,,subalpine larch,Larix lyallii,subalpine larch,Plantae,69848
14950291,7/28/18,2018-07-28 18:11:05 UTC,Pacific Time (US & Canada),8641,John Brew,2018-07-30 16:14:30 UTC,2018-10-04 15:26:58 UTC,research,CC-BY,https://inaturalist-open-data.s3.amazonaws.com/photos/22301612/medium.jpg,,"Easy Pass, about 2200 meters",1,0,FALSE,3,"Okanogan National Forest, Marblemount, WA, US",48.57211333,-120.84355,0,,,,0,,,,subalpine larch,Larix lyallii,subalpine larch,Plantae,69848
14953179,7/23/18,2018-07-23 17:34:14 UTC,Mountain Time (US & Canada),993286,,2018-07-30 17:23:57 UTC,2024-06-27 06:20:09 UTC,research,CC-BY-NC,https://inaturalist-open-data.s3.amazonaws.com/photos/22305879/medium.jpg,,,2,0,FALSE,3,"Banff National Park, Banff, CA-AB-FN, CA-AB, CA",51.18427989,-115.9620623,5,,,,5,,open,,subalpine larch,Larix lyallii,subalpine larch,Plantae,69848
15339707,7/17/18,2018-07-18 00:25:00 UTC,Pacific Time (US & Canada),266047,Doug Macaulay,2018-08-12 03:28:55 UTC,2023-02-22 02:51:34 UTC,research,CC-BY,https://inaturalist-open-data.s3.amazonaws.com/photos/22976939/medium.jpeg,,,1,0,FALSE,,Plateau Mountain Ecological Reserve,50.222297,-114.529819,154,,,,154,,open,google,Larix lyallii,Larix lyallii,subalpine larch,Plantae,69848
15342043,8/7/18,2018-08-07 21:19:10 UTC,Pacific Time (US & Canada),142166,Emily Han,2018-08-12 05:52:14 UTC,2022-09-06 04:25:23 UTC,research,,https://static.inaturalist.org/photos/22981523/medium.jpg,,,2,0,FALSE,3,"Okanogan National Forest, Deming, WA, US",48.73612963,-120.6796144,32,,,,32,,open,,subalpine larch,Larix lyallii,subalpine larch,Plantae,69848
15517051,8/11/18,2018-08-11 18:44:02 UTC,Pacific Time (US & Canada),1130825,Tanglaw Fletcher,2018-08-16 23:23:02 UTC,2023-03-05 06:10:59 UTC,research,,https://static.inaturalist.org/photos/23256427/medium.jpg,,Larch tree. Female cones point up at first but hang down as they mature. Not evergreen since they lose needles in winter. ,2,0,FALSE,3,"Whatcom County, US-WA, US",48.7330066,-120.6691861,5,,,,5,,open,,subalpine larch,Larix lyallii,subalpine larch,Plantae,69848
15580981,8/11/18,2018-08-11 18:45:52 UTC,Pacific Time (US & Canada),1130820,,2018-08-17 18:55:32 UTC,2019-07-20 16:28:03 UTC,research,,https://static.inaturalist.org/photos/23301283/medium.jpg,,"Lark. Deciduous evergreen. Comes first point up then hang down as it matures. Needles grow in clusters

",2,0,FALSE,3,"Okanogan County, US-WA, US",48.733061,-120.6691217,10,,,,10,,open,,subalpine larch,Larix lyallii,subalpine larch,Plantae,69848
15705807,8/11/18,2018-08-11 18:43:42 UTC,Pacific Time (US & Canada),1130821,Patrick Durose,2018-08-19 23:40:27 UTC,2023-03-08 23:10:09 UTC,research,,https://static.inaturalist.org/photos/23479762/medium.jpeg,,"Needles in clumps, leafs fall of in winter, cones hang up until matureaty then hang down",1,0,FALSE,2,"Whatcom County, US-WA, US",48.7329999,-120.6691805,10,,,,10,,open,,subalpine larch,Larix lyallii,subalpine larch,Plantae,69848
15728242,8/11/18,2018-08-11 18:43:49 UTC,Pacific Time (US & Canada),1127574,,2018-08-20 17:24:19 UTC,2024-05-08 00:28:39 UTC,research,,https://static.inaturalist.org/photos/23483802/medium.jpg,,"20 feet tall, not evergreen but has needles, no cones",3,1,FALSE,3,"Whatcom County, US-WA, US",48.73297328,-120.6691941,5,,,,5,,open,,subalpine larch,Larix lyallii,subalpine larch,Plantae,69848
15728309,8/11/18,2018-08-11 18:44:10 UTC,Pacific Time (US & Canada),1132479,Kyle Stone,2018-08-20 17:25:12 UTC,2023-03-05 06:10:03 UTC,research,,https://static.inaturalist.org/photos/23483865/medium.jpeg,,,3,1,FALSE,2,"Whatcom County, US-WA, US",48.73301088,-120.6691012,6,,,,6,,open,,subalpine larch,Larix lyallii,subalpine larch,Plantae,69848
15829284,8/23/18,2018-08-23 19:45:08 UTC,Mountain Time (US & Canada),1032438,,2018-08-24 00:25:35 UTC,2024-06-27 06:20:06 UTC,research,,https://static.inaturalist.org/photos/23664449/medium.jpg,,,1,0,FALSE,3,"Banff National Park, , AB, CA",51.29817167,-116.0892805,10,,,,10,,,,subalpine larch,Larix lyallii,subalpine larch,Plantae,69848
16037974,7/13/10,2010-07-13 18:14:00 UTC,Eastern Time (US & Canada),566241,Gordon Neish,2018-08-30 18:54:13 UTC,2018-10-04 15:26:30 UTC,research,CC-BY-NC,https://inaturalist-open-data.s3.amazonaws.com/photos/24023041/medium.jpg,,,1,0,FALSE,,"Okanagan-Similkameen, BC, Canada",49.065583,-120.196783,,,,,,,,,subalpine larch,Larix lyallii,subalpine larch,Plantae,69848
16381328,8/11/18,2018-08-11 18:00:00 UTC,Pacific Time (US & Canada),459348,John D Reynolds,2018-09-10 05:11:57 UTC,2023-03-23 21:25:58 UTC,research,CC-BY,https://inaturalist-open-data.s3.amazonaws.com/photos/24633434/medium.jpg,"2018, BC, Canada, iNaturalist, Manning Park, plant, plants",,1,0,FALSE,,"E.C. Manning, Okanagan-Similkameen, British Columbia, Canada",49.01176111,-120.8285056,5,,,,5,,open,,subalpine larch,Larix lyallii,subalpine larch,Plantae,69848
16523328,9/11/18,2018-09-11 19:18:39 UTC,Mountain Time (US & Canada),18062,ColinDJones,2018-09-14 15:26:24 UTC,2018-09-14 15:47:04 UTC,research,CC-BY-NC,https://inaturalist-open-data.s3.amazonaws.com/photos/24872591/medium.jpg,,,1,0,FALSE,3,"East Kootenay F, , BC, CA",50.459295,-115.7732783,0,,,,0,,,,subalpine larch,Larix lyallii,subalpine larch,Plantae,69848
16830063,8/7/18,2018-08-07 22:54:00 UTC,Pacific Time (US & Canada),8641,John Brew,2018-09-23 14:49:59 UTC,2019-05-08 06:48:49 UTC,research,CC-BY,https://inaturalist-open-data.s3.amazonaws.com/photos/25416746/medium.jpg,,,2,0,FALSE,,"Chelan County, WA, USA",47.48184722,-120.7996417,,,,,,,open,,subalpine larch,Larix lyallii,subalpine larch,Plantae,69848
16830267,8/7/18,2018-08-07 22:13:00 UTC,Pacific Time (US & Canada),8641,John Brew,2018-09-23 14:55:46 UTC,2019-05-09 03:26:29 UTC,research,CC-BY,https://inaturalist-open-data.s3.amazonaws.com/photos/25417047/medium.jpg,,,1,0,FALSE,,"Chelan County, WA, USA",47.47734167,-120.8119278,,,,,,,open,,subalpine larch,Larix lyallii,subalpine larch,Plantae,69848
16862861,9/22/18,2018-09-22 16:15:00 UTC,Central Time (US & Canada),608898,Nick Belliveau,2018-09-24 06:18:45 UTC,2024-06-27 06:20:00 UTC,research,CC-BY-NC,https://inaturalist-open-data.s3.amazonaws.com/photos/25467178/medium.jpeg,,,2,0,FALSE,,"Division No. 15, AB, Canada",51.3285756,-116.1789372,641,,,,641,,,,subalpine larch,Larix lyallii,subalpine larch,Plantae,69848
16901938,9/22/18,2018-09-22 19:13:32 UTC,Pacific Time (US & Canada),1032440,,2018-09-25 14:25:06 UTC,2018-09-26 20:14:52 UTC,research,,https://static.inaturalist.org/photos/25534238/medium.jpg,,,1,0,FALSE,3,"Wenatchee National Forest, Leavenworth, WA, US",47.48245404,-120.7936607,1364,,,,1364,,,,subalpine larch,Larix lyallii,subalpine larch,Plantae,69848
16916871,9/25/18,2018-09-25 20:59:51 UTC,Mountain Time (US & Canada),975090,Steve Joyce,2018-09-25 23:11:26 UTC,2024-06-27 06:19:49 UTC,research,,https://static.inaturalist.org/photos/25559350/medium.jpg,,,1,0,FALSE,3,"Banff National Park, , AB, CA",51.32741667,-116.17903,5,,,,5,,,,subalpine larch,Larix lyallii,subalpine larch,Plantae,69848
17163064,9/25/18,2018-09-25 19:22:00 UTC,Mountain Time (US & Canada),1079214,Lori Skulski,2018-10-03 18:14:19 UTC,2019-12-18 17:17:33 UTC,research,,https://inaturalist-open-data.s3.amazonaws.com/photos/26005597/medium.jpg,,"Larix lyallii cones - note reflexed bract tips (where still present and unbroken; they seem to be rather fragile) and longer than cone scales.

Larix lyallii bark - young trees and mature specimens.",3,0,FALSE,,"Division No. 15, AB, Canada",50.56630556,-114.9971306,,,,,,,open,,subalpine larch,Larix lyallii,subalpine larch,Plantae,69848
17304022,10/7/18,2018-10-07 19:31:25 UTC,Mountain Time (US & Canada),63640,Jody Allair,2018-10-08 01:51:51 UTC,2018-10-23 17:22:51 UTC,research,CC-BY-NC,https://inaturalist-open-data.s3.amazonaws.com/photos/26261540/medium.jpg,,,1,0,FALSE,3,"Peter Lougheed Provincial Park - Kananaskis Country, , AB, CA",50.59667,-114.987525,32,,,,32,,,,subalpine larch,Larix lyallii,subalpine larch,Plantae,69848
17308606,10/7/18,2018-10-07 20:58:35 UTC,Pacific Time (US & Canada),112785,Sam Herniman,2018-10-08 04:39:58 UTC,2022-01-08 22:16:35 UTC,research,CC0,https://inaturalist-open-data.s3.amazonaws.com/photos/26270121/medium.jpg,,,2,0,FALSE,3,"E.C. Manning, CA-BC-FV, CA-BC, CA",49.02374293,-120.8308566,5,,,,5,,,,subalpine larch,Larix lyallii,subalpine larch,Plantae,69848
17488971,10/12/18,2018-10-12 20:05:00 UTC,Pacific Time (US & Canada),538622,Eric Jain,2018-10-14 06:17:59 UTC,2019-05-08 06:46:52 UTC,research,CC-BY-NC,https://inaturalist-open-data.s3.amazonaws.com/photos/26602677/medium.jpg,flora,,1,0,FALSE,,"Chelan County, WA, USA",48.08500357,-120.8081927,,,,,,,open,,subalpine larch,Larix lyallii,subalpine larch,Plantae,69848
17534967,10/14/18,2018-10-14 22:09:29 UTC,Pacific Time (US & Canada),710,John Cramer III,2018-10-15 17:00:24 UTC,2019-05-08 06:47:01 UTC,research,,https://static.inaturalist.org/photos/26692217/medium.jpeg,,,1,0,FALSE,2,"Chelan County, US-WA, US",48.49987538,-120.7604636,6,,,,6,,open,,subalpine larch,Larix lyallii,subalpine larch,Plantae,69848
17843890,10/13/18,2018-10-13 21:07:00 UTC,Pacific Time (US & Canada),104905,Joan Septembre,2018-10-26 03:25:50 UTC,2019-05-08 06:49:47 UTC,research,CC-BY-NC-ND,https://static.inaturalist.org/photos/27237958/medium.jpeg,,Unique larch tree along the Enchantments trail.  Would be interesting to know the story behind the bend in the tree - a hiker trying to get away from an overly friendly mountain goat perhaps?!,1,0,FALSE,,"Chelan County, WA, USA",47.47846534,-120.8067739,310,,,,310,,open,,subalpine larch,Larix lyallii,subalpine larch,Plantae,69848
17861907,10/23/18,2018-10-23 20:30:00 UTC,Eastern Time (US & Canada),32654,Evan M. Raskin,2018-10-26 22:13:04 UTC,2019-04-20 11:41:31 UTC,research,CC-BY,https://inaturalist-open-data.s3.amazonaws.com/photos/27268188/medium.jpg,,,1,0,FALSE,,"West Opabin Trail, Yoho National Park",51.347159,-116.330136,10,,,,10,,open,,subalpine larch,Larix lyallii,subalpine larch,Plantae,69848
18386012,9/17/05,2005-09-17 07:48:18 UTC,Pacific Time (US & Canada),8641,John Brew,2018-11-14 04:06:41 UTC,2018-11-15 17:11:39 UTC,research,CC-BY,https://inaturalist-open-data.s3.amazonaws.com/photos/28899/medium.jpg,"Washington, hiking, BD group, Spider Meadow, Larch Knob, Subalpine Larch, Larch, Larix lyallii, Pinaceae, Larix, L., lyallii, Pinales, Pinopsida, Pinophyta, Plantae, tree, Glacier Peak Wilderness, taxonomy:family=Pinaceae, taxonomy:order=Pinales, taxonomy:class=Pinopsida, Subalpine Larch at Larch Knob","Spider Meadow Larch Knob North Cascades, Washington, USA 17 Sep 05

These are most beautiful in the falll as they turn from green to bright yellow and shed their needles. One of my favourite trees in the North Cascades.

<a href=""http://en.wikipedia.org/wiki/Subalpine_Larch"" rel=""nofollow"">Larix lyallii</a> 
subalpine larch, alpine larch, Lyall's larch, tamarack
Gymnosperm  Pinaceae

Kingdom: Plantae
Division: Pinophyta
Class: Pinopsida
Order: Pinales
Family: Pinaceae
Genus: Larix
Species: L. lyallii
 

i091705 071",2,0,FALSE,,"Washington, United States",48.16099,-120.876302,,,,,,,,,subalpine larch,Larix lyallii,subalpine larch,Plantae,69848
18744435,7/14/18,2018-07-14 16:42:00 UTC,Mountain Time (US & Canada),1287370,Carrie Voss,2018-12-01 00:04:33 UTC,2023-07-07 03:16:03 UTC,research,CC-BY-NC-SA,https://inaturalist-open-data.s3.amazonaws.com/photos/28702361/medium.jpeg,,Larch found near the top of Trapper Peak. High elevation suggests subalpine larch. Also small and stunted.,1,0,FALSE,,"Trapper Peak, Montana 59829, USA",45.8899191,-114.2975884,1510,,,,1510,,,,subalpine larch,Larix lyallii,subalpine larch,Plantae,69848
19507496,10/13/18,2018-10-13 19:34:37 UTC,Pacific Time (US & Canada),836662,,2019-01-08 06:26:10 UTC,2019-01-18 22:40:07 UTC,research,,https://static.inaturalist.org/photos/30019591/medium.jpg,,High elevation @maple pass loop trail,1,0,FALSE,3,"Okanogan National Forest, Stehekin, WA, US",48.49960833,-120.7561417,10,,,,10,,,,subalpine larch,Larix lyallii,subalpine larch,Plantae,69848
19760449,1/20/19,2019-01-20 18:01:59 UTC,Mountain Time (US & Canada),1424137,,2019-01-20 18:48:59 UTC,2024-06-27 06:19:45 UTC,research,CC-BY-NC,https://inaturalist-open-data.s3.amazonaws.com/photos/30449165/medium.jpg,,,1,0,FALSE,3,"Lake Louise Ski Resort, , AB, CA",51.45635013,-116.1351747,8,,,,8,,,,subalpine larch,Larix lyallii,subalpine larch,Plantae,69848
20034748,7/8/12,2012-07-08 19:28:00 UTC,Mountain Time (US & Canada),1403418,,2019-02-02 18:45:00 UTC,2019-02-02 19:58:37 UTC,research,CC-BY-SA,https://inaturalist-open-data.s3.amazonaws.com/photos/30929266/medium.jpeg,,,1,0,FALSE,,"Division No. 15, AB, Canada",50.92553103,-115.2434446,122,,,,122,,,,subalpine larch,Larix lyallii,subalpine larch,Plantae,69848
20054698,8/23/09,2009-08-23 21:40:00 UTC,Mountain Time (US & Canada),1403418,,2019-02-03 14:47:03 UTC,2024-06-27 06:19:37 UTC,research,CC-BY-SA,https://inaturalist-open-data.s3.amazonaws.com/photos/30964171/medium.jpeg,,,2,0,FALSE,,"Division No. 15, AB, Canada",51.39635553,-116.216052,528,,,,528,,open,,subalpine larch,Larix lyallii,subalpine larch,Plantae,69848
20142695,9/4/06,2006-09-04 19:19:00 UTC,Eastern Time (US & Canada),788181,Lada Malek,2019-02-06 01:34:22 UTC,2019-02-06 03:44:35 UTC,research,CC-BY-NC,https://inaturalist-open-data.s3.amazonaws.com/photos/31067338/medium.jpeg,,,2,0,FALSE,,"Division No. 15, AB, Canada",50.75768131,-115.3758789,61,,,,61,,,,subalpine larch,Larix lyallii,subalpine larch,Plantae,69848
20404025,10/22/15,2015-10-22 21:20:00 UTC,Mountain Time (US & Canada),1079214,Lori Skulski,2019-02-17 01:13:06 UTC,2024-06-27 06:19:31 UTC,research,,https://static.inaturalist.org/photos/31506866/medium.jpeg,,,2,0,FALSE,,"Division No. 15, AB, Canada",51.22123611,-115.9895472,,,,,,,open,,subalpine larch,Larix lyallii,subalpine larch,Plantae,69848
20493129,7/1/18,2018-07-01 18:23:03 UTC,Pacific Time (US & Canada),1482644,,2019-02-19 20:04:57 UTC,2020-12-05 21:53:40 UTC,research,CC-BY-NC,https://inaturalist-open-data.s3.amazonaws.com/photos/31627807/medium.jpg,,,2,0,FALSE,3,"Cathedral Provincial Park, , BC, CA",49.03764717,-120.1947467,5,,,,5,,open,,subalpine larch,Larix lyallii,subalpine larch,Plantae,69848
20733979,1/1/15,2015-01-01 00:00:00 UTC,UTC,1470528,,2019-02-24 18:59:49 UTC,2024-06-27 06:19:25 UTC,research,CC-BY-NC,https://inaturalist-open-data.s3.amazonaws.com/photos/31967744/medium.jpg,,,1,0,FALSE,,"Division No. 15, AB, Canada",51.41376034,-116.2530158,31,,,,31,,open,,subalpine larch,Larix lyallii,subalpine larch,Plantae,69848
21036230,10/3/15,2015-10-03 19:49:00 UTC,Pacific Time (US & Canada),5717,Richard Olmstead,2019-03-07 23:47:39 UTC,2019-03-12 18:41:41 UTC,research,CC-BY,https://static.inaturalist.org/photos/32495937/medium.jpg,,,1,0,FALSE,,"Chelan County, WA, USA",48.50603316,-120.7670805,61,,,,61,,open,,subalpine larch,Larix lyallii,subalpine larch,Plantae,69848
21076448,5/25/16,2016-05-25 01:18:06 UTC,Auckland,946796,,2019-03-09 10:18:30 UTC,2024-06-27 06:19:17 UTC,research,CC-BY-NC,https://inaturalist-open-data.s3.amazonaws.com/photos/32567771/medium.jpeg,,,1,0,FALSE,2,"Improvement District No. 9, AB T0L, Canada",51.32599741,-116.2019131,2813,,,,2813,,open,gps,subalpine larch,Larix lyallii,subalpine larch,Plantae,69848
21152665,3/9/19,2019-03-09 20:11:40 UTC,Mountain Time (US & Canada),846257,JD James,2019-03-11 19:36:42 UTC,2024-06-27 06:19:08 UTC,research,CC-BY-NC-ND,https://inaturalist-open-data.s3.amazonaws.com/photos/32699412/medium.jpeg,,"Star trek run , Sunshine",1,0,FALSE,2,"Improvement District No. 9, AB T0L, Canada",51.08203772,-115.7889854,88,,,,88,,open,gps,subalpine larch,Larix lyallii,subalpine larch,Plantae,69848
24917633,10/12/08,2008-10-12 18:22:00 UTC,Mountain Time (US & Canada),1403418,,2019-05-11 04:38:36 UTC,2019-05-11 04:43:07 UTC,research,CC-BY-SA,https://inaturalist-open-data.s3.amazonaws.com/photos/38546856/medium.jpg,,,1,0,FALSE,,"Division No. 15, AB, Canada",50.59562846,-115.0114673,488,,,,488,,open,,subalpine larch,Larix lyallii,subalpine larch,Plantae,69848
24918064,11/15/08,2008-11-15 21:21:00 UTC,Mountain Time (US & Canada),1403418,,2019-05-11 04:52:43 UTC,2019-05-17 03:22:31 UTC,research,CC-BY-SA,https://inaturalist-open-data.s3.amazonaws.com/photos/38547611/medium.jpg,,,1,0,FALSE,,"East Kootenay, BC, Canada",50.57333139,-115.1007612,61,,,,61,,open,,subalpine larch,Larix lyallii,subalpine larch,Plantae,69848
26549753,8/29/11,2011-08-29 14:22:00 UTC,Pacific Time (US & Canada),1798817,Daniel Stewart,2019-06-07 14:24:47 UTC,2019-06-07 15:07:34 UTC,research,CC-BY-NC,https://inaturalist-open-data.s3.amazonaws.com/photos/41234853/medium.jpg,,,1,0,FALSE,,"Fraser Valley, BC, Canada",49.02374739,-120.8306904,85,,,,85,,open,,subalpine larch,Larix lyallii,subalpine larch,Plantae,69848
27786626,6/27/19,2019-06-27 18:34:54 UTC,Pacific Time (US & Canada),1424971,Maleen Mund,2019-06-28 00:52:43 UTC,2020-11-12 01:03:49 UTC,research,CC-BY-NC,https://inaturalist-open-data.s3.amazonaws.com/photos/43269817/medium.jpeg,,,2,1,FALSE,2,"Keremeos, BC V0X 1N0, Canada",49.06119156,-120.2006073,,,,,,,open,gps,subalpine larch,Larix lyallii,subalpine larch,Plantae,69848
27823655,6/27/19,2019-06-27 18:32:42 UTC,Pacific Time (US & Canada),1198147,Tori Miller,2019-06-28 18:39:55 UTC,2023-07-07 11:46:00 UTC,research,CC-BY-NC,https://inaturalist-open-data.s3.amazonaws.com/photos/43331942/medium.jpg,,,2,1,FALSE,3,"Cathedral Provincial Park and Protected Area, , BC, CA",49.06061117,-120.2021717,24,,,,24,,open,,subalpine larch,Larix lyallii,subalpine larch,Plantae,69848
28024274,6/30/19,2019-06-30 23:35:29 UTC,Mountain Time (US & Canada),1920124,,2019-07-01 22:49:32 UTC,2020-08-19 19:27:18 UTC,research,,https://static.inaturalist.org/photos/43657468/medium.jpg,,,2,0,FALSE,3,"Elbow - Sheep Wildland Provincial Park, , AB, CA",50.51677681,-114.7886164,596,,,,596,,open,,subalpine larch,Larix lyallii,subalpine larch,Plantae,69848
28460359,6/15/19,2019-06-15 19:29:00 UTC,Pacific Time (US & Canada),1657037,Christopher J. Earle,2019-07-08 21:37:42 UTC,2020-10-12 03:30:36 UTC,research,CC-BY-NC,https://inaturalist-open-data.s3.amazonaws.com/photos/44366224/medium.jpg,"Fire ecology, Forest, Larix, Larix lyallii, Pinaceae",Larix lyallii in area burned Aug-Sep 2017 (Lolo Peak Fire).,1,0,FALSE,,"Missoula County, MT, USA",46.6942675,-114.206945,,,,,,,open,,subalpine larch,Larix lyallii,subalpine larch,Plantae,69848
28465276,7/8/19,2019-07-08 14:16:27 UTC,Mountain Time (US & Canada),1287370,Carrie Voss,2019-07-08 23:02:18 UTC,2024-01-13 05:21:51 UTC,research,CC-BY-NC-SA,https://inaturalist-open-data.s3.amazonaws.com/photos/44375144/medium.jpeg,,,1,0,FALSE,2,"Troy, MT 59935, USA",48.8983345,-115.9463882,,,,,,,open,gps,subalpine larch,Larix lyallii,subalpine larch,Plantae,69848
28710297,7/8/19,2019-07-08 22:18:00 UTC,Pacific Time (US & Canada),27263,Wendy Feltham,2019-07-13 02:54:27 UTC,2023-06-21 16:25:08 UTC,research,,https://static.inaturalist.org/photos/44770134/medium.jpg,,My first Larch Trees by Cutthroat Lake.,1,0,FALSE,,"Cutthroat Lake, Washington 98862, USA",48.5410158,-120.6801175,107,,,,107,,open,,subalpine larch,Larix lyallii,subalpine larch,Plantae,69848
28822308,7/14/19,2019-07-14 17:24:56 UTC,Pacific Time (US & Canada),1865895,,2019-07-14 20:51:26 UTC,2024-05-08 00:27:44 UTC,research,CC-BY-NC,https://inaturalist-open-data.s3.amazonaws.com/photos/44953259/medium.jpg,,,2,0,FALSE,3,"Okanogan National Forest, Tonasket, WA, US",48.66333,-119.9394833,6,,,,6,,open,,subalpine larch,Larix lyallii,subalpine larch,Plantae,69848
28834212,7/12/19,2019-07-12 18:09:20 UTC,Mountain Time (US & Canada),1240249,Nikki Beaudoin,2019-07-14 23:55:06 UTC,2020-11-27 07:32:08 UTC,research,,https://static.inaturalist.org/photos/44973024/medium.jpg,,,2,0,FALSE,3,"Mount Assiniboine Provincial Park, , BC, CA",51.06840833,-115.7869033,16,,,,16,,open,,subalpine larch,Larix lyallii,subalpine larch,Plantae,69848
29299628,7/20/19,2019-07-20 20:10:51 UTC,Pacific Time (US & Canada),1417891,,2019-07-22 04:48:16 UTC,2024-01-24 04:21:29 UTC,research,CC-BY-NC,https://inaturalist-open-data.s3.amazonaws.com/photos/45721367/medium.jpeg,,,5,1,FALSE,2,"Manning Park, BC V0X 1R0, Canada",49.01868351,-120.8310297,263,,,,263,,open,gps,subalpine larch,Larix lyallii,subalpine larch,Plantae,69848
29305099,7/20/19,2019-07-21 02:15:00 UTC,Pacific Time (US & Canada),538622,Eric Jain,2019-07-22 08:34:48 UTC,2020-01-22 00:31:53 UTC,research,CC-BY-NC,https://inaturalist-open-data.s3.amazonaws.com/photos/45729756/medium.jpg,flora,,1,0,FALSE,,"Chelan, Washington, United States",48.15005336,-120.3524954,,,,,,,open,,subalpine larch,Larix lyallii,subalpine larch,Plantae,69848
29958146,7/23/19,2019-07-23 18:19:30 UTC,Mountain Time (US & Canada),1287370,Carrie Voss,2019-08-01 03:03:05 UTC,2023-07-07 13:41:09 UTC,research,CC-BY-NC-SA,https://inaturalist-open-data.s3.amazonaws.com/photos/46782902/medium.jpeg,,,1,0,FALSE,2,"East Kootenay G, BC, Canada",51.05361176,-116.1363907,,,,,,,open,gps,subalpine larch,Larix lyallii,subalpine larch,Plantae,69848
30286289,8/5/19,2019-08-05 22:59:03 UTC,Pacific Time (US & Canada),2069320,,2019-08-06 02:48:00 UTC,2023-02-26 02:37:16 UTC,research,CC-BY-NC,https://inaturalist-open-data.s3.amazonaws.com/photos/47307999/medium.jpeg,,,2,0,FALSE,2,"Chelan County, US-WA, US",48.50839686,-120.765362,3,,,,3,,open,,subalpine larch,Larix lyallii,subalpine larch,Plantae,69848
30553754,7/18/93,1993-07-18 15:30:00 UTC,Pacific Time (US & Canada),1657037,Christopher J. Earle,2019-08-10 17:56:08 UTC,2019-08-10 20:58:45 UTC,research,CC-BY-NC,https://inaturalist-open-data.s3.amazonaws.com/photos/47737841/medium.jpg,"Big tree, Forest, Larix, Mountain-Cascades, Mountains, People, Pinaceae",A very big LALY above the upper (S) end of the lake,1,0,FALSE,,"Chelan, Washington, United States",48.06162833,-120.7388967,,,,,,,open,,subalpine larch,Larix lyallii,subalpine larch,Plantae,69848
30554901,10/7/06,2006-10-07 17:58:00 UTC,Pacific Time (US & Canada),1657037,Christopher J. Earle,2019-08-10 18:12:38 UTC,2019-08-10 20:58:06 UTC,research,CC-BY-NC,https://inaturalist-open-data.s3.amazonaws.com/photos/47740188/medium.jpg,"Gymno, Larix, Larix lyallii, Pinaceae, Plant",,1,0,FALSE,,"Chelan, Washington, United States",48.5089,-120.7623528,,,,,,,open,,subalpine larch,Larix lyallii,subalpine larch,Plantae,69848
30554905,10/7/06,2006-10-07 18:19:00 UTC,Pacific Time (US & Canada),1657037,Christopher J. Earle,2019-08-10 18:12:40 UTC,2019-08-10 20:58:04 UTC,research,CC-BY-NC,https://inaturalist-open-data.s3.amazonaws.com/photos/47740228/medium.jpg,,,1,0,FALSE,,"Chelan, Washington, United States",48.50079167,-120.7662722,,,,,,,open,,subalpine larch,Larix lyallii,subalpine larch,Plantae,69848
30575523,8/8/19,2019-08-08 20:40:58 UTC,Pacific Time (US & Canada),5999,Leah Ramsay,2019-08-10 23:22:58 UTC,2019-08-11 03:15:05 UTC,research,CC-BY-NC,https://inaturalist-open-data.s3.amazonaws.com/photos/47774238/medium.jpg,,,1,0,FALSE,3,"Cathedral Provincial Park and Protected Area, , BC, CA",49.0570945,-120.2040333,48,,,,48,,open,,subalpine larch,Larix lyallii,subalpine larch,Plantae,69848
30708093,8/9/19,2019-08-09 15:58:51 UTC,Pacific Time (US & Canada),1285263,,2019-08-12 20:28:37 UTC,2020-12-01 15:24:28 UTC,research,CC0,https://inaturalist-open-data.s3.amazonaws.com/photos/47988415/medium.jpg,,,2,1,FALSE,3,"Top of the World Provincial Park, , BC, CA",49.843025,-115.4332417,16,,,,16,,open,,subalpine larch,Larix lyallii,subalpine larch,Plantae,69848
30775372,8/9/19,2019-08-09 15:59:02 UTC,Mountain Time (US & Canada),2063746,Ally,2019-08-13 21:33:22 UTC,2021-02-05 15:17:01 UTC,research,CC-BY-NC,https://inaturalist-open-data.s3.amazonaws.com/photos/48099594/medium.jpg,,,1,0,FALSE,3,"Top of the World Provincial Park, BC, CA",49.843045,-115.4331283,8,,,,8,,open,,subalpine larch,Larix lyallii,subalpine larch,Plantae,69848
30996769,8/14/19,2019-08-15 01:23:41 UTC,Pacific Time (US & Canada),798730,Justin Baldwin,2019-08-17 16:33:43 UTC,2019-08-17 23:22:05 UTC,research,,https://static.inaturalist.org/photos/48466833/medium.jpg,,,1,0,FALSE,3,"Okanogan-Wenatchee National Forest, Leavenworth, WA, US",47.71324723,-120.9361281,5,,,,5,,open,,subalpine larch,Larix lyallii,subalpine larch,Plantae,69848
30996844,8/14/19,2019-08-15 03:00:20 UTC,Pacific Time (US & Canada),798730,Justin Baldwin,2019-08-17 16:35:13 UTC,2019-08-17 23:21:32 UTC,research,,https://static.inaturalist.org/photos/48466942/medium.jpg,,,1,0,FALSE,3,"Chelan County, US-WA, US",47.71529043,-120.9207245,5,,,,5,,open,,subalpine larch,Larix lyallii,subalpine larch,Plantae,69848
30996891,8/15/19,2019-08-15 16:57:36 UTC,Pacific Time (US & Canada),798730,Justin Baldwin,2019-08-17 16:36:03 UTC,2019-08-17 23:28:09 UTC,research,,https://static.inaturalist.org/photos/48467009/medium.jpg,,,1,0,FALSE,3,"Chelan County, US-WA, US",47.71663527,-120.9184011,10,,,,10,,open,,subalpine larch,Larix lyallii,subalpine larch,Plantae,69848
30997338,8/15/19,2019-08-16 00:12:28 UTC,Pacific Time (US & Canada),798730,Justin Baldwin,2019-08-17 16:43:26 UTC,2019-08-17 23:26:24 UTC,research,,https://static.inaturalist.org/photos/48467850/medium.jpg,,,1,0,FALSE,3,"Okanogan-Wenatchee National Forest, Leavenworth, WA, US",47.75324135,-120.8963601,5,,,,5,,open,,subalpine larch,Larix lyallii,subalpine larch,Plantae,69848
31082841,8/2/19,2019-08-02 23:54:11 UTC,Pacific Time (US & Canada),1492551,,2019-08-18 22:01:02 UTC,2023-02-24 21:09:29 UTC,research,CC-BY-NC,https://inaturalist-open-data.s3.amazonaws.com/photos/48611479/medium.jpg,,,2,0,FALSE,3,"Okanogan County, US-WA, US",48.7375783,-120.6784628,5,,,,5,,open,,subalpine larch,Larix lyallii,subalpine larch,Plantae,69848
31151644,8/19/19,2019-08-19 18:51:31 UTC,Pacific Time (US & Canada),740900,,2019-08-20 01:10:19 UTC,2021-06-11 12:31:55 UTC,research,CC-BY-NC,https://inaturalist-open-data.s3.amazonaws.com/photos/48727127/medium.jpg,,,2,0,FALSE,3,"Okanogan-Wenatchee National Forest, Leavenworth, WA, US",47.46266167,-120.9424133,5,,,,5,,open,,subalpine larch,Larix lyallii,subalpine larch,Plantae,69848
31299725,8/9/19,2019-08-09 17:02:47 UTC,UTC,1278807,,2019-08-22 17:22:20 UTC,2023-08-18 05:21:12 UTC,research,,https://static.inaturalist.org/photos/48974974/medium.jpg,,,2,0,FALSE,3,"Okanogan-Wenatchee National Forest, Stehekin, WA, US",48.50854167,-120.7655033,48,,,,48,,open,,subalpine larch,Larix lyallii,subalpine larch,Plantae,69848
31316949,8/20/19,2019-08-21 00:35:00 UTC,Pacific Time (US & Canada),538622,Eric Jain,2019-08-22 23:13:35 UTC,2019-08-23 03:06:27 UTC,research,CC-BY-NC,https://inaturalist-open-data.s3.amazonaws.com/photos/48993746/medium.jpg,flora,,1,0,FALSE,,"Chelan County, WA, USA",48.18424681,-120.8963918,,,,,,,open,,subalpine larch,Larix lyallii,subalpine larch,Plantae,69848
31329278,10/7/18,2018-10-07 20:55:58 UTC,Pacific Time (US & Canada),1843005,,2019-08-23 04:16:11 UTC,2023-03-08 23:12:25 UTC,research,,https://static.inaturalist.org/photos/49024801/medium.jpeg,,,2,0,FALSE,2,"Chelan County, WA, USA",48.50211334,-120.7689896,,,,,,,open,gps,subalpine larch,Larix lyallii,subalpine larch,Plantae,69848
31474843,8/24/19,2019-08-24 21:02:42 UTC,Mountain Time (US & Canada),1598326,Jonathan Fearns,2019-08-25 14:57:29 UTC,2019-08-25 16:17:09 UTC,research,,https://static.inaturalist.org/photos/49263098/medium.jpg,,,1,0,FALSE,3,"Pincher Creek No. 9, AB, CA",49.21599167,-114.0367445,6,,,,6,,open,,subalpine larch,Larix lyallii,subalpine larch,Plantae,69848
31513168,8/24/19,2019-08-24 19:06:42 UTC,Pacific Time (US & Canada),1798047,,2019-08-25 23:42:52 UTC,2022-09-21 04:22:48 UTC,research,CC-BY-NC,https://inaturalist-open-data.s3.amazonaws.com/photos/49326060/medium.jpg,,,2,0,FALSE,3,"Okanogan National Forest, Deming, WA, US",48.75286333,-120.6948167,10,,,,10,,open,,subalpine larch,Larix lyallii,subalpine larch,Plantae,69848
31704570,8/10/19,2019-08-10 20:09:00 UTC,Pacific Time (US & Canada),1195500,,2019-08-29 01:35:32 UTC,2020-11-25 13:50:56 UTC,research,CC-BY-NC,https://inaturalist-open-data.s3.amazonaws.com/photos/49647339/medium.jpeg,,,1,0,FALSE,,"Top of the World, East Kootenay, British Columbia, Canada",49.86686752,-115.4108975,,,,,,,open,,subalpine larch,Larix lyallii,subalpine larch,Plantae,69848
31704582,8/10/19,2019-08-10 20:14:00 UTC,Pacific Time (US & Canada),1195500,,2019-08-29 01:35:41 UTC,2020-11-25 13:52:30 UTC,research,CC-BY-NC,https://inaturalist-open-data.s3.amazonaws.com/photos/49647620/medium.jpeg,,,1,0,FALSE,,"East Kootenay, BC, Canada",49.86738576,-115.4121004,,,,,,,open,,subalpine larch,Larix lyallii,subalpine larch,Plantae,69848
31704638,8/10/19,2019-08-10 21:02:00 UTC,Pacific Time (US & Canada),1195500,,2019-08-29 01:36:23 UTC,2020-11-25 13:53:27 UTC,research,CC-BY-NC,https://inaturalist-open-data.s3.amazonaws.com/photos/49648554/medium.jpeg,,,1,0,FALSE,,"Top of the World, East Kootenay, British Columbia, Canada",49.8674675,-115.4122089,,,,,,,open,,subalpine larch,Larix lyallii,subalpine larch,Plantae,69848
31751256,8/26/19,2019-08-26 22:39:00 UTC,Pacific Time (US & Canada),740297,Matt Berger,2019-08-29 21:09:49 UTC,2022-09-06 04:28:33 UTC,research,CC-BY,https://inaturalist-open-data.s3.amazonaws.com/photos/49727644/medium.jpg,,Top of Pass,2,0,FALSE,3,"Okanogan-Wenatchee National Forest, Mazama, WA, US",48.67056667,-120.7180783,10,,,,10,,open,,subalpine larch,Larix lyallii,subalpine larch,Plantae,69848
31752913,8/26/19,2019-08-26 17:26:56 UTC,Pacific Time (US & Canada),740297,Matt Berger,2019-08-29 21:42:01 UTC,2023-03-08 23:12:28 UTC,research,CC-BY,https://inaturalist-open-data.s3.amazonaws.com/photos/49730381/medium.jpg,,On passes and ridges,2,0,FALSE,3,"Okanogan-Wenatchee National Forest, Marblemount, WA, US",48.58498833,-120.7208633,5,,,,5,,open,,subalpine larch,Larix lyallii,subalpine larch,Plantae,69848
31753447,8/26/19,2019-08-26 15:29:58 UTC,Pacific Time (US & Canada),740297,Matt Berger,2019-08-29 21:53:09 UTC,2023-03-08 23:12:28 UTC,research,CC-BY,https://inaturalist-open-data.s3.amazonaws.com/photos/49731417/medium.jpg,,Subalpine ridge ,2,0,FALSE,3,"Okanogan-Wenatchee National Forest, Marblemount, WA, US",48.55021333,-120.7091617,10,,,,10,,open,,subalpine larch,Larix lyallii,subalpine larch,Plantae,69848
31892626,7/23/19,2019-07-24 02:43:41 UTC,Pacific Time (US & Canada),1062241,,2019-09-01 02:31:41 UTC,2020-10-12 03:30:07 UTC,research,CC-BY-NC,https://inaturalist-open-data.s3.amazonaws.com/photos/49964263/medium.jpeg,,Little larch,1,0,FALSE,2,"Mount Assiniboine, CA-BC-EK, CA-BC, CA",50.89662333,-115.6390833,11,,,,11,,open,,subalpine larch,Larix lyallii,subalpine larch,Plantae,69848
32001628,8/31/19,2019-09-01 01:19:00 UTC,Pacific Time (US & Canada),538622,Eric Jain,2019-09-02 18:56:19 UTC,2019-09-03 15:33:55 UTC,research,CC-BY-NC,https://inaturalist-open-data.s3.amazonaws.com/photos/50145395/medium.jpg,flora,,1,0,FALSE,,"Okanogan County, WA, USA",48.66275492,-119.9405524,,,,,,,open,,subalpine larch,Larix lyallii,subalpine larch,Plantae,69848
32166851,8/27/19,2019-08-27 18:02:00 UTC,Pacific Time (US & Canada),1765764,,2019-09-05 16:26:08 UTC,2020-10-12 03:29:56 UTC,research,CC-BY-NC,https://inaturalist-open-data.s3.amazonaws.com/photos/50425303/medium.jpg,,,2,0,FALSE,,"Columbia-Shuswap, BC, Canada",51.3555372,-116.3792917,488,,,,488,,open,,subalpine larch,Larix lyallii,subalpine larch,Plantae,69848
32180790,9/30/18,2018-09-30 20:01:00 UTC,Pacific Time (US & Canada),1657037,Christopher J. Earle,2019-09-05 20:26:23 UTC,2020-09-14 02:34:43 UTC,research,CC-BY-NC,https://inaturalist-open-data.s3.amazonaws.com/photos/50447183/medium.jpg,Mountain-Cascades,"Alpine larch at Ingalls Pass, and Mt. Stuart in the clouds.",2,0,FALSE,,"Chelan, Washington, United States",47.45946167,-120.9348483,,,,,,,open,,subalpine larch,Larix lyallii,subalpine larch,Plantae,69848
33046348,9/19/19,2019-09-19 20:04:00 UTC,Mountain Time (US & Canada),88044,BioBlitz,2019-09-20 02:36:30 UTC,2024-06-27 06:19:03 UTC,research,CC-BY-ND,https://inaturalist-open-data.s3.amazonaws.com/photos/51870934/medium.jpeg,,Panorama Ridge,1,0,FALSE,,"Division No. 15, AB, Canada",51.31166325,-116.1081533,345,,,,345,,open,,subalpine larch,Larix lyallii,subalpine larch,Plantae,69848
33167579,9/21/19,2019-09-21 19:09:48 UTC,Pacific Time (US & Canada),798730,Justin Baldwin,2019-09-22 00:58:11 UTC,2023-02-24 02:36:42 UTC,research,,https://static.inaturalist.org/photos/52069528/medium.jpg,,,3,1,FALSE,3,"Chelan County, US-WA, US",47.49294082,-120.8401212,357,,,,357,,open,,subalpine larch,Larix lyallii,subalpine larch,Plantae,69848
33172859,9/10/19,2019-09-10 17:05:09 UTC,Pacific Time (US & Canada),8641,John Brew,2019-09-22 02:54:06 UTC,2023-03-08 23:12:38 UTC,research,CC-BY,https://inaturalist-open-data.s3.amazonaws.com/photos/52078499/medium.jpg,,Blue Lake trail,1,0,FALSE,3,"Okanogan-Wenatchee National Forest, Stehekin, WA, US",48.50626667,-120.6578617,,,,,,,open,,subalpine larch,Larix lyallii,subalpine larch,Plantae,69848
33257703,9/10/19,2019-09-10 17:21:19 UTC,Pacific Time (US & Canada),8641,John Brew,2019-09-23 14:18:48 UTC,2023-03-08 23:12:43 UTC,research,CC-BY,https://inaturalist-open-data.s3.amazonaws.com/photos/52220887/medium.jpg,,"The largest subalpine larch I saw  in this area
Blue Lake trail",1,0,FALSE,3,"Okanogan-Wenatchee National Forest, Stehekin, WA, US",48.501805,-120.667255,,,,,,,open,,subalpine larch,Larix lyallii,subalpine larch,Plantae,69848
33257768,9/10/19,2019-09-10 17:25:57 UTC,Pacific Time (US & Canada),8641,John Brew,2019-09-23 14:20:47 UTC,2019-09-24 19:04:55 UTC,research,CC-BY,https://inaturalist-open-data.s3.amazonaws.com/photos/52220997/medium.jpg,,Blue Lake,1,0,FALSE,3,"Okanogan-Wenatchee National Forest, Stehekin, WA, US",48.49757167,-120.669405,,,,,,,open,,subalpine larch,Larix lyallii,subalpine larch,Plantae,69848
33295243,9/11/19,2019-09-11 16:39:29 UTC,Pacific Time (US & Canada),8641,John Brew,2019-09-24 03:00:29 UTC,2019-09-24 17:44:27 UTC,research,CC-BY,https://inaturalist-open-data.s3.amazonaws.com/photos/52285011/medium.jpg,,Pacific Crest Trail to Cutthroat Pass,1,0,FALSE,3,"Okanogan-Wenatchee National Forest, Marblemount, WA, US",48.55304667,-120.7097283,,,,,,,open,,subalpine larch,Larix lyallii,subalpine larch,Plantae,69848
33295435,9/11/19,2019-09-11 16:48:34 UTC,Pacific Time (US & Canada),8641,John Brew,2019-09-24 03:05:10 UTC,2019-09-24 17:44:26 UTC,research,CC-BY,https://inaturalist-open-data.s3.amazonaws.com/photos/52285402/medium.jpg,,Pacific Crest Trail to Cutthroat Pass,1,0,FALSE,3,"Okanogan-Wenatchee National Forest, Marblemount, WA, US",48.55145833,-120.7069917,,,,,,,open,,subalpine larch,Larix lyallii,subalpine larch,Plantae,69848
33296193,9/11/19,2019-09-11 17:19:56 UTC,Pacific Time (US & Canada),8641,John Brew,2019-09-24 03:27:45 UTC,2019-09-24 17:44:18 UTC,research,CC-BY,https://inaturalist-open-data.s3.amazonaws.com/photos/52286904/medium.jpg,,Pacific Crest Trail to Cutthroat Pass,1,0,FALSE,3,"Okanogan-Wenatchee National Forest, Marblemount, WA, US",48.55529667,-120.7043367,,,,,,,open,,subalpine larch,Larix lyallii,subalpine larch,Plantae,69848
33373503,9/11/19,2019-09-11 17:52:15 UTC,Pacific Time (US & Canada),8641,John Brew,2019-09-25 15:05:23 UTC,2019-09-25 20:11:53 UTC,research,CC-BY,https://inaturalist-open-data.s3.amazonaws.com/photos/52412765/medium.jpg,,"Pacific Crest Trail between Cutthroat and Granite Pass
Elevation about 2070 meters (6800 feet)",1,0,FALSE,3,"Okanogan-Wenatchee National Forest, Mazama, WA, US",48.557445,-120.6903617,,,,,,,open,,subalpine larch,Larix lyallii,subalpine larch,Plantae,69848
33375378,9/11/19,2019-09-11 17:55:28 UTC,Pacific Time (US & Canada),8641,John Brew,2019-09-25 15:36:59 UTC,2019-09-25 20:14:09 UTC,research,CC-BY,https://inaturalist-open-data.s3.amazonaws.com/photos/52415695/medium.jpg,,"Pacific Crest Trail between Cutthroat and Granite Pass
Elevation about 2070 meters (6800 feet)",1,0,FALSE,3,"Okanogan-Wenatchee National Forest, Mazama, WA, US",48.558195,-120.6908867,,,,,,,open,,subalpine larch,Larix lyallii,subalpine larch,Plantae,69848
33375962,9/11/19,2019-09-11 18:13:50 UTC,Pacific Time (US & Canada),8641,John Brew,2019-09-25 15:48:07 UTC,2019-10-14 00:19:52 UTC,research,CC-BY,https://inaturalist-open-data.s3.amazonaws.com/photos/52416666/medium.jpg,,"Pacific Crest Trail between Cutthroat and Granite Pass
Elevation about 2070 meters (6800 feet)",1,0,FALSE,3,"Okanogan-Wenatchee National Forest, Mazama, WA, US",48.56661667,-120.6859117,,,,,,,open,,subalpine larch,Larix lyallii,subalpine larch,Plantae,69848
33412026,9/11/19,2019-09-11 18:17:07 UTC,Pacific Time (US & Canada),8641,John Brew,2019-09-26 04:10:17 UTC,2019-09-26 19:33:15 UTC,research,CC-BY,https://inaturalist-open-data.s3.amazonaws.com/photos/52475869/medium.jpg,,"Pacific Crest Trail between Cutthroat and Granite Pass
Elevation about 2070 meters (6800 feet)",2,0,FALSE,3,"Okanogan-Wenatchee National Forest, Marblemount, WA, US",48.56692,-120.6861867,,,,,,,open,,subalpine larch,Larix lyallii,subalpine larch,Plantae,69848
33628579,9/26/19,2019-09-26 18:11:00 UTC,Mountain Time (US & Canada),1079214,Lori Skulski,2019-09-30 01:20:16 UTC,2019-10-08 02:13:51 UTC,research,,https://static.inaturalist.org/photos/52834270/medium.jpeg,,,1,0,FALSE,,"Division No. 15, AB, Canada",50.54825,-114.8308472,,,,,,,open,,subalpine larch,Larix lyallii,subalpine larch,Plantae,69848
33648581,9/12/19,2019-09-12 19:09:11 UTC,Pacific Time (US & Canada),8641,John Brew,2019-09-30 14:27:27 UTC,2019-09-30 15:45:26 UTC,research,CC-BY,https://inaturalist-open-data.s3.amazonaws.com/photos/52870314/medium.jpg,,Maple Pass Loop trail,1,0,FALSE,3,"Okanogan-Wenatchee National Forest, Stehekin, WA, US",48.50388667,-120.76772,,,,,,,open,,subalpine larch,Larix lyallii,subalpine larch,Plantae,69848
33733866,9/12/19,2019-09-12 17:09:51 UTC,Pacific Time (US & Canada),8641,John Brew,2019-10-02 01:40:28 UTC,2023-03-08 23:12:44 UTC,research,CC-BY,https://inaturalist-open-data.s3.amazonaws.com/photos/53012729/medium.jpg,,Maple Pass Loop trail ,1,0,FALSE,3,"Okanogan-Wenatchee National Forest, Stehekin, WA, US",48.501505,-120.7513883,,,,,,,open,,subalpine larch,Larix lyallii,subalpine larch,Plantae,69848
33734321,9/12/19,2019-09-12 16:40:22 UTC,Pacific Time (US & Canada),8641,John Brew,2019-10-02 01:49:29 UTC,2023-03-08 23:12:45 UTC,research,CC-BY,https://inaturalist-open-data.s3.amazonaws.com/photos/53013396/medium.jpg,,Maple Pass Loop trail ,1,0,FALSE,3,"Okanogan-Wenatchee National Forest, Stehekin, WA, US",48.50652833,-120.7419717,,,,,,,open,,subalpine larch,Larix lyallii,subalpine larch,Plantae,69848
33859610,8/29/17,2017-08-29 16:15:00 UTC,Pacific Time (US & Canada),740297,Matt Berger,2019-10-04 20:46:52 UTC,2022-10-14 23:54:02 UTC,research,CC-BY,https://inaturalist-open-data.s3.amazonaws.com/photos/53224143/medium.jpeg,,,2,0,FALSE,,"Lewis and Clark County, MT, USA",47.73506667,-113.143975,5,,,,5,,open,,subalpine larch,Larix lyallii,subalpine larch,Plantae,69848
33992474,10/6/19,2019-10-06 19:22:34 UTC,Pacific Time (US & Canada),1496357,,2019-10-07 02:41:17 UTC,2020-04-27 04:41:45 UTC,research,CC-BY-NC,https://inaturalist-open-data.s3.amazonaws.com/photos/53447977/medium.jpg,,,1,0,FALSE,3,"E. C. Manning Provincial Park, , BC, CA",49.01858617,-120.8313217,6,,,,6,,open,,subalpine larch,Larix lyallii,subalpine larch,Plantae,69848
34034500,10/6/19,2019-10-06 22:41:28 UTC,Pacific Time (US & Canada),710,John Cramer III,2019-10-07 21:22:31 UTC,2023-03-08 23:12:51 UTC,research,,https://static.inaturalist.org/photos/53516258/medium.jpeg,,,1,0,FALSE,2,"Chelan County, WA, USA",48.49960327,-120.7611237,,,,,,,open,gps,subalpine larch,Larix lyallii,subalpine larch,Plantae,69848
34044999,10/6/19,2019-10-06 21:42:31 UTC,Pacific Time (US & Canada),1245678,,2019-10-08 01:29:33 UTC,2020-02-08 19:30:34 UTC,research,,https://static.inaturalist.org/photos/53534303/medium.jpg,,,1,0,FALSE,3,"Okanogan-Wenatchee National Forest, Leavenworth, WA, US",48.0831945,-120.803825,5,,,,5,,open,,subalpine larch,Larix lyallii,subalpine larch,Plantae,69848
34234937,10/11/19,2019-10-11 20:58:00 UTC,Pacific Time (US & Canada),538622,Eric Jain,2019-10-12 05:49:19 UTC,2019-10-15 00:46:54 UTC,research,CC-BY-NC,https://inaturalist-open-data.s3.amazonaws.com/photos/53854467/medium.jpg,flora,,1,0,FALSE,,"North Cascades National Park, Skagit, Washington, United States",48.57133529,-120.8421031,,,,,,,open,,subalpine larch,Larix lyallii,subalpine larch,Plantae,69848
34340846,9/21/19,2019-09-21 19:41:00 UTC,Eastern Time (US & Canada),705651,Mathis Natvik,2019-10-14 02:45:06 UTC,2019-10-14 15:45:37 UTC,research,,https://static.inaturalist.org/photos/54033103/medium.jpg,,,1,0,FALSE,,"Division No. 15, AB, Canada",50.64677197,-114.9678752,,,,,,,open,,subalpine larch,Larix lyallii,subalpine larch,Plantae,69848
37493455,9/26/04,2004-09-26 22:23:13 UTC,Eastern Time (US & Canada),2185878,,2020-01-11 19:11:07 UTC,2020-04-27 04:41:39 UTC,research,,https://inaturalist-open-data.s3.amazonaws.com/photos/59447123/medium.jpg,,,2,0,FALSE,3,"Mount Assiniboine Provincial Park, BC, CA",50.9224771,-115.6599867,,,,,,,open,,subalpine larch,Larix lyallii,subalpine larch,Plantae,69848
37853983,8/3/16,2016-08-03 16:05:00 UTC,Pacific Time (US & Canada),46945,T. Abe Lloyd,2020-01-22 20:41:45 UTC,2022-09-06 04:16:30 UTC,research,CC-BY-NC,https://inaturalist-open-data.s3.amazonaws.com/photos/60088297/medium.jpeg,,,2,0,FALSE,,"Whatcom County, WA, USA",48.75834968,-120.8581383,31,,,,31,,open,,subalpine larch,Larix lyallii,subalpine larch,Plantae,69848
38230419,8/27/16,2016-08-27 22:07:00 UTC,Pacific Time (US & Canada),1541811,Rand Rudland,2020-02-02 20:49:34 UTC,2020-11-12 02:37:49 UTC,research,CC-BY,https://static.inaturalist.org/photos/60725816/medium.jpeg,,,2,0,FALSE,,"Cathedral Lakes Prov Park, Okanagan-Similkameen G, BC V0X 1N0, Canada",49.0561884,-120.2076112,288,,,,288,,open,,subalpine larch,Larix lyallii,subalpine larch,Plantae,69848
38277571,12/27/19,2019-12-27 19:57:00 UTC,Eastern Time (US & Canada),705651,Mathis Natvik,2020-02-03 23:52:32 UTC,2023-03-08 23:14:51 UTC,research,,https://static.inaturalist.org/photos/60810479/medium.jpg,,,1,0,FALSE,,"Division No. 15, AB, Canada",50.80563664,-115.2936488,4,,,,4,,open,,subalpine larch,Larix lyallii,subalpine larch,Plantae,69848
38308176,12/27/19,2019-12-27 20:14:00 UTC,Eastern Time (US & Canada),705651,Mathis Natvik,2020-02-04 22:16:22 UTC,2023-03-08 23:14:56 UTC,research,,https://static.inaturalist.org/photos/60865806/medium.jpg,,,1,0,FALSE,,"Division No. 15, AB, Canada",50.80604072,-115.2927392,8,,,,8,,open,,subalpine larch,Larix lyallii,subalpine larch,Plantae,69848
38308255,12/27/19,2019-12-27 19:39:00 UTC,Eastern Time (US & Canada),705651,Mathis Natvik,2020-02-04 22:18:11 UTC,2020-03-13 21:38:18 UTC,research,,https://static.inaturalist.org/photos/60865875/medium.jpg,,,2,0,FALSE,,"Division No. 15, AB, Canada",50.81159197,-115.2758345,4,,,,4,,open,,subalpine larch,Larix lyallii,subalpine larch,Plantae,69848
38947448,1/10/20,2020-01-10 19:40:25 UTC,UTC,2520374,,2020-02-21 03:42:39 UTC,2020-04-27 04:41:55 UTC,research,CC-BY-NC,https://inaturalist-open-data.s3.amazonaws.com/photos/61874359/medium.jpg,,,2,0,FALSE,3,"East Kootenay C, BC, CA",49.75118552,-115.5173246,26745,,,,26745,,open,,subalpine larch,Larix lyallii,subalpine larch,Plantae,69848
39188021,8/30/15,2015-08-30 12:36:00 UTC,Paris,2585621,Daniel Knig,2020-02-25 01:03:06 UTC,2023-03-08 23:16:31 UTC,research,CC-BY-NC,https://inaturalist-open-data.s3.amazonaws.com/photos/62136124/medium.jpg,,,1,0,FALSE,,"Chester Lake Trail, Division No. 15, AB, Kanada",50.81236107,-115.2758128,697,,,,697,,open,,subalpine larch,Larix lyallii,subalpine larch,Plantae,69848
39636760,3/5/20,2020-03-05 20:29:41 UTC,Mountain Time (US & Canada),785779,Matt Wallace,2020-03-07 04:31:46 UTC,2023-03-08 23:16:58 UTC,research,,https://static.inaturalist.org/photos/62903686/medium.jpeg,,"Subalpine larix species located near top of Gold Chair, Nakiska ski resort.",2,0,FALSE,2,"Kananaskis, AB T0L, Canada",50.94772115,-115.1902131,25,,,,25,,open,gps,subalpine larch,Larix lyallii,subalpine larch,Plantae,69848
40364776,7/12/14,2014-07-12 18:17:00 UTC,Mountain Time (US & Canada),1068866,James Telford,2020-03-21 16:09:41 UTC,2020-03-25 15:11:53 UTC,research,CC-BY,https://inaturalist-open-data.s3.amazonaws.com/photos/64113932/medium.jpeg,,,1,0,FALSE,,"Division No. 3, AB, Canada",49.01555922,-114.0163837,1340,,,,1340,,open,,subalpine larch,Larix lyallii,subalpine larch,Plantae,69848
41738418,6/24/15,2015-06-24 16:21:00 UTC,Pacific Time (US & Canada),408815,Ian Cruickshank,2020-04-09 03:30:47 UTC,2020-04-09 13:00:28 UTC,research,CC-BY-NC,https://inaturalist-open-data.s3.amazonaws.com/photos/66219589/medium.jpeg,,,1,0,FALSE,,"Division No. 3, AB, Canada",49.02018223,-114.0126227,488,,,,488,,open,,subalpine larch,Larix lyallii,subalpine larch,Plantae,69848
41889574,7/4/15,2015-07-04 16:25:00 UTC,Pacific Time (US & Canada),408815,Ian Cruickshank,2020-04-11 07:50:07 UTC,2020-04-11 16:17:08 UTC,research,CC-BY-NC,https://inaturalist-open-data.s3.amazonaws.com/photos/66473412/medium.jpeg,,,1,0,FALSE,,"Division No. 3, AB, Canada",49.01544167,-114.0203283,,,,,,,open,,subalpine larch,Larix lyallii,subalpine larch,Plantae,69848
41890090,7/4/15,2015-07-04 20:18:00 UTC,Pacific Time (US & Canada),408815,Ian Cruickshank,2020-04-11 08:06:27 UTC,2020-10-12 02:40:58 UTC,research,CC-BY-NC,https://inaturalist-open-data.s3.amazonaws.com/photos/66474370/medium.jpeg,,,2,0,FALSE,,"Waterton Lakes, Division No. 3, Alberta, Canada",49.03307167,-113.99152,,,,,,,open,,subalpine larch,Larix lyallii,subalpine larch,Plantae,69848
42049549,10/6/18,2018-10-07 05:02:55 UTC,Pacific Time (US & Canada),1383451,Claire Thompson,2020-04-13 00:01:34 UTC,2020-04-27 04:41:46 UTC,research,,https://static.inaturalist.org/photos/66738580/medium.jpg,,,1,0,FALSE,3,"Okanogan-Wenatchee National Forest, Marblemount, WA, US",48.57324039,-120.8376644,1935,,,,1935,,open,,subalpine larch,Larix lyallii,subalpine larch,Plantae,69848
42240843,8/12/02,2002-08-12 20:38:00 UTC,Eastern Time (US & Canada),788181,Lada Malek,2020-04-15 15:51:41 UTC,2020-04-17 14:07:23 UTC,research,CC-BY-NC,https://inaturalist-open-data.s3.amazonaws.com/photos/67059740/medium.jpeg,,,2,0,FALSE,,"East Kootenay, BC, Canada",50.35877319,-116.6186156,31,,,,31,,open,,subalpine larch,Larix lyallii,subalpine larch,Plantae,69848
42295589,8/6/15,2015-08-06 16:21:00 UTC,Pacific Time (US & Canada),408815,Ian Cruickshank,2020-04-16 05:54:04 UTC,2020-04-16 13:00:39 UTC,research,CC-BY-NC,https://inaturalist-open-data.s3.amazonaws.com/photos/67150172/medium.jpeg,,,1,0,FALSE,,"Division No. 3, AB, Canada",49.13044167,-114.153395,,,,,,,open,,subalpine larch,Larix lyallii,subalpine larch,Plantae,69848
42650559,6/14/15,2015-06-14 18:51:00 UTC,Pacific Time (US & Canada),408815,Ian Cruickshank,2020-04-20 07:12:34 UTC,2020-04-20 07:16:23 UTC,research,CC-BY-NC,https://inaturalist-open-data.s3.amazonaws.com/photos/67730362/medium.jpeg,,,1,0,FALSE,,"Division No. 3, AB, Canada",49.04510648,-113.7931801,244,,,,244,,open,,Larix lyallii,Larix lyallii,subalpine larch,Plantae,69848
42739357,10/1/19,2019-10-01 18:11:40 UTC,Pacific Time (US & Canada),2787296,Taylor Justason,2020-04-21 08:27:57 UTC,2020-04-24 05:35:59 UTC,research,CC-BY-NC,https://inaturalist-open-data.s3.amazonaws.com/photos/67876023/medium.jpeg,,,1,0,FALSE,2,"Keremeos, BC V0X 1N0, Canada",49.08098902,-120.2100705,125,,,,125,,open,gps,subalpine larch,Larix lyallii,subalpine larch,Plantae,69848
42797858,10/1/19,2019-10-01 16:49:05 UTC,Pacific Time (US & Canada),2787296,Taylor Justason,2020-04-21 22:49:59 UTC,2020-05-20 13:42:22 UTC,research,CC-BY-NC,https://inaturalist-open-data.s3.amazonaws.com/photos/67965460/medium.jpeg,,,1,0,FALSE,2,"Keremeos, BC V0X 1N0, Canada",49.07410278,-120.1940306,,,,,,,open,gps,subalpine larch,Larix lyallii,subalpine larch,Plantae,69848
43814914,10/13/18,2018-10-13 22:05:52 UTC,Pacific Time (US & Canada),2263031,Stephen Hui,2020-04-27 02:50:49 UTC,2021-06-11 12:32:27 UTC,research,CC-BY-NC,https://inaturalist-open-data.s3.amazonaws.com/photos/69491106/medium.jpg,,Subalpine terrain. ,2,0,FALSE,3,"Okanogan-Wenatchee National Forest, Leavenworth, WA, US",47.47863682,-120.8017754,234,,,,234,,open,,subalpine larch,Larix lyallii,subalpine larch,Plantae,69848
44852629,6/20/15,2015-06-20 21:40:00 UTC,Pacific Time (US & Canada),408815,Ian Cruickshank,2020-05-04 07:13:47 UTC,2020-09-25 19:48:01 UTC,research,CC-BY-NC,https://inaturalist-open-data.s3.amazonaws.com/photos/71105512/medium.jpeg,,,1,0,FALSE,,"Waterton Lakes, Division No. 3, Alberta, Canada",49.081755,-114.0106383,,,,,,,open,,subalpine larch,Larix lyallii,subalpine larch,Plantae,69848
45420414,7/26/10,2010-07-26 11:08:00 UTC,Pacific Time (US & Canada),2753018,James Miskelly,2020-05-09 22:33:31 UTC,2020-05-11 15:57:24 UTC,research,CC-BY-NC,https://inaturalist-open-data.s3.amazonaws.com/photos/72019199/medium.jpeg,,,1,0,FALSE,,"Okanogan County, WA, USA",48.73798865,-120.671994,100,,,,100,,open,,subalpine larch,Larix lyallii,subalpine larch,Plantae,69848
47365656,5/23/20,2020-05-23 21:29:42 UTC,Pacific Time (US & Canada),2726752,,2020-05-26 03:56:44 UTC,2023-08-18 05:17:19 UTC,research,,https://static.inaturalist.org/photos/75123298/medium.jpg,,,2,0,FALSE,3,"Okanogan-Wenatchee National Forest, Mazama, WA, US",48.53275537,-120.6729155,4301,,,,4301,,open,,subalpine larch,Larix lyallii,subalpine larch,Plantae,69848
48238986,9/24/12,2012-09-25 00:27:00 UTC,Pacific Time (US & Canada),46945,T. Abe Lloyd,2020-06-02 15:19:16 UTC,2020-09-14 02:31:26 UTC,research,CC-BY-NC,https://inaturalist-open-data.s3.amazonaws.com/photos/76530892/medium.jpeg,,,2,0,FALSE,,"Okanogan County, WA, USA",48.52077575,-120.6506546,33,,,,33,,open,,subalpine larch,Larix lyallii,subalpine larch,Plantae,69848
48254254,7/14/18,,UTC,1016558,Brendan McGarry,2020-06-02 17:49:03 UTC,2020-06-02 18:08:35 UTC,research,,https://static.inaturalist.org/photos/76554360/medium.jpeg,,,1,0,FALSE,,"Jackita Ridge, Washington, USA",48.7787447,-120.8426141,1429,,,,1429,,open,,subalpine larch,Larix lyallii,subalpine larch,Plantae,69848
50314137,6/20/20,2020-06-20 19:49:15 UTC,Mountain Time (US & Canada),1777071,,2020-06-20 19:50:02 UTC,2024-06-27 06:18:50 UTC,research,CC-BY-NC,https://inaturalist-open-data.s3.amazonaws.com/photos/81958880/medium.jpg,,,2,0,FALSE,3,"Banff National Park, AB, CA",51.41677935,-116.2394083,1414,,,,1414,,open,,subalpine larch,Larix lyallii,subalpine larch,Plantae,69848
51096537,6/25/20,2020-06-25 20:39:37 UTC,Mountain Time (US & Canada),3195879,,2020-06-27 14:33:52 UTC,2022-03-21 22:38:24 UTC,research,CC-BY-NC,https://inaturalist-open-data.s3.amazonaws.com/photos/81166765/medium.jpg,,,1,0,FALSE,3,"East Kootenay, CA-BC, CA",50.46659633,-115.216802,10,,,,10,,open,,subalpine larch,Larix lyallii,subalpine larch,Plantae,69848
51278230,6/25/20,2020-06-25 22:11:06 UTC,Pacific Time (US & Canada),1275261,Jim Scarborough,2020-06-28 20:33:25 UTC,2022-09-23 03:58:23 UTC,research,,https://static.inaturalist.org/photos/81458415/medium.jpg,,,1,0,FALSE,3,"Okanogan-Wenatchee National Forest, Mazama, WA, US",48.50164818,-120.4588776,5006,,,,5006,,open,,subalpine larch,Larix lyallii,subalpine larch,Plantae,69848
51986660,7/3/20,2020-07-03 21:54:45 UTC,Pacific Time (US & Canada),350245,Mark Robinson,2020-07-05 05:11:51 UTC,2024-05-08 02:00:34 UTC,research,CC-BY-NC,https://inaturalist-open-data.s3.amazonaws.com/photos/82623058/medium.jpg,,,1,0,FALSE,3,"Okanogan-Wenatchee National Forest, Mazama, WA, US",48.74898833,-120.3248283,4,,,,4,,open,,subalpine larch,Larix lyallii,subalpine larch,Plantae,69848
52112514,6/30/20,2020-06-30 20:10:48 UTC,Pacific Time (US & Canada),2060810,Mrs S Loves Art,2020-07-06 03:43:48 UTC,2020-10-12 03:29:38 UTC,research,,https://static.inaturalist.org/photos/86775815/medium.jpg,,,1,0,FALSE,3,"Cathedral Provincial Park and Protected Area, BC, CA",49.0655695,-120.1964633,32,,,,32,,open,,subalpine larch,Larix lyallii,subalpine larch,Plantae,69848
52117226,6/19/20,2020-06-20 01:33:44 UTC,Pacific Time (US & Canada),8641,John Brew,2020-07-06 05:07:31 UTC,2023-02-05 03:19:10 UTC,research,CC-BY,https://inaturalist-open-data.s3.amazonaws.com/photos/82831246/medium.jpg,,"I think Larix lyalli , at Ingalls Pass",1,0,FALSE,3,"Okanogan-Wenatchee National Forest, Leavenworth, WA, US",47.45948667,-120.9355167,,,,,,,open,,subalpine larch,Larix lyallii,subalpine larch,Plantae,69848
52510329,7/5/20,2020-07-05 19:24:29 UTC,Mountain Time (US & Canada),1636116,Yves Dansereau,2020-07-09 21:05:00 UTC,2024-06-27 06:18:41 UTC,research,CC-BY-NC,https://inaturalist-open-data.s3.amazonaws.com/photos/83478593/medium.jpg,,,1,0,FALSE,3,"Banff National Park, AB, CA",51.26341667,-116.0841217,,,,,,,open,,subalpine larch,Larix lyallii,subalpine larch,Plantae,69848
53648816,7/18/20,2020-07-18 22:54:16 UTC,Mountain Time (US & Canada),1658303,Paul Grieve,2020-07-19 20:37:45 UTC,2024-06-27 06:18:32 UTC,research,,https://static.inaturalist.org/photos/85335892/medium.jpg,,No idea what species ,1,0,FALSE,3,"Banff National Park, AB, CA",51.11146367,-115.8671143,437,,,,437,,open,,subalpine larch,Larix lyallii,subalpine larch,Plantae,69848
53691901,7/18/20,2020-07-18 21:34:42 UTC,Pacific Time (US & Canada),787680,Samuel Grubinger,2020-07-20 03:47:35 UTC,2020-10-12 03:29:30 UTC,research,,https://static.inaturalist.org/photos/85406735/medium.jpg,,On the Heather Trail in EC Manning. ~1km from trailhead.  Elevation around 2000 meters.,1,0,FALSE,3,"E. C. Manning Provincial Park, BC, CA",49.11181383,-120.7581033,5,,,,5,,open,,subalpine larch,Larix lyallii,subalpine larch,Plantae,69848
53693111,7/19/20,2020-07-19 20:04:17 UTC,Pacific Time (US & Canada),2046206,Erin Springinotic,2020-07-20 04:08:05 UTC,2023-01-13 00:30:26 UTC,research,CC0,https://inaturalist-open-data.s3.amazonaws.com/photos/85411496/medium.jpg,,,3,1,FALSE,3,"Central Kootenay H, BC, CA",49.93723703,-117.1506023,40,,,,40,,open,,subalpine larch,Larix lyallii,subalpine larch,Plantae,69848
54183593,7/22/20,2020-07-22 21:24:18 UTC,Mountain Time (US & Canada),542836,Aerin Jacob,2020-07-24 18:18:36 UTC,2024-06-27 06:18:28 UTC,research,CC-BY,https://inaturalist-open-data.s3.amazonaws.com/photos/86205520/medium.jpg,,,2,0,FALSE,3,"Banff National Park, Banff, CA-AB-FN, CA-AB, CA",51.18804726,-115.9545084,4,,,,4,,open,,subalpine larch,Larix lyallii,subalpine larch,Plantae,69848
54184138,7/23/20,2020-07-23 18:34:03 UTC,Mountain Time (US & Canada),542836,Aerin Jacob,2020-07-24 18:25:11 UTC,2024-06-27 06:18:23 UTC,research,CC-BY,https://inaturalist-open-data.s3.amazonaws.com/photos/86203220/medium.jpg,,,2,0,FALSE,3,"Banff, Banff National Park, CA-AB-FN, CA-AB, CA",51.10928832,-115.9263148,10,,,,10,,open,,subalpine larch,Larix lyallii,subalpine larch,Plantae,69848
54186228,7/21/20,,UTC,2792733,Chris,2020-07-24 18:45:41 UTC,2024-06-27 06:18:13 UTC,research,CC-BY-NC,https://inaturalist-open-data.s3.amazonaws.com/photos/86206714/medium.jpg,,,1,0,FALSE,,"Arnica Lake Trail, Improvement District No. 9, AB T0L, Canada",51.2292461,-116.0042465,176,,,,176,,open,,subalpine larch,Larix lyallii,subalpine larch,Plantae,69848
54186900,7/21/20,,UTC,2792733,Chris,2020-07-24 18:52:42 UTC,2024-06-27 06:18:08 UTC,research,CC-BY-NC,https://inaturalist-open-data.s3.amazonaws.com/photos/86208184/medium.jpg,,,1,0,FALSE,,"Lower Twin Lake, Improvement District No. 9, AB T0L, Canada",51.2019315,-115.9822844,597,,,,597,,open,,subalpine larch,Larix lyallii,subalpine larch,Plantae,69848
54968925,7/18/20,2020-07-18 21:54:00 UTC,Pacific Time (US & Canada),1421387,Kate McKeown,2020-07-31 20:54:47 UTC,2023-01-25 21:08:22 UTC,research,CC0,https://inaturalist-open-data.s3.amazonaws.com/photos/87482203/medium.jpeg,,,1,0,FALSE,,"Central Kootenay, British Columbia, Canada",50.251484,-116.549873,,,,,,,open,,subalpine larch,Larix lyallii,subalpine larch,Plantae,69848
55063396,7/18/20,2020-07-18 14:31:00 UTC,Atlantic Time (Canada),255040,Lena Dietz Chiasson,2020-08-01 18:24:13 UTC,2023-01-15 20:33:32 UTC,research,CC0,https://inaturalist-open-data.s3.amazonaws.com/photos/87648155/medium.jpeg,,,2,0,FALSE,,"District rgional d'East Kootenay, BC, Canada",50.252964,-116.549599,,,,,,,open,,subalpine larch,Larix lyallii,subalpine larch,Plantae,69848
55078528,7/18/20,2020-07-18 20:05:00 UTC,Mountain Time (US & Canada),785779,Matt Wallace,2020-08-01 20:37:39 UTC,2024-06-27 06:17:52 UTC,research,,https://static.inaturalist.org/photos/87675706/medium.jpg,,Locations are as close as I can navigate using the satelite imagery. shadows and no visibility of trail in imagery. All photos on trail to/from Taylor Lake.,1,0,FALSE,,Taylor Lake 1,51.29812436,-116.0917111,30,,,,30,,open,,subalpine larch,Larix lyallii,subalpine larch,Plantae,69848
55120353,8/1/20,2020-08-01 20:25:02 UTC,Pacific Time (US & Canada),1148374,Ben Keen,2020-08-02 05:00:15 UTC,2023-08-06 18:42:12 UTC,research,CC0,https://inaturalist-open-data.s3.amazonaws.com/photos/87749749/medium.jpeg,,,1,0,FALSE,2,"Manning Park, BC V0X 1R0, Canada",49.02585278,-120.8305889,,,,,,,open,gps,subalpine larch,Larix lyallii,subalpine larch,Plantae,69848
55192187,7/18/20,2020-07-18 20:04:00 UTC,Pacific Time (US & Canada),302785,Thomas Barbin,2020-08-02 19:18:50 UTC,2023-01-20 01:07:18 UTC,research,CC0,https://inaturalist-open-data.s3.amazonaws.com/photos/87863099/medium.jpg,Purcell Wilderness Conservancy,,2,0,FALSE,,"Central Kootenay, British Columbia, Canada",50.252743,-116.551445,,,,,,,open,,subalpine larch,Larix lyallii,subalpine larch,Plantae,69848
55241838,7/18/20,2020-07-19 00:50:00 UTC,Pacific Time (US & Canada),302785,Thomas Barbin,2020-08-03 03:34:13 UTC,2023-01-20 01:07:18 UTC,research,CC0,https://inaturalist-open-data.s3.amazonaws.com/photos/87949173/medium.jpg,,,2,0,FALSE,,"Central Kootenay, British Columbia, Canada",50.25713,-116.551559,,,,,,,open,,subalpine larch,Larix lyallii,subalpine larch,Plantae,69848
55339187,7/12/20,2020-07-12 22:19:00 UTC,Mountain Time (US & Canada),435637,Cole Wolf,2020-08-04 00:08:02 UTC,2024-06-26 03:12:59 UTC,research,CC-BY,https://inaturalist-open-data.s3.amazonaws.com/photos/88109334/medium.jpg,,,1,0,FALSE,,"Missoula County, MT, USA",46.68379303,-114.2273257,300,,,,300,,open,,subalpine larch,Larix lyallii,subalpine larch,Plantae,69848
55359343,7/29/20,2020-07-29 18:00:00 UTC,Mountain Time (US & Canada),3326625,Anna Larney,2020-08-04 04:33:41 UTC,2020-09-24 22:23:39 UTC,research,CC-BY-NC,https://inaturalist-open-data.s3.amazonaws.com/photos/88014485/medium.jpeg,,,1,0,FALSE,,"Division No. 3, AB, Canada",49.33633333,-114.3818139,10,,,,10,,open,,subalpine larch,Larix lyallii,subalpine larch,Plantae,69848
55363584,8/1/20,2020-08-01 17:11:00 UTC,Pacific Time (US & Canada),538622,Eric Jain,2020-08-04 06:27:44 UTC,2020-11-24 04:52:04 UTC,research,CC-BY-NC,https://inaturalist-open-data.s3.amazonaws.com/photos/88152721/medium.jpg,flora,,1,0,FALSE,,"Chelan, Washington, United States",48.02184882,-120.5270048,,,,,,,open,,subalpine larch,Larix lyallii,subalpine larch,Plantae,69848
55459236,8/4/20,2020-08-04 19:14:31 UTC,Pacific Time (US & Canada),3364750,,2020-08-05 03:35:00 UTC,2020-10-12 03:29:04 UTC,research,CC-BY-NC,https://inaturalist-open-data.s3.amazonaws.com/photos/88312374/medium.jpg,,,1,0,FALSE,3,"E.C. Manning, CA-BC-FV, CA-BC, CA",49.02786708,-120.8323996,16,,,,16,,open,,subalpine larch,Larix lyallii,subalpine larch,Plantae,69848
55465611,8/4/20,2020-08-04 21:57:08 UTC,Pacific Time (US & Canada),3350864,,2020-08-05 05:42:28 UTC,2021-06-20 06:54:16 UTC,research,CC-BY-NC,https://inaturalist-open-data.s3.amazonaws.com/photos/88323102/medium.jpg,,,2,0,FALSE,3,"E. C. Manning Provincial Park, BC, CA",49.01043333,-120.8351583,,,,,,,open,,subalpine larch,Larix lyallii,subalpine larch,Plantae,69848
55572958,7/29/20,,UTC,1556854,,2020-08-06 06:03:02 UTC,2022-09-06 04:24:22 UTC,research,CC-BY-NC,https://inaturalist-open-data.s3.amazonaws.com/photos/88501608/medium.jpeg,,,1,0,FALSE,,"Okanogan County, WA, USA",48.74262456,-120.6791207,31,,,,31,,open,,subalpine larch,Larix lyallii,subalpine larch,Plantae,69848
55752400,8/6/20,2020-08-06 21:41:00 UTC,Mountain Time (US & Canada),705651,Mathis Natvik,2020-08-08 00:40:22 UTC,2020-09-24 18:52:07 UTC,research,,https://static.inaturalist.org/photos/88796050/medium.jpg,,,1,0,FALSE,,"Division No. 15, AB, Canada",50.81125,-115.2753389,,,,,,,open,,subalpine larch,Larix lyallii,subalpine larch,Plantae,69848
55875731,8/2/20,2020-08-02 22:47:00 UTC,Mountain Time (US & Canada),449500,Blake Weis,2020-08-09 03:31:39 UTC,2020-08-09 04:50:18 UTC,research,CC-BY-NC,https://inaturalist-open-data.s3.amazonaws.com/photos/88987780/medium.jpg,,,1,0,FALSE,,"Division No. 3, AB, Canada",49.03086372,-113.9916383,53,,,,53,,open,,subalpine larch,Larix lyallii,subalpine larch,Plantae,69848
55963450,8/8/20,2020-08-08 21:43:00 UTC,Pacific Time (US & Canada),538622,Eric Jain,2020-08-09 21:42:40 UTC,2022-04-19 12:09:52 UTC,research,CC-BY-NC,https://inaturalist-open-data.s3.amazonaws.com/photos/89143385/medium.jpg,,,1,0,FALSE,,"North Cascades National Park, North Cascades National Park Service Complex, Chelan, Washington, United States",48.4835954,-120.6796552,,,,,,,open,,subalpine larch,Larix lyallii,subalpine larch,Plantae,69848
56089964,8/10/20,2020-08-10 19:40:31 UTC,Pacific Time (US & Canada),1641019,Shane Johnson,2020-08-11 02:03:02 UTC,2023-07-07 23:14:17 UTC,research,CC0,https://inaturalist-open-data.s3.amazonaws.com/photos/89356608/medium.jpeg,,,1,0,FALSE,2,"East Kootenay, CA-BC, CA",49.50814703,-116.51606,3,,,,3,,open,,subalpine larch,Larix lyallii,subalpine larch,Plantae,69848
56195884,8/9/20,2020-08-09 14:09:00 UTC,Eastern Time (US & Canada),1072697,Caroline Biel,2020-08-12 05:00:43 UTC,2020-08-22 04:41:24 UTC,research,,https://static.inaturalist.org/photos/89514246/medium.jpeg,,,1,0,FALSE,,"Okanagan-Similkameen, BC, Canada",49.037254,-120.829902,122,,,,122,,open,,subalpine larch,Larix lyallii,subalpine larch,Plantae,69848
56261842,8/11/20,2020-08-11 21:34:14 UTC,Mountain Time (US & Canada),3407129,Paul Fisher,2020-08-12 21:21:48 UTC,2020-08-13 21:24:36 UTC,research,,https://static.inaturalist.org/photos/89646409/medium.jpg,,,1,0,FALSE,3,"Mount Assiniboine Provincial Park, BC, CA",50.91790011,-115.6517038,438,,,,438,,open,,subalpine larch,Larix lyallii,subalpine larch,Plantae,69848
56592468,8/14/20,2020-08-14 15:14:03 UTC,Pacific Time (US & Canada),693721,Lindsey Salmonson,2020-08-16 03:34:15 UTC,2023-01-25 21:31:13 UTC,research,CC-BY,https://inaturalist-open-data.s3.amazonaws.com/photos/90196922/medium.jpg,"Tree, Pinaceae, Gymnosperm, Okanogan",6500 feet. Fuzz on twigs and needles,1,0,FALSE,3,"Okanogan County, US-WA, US",48.77792098,-120.7240399,305,,,,305,,open,,subalpine larch,Larix lyallii,subalpine larch,Plantae,69848
56859960,8/17/20,2020-08-17 21:32:51 UTC,Pacific Time (US & Canada),2046206,Erin Springinotic,2020-08-18 18:08:57 UTC,2023-01-13 00:30:26 UTC,research,CC0,https://inaturalist-open-data.s3.amazonaws.com/photos/90643356/medium.jpg,,,3,1,FALSE,3,"Central Kootenay H, BC, CA",49.92991389,-117.1417595,7,,,,7,,open,,subalpine larch,Larix lyallii,subalpine larch,Plantae,69848
57151739,8/20/20,2020-08-20 20:01:00 UTC,Mountain Time (US & Canada),785779,Matt Wallace,2020-08-21 19:43:05 UTC,2020-08-22 22:31:28 UTC,research,,https://static.inaturalist.org/photos/91136412/medium.jpeg,,,2,0,FALSE,,"Division No. 15, Alberta, Canada",50.51708667,-114.7884133,,,,,,,open,,subalpine larch,Larix lyallii,subalpine larch,Plantae,69848
57616031,7/18/20,2020-07-18 16:49:00 UTC,Pacific Time (US & Canada),499708,Jason Headley,2020-08-26 06:08:32 UTC,2021-09-14 17:17:23 UTC,research,CC0,https://inaturalist-open-data.s3.amazonaws.com/photos/91904336/medium.jpg,,,2,0,FALSE,,"Central Kootenay, British Columbia, Canada",50.25706333,-116.5512933,,,,,,,open,,subalpine larch,Larix lyallii,subalpine larch,Plantae,69848
57616066,7/19/20,2020-07-19 14:24:00 UTC,Pacific Time (US & Canada),499708,Jason Headley,2020-08-26 06:08:43 UTC,2021-11-07 03:43:43 UTC,research,CC0,https://inaturalist-open-data.s3.amazonaws.com/photos/91904988/medium.jpg,,,2,0,FALSE,,"East Kootenay, British Columbia, Canada",50.25199667,-116.5484417,,,,,,,open,,subalpine larch,Larix lyallii,subalpine larch,Plantae,69848
57706351,8/23/20,2020-08-24 01:50:22 UTC,Pacific Time (US & Canada),3415777,,2020-08-27 04:21:08 UTC,2023-08-18 05:16:18 UTC,research,CC-BY-NC,https://inaturalist-open-data.s3.amazonaws.com/photos/92237340/medium.jpeg,,,2,0,FALSE,2,"Okanogan County, US-WA, US",48.55211145,-120.6872104,13,,,,13,,open,,subalpine larch,Larix lyallii,subalpine larch,Plantae,69848
58143347,8/30/20,2020-08-30 22:26:42 UTC,Mountain Time (US & Canada),946460,brucesmith,2020-08-31 13:40:07 UTC,2020-10-12 03:32:11 UTC,research,,https://static.inaturalist.org/photos/92802926/medium.jpg,,,1,0,FALSE,3,"Bitterroot National Forest, Darby, MT, US",45.88276333,-114.2763883,4,,,,4,,open,,subalpine larch,Larix lyallii,subalpine larch,Plantae,69848
58348497,8/31/20,2020-08-31 17:56:00 UTC,Mountain Time (US & Canada),1586884,,2020-09-02 18:02:06 UTC,2024-06-27 06:17:48 UTC,research,CC-BY-NC,https://inaturalist-open-data.s3.amazonaws.com/photos/93148234/medium.jpeg,,,2,0,FALSE,,"Arnica Lake, Improvement District No. 9, AB T0L, Canada",51.2230431,-115.9981562,202,,,,202,,open,,subalpine larch,Larix lyallii,subalpine larch,Plantae,69848
58573324,8/4/14,2014-08-04 18:03:00 UTC,Eastern Time (US & Canada),3263572,Tom,2020-09-05 04:03:08 UTC,2024-06-27 06:17:43 UTC,research,CC-BY-NC,https://inaturalist-open-data.s3.amazonaws.com/photos/93524773/medium.png,,,1,0,FALSE,,"Division No. 15, AB, Canada",51.41500143,-116.2503396,179,,,,179,,open,,subalpine larch,Larix lyallii,subalpine larch,Plantae,69848
59022849,9/3/20,2020-09-03 18:08:35 UTC,Pacific Time (US & Canada),1955525,Yanik Nill,2020-09-09 06:13:14 UTC,2020-11-23 17:07:25 UTC,research,CC-BY-NC,https://inaturalist-open-data.s3.amazonaws.com/photos/94275230/medium.jpeg,,,1,0,FALSE,2,"Edgewater, BC V0A 1E0, Canada",50.90958353,-115.6458168,135,,,,135,,open,gps,subalpine larch,Larix lyallii,subalpine larch,Plantae,69848
59033873,8/22/20,2020-08-22 18:59:00 UTC,Pacific Time (US & Canada),1816805,Peter Zika,2020-09-09 12:09:03 UTC,2023-01-24 21:39:12 UTC,research,CC-BY-NC,https://inaturalist-open-data.s3.amazonaws.com/photos/94293704/medium.jpeg,,,1,0,FALSE,,"Tamarack Peak, Whatcom County, Washington, USA",48.77900278,-120.7223278,5,,,,5,,open,,subalpine larch,Larix lyallii,subalpine larch,Plantae,69848
59045280,9/7/20,2020-09-07 22:08:26 UTC,Mountain Time (US & Canada),2012749,,2020-09-09 15:03:27 UTC,2024-06-27 06:17:28 UTC,research,CC-BY-NC,https://inaturalist-open-data.s3.amazonaws.com/photos/94314091/medium.jpg,,,2,0,FALSE,3,"Banff National Park, AB, CA",51.41236167,-116.2474533,,,,,,,open,,subalpine larch,Larix lyallii,subalpine larch,Plantae,69848
59056403,9/9/20,2020-09-09 17:10:19 UTC,Mountain Time (US & Canada),2818419,,2020-09-09 17:12:42 UTC,2024-06-27 06:17:21 UTC,research,CC-BY-NC,https://inaturalist-open-data.s3.amazonaws.com/photos/94332509/medium.jpg,,,1,0,FALSE,3,"Banff National Park, AB, CA",51.3953137,-116.213686,16,,,,16,,open,,subalpine larch,Larix lyallii,subalpine larch,Plantae,69848
59101141,8/26/20,2020-08-26 18:59:00 UTC,Pacific Time (US & Canada),1816805,Peter Zika,2020-09-10 02:40:27 UTC,2023-01-24 21:38:50 UTC,research,CC-BY-NC,https://inaturalist-open-data.s3.amazonaws.com/photos/94408759/medium.jpeg,,,1,0,FALSE,,"Maple Pass Loop, Chelan County, Washington, USA",48.50381389,-120.7670056,5,,,,5,,open,,subalpine larch,Larix lyallii,subalpine larch,Plantae,69848
59130205,9/7/20,2020-09-07 23:28:07 UTC,Mountain Time (US & Canada),3562921,,2020-09-10 14:53:47 UTC,2024-06-27 06:17:15 UTC,research,CC-BY-NC,https://inaturalist-open-data.s3.amazonaws.com/photos/94459733/medium.jpg,,,2,0,FALSE,3,"Banff National Park, AB, CA",51.47407899,-115.9971342,17298,,,,17298,,open,,subalpine larch,Larix lyallii,subalpine larch,Plantae,69848
59174509,9/10/20,2020-09-10 16:16:20 UTC,Eastern Time (US & Canada),745026,,2020-09-10 23:19:08 UTC,2020-09-25 19:39:19 UTC,research,CC-BY-NC,https://inaturalist-open-data.s3.amazonaws.com/photos/94533358/medium.jpeg,,,2,0,FALSE,333,Division No. 15,50.59690833,-114.987975,,,,,,,open,,subalpine larch,Larix lyallii,subalpine larch,Plantae,69848
59239754,9/10/20,2020-09-10 18:13:08 UTC,Mountain Time (US & Canada),3220099,Kira Sawatzky,2020-09-11 18:24:19 UTC,2020-09-28 03:59:39 UTC,research,,https://static.inaturalist.org/photos/94660925/medium.jpg,,,2,0,FALSE,3,"Peter Lougheed Provincial Park, AB, CA",50.59696667,-114.9629833,4,,,,4,,open,,subalpine larch,Larix lyallii,subalpine larch,Plantae,69848
59340511,9/12/20,2020-09-12 17:23:03 UTC,Mountain Time (US & Canada),3424946,Shaun James,2020-09-12 17:23:08 UTC,2024-06-27 06:17:07 UTC,research,,https://static.inaturalist.org/photos/94883453/medium.jpg,,,1,0,FALSE,3,"Banff National Park, AB, CA",51.2322207,-116.0043497,24,,,,24,,open,,subalpine larch,Larix lyallii,subalpine larch,Plantae,69848
59407002,9/12/20,2020-09-12 16:10:20 UTC,Mountain Time (US & Canada),3476863,,2020-09-13 03:23:59 UTC,2020-09-26 16:14:55 UTC,research,CC-BY-NC,https://inaturalist-open-data.s3.amazonaws.com/photos/94921425/medium.jpg,,,2,0,FALSE,3,"Spray Valley Provincial Park, AB, CA",50.8163,-115.2064533,447,,,,447,,open,,subalpine larch,Larix lyallii,subalpine larch,Plantae,69848
59529010,9/11/20,2020-09-11 17:34:46 UTC,Mountain Time (US & Canada),542836,Aerin Jacob,2020-09-14 00:56:15 UTC,2020-09-14 01:18:59 UTC,research,CC-BY,https://inaturalist-open-data.s3.amazonaws.com/photos/95122448/medium.jpg,,,1,0,FALSE,3,"Kootenay, CA-BC-EK, CA-BC, CA",51.1898343,-116.3036419,4,,,,4,,open,,subalpine larch,Larix lyallii,subalpine larch,Plantae,69848
59730174,9/15/20,2020-09-15 20:09:44 UTC,Mountain Time (US & Canada),3142919,,2020-09-15 23:02:27 UTC,2020-09-26 04:30:21 UTC,research,CC-BY-NC,https://inaturalist-open-data.s3.amazonaws.com/photos/95456833/medium.jpg,,,2,0,FALSE,3,"Peter Lougheed Provincial Park, AB, CA",50.59787,-114.989145,6,,,,6,,open,,subalpine larch,Larix lyallii,subalpine larch,Plantae,69848
59754206,9/13/20,2020-09-13 17:05:48 UTC,Mountain Time (US & Canada),542836,Aerin Jacob,2020-09-16 05:31:47 UTC,2020-09-22 21:46:23 UTC,research,CC-BY,https://inaturalist-open-data.s3.amazonaws.com/photos/95499257/medium.jpg,,,1,0,FALSE,3,"Kootenay National Park, BC, CA",51.09906348,-116.1436818,4796,,,,4796,,open,,subalpine larch,Larix lyallii,subalpine larch,Plantae,69848
60079250,9/7/20,2020-09-08 00:02:47 UTC,Pacific Time (US & Canada),3415777,,2020-09-19 16:15:26 UTC,2020-09-20 15:16:14 UTC,research,CC-BY-NC,https://inaturalist-open-data.s3.amazonaws.com/photos/96041522/medium.jpeg,,,1,0,FALSE,2,"Whatcom County, US-WA, US",48.74124137,-120.8967028,9,,,,9,,open,,subalpine larch,Larix lyallii,subalpine larch,Plantae,69848
60083892,9/18/20,2020-09-18 20:53:00 UTC,Mountain Time (US & Canada),785779,Matt Wallace,2020-09-19 16:57:55 UTC,2020-09-19 20:03:29 UTC,research,,https://static.inaturalist.org/photos/96046264/medium.jpeg,,,1,0,FALSE,,"Division No. 15, AB, Canada",50.59308137,-115.0041047,31,,,,31,,open,,subalpine larch,Larix lyallii,subalpine larch,Plantae,69848
60083916,9/18/20,2020-09-18 20:49:00 UTC,Mountain Time (US & Canada),785779,Matt Wallace,2020-09-19 16:58:00 UTC,2020-09-19 19:58:47 UTC,research,,https://static.inaturalist.org/photos/96046950/medium.jpeg,,,1,0,FALSE,,"Division No. 15, AB, Canada",50.59180468,-115.0176364,31,,,,31,,open,,subalpine larch,Larix lyallii,subalpine larch,Plantae,69848
60083926,9/18/20,2020-09-18 20:40:00 UTC,Mountain Time (US & Canada),785779,Matt Wallace,2020-09-19 16:58:01 UTC,2020-09-19 19:58:36 UTC,research,,https://static.inaturalist.org/photos/96047124/medium.jpg,,,1,0,FALSE,,"Peter Lougheed, Division No. 15, Alberta, Canada",50.59101,-115.0158631,,,,,,,open,,subalpine larch,Larix lyallii,subalpine larch,Plantae,69848
60085513,9/18/20,2020-09-18 20:33:00 UTC,Mountain Time (US & Canada),785779,Matt Wallace,2020-09-19 17:10:38 UTC,2020-09-19 19:57:40 UTC,research,,https://static.inaturalist.org/photos/96049754/medium.jpg,,,1,0,FALSE,,"Division No. 15, AB, Canada",50.5910243,-115.018635,,,,,,,open,,subalpine larch,Larix lyallii,subalpine larch,Plantae,69848
60091938,9/18/20,2020-09-18 17:53:00 UTC,Mountain Time (US & Canada),785779,Matt Wallace,2020-09-19 18:06:41 UTC,2020-09-24 18:38:54 UTC,research,,https://static.inaturalist.org/photos/96059279/medium.jpg,,,1,0,FALSE,,"Division No. 15, AB, Canada",50.5917044,-115.0105224,,,,,,,open,,subalpine larch,Larix lyallii,subalpine larch,Plantae,69848
60094856,9/18/20,2020-09-18 17:30:00 UTC,Mountain Time (US & Canada),785779,Matt Wallace,2020-09-19 18:30:17 UTC,2020-09-19 19:43:44 UTC,research,,https://static.inaturalist.org/photos/96061899/medium.jpg,,,1,0,FALSE,,"Division No. 15, AB, Canada",50.5931783,-115.0000295,,,,,,,open,,subalpine larch,Larix lyallii,subalpine larch,Plantae,69848
60094905,9/18/20,2020-09-18 16:51:00 UTC,Mountain Time (US & Canada),785779,Matt Wallace,2020-09-19 18:30:27 UTC,2020-09-24 18:38:44 UTC,research,,https://static.inaturalist.org/photos/96064830/medium.jpeg,,,2,0,FALSE,,"Peter Lougheed, Division No. 15, Alberta, Canada",50.59869333,-114.9904017,,,,,,,open,,subalpine larch,Larix lyallii,subalpine larch,Plantae,69848
60094932,9/18/20,2020-09-18 16:49:00 UTC,Mountain Time (US & Canada),785779,Matt Wallace,2020-09-19 18:30:31 UTC,2020-09-19 20:08:11 UTC,research,,https://static.inaturalist.org/photos/96066004/medium.jpeg,,,1,0,FALSE,,"Division No. 15, AB, Canada",50.59781184,-114.9910952,30,,,,30,,open,,subalpine larch,Larix lyallii,subalpine larch,Plantae,69848
60189655,7/21/20,2020-07-21 21:33:39 UTC,Pacific Time (US & Canada),8641,John Brew,2020-09-20 14:37:20 UTC,2021-06-11 12:28:07 UTC,research,CC-BY,https://inaturalist-open-data.s3.amazonaws.com/photos/96222860/medium.jpg,,,2,0,FALSE,3,"Okanogan-Wenatchee National Forest, Cle Elum, WA, US",47.46422,-120.9596967,,,,,,,open,,subalpine larch,Larix lyallii,subalpine larch,Plantae,69848
60247566,9/20/20,2020-09-20 19:33:22 UTC,Mountain Time (US & Canada),3581642,,2020-09-20 21:45:22 UTC,2020-11-11 21:13:21 UTC,research,CC-BY-NC,https://inaturalist-open-data.s3.amazonaws.com/photos/96317465/medium.jpg,,,1,0,FALSE,3,"Yoho National Park, BC, CA",51.44875333,-116.3701083,,,,,,,open,,subalpine larch,Larix lyallii,subalpine larch,Plantae,69848
60278032,9/19/20,2020-09-19 18:04:16 UTC,Pacific Time (US & Canada),780918,patrick vant,2020-09-21 02:08:47 UTC,2023-07-08 00:06:34 UTC,research,CC-BY-NC,https://inaturalist-open-data.s3.amazonaws.com/photos/96370437/medium.jpg,,,2,0,FALSE,3,"Chelan County, US-WA, US",47.47772506,-120.8101765,4,,,,4,,open,,subalpine larch,Larix lyallii,subalpine larch,Plantae,69848
60399273,9/20/20,2020-09-20 22:33:00 UTC,Pacific Time (US & Canada),538622,Eric Jain,2020-09-22 07:12:40 UTC,2021-10-25 21:04:32 UTC,research,CC-BY-NC,https://inaturalist-open-data.s3.amazonaws.com/photos/96577191/medium.jpg,flora,,2,0,FALSE,,"Kittitas, Washington, United States",47.42046816,-120.8614131,,,,,,,open,,subalpine larch,Larix lyallii,subalpine larch,Plantae,69848
60617568,7/18/20,2020-07-18 16:06:00 UTC,Pacific Time (US & Canada),499708,Jason Headley,2020-09-24 15:53:21 UTC,2021-11-07 03:42:00 UTC,research,CC0,https://inaturalist-open-data.s3.amazonaws.com/photos/96931075/medium.jpg,,,2,0,FALSE,,"East Kootenay, BC, Canada",50.25281167,-116.549355,12,,,,12,,open,,subalpine larch,Larix lyallii,subalpine larch,Plantae,69848
60625226,9/19/20,2020-09-19 21:09:37 UTC,Mountain Time (US & Canada),3589659,Cole Farwell,2020-09-24 17:14:06 UTC,2020-11-23 16:10:40 UTC,research,CC-BY-NC,https://inaturalist-open-data.s3.amazonaws.com/photos/96954565/medium.jpeg,,These trees turning yellow in the fall makes them easy to identify,3,1,FALSE,2,"Turner Valley, AB T0L 2A0, Canada",50.53522984,-114.919142,1567,,,,1567,,open,gps,subalpine larch,Larix lyallii,subalpine larch,Plantae,69848
60627306,7/18/20,2020-07-18 18:38:00 UTC,Pacific Time (US & Canada),499708,Jason Headley,2020-09-24 17:36:06 UTC,2021-09-14 17:17:07 UTC,research,CC0,https://inaturalist-open-data.s3.amazonaws.com/photos/96954033/medium.jpg,,,2,0,FALSE,,"Central Kootenay, British Columbia, Canada",50.25935333,-116.551575,16,,,,16,,open,,subalpine larch,Larix lyallii,subalpine larch,Plantae,69848
60665632,9/12/20,2020-09-12 23:14:00 UTC,Mountain Time (US & Canada),705651,Mathis Natvik,2020-09-25 00:06:03 UTC,2020-09-25 03:21:12 UTC,research,,https://static.inaturalist.org/photos/97020442/medium.jpg,,,1,0,FALSE,,"Division No. 15, AB, Canada",50.79934444,-115.2477611,,,,,,,open,,subalpine larch,Larix lyallii,subalpine larch,Plantae,69848
60684829,9/3/20,2020-09-03 21:44:41 UTC,Pacific Time (US & Canada),8641,John Brew,2020-09-25 04:46:09 UTC,2020-09-26 20:43:13 UTC,research,CC-BY,https://inaturalist-open-data.s3.amazonaws.com/photos/97054788/medium.jpg,,,1,0,FALSE,3,"Okanogan-Wenatchee National Forest, Deming, WA, US",48.73205833,-120.676,,,,,,,open,,subalpine larch,Larix lyallii,subalpine larch,Plantae,69848
60787863,9/3/20,2020-09-04 00:37:52 UTC,Pacific Time (US & Canada),8641,John Brew,2020-09-26 03:29:28 UTC,2020-09-26 16:07:01 UTC,research,CC-BY,https://inaturalist-open-data.s3.amazonaws.com/photos/97222096/medium.jpg,,I think L. lyalli. Along the Pacific Crest Trail ,1,0,FALSE,3,"Okanogan-Wenatchee National Forest, Deming, WA, US",48.6956,-120.6884867,,,,,,,open,,subalpine larch,Larix lyallii,subalpine larch,Plantae,69848
60788744,9/3/20,2020-09-04 01:46:22 UTC,Pacific Time (US & Canada),8641,John Brew,2020-09-26 03:44:24 UTC,2020-09-27 05:35:47 UTC,research,CC-BY,https://inaturalist-open-data.s3.amazonaws.com/photos/97223403/medium.jpg,,Along the Pacific Crest Trail ,2,0,FALSE,3,"Okanogan-Wenatchee National Forest, Mazama, WA, US",48.68213833,-120.705095,,,,,,,open,,subalpine larch,Larix lyallii,subalpine larch,Plantae,69848
60921506,9/4/20,2020-09-04 21:03:55 UTC,Pacific Time (US & Canada),8641,John Brew,2020-09-27 03:35:33 UTC,2022-09-06 04:28:36 UTC,research,CC-BY,https://inaturalist-open-data.s3.amazonaws.com/photos/97440695/medium.jpg,,,1,0,FALSE,3,"Okanogan-Wenatchee National Forest, Deming, WA, US",48.67010333,-120.7178083,,,,,,,open,,subalpine larch,Larix lyallii,subalpine larch,Plantae,69848
60925140,9/4/20,2020-09-04 21:04:11 UTC,Pacific Time (US & Canada),8641,John Brew,2020-09-27 04:30:30 UTC,2020-09-27 17:00:16 UTC,research,CC-BY,https://inaturalist-open-data.s3.amazonaws.com/photos/97447635/medium.jpg,,,1,0,FALSE,3,"Okanogan-Wenatchee National Forest, Deming, WA, US",48.67003,-120.7178917,,,,,,,open,,subalpine larch,Larix lyallii,subalpine larch,Plantae,69848
60925208,9/4/20,2020-09-04 21:35:12 UTC,Pacific Time (US & Canada),8641,John Brew,2020-09-27 04:31:47 UTC,2022-09-06 22:36:52 UTC,research,CC-BY,https://inaturalist-open-data.s3.amazonaws.com/photos/97447765/medium.jpg,,"Up above Cutthroat Pass, heading to Granite Pass on the PCT",1,0,FALSE,3,"Okanogan-Wenatchee National Forest, Mazama, WA, US",48.68248667,-120.7055917,,,,,,,open,,subalpine larch,Larix lyallii,subalpine larch,Plantae,69848
61140823,9/27/20,2020-09-27 23:41:05 UTC,Pacific Time (US & Canada),3222030,,2020-09-28 20:38:52 UTC,2020-10-12 03:28:50 UTC,research,CC-BY-NC,https://inaturalist-open-data.s3.amazonaws.com/photos/97809367/medium.jpg,,,1,0,FALSE,3,"E. C. Manning Provincial Park, BC, CA",49.02383333,-120.83113,9,,,,9,,open,,subalpine larch,Larix lyallii,subalpine larch,Plantae,69848
61197993,9/5/20,2020-09-05 16:16:29 UTC,Pacific Time (US & Canada),8641,John Brew,2020-09-29 10:52:36 UTC,2022-09-21 04:22:43 UTC,research,CC-BY,https://inaturalist-open-data.s3.amazonaws.com/photos/97903871/medium.jpg,,,1,0,FALSE,3,"Okanogan-Wenatchee National Forest, Mazama, WA, US",48.74943667,-120.691505,,,,,,,open,,subalpine larch,Larix lyallii,subalpine larch,Plantae,69848
61212377,9/26/20,2020-09-26 19:49:02 UTC,Pacific Time (US & Canada),3640366,Michelle Herrewynen,2020-09-29 14:31:41 UTC,2024-01-19 19:47:14 UTC,research,,https://static.inaturalist.org/photos/97926471/medium.jpg,,,3,1,FALSE,3,"E. C. Manning Provincial Park, BC, CA",49.02871231,-120.8307329,768,,,,768,,open,,subalpine larch,Larix lyallii,subalpine larch,Plantae,69848
61333154,9/5/20,2020-09-05 16:18:55 UTC,Pacific Time (US & Canada),8641,John Brew,2020-09-30 20:30:07 UTC,2023-01-24 21:05:13 UTC,research,CC-BY,https://inaturalist-open-data.s3.amazonaws.com/photos/98134088/medium.jpg,,,1,0,FALSE,3,"Okanogan-Wenatchee National Forest, Mazama, WA, US",48.74849667,-120.6912083,,,,,,,open,,subalpine larch,Larix lyallii,subalpine larch,Plantae,69848
61333228,9/5/20,2020-09-05 16:18:55 UTC,Pacific Time (US & Canada),8641,John Brew,2020-09-30 20:31:11 UTC,2020-10-01 17:17:31 UTC,research,CC-BY,https://inaturalist-open-data.s3.amazonaws.com/photos/98134254/medium.jpg,,,1,0,FALSE,3,"Okanogan-Wenatchee National Forest, Mazama, WA, US",48.74849667,-120.6912083,,,,,,,open,,subalpine larch,Larix lyallii,subalpine larch,Plantae,69848
61335365,9/5/20,2020-09-05 16:32:05 UTC,Pacific Time (US & Canada),8641,John Brew,2020-09-30 20:53:15 UTC,2022-09-21 04:22:39 UTC,research,CC-BY,https://inaturalist-open-data.s3.amazonaws.com/photos/98137669/medium.jpg,,,1,0,FALSE,3,"Okanogan-Wenatchee National Forest, Mazama, WA, US",48.74657833,-120.6894967,,,,,,,open,,subalpine larch,Larix lyallii,subalpine larch,Plantae,69848
61349645,9/29/20,2020-09-29 20:01:36 UTC,Pacific Time (US & Canada),3232558,Valentina Coy Arias,2020-09-30 23:38:37 UTC,2020-12-05 21:52:41 UTC,research,,https://static.inaturalist.org/photos/98161964/medium.jpg,,,2,0,FALSE,3,"E. C. Manning Provincial Park, BC, CA",49.02811334,-120.8253456,756,,,,756,,open,,subalpine larch,Larix lyallii,subalpine larch,Plantae,69848
61353428,9/2/12,2012-09-02 19:25:00 UTC,Mountain Time (US & Canada),785779,Matt Wallace,2020-10-01 00:24:16 UTC,2020-10-01 16:36:37 UTC,research,,https://static.inaturalist.org/photos/98168453/medium.jpeg,,,1,0,FALSE,,"Division No. 15, AB, Canada",50.80927038,-115.2827597,300,,,,300,,open,,subalpine larch,Larix lyallii,subalpine larch,Plantae,69848
61356761,9/29/20,2020-09-29 19:56:00 UTC,Mountain Time (US & Canada),457523,Tony Wood,2020-10-01 01:13:32 UTC,2024-06-27 06:16:53 UTC,research,CC0,https://inaturalist-open-data.s3.amazonaws.com/photos/98174147/medium.jpeg,,,1,0,FALSE,,"Division No. 15, AB, Canada",51.36758113,-116.2178532,539,,,,539,,open,,subalpine larch,Larix lyallii,subalpine larch,Plantae,69848
61440452,9/5/20,2020-09-05 16:46:50 UTC,Pacific Time (US & Canada),8641,John Brew,2020-10-02 00:44:32 UTC,2022-09-21 04:22:38 UTC,research,CC-BY,https://inaturalist-open-data.s3.amazonaws.com/photos/98318787/medium.jpg,,,1,0,FALSE,3,"Okanogan-Wenatchee National Forest, Mazama, WA, US",48.745095,-120.68652,,,,,,,open,,subalpine larch,Larix lyallii,subalpine larch,Plantae,69848
61473375,10/1/20,2020-10-01 16:39:50 UTC,Pacific Time (US & Canada),1641019,Shane Johnson,2020-10-02 13:17:37 UTC,2023-07-08 00:10:44 UTC,research,CC0,https://inaturalist-open-data.s3.amazonaws.com/photos/98376181/medium.jpeg,,,1,0,FALSE,2,"E.C. Manning, CA-BC-FV, CA-BC, CA",49.02803786,-120.8313518,9,,,,9,,open,,subalpine larch,Larix lyallii,subalpine larch,Plantae,69848
61484131,8/5/18,2018-08-05 19:12:00 UTC,Mountain Time (US & Canada),2476609,Ian Adams,2020-10-02 15:48:00 UTC,2020-10-03 03:55:12 UTC,research,CC-BY,https://inaturalist-open-data.s3.amazonaws.com/photos/98393696/medium.jpg,,,1,0,FALSE,,"East Kootenay, BC, Canada",50.76277778,-116.7302778,50,,,,50,,open,,subalpine larch,Larix lyallii,subalpine larch,Plantae,69848
61539758,7/12/15,2015-07-12 17:28:00 UTC,Pacific Time (US & Canada),408815,Ian Cruickshank,2020-10-03 04:50:30 UTC,2020-12-31 03:19:04 UTC,research,CC-BY-NC,https://inaturalist-open-data.s3.amazonaws.com/photos/98488262/medium.jpeg,,,3,1,FALSE,,"Akamina-Kishinena, East Kootenay, British Columbia, Canada",49.01393,-114.0706617,,,,,,,open,,subalpine larch,Larix lyallii,subalpine larch,Plantae,69848
61539764,7/12/15,2015-07-12 19:22:00 UTC,Pacific Time (US & Canada),408815,Ian Cruickshank,2020-10-03 04:50:32 UTC,2020-11-03 16:39:09 UTC,research,CC-BY-NC,https://inaturalist-open-data.s3.amazonaws.com/photos/98488309/medium.jpeg,,,3,0,FALSE,,"East Kootenay, BC, Canada",49.01055639,-114.0753949,977,,,,977,,open,,subalpine larch,Larix lyallii,subalpine larch,Plantae,69848
61539793,7/12/15,2015-07-12 22:37:00 UTC,Pacific Time (US & Canada),408815,Ian Cruickshank,2020-10-03 04:50:41 UTC,2023-03-08 23:20:16 UTC,research,CC-BY-NC,https://inaturalist-open-data.s3.amazonaws.com/photos/98488541/medium.jpeg,,,2,0,FALSE,,"Akamina-Kishinena, East Kootenay, British Columbia, Canada",49.02462833,-114.117755,,,,,,,open,,subalpine larch,Larix lyallii,subalpine larch,Plantae,69848
61539794,7/12/15,2015-07-12 22:44:00 UTC,Pacific Time (US & Canada),408815,Ian Cruickshank,2020-10-03 04:50:41 UTC,2020-11-03 16:39:24 UTC,research,CC-BY-NC,https://inaturalist-open-data.s3.amazonaws.com/photos/98488549/medium.jpeg,,,3,0,FALSE,,"Akamina-Kishinena, East Kootenay, British Columbia, Canada",49.02399333,-114.1169517,,,,,,,open,,subalpine larch,Larix lyallii,subalpine larch,Plantae,69848
61595310,10/3/20,2020-10-03 19:19:09 UTC,Pacific Time (US & Canada),2469643,Keanna Driedger,2020-10-03 19:19:51 UTC,2024-01-19 19:41:47 UTC,research,,https://static.inaturalist.org/photos/98836065/medium.jpg,,,2,0,FALSE,3,"E.C. Manning, CA-BC-FV, CA-BC, CA",49.0198258,-120.831816,6,,,,6,,open,,subalpine larch,Larix lyallii,subalpine larch,Plantae,69848
61636387,9/28/20,2020-09-28 23:53:00 UTC,Pacific Time (US & Canada),459348,John D Reynolds,2020-10-04 02:32:41 UTC,2023-03-23 21:25:58 UTC,research,CC-BY,https://inaturalist-open-data.s3.amazonaws.com/photos/98647368/medium.jpg,"2020, BC, Canada, iNaturalist, plant","Cathedral Provincial Park, BC, Canada",2,0,FALSE,,"Okanagan-Similkameen, BC, Canada",49.06554444,-120.1969222,11,,,,11,,open,,subalpine larch,Larix lyallii,subalpine larch,Plantae,69848
61636536,10/3/20,2020-10-03 18:48:06 UTC,Pacific Time (US & Canada),3350864,,2020-10-04 02:34:35 UTC,2020-10-12 03:29:20 UTC,research,CC-BY-NC,https://inaturalist-open-data.s3.amazonaws.com/photos/98649364/medium.jpg,,,1,0,FALSE,3,"E. C. Manning Provincial Park, BC, CA",49.1451945,-120.7346583,,,,,,,open,,subalpine larch,Larix lyallii,subalpine larch,Plantae,69848
61643683,9/28/20,2020-09-29 00:30:00 UTC,Pacific Time (US & Canada),459348,John D Reynolds,2020-10-04 04:59:15 UTC,2023-03-23 21:25:58 UTC,research,CC-BY,https://inaturalist-open-data.s3.amazonaws.com/photos/98660331/medium.jpg,"2020, BC, Canada","Cathedral Provincial Park, BC, Canada",2,0,FALSE,,"Okanagan-Similkameen, BC, Canada",49.06359167,-120.2024528,11,,,,11,,open,,subalpine larch,Larix lyallii,subalpine larch,Plantae,69848
61646217,9/28/20,2020-09-28 16:41:00 UTC,UTC,136692,Debora Obrist,2020-10-04 05:51:56 UTC,2020-10-16 18:04:24 UTC,research,,https://static.inaturalist.org/photos/98666041/medium.jpeg,,,1,0,FALSE,,"Okanagan-Similkameen, British Columbia, Canada",49.06469722,-120.1964028,10,,,,10,,open,,subalpine larch,Larix lyallii,subalpine larch,Plantae,69848
61721198,10/3/20,2020-10-03 17:59:21 UTC,Pacific Time (US & Canada),3695744,,2020-10-04 21:54:00 UTC,2020-11-13 02:52:23 UTC,research,CC-BY-NC,https://inaturalist-open-data.s3.amazonaws.com/photos/98794745/medium.jpg,,,1,0,FALSE,3,"E. C. Manning Provincial Park, BC, CA",49.02157217,-120.8248533,2617,,,,2617,,open,,subalpine larch,Larix lyallii,subalpine larch,Plantae,69848
61781469,10/3/20,2020-10-03 20:44:26 UTC,Pacific Time (US & Canada),3710447,,2020-10-05 15:12:32 UTC,2020-10-12 03:28:33 UTC,research,CC-BY-NC,https://inaturalist-open-data.s3.amazonaws.com/photos/98903042/medium.jpg,,,1,0,FALSE,3,"E. C. Manning Provincial Park, BC, CA",49.0222773,-120.8303098,434,,,,434,,open,,subalpine larch,Larix lyallii,subalpine larch,Plantae,69848
61835363,9/29/20,2020-09-29 21:04:00 UTC,Pacific Time (US & Canada),459348,John D Reynolds,2020-10-06 02:58:41 UTC,2023-03-23 21:25:58 UTC,research,CC-BY,https://inaturalist-open-data.s3.amazonaws.com/photos/98993790/medium.jpg,"2020, BC, Canada, iNaturalist","Cathedral Provincial Park, BC, Canada",2,0,FALSE,,"Okanagan-Similkameen, British Columbia, Canada",49.08570556,-120.1923306,4,,,,4,,open,,subalpine larch,Larix lyallii,subalpine larch,Plantae,69848
61839902,9/29/20,2020-09-29 22:45:00 UTC,Pacific Time (US & Canada),459348,John D Reynolds,2020-10-06 04:34:51 UTC,2023-03-23 21:25:58 UTC,research,CC-BY,https://inaturalist-open-data.s3.amazonaws.com/photos/99002888/medium.jpg,"2020, BC, Canada, iNaturalist","Cathedral Provincial Park, BC, Canada",2,0,FALSE,,"Okanagan-Similkameen, BC, Canada",49.10013333,-120.2277444,1938,,,,1938,,open,,subalpine larch,Larix lyallii,subalpine larch,Plantae,69848
61839904,9/29/20,2020-09-29 22:47:00 UTC,Pacific Time (US & Canada),459348,John D Reynolds,2020-10-06 04:34:52 UTC,2023-03-23 21:25:58 UTC,research,CC-BY,https://inaturalist-open-data.s3.amazonaws.com/photos/99002920/medium.jpg,"2020, BC, Canada, iNaturalist","Cathedral Provincial Park, BC, Canada",2,0,FALSE,,"Okanagan-Similkameen, British Columbia, Canada",49.08055833,-120.2098528,6,,,,6,,open,,subalpine larch,Larix lyallii,subalpine larch,Plantae,69848
61839905,9/29/20,2020-09-29 22:44:00 UTC,Pacific Time (US & Canada),459348,John D Reynolds,2020-10-06 04:34:52 UTC,2023-03-23 21:25:58 UTC,research,CC-BY,https://inaturalist-open-data.s3.amazonaws.com/photos/99002925/medium.jpg,"2020, BC, Canada, iNaturalist","Cathedral Provincial Park, BC, Canada",2,0,FALSE,,"Okanagan-Similkameen, BC, Canada",49.08108889,-120.2098833,26,,,,26,,open,,subalpine larch,Larix lyallii,subalpine larch,Plantae,69848
61840726,9/29/20,2020-09-30 00:07:00 UTC,Pacific Time (US & Canada),459348,John D Reynolds,2020-10-06 04:56:09 UTC,2023-03-23 21:25:58 UTC,research,CC-BY,https://inaturalist-open-data.s3.amazonaws.com/photos/99003743/medium.jpg,,"Cathedral Provincial Park, BC, Canada",2,0,FALSE,,"Okanagan-Similkameen, BC, Canada",49.07180278,-120.1955028,6,,,,6,,open,,subalpine larch,Larix lyallii,subalpine larch,Plantae,69848
61840727,9/29/20,2020-09-30 00:11:00 UTC,Pacific Time (US & Canada),459348,John D Reynolds,2020-10-06 04:56:09 UTC,2023-03-23 21:25:58 UTC,research,CC-BY,https://inaturalist-open-data.s3.amazonaws.com/photos/99003758/medium.jpg,"2020, BC, Canada, iNaturalist","Cathedral Provincial Park, BC, Canada",2,0,FALSE,,"Okanagan-Similkameen, BC, Canada",49.07297778,-120.1945417,9,,,,9,,open,,subalpine larch,Larix lyallii,subalpine larch,Plantae,69848
61840729,9/29/20,2020-09-30 00:17:00 UTC,Pacific Time (US & Canada),459348,John D Reynolds,2020-10-06 04:56:09 UTC,2023-03-23 21:25:58 UTC,research,CC-BY,https://inaturalist-open-data.s3.amazonaws.com/photos/99003779/medium.jpg,,"Cathedral Provincial Park, BC, Canada",2,0,FALSE,,"Okanagan-Similkameen, British Columbia, Canada",49.07336389,-120.1946722,45,,,,45,,open,,subalpine larch,Larix lyallii,subalpine larch,Plantae,69848
61841711,9/29/20,2020-09-30 00:52:00 UTC,Pacific Time (US & Canada),459348,John D Reynolds,2020-10-06 05:26:28 UTC,2023-03-23 21:25:58 UTC,research,CC-BY,https://inaturalist-open-data.s3.amazonaws.com/photos/99008431/medium.jpg,"2020, BC, Canada","Cathedral Provincial Park, BC, Canada",2,0,FALSE,,"Okanagan-Similkameen, British Columbia, Canada",49.07611389,-120.1958083,4,,,,4,,open,,subalpine larch,Larix lyallii,subalpine larch,Plantae,69848
61841712,9/29/20,2020-09-30 00:52:00 UTC,Pacific Time (US & Canada),459348,John D Reynolds,2020-10-06 05:26:28 UTC,2023-03-23 21:25:58 UTC,research,CC-BY,https://inaturalist-open-data.s3.amazonaws.com/photos/99008443/medium.jpg,BC,"Cathedral Provincial Park, BC, Canada",2,0,FALSE,,"Okanagan-Similkameen, British Columbia, Canada",49.07611944,-120.1957944,12,,,,12,,open,,subalpine larch,Larix lyallii,subalpine larch,Plantae,69848
61843489,9/30/20,2020-09-30 15:23:00 UTC,Pacific Time (US & Canada),459348,John D Reynolds,2020-10-06 06:17:17 UTC,2023-03-23 21:25:58 UTC,research,CC-BY,https://inaturalist-open-data.s3.amazonaws.com/photos/99011206/medium.jpg,"2020, BC, Canada, iNaturalist","Cathedral Provincial Park, BC, Canada",2,0,FALSE,,"Okanagan-Similkameen, BC, Canada",49.06178611,-120.2000972,5,,,,5,,open,,subalpine larch,Larix lyallii,subalpine larch,Plantae,69848
61843490,9/30/20,2020-09-30 15:37:00 UTC,Pacific Time (US & Canada),459348,John D Reynolds,2020-10-06 06:17:17 UTC,2023-03-23 21:25:58 UTC,research,CC-BY,https://inaturalist-open-data.s3.amazonaws.com/photos/99011213/medium.jpg,,"Cathedral Provincial Park, BC, Canada",2,0,FALSE,,"Okanagan-Similkameen, BC, Canada",49.06005556,-120.2030639,18,,,,18,,open,,subalpine larch,Larix lyallii,subalpine larch,Plantae,69848
61843492,9/30/20,2020-09-30 15:29:00 UTC,Pacific Time (US & Canada),459348,John D Reynolds,2020-10-06 06:17:18 UTC,2023-03-23 21:25:58 UTC,research,CC-BY,https://inaturalist-open-data.s3.amazonaws.com/photos/99011223/medium.jpg,"2020, BC, Canada, iNaturalist","Cathedral Provincial Park, BC, Canada",2,0,FALSE,,"Okanagan-Similkameen, BC, Canada",49.06080556,-120.2015306,21,,,,21,,open,,subalpine larch,Larix lyallii,subalpine larch,Plantae,69848
61843493,9/30/20,2020-09-30 15:28:00 UTC,Pacific Time (US & Canada),459348,John D Reynolds,2020-10-06 06:17:18 UTC,2023-03-23 21:25:58 UTC,research,CC-BY,https://inaturalist-open-data.s3.amazonaws.com/photos/99011245/medium.jpg,"2020, BC, Canada","Cathedral Provincial Park, BC, Canada",2,0,FALSE,,"Okanagan-Similkameen, BC, Canada",49.06141389,-120.2004,1603,,,,1603,,open,,subalpine larch,Larix lyallii,subalpine larch,Plantae,69848
61924158,9/30/20,2020-09-30 16:07:00 UTC,Pacific Time (US & Canada),459348,John D Reynolds,2020-10-07 04:27:19 UTC,2023-03-23 21:25:58 UTC,research,CC-BY,https://inaturalist-open-data.s3.amazonaws.com/photos/99148654/medium.jpg,"2020, BC, Canada, iNaturalist","Cathedral Provincial Park, BC, Canada",2,0,FALSE,,"Okanagan-Similkameen, BC, Canada",49.05805556,-120.2101444,4,,,,4,,open,,subalpine larch,Larix lyallii,subalpine larch,Plantae,69848
61929247,9/30/20,2020-09-30 19:56:00 UTC,Pacific Time (US & Canada),459348,John D Reynolds,2020-10-07 06:52:08 UTC,2023-03-23 21:25:58 UTC,research,CC-BY,https://inaturalist-open-data.s3.amazonaws.com/photos/99159232/medium.jpg,,"Cathedral Provincial Park, BC, Canada",1,0,FALSE,,"Okanagan-Similkameen, British Columbia, Canada",49.044025,-120.1923917,129,,,,129,,open,,subalpine larch,Larix lyallii,subalpine larch,Plantae,69848
61929248,9/30/20,2020-09-30 19:11:00 UTC,Pacific Time (US & Canada),459348,John D Reynolds,2020-10-07 06:52:08 UTC,2023-03-23 21:25:58 UTC,research,CC-BY,https://inaturalist-open-data.s3.amazonaws.com/photos/99159252/medium.jpg,"2020, BC, Canada, iNaturalist","Cathedral Provincial Park, BC, Canada",2,0,FALSE,,"Okanagan-Similkameen, BC, Canada",49.04121389,-120.1990806,18,,,,18,,open,,subalpine larch,Larix lyallii,subalpine larch,Plantae,69848
61929249,9/30/20,2020-09-30 19:11:00 UTC,Pacific Time (US & Canada),459348,John D Reynolds,2020-10-07 06:52:08 UTC,2023-03-23 21:25:58 UTC,research,CC-BY,https://inaturalist-open-data.s3.amazonaws.com/photos/99159264/medium.jpg,"2020, BC, Canada, iNaturalist","Cathedral Provincial Park, BC, Canada",2,0,FALSE,,"Okanagan-Similkameen, British Columbia, Canada",49.04121667,-120.19905,13,,,,13,,open,,subalpine larch,Larix lyallii,subalpine larch,Plantae,69848
61956953,10/5/20,2020-10-05 18:04:47 UTC,Pacific Time (US & Canada),3695510,,2020-10-07 16:39:53 UTC,2024-05-08 00:22:37 UTC,research,CC-BY-NC,https://inaturalist-open-data.s3.amazonaws.com/photos/99206380/medium.jpg,,,3,1,FALSE,3,"Chelan County, US-WA, US",48.12947907,-120.6552219,6,,,,26743,obscured,open,,subalpine larch,Larix lyallii,subalpine larch,Plantae,69848
62012255,9/29/20,2020-09-29 15:02:00 UTC,UTC,136692,Debora Obrist,2020-10-08 06:53:41 UTC,2020-10-16 20:39:19 UTC,research,,https://static.inaturalist.org/photos/99303258/medium.jpeg,,,1,0,FALSE,,"Okanagan-Similkameen, British Columbia, Canada",49.08961944,-120.2076722,5,,,,5,,open,,subalpine larch,Larix lyallii,subalpine larch,Plantae,69848
62163873,10/8/20,2020-10-08 21:24:00 UTC,Mountain Time (US & Canada),449500,Blake Weis,2020-10-10 02:14:22 UTC,2020-10-12 00:12:01 UTC,research,CC-BY-NC,https://inaturalist-open-data.s3.amazonaws.com/photos/99561822/medium.jpg,,,1,0,FALSE,,"Division No. 15, AB, Canada",50.59736075,-115.1625405,220,,,,220,,open,,subalpine larch,Larix lyallii,subalpine larch,Plantae,69848
62210555,9/20/20,2020-09-20 18:35:00 UTC,Mountain Time (US & Canada),2864763,,2020-10-10 16:57:45 UTC,2020-11-02 14:20:41 UTC,research,CC-BY-NC,https://inaturalist-open-data.s3.amazonaws.com/photos/99645844/medium.jpeg,,,2,0,FALSE,,"AB-40, Kananaskis, AB T0L, Canada",50.5978479,-114.990129,227,,,,227,,open,,subalpine larch,Larix lyallii,subalpine larch,Plantae,69848
62257475,10/10/20,2020-10-10 19:02:00 UTC,Pacific Time (US & Canada),3692603,,2020-10-11 01:07:07 UTC,2022-05-06 19:54:20 UTC,research,CC-BY-NC,https://inaturalist-open-data.s3.amazonaws.com/photos/99717060/medium.jpg,,Threatened species,1,0,FALSE,,"Okanagan-Similkameen, British Columbia, Canada",49.019925,-120.3895806,10,,,,10,,open,,subalpine larch,Larix lyallii,subalpine larch,Plantae,69848
62265191,9/27/20,2020-09-27 22:39:07 UTC,Pacific Time (US & Canada),1955525,Yanik Nill,2020-10-11 03:03:46 UTC,2020-10-12 03:28:43 UTC,research,CC-BY-NC,https://inaturalist-open-data.s3.amazonaws.com/photos/99740632/medium.jpeg,,,1,0,FALSE,2,"Manning Park, BC V0X 1R0, Canada",49.02363493,-120.8310109,37,,,,37,,open,gps,subalpine larch,Larix lyallii,subalpine larch,Plantae,69848
62376814,10/11/20,2020-10-12 00:06:57 UTC,Mountain Time (US & Canada),546424,,2020-10-12 04:51:52 UTC,2024-06-27 06:16:48 UTC,research,,https://static.inaturalist.org/photos/99933252/medium.jpg,,,1,0,FALSE,3,"Lake Louise Ski Resort, Improvement District No. 9, AB, CA",51.45533,-116.1364972,4,,,,4,,open,,subalpine larch,Larix lyallii,subalpine larch,Plantae,69848
62437375,9/16/20,2020-09-16 21:46:00 UTC,Mountain Time (US & Canada),88044,BioBlitz,2020-10-12 22:07:17 UTC,2024-06-27 06:16:42 UTC,research,CC-BY-ND,https://inaturalist-open-data.s3.amazonaws.com/photos/100036021/medium.jpeg,,Fairview Mountain,1,0,FALSE,,"Division No. 15, AB, Canada",51.39576947,-116.2171886,352,,,,352,,open,,subalpine larch,Larix lyallii,subalpine larch,Plantae,69848
62453823,9/28/20,2020-09-29 00:27:00 UTC,Pacific Time (US & Canada),612807,Celeste Kieran,2020-10-13 02:10:01 UTC,2024-06-20 01:02:57 UTC,research,CC0,https://inaturalist-open-data.s3.amazonaws.com/photos/100064797/medium.jpeg,,,1,0,FALSE,,"Okanagan-Similkameen, British Columbia, Canada",49.06360556,-120.2019056,8,,,,8,,open,,subalpine larch,Larix lyallii,subalpine larch,Plantae,69848
62458581,9/29/20,2020-09-29 22:47:00 UTC,Pacific Time (US & Canada),612807,Celeste Kieran,2020-10-13 03:36:12 UTC,2024-06-20 01:07:47 UTC,research,CC0,https://inaturalist-open-data.s3.amazonaws.com/photos/100074453/medium.jpeg,,,1,0,FALSE,,"Okanagan-Similkameen, British Columbia, Canada",49.08026389,-120.2097694,12,,,,12,,open,,subalpine larch,Larix lyallii,subalpine larch,Plantae,69848
62464006,10/6/10,2010-10-06 12:03:00 UTC,UTC,3673266,Terry M,2020-10-13 05:46:28 UTC,2020-11-14 11:52:05 UTC,research,CC-BY-NC,https://inaturalist-open-data.s3.amazonaws.com/photos/100084037/medium.jpeg,,,1,0,FALSE,,"Fraser Valley, BC, Canada",49.02473077,-120.8306346,61,,,,61,,open,,subalpine larch,Larix lyallii,subalpine larch,Plantae,69848
62569975,9/30/20,2020-09-30 08:25:00 UTC,UTC,136692,Debora Obrist,2020-10-14 17:40:55 UTC,2020-12-05 21:54:19 UTC,research,,https://static.inaturalist.org/photos/100200615/medium.jpeg,,,2,0,FALSE,,"Okanagan-Similkameen, British Columbia, Canada",49.06113056,-120.2001278,30,,,,30,,open,,subalpine larch,Larix lyallii,subalpine larch,Plantae,69848
62583891,9/28/20,2020-09-29 00:31:00 UTC,Pacific Time (US & Canada),612807,Celeste Kieran,2020-10-14 20:27:53 UTC,2024-06-20 01:16:44 UTC,research,CC0,https://inaturalist-open-data.s3.amazonaws.com/photos/100293199/medium.jpeg,,,1,0,FALSE,,"Okanagan-Similkameen, British Columbia, Canada",49.06354167,-120.2017361,,,,,,,open,,subalpine larch,Larix lyallii,subalpine larch,Plantae,69848
62583892,9/28/20,2020-09-29 00:31:00 UTC,Pacific Time (US & Canada),612807,Celeste Kieran,2020-10-14 20:27:53 UTC,2024-06-20 01:16:46 UTC,research,CC0,https://inaturalist-open-data.s3.amazonaws.com/photos/100293224/medium.jpeg,,,1,0,FALSE,,"Okanagan-Similkameen, BC, Canada",49.06354167,-120.2017361,,,,,,,open,,subalpine larch,Larix lyallii,subalpine larch,Plantae,69848
62587714,9/29/20,2020-09-29 21:04:00 UTC,Pacific Time (US & Canada),612807,Celeste Kieran,2020-10-14 21:11:51 UTC,2024-06-20 01:20:17 UTC,research,CC0,https://inaturalist-open-data.s3.amazonaws.com/photos/100300079/medium.jpeg,,,2,1,FALSE,,"Okanagan-Similkameen, British Columbia, Canada",49.08611389,-120.1929639,,,,,,,open,,subalpine larch,Larix lyallii,subalpine larch,Plantae,69848
62587746,9/29/20,2020-09-29 21:20:00 UTC,Pacific Time (US & Canada),612807,Celeste Kieran,2020-10-14 21:12:03 UTC,2024-06-20 01:21:13 UTC,research,CC0,https://inaturalist-open-data.s3.amazonaws.com/photos/100300375/medium.jpeg,,,2,1,FALSE,,"Okanagan-Similkameen, BC, Canada",49.08940556,-120.1986167,,,,,,,open,,subalpine larch,Larix lyallii,subalpine larch,Plantae,69848
62589329,9/29/20,2020-09-29 21:56:00 UTC,Pacific Time (US & Canada),612807,Celeste Kieran,2020-10-14 21:29:04 UTC,2024-06-20 01:24:03 UTC,research,CC0,https://inaturalist-open-data.s3.amazonaws.com/photos/100304054/medium.jpeg,,,2,1,FALSE,,"Okanagan-Similkameen, British Columbia, Canada",49.08991944,-120.2055139,,,,,,,open,,subalpine larch,Larix lyallii,subalpine larch,Plantae,69848
62589338,9/29/20,2020-09-29 22:13:00 UTC,Pacific Time (US & Canada),612807,Celeste Kieran,2020-10-14 21:29:10 UTC,2024-06-20 01:24:45 UTC,research,CC0,https://inaturalist-open-data.s3.amazonaws.com/photos/100304489/medium.jpeg,,,2,1,FALSE,,"Okanagan-Similkameen, BC, Canada",49.08771944,-120.2102278,,,,,,,open,,subalpine larch,Larix lyallii,subalpine larch,Plantae,69848
62589402,9/29/20,2020-09-29 22:43:00 UTC,Pacific Time (US & Canada),612807,Celeste Kieran,2020-10-14 21:29:48 UTC,2024-06-20 01:26:21 UTC,research,CC0,https://inaturalist-open-data.s3.amazonaws.com/photos/100304934/medium.jpeg,,,1,0,FALSE,,"Okanagan-Similkameen, British Columbia, Canada",49.08153611,-120.2102972,,,,,,,open,,subalpine larch,Larix lyallii,subalpine larch,Plantae,69848
62589407,9/29/20,2020-09-29 22:43:00 UTC,Pacific Time (US & Canada),612807,Celeste Kieran,2020-10-14 21:29:52 UTC,2024-06-20 01:26:25 UTC,research,CC0,https://inaturalist-open-data.s3.amazonaws.com/photos/100304949/medium.jpeg,,,1,0,FALSE,,"Okanagan-Similkameen, British Columbia, Canada",49.08153611,-120.2102972,,,,,,,open,,subalpine larch,Larix lyallii,subalpine larch,Plantae,69848
62589596,9/29/20,2020-09-30 00:07:00 UTC,Pacific Time (US & Canada),612807,Celeste Kieran,2020-10-14 21:32:29 UTC,2024-06-20 01:27:00 UTC,research,CC0,https://inaturalist-open-data.s3.amazonaws.com/photos/100305074/medium.jpeg,,,2,1,FALSE,,"Okanagan-Similkameen, BC, Canada",49.0719,-120.1964111,,,,,,,open,,subalpine larch,Larix lyallii,subalpine larch,Plantae,69848
62590398,9/29/20,2020-09-30 00:18:00 UTC,Pacific Time (US & Canada),612807,Celeste Kieran,2020-10-14 21:43:08 UTC,2024-06-20 01:24:53 UTC,research,CC0,https://inaturalist-open-data.s3.amazonaws.com/photos/100304540/medium.jpeg,,,2,1,FALSE,,"Okanagan-Similkameen, BC, Canada",49.07303889,-120.1946111,,,,,,,open,,subalpine larch,Larix lyallii,subalpine larch,Plantae,69848
62590632,9/30/20,2020-09-30 15:22:00 UTC,Pacific Time (US & Canada),612807,Celeste Kieran,2020-10-14 21:45:35 UTC,2024-06-20 01:27:40 UTC,research,CC0,https://inaturalist-open-data.s3.amazonaws.com/photos/100305416/medium.jpeg,,,2,1,FALSE,,"Okanagan-Similkameen, British Columbia, Canada",49.063575,-120.1992278,,,,,,,open,,subalpine larch,Larix lyallii,subalpine larch,Plantae,69848
62590639,9/30/20,2020-09-30 15:22:00 UTC,Pacific Time (US & Canada),612807,Celeste Kieran,2020-10-14 21:45:38 UTC,2024-06-20 01:27:40 UTC,research,CC0,https://inaturalist-open-data.s3.amazonaws.com/photos/100305422/medium.jpeg,,,2,1,FALSE,,"Okanagan-Similkameen, BC, Canada",49.063575,-120.1992278,,,,,,,open,,subalpine larch,Larix lyallii,subalpine larch,Plantae,69848
62590742,9/30/20,2020-09-30 15:30:00 UTC,Pacific Time (US & Canada),612807,Celeste Kieran,2020-10-14 21:47:08 UTC,2024-06-20 01:24:18 UTC,research,CC0,https://inaturalist-open-data.s3.amazonaws.com/photos/100304236/medium.jpeg,,,1,0,FALSE,,"Okanagan-Similkameen, British Columbia, Canada",49.06100833,-120.2013222,,,,,,,open,,subalpine larch,Larix lyallii,subalpine larch,Plantae,69848
62594282,9/30/20,2020-09-30 19:16:00 UTC,Pacific Time (US & Canada),612807,Celeste Kieran,2020-10-14 22:34:51 UTC,2024-06-20 01:30:15 UTC,research,CC0,https://inaturalist-open-data.s3.amazonaws.com/photos/100309293/medium.jpeg,,,1,0,FALSE,,"Okanagan-Similkameen, BC, Canada",49.03964167,-120.1975333,,,,,,,open,,subalpine larch,Larix lyallii,subalpine larch,Plantae,69848
62594303,9/30/20,2020-09-30 19:16:00 UTC,Pacific Time (US & Canada),612807,Celeste Kieran,2020-10-14 22:34:58 UTC,2024-06-20 01:30:19 UTC,research,CC0,https://inaturalist-open-data.s3.amazonaws.com/photos/100309335/medium.jpeg,,,1,0,FALSE,,"Okanagan-Similkameen, British Columbia, Canada",49.04015833,-120.1979361,,,,,,,open,,subalpine larch,Larix lyallii,subalpine larch,Plantae,69848
62594554,9/30/20,2020-09-30 16:43:00 UTC,Pacific Time (US & Canada),612807,Celeste Kieran,2020-10-14 22:37:50 UTC,2024-06-20 01:25:09 UTC,research,CC0,https://inaturalist-open-data.s3.amazonaws.com/photos/100304660/medium.jpeg,,,1,0,FALSE,,"Okanagan-Similkameen, British Columbia, Canada",49.055825,-120.2151278,,,,,,,open,,subalpine larch,Larix lyallii,subalpine larch,Plantae,69848
62738035,9/30/20,2020-09-30 12:58:00 UTC,UTC,136692,Debora Obrist,2020-10-16 21:27:46 UTC,2020-10-16 21:31:55 UTC,research,,https://static.inaturalist.org/photos/100565797/medium.jpeg,,,2,0,FALSE,,"Okanagan-Similkameen, BC, Canada",49.04450278,-120.1929083,10,,,,10,,open,,subalpine larch,Larix lyallii,subalpine larch,Plantae,69848
62852769,10/15/20,2020-10-15 23:01:00 UTC,Arizona,953201,Mollie,2020-10-18 01:44:02 UTC,2022-08-07 18:13:10 UTC,research,,https://static.inaturalist.org/photos/100775560/medium.jpg,,,3,0,FALSE,3,"Okanogan-Wenatchee National Forest, Leavenworth, WA, US",47.53848333,-120.8638917,5,,,,5,,open,,subalpine larch,Larix lyallii,subalpine larch,Plantae,69848
62862806,10/17/20,2020-10-17 20:01:28 UTC,Mountain Time (US & Canada),3746532,,2020-10-18 03:55:01 UTC,2023-08-18 05:22:23 UTC,research,CC-BY-NC,https://inaturalist-open-data.s3.amazonaws.com/photos/100793959/medium.jpeg,,Western larch,2,0,FALSE,2,"Chelan County, US-WA, US",48.06443039,-120.7321784,7,,,,7,,open,,subalpine larch,Larix lyallii,subalpine larch,Plantae,69848
63046935,9/18/20,2020-09-18 20:40:50 UTC,Mountain Time (US & Canada),1486687,Jim Wallace,2020-10-19 21:58:12 UTC,2020-11-29 20:03:00 UTC,research,CC-BY-NC,https://inaturalist-open-data.s3.amazonaws.com/photos/101119915/medium.jpeg,,,2,0,FALSE,2,"Kananaskis, AB T0L, Canada",50.59111111,-115.0155556,,,,,,,open,,subalpine larch,Larix lyallii,subalpine larch,Plantae,69848
63055747,9/19/20,2020-09-19 19:17:07 UTC,Pacific Time (US & Canada),3765174,Robyn Hanson,2020-10-20 00:17:41 UTC,2024-03-19 23:22:05 UTC,research,CC0,https://inaturalist-open-data.s3.amazonaws.com/photos/101135772/medium.jpg,,,1,0,FALSE,3,"E. C. Manning Provincial Park, Okanagan-Similkameen H, BC, CA",49.02629167,-120.8304367,5,,,,5,,open,,subalpine larch,Larix lyallii,subalpine larch,Plantae,69848
63437162,9/5/20,2020-09-05 15:59:56 UTC,Pacific Time (US & Canada),8641,John Brew,2020-10-24 23:19:35 UTC,2020-10-25 16:10:34 UTC,research,CC-BY,https://inaturalist-open-data.s3.amazonaws.com/photos/101804208/medium.jpg,,,1,0,FALSE,3,"Okanogan-Wenatchee National Forest, Deming, WA, US",48.74341333,-120.6844783,,,,,,,open,,subalpine larch,Larix lyallii,subalpine larch,Plantae,69848
63455111,9/29/20,2020-09-29 18:27:00 UTC,Pacific Time (US & Canada),1816805,Peter Zika,2020-10-25 04:07:30 UTC,2022-04-20 20:56:41 UTC,research,CC-BY-NC,https://inaturalist-open-data.s3.amazonaws.com/photos/101837607/medium.jpeg,,,1,0,FALSE,,"Blue Lake, Chelan County, Washington, USA",48.50586944,-120.6721417,10,,,,10,,open,,subalpine larch,Larix lyallii,subalpine larch,Plantae,69848
63455168,9/27/20,2020-09-27 23:34:00 UTC,Pacific Time (US & Canada),1816805,Peter Zika,2020-10-25 04:08:26 UTC,2022-04-20 20:56:41 UTC,research,CC-BY-NC,https://inaturalist-open-data.s3.amazonaws.com/photos/101837707/medium.jpeg,,,1,0,FALSE,,"Harts Pass area, Okanogan County, Washington, USA",48.73754444,-120.6784889,5,,,,5,,open,,subalpine larch,Larix lyallii,subalpine larch,Plantae,69848
63490197,7/4/20,2020-07-04 17:44:54 UTC,Mountain Time (US & Canada),1498364,Dan,2020-10-25 16:03:34 UTC,2020-10-25 17:11:17 UTC,research,CC-BY-NC,https://inaturalist-open-data.s3.amazonaws.com/photos/101899986/medium.jpeg,,,1,0,FALSE,2,"Pincher Creek No. 9, AB, Canada",49.33350617,-114.3869317,457,,,,457,,open,gps,subalpine larch,Larix lyallii,subalpine larch,Plantae,69848
63497776,10/24/20,2020-10-24 20:48:40 UTC,Pacific Time (US & Canada),3352889,,2020-10-25 17:32:04 UTC,2022-05-06 22:47:35 UTC,research,CC-BY-NC,https://inaturalist-open-data.s3.amazonaws.com/photos/101913588/medium.jpeg,,,2,0,FALSE,2,"Winthrop, WA 98862, USA",48.58369726,-120.6692157,1817,,,,1817,,open,,subalpine larch,Larix lyallii,subalpine larch,Plantae,69848
63545548,9/5/20,2020-09-05 23:43:13 UTC,Pacific Time (US & Canada),8641,John Brew,2020-10-26 03:15:39 UTC,2022-04-19 12:46:06 UTC,research,CC-BY,https://inaturalist-open-data.s3.amazonaws.com/photos/101999395/medium.jpg,,,1,0,FALSE,3,"Okanogan-Wenatchee National Forest, Mazama, WA, US",48.701295,-120.6742617,,,,,,,open,,subalpine larch,Larix lyallii,subalpine larch,Plantae,69848
63587189,10/25/20,2020-10-25 19:37:26 UTC,Pacific Time (US & Canada),3742720,,2020-10-26 19:28:16 UTC,2023-01-24 19:51:20 UTC,research,CC-BY-NC,https://inaturalist-open-data.s3.amazonaws.com/photos/102075083/medium.jpeg,,,2,0,FALSE,2,"Winthrop, WA 98862, USA",48.51247446,-120.6707466,363,,,,363,,open,gps,subalpine larch,Larix lyallii,subalpine larch,Plantae,69848
63609415,7/4/14,2014-07-05 02:21:00 UTC,Pacific Time (US & Canada),46945,T. Abe Lloyd,2020-10-27 01:50:10 UTC,2023-01-24 19:50:30 UTC,research,CC-BY-NC,https://inaturalist-open-data.s3.amazonaws.com/photos/102114063/medium.jpeg,,,2,0,FALSE,,"Chelan County, WA, USA",48.16248073,-120.8780256,31,,,,31,,open,,subalpine larch,Larix lyallii,subalpine larch,Plantae,69848
63662491,10/11/20,2020-10-11 19:00:20 UTC,Pacific Time (US & Canada),2608877,,2020-10-27 21:42:47 UTC,2020-12-07 03:09:22 UTC,research,,https://static.inaturalist.org/photos/102210946/medium.jpg,,,1,0,FALSE,3,"E. C. Manning Provincial Park, Okanagan-Similkameen H, BC, CA",49.02414717,-120.8307717,16,,,,16,,open,,subalpine larch,Larix lyallii,subalpine larch,Plantae,69848
63678596,9/6/20,2020-09-06 14:04:14 UTC,Pacific Time (US & Canada),8641,John Brew,2020-10-28 02:48:51 UTC,2022-04-19 12:08:09 UTC,research,CC-BY,https://inaturalist-open-data.s3.amazonaws.com/photos/102240715/medium.jpg,,,1,0,FALSE,3,"Okanogan-Wenatchee National Forest, Mazama, WA, US",48.74129667,-120.6786833,,,,,,,open,,subalpine larch,Larix lyallii,subalpine larch,Plantae,69848
63703489,8/3/09,2009-08-03 19:44:00 UTC,Arizona,5240,Brian Catto,2020-10-28 15:37:07 UTC,2024-06-27 06:16:38 UTC,research,CC-BY,https://static.inaturalist.org/photos/102283089/medium.jpg,,,1,0,FALSE,,"Division No. 15, AB, Canada",51.41469957,-116.2508757,15,,,,15,,open,,subalpine larch,Larix lyallii,subalpine larch,Plantae,69848
63703490,9/25/05,2005-09-25 18:45:00 UTC,Arizona,5240,Brian Catto,2020-10-28 15:37:08 UTC,2024-06-27 06:16:30 UTC,research,CC-BY,https://static.inaturalist.org/photos/102283239/medium.jpeg,,,1,0,FALSE,,"Division No. 15, AB, Canada",51.39492847,-116.2143981,8,,,,8,,open,,subalpine larch,Larix lyallii,subalpine larch,Plantae,69848
63703491,10/3/17,2017-10-03 19:56:00 UTC,Arizona,5240,Brian Catto,2020-10-28 15:37:08 UTC,2020-11-18 22:59:30 UTC,research,CC-BY,https://static.inaturalist.org/photos/102283370/medium.jpg,,,1,0,FALSE,,"Columbia-Shuswap, BC, Canada",51.34702764,-116.3302831,31,,,,31,,open,,subalpine larch,Larix lyallii,subalpine larch,Plantae,69848
63767865,10/5/20,2020-10-05 20:38:24 UTC,Pacific Time (US & Canada),2704179,Liz Landefeld,2020-10-29 15:58:18 UTC,2023-01-24 20:17:48 UTC,research,,https://static.inaturalist.org/photos/102398844/medium.jpg,,THE biggest larch I have EVER seen,1,0,FALSE,3,"Okanogan-Wenatchee National Forest, Leavenworth, WA, US",48.14144167,-120.8194717,32,,,,32,,open,,subalpine larch,Larix lyallii,subalpine larch,Plantae,69848
63796801,9/28/20,2020-09-29 00:21:00 UTC,Pacific Time (US & Canada),136692,Debora Obrist,2020-10-30 01:06:09 UTC,2020-11-11 23:52:10 UTC,research,,https://static.inaturalist.org/photos/102447685/medium.jpeg,,,2,0,FALSE,,"Okanagan-Similkameen, BC, Canada",49.06326292,-120.1981626,336,,,,336,,open,,subalpine larch,Larix lyallii,subalpine larch,Plantae,69848
63796804,9/28/20,2020-09-29 00:21:00 UTC,Pacific Time (US & Canada),136692,Debora Obrist,2020-10-30 01:06:10 UTC,2020-11-01 23:51:20 UTC,research,,https://static.inaturalist.org/photos/102447736/medium.jpeg,,,1,0,FALSE,,"Okanagan-Similkameen, BC, Canada",49.06326292,-120.1981626,336,,,,336,,open,,subalpine larch,Larix lyallii,subalpine larch,Plantae,69848
63826118,9/6/20,2020-09-06 14:16:37 UTC,Pacific Time (US & Canada),8641,John Brew,2020-10-30 16:16:28 UTC,2022-04-19 12:06:54 UTC,research,CC-BY,https://inaturalist-open-data.s3.amazonaws.com/photos/102504116/medium.jpg,,,1,0,FALSE,3,"Okanogan-Wenatchee National Forest, Mazama, WA, US",48.74325333,-120.6774583,,,,,,,open,,subalpine larch,Larix lyallii,subalpine larch,Plantae,69848
63899431,9/6/20,2020-09-06 15:23:27 UTC,Pacific Time (US & Canada),8641,John Brew,2020-10-31 17:53:39 UTC,2022-08-24 00:15:36 UTC,research,CC-BY,https://inaturalist-open-data.s3.amazonaws.com/photos/102633488/medium.jpg,,,2,0,FALSE,3,"Okanogan-Wenatchee National Forest, Mazama, WA, US",48.74790333,-120.669795,,,,,,,open,,subalpine larch,Larix lyallii,subalpine larch,Plantae,69848
63899542,9/6/20,2020-09-06 15:27:08 UTC,Pacific Time (US & Canada),8641,John Brew,2020-10-31 17:55:21 UTC,2020-11-02 21:28:42 UTC,research,CC-BY,https://inaturalist-open-data.s3.amazonaws.com/photos/102633731/medium.jpg,,,1,0,FALSE,3,"Okanogan-Wenatchee National Forest, Mazama, WA, US",48.74849167,-120.6692133,,,,,,,open,,subalpine larch,Larix lyallii,subalpine larch,Plantae,69848
63900964,9/6/20,2020-09-06 15:38:12 UTC,Pacific Time (US & Canada),8641,John Brew,2020-10-31 18:14:19 UTC,2022-04-19 12:06:42 UTC,research,CC-BY,https://inaturalist-open-data.s3.amazonaws.com/photos/102636241/medium.jpg,,,1,0,FALSE,3,"Okanogan-Wenatchee National Forest, Mazama, WA, US",48.74982833,-120.6682167,,,,,,,open,,subalpine larch,Larix lyallii,subalpine larch,Plantae,69848
63998861,11/1/20,2020-11-01 19:45:03 UTC,Pacific Time (US & Canada),205708,Remington Jackson,2020-11-01 23:01:34 UTC,2022-01-05 00:37:40 UTC,research,CC-BY-NC,https://inaturalist-open-data.s3.amazonaws.com/photos/102810861/medium.jpg,,,1,0,FALSE,3,"Chelan County, US-WA, US",47.49277595,-120.8369176,10,,,,10,,open,,subalpine larch,Larix lyallii,subalpine larch,Plantae,69848
64014497,9/6/20,2020-09-06 16:17:45 UTC,Pacific Time (US & Canada),8641,John Brew,2020-11-02 03:13:37 UTC,2022-04-19 12:07:51 UTC,research,CC-BY,https://inaturalist-open-data.s3.amazonaws.com/photos/102840070/medium.jpg,,,1,0,FALSE,3,"Okanogan-Wenatchee National Forest, Mazama, WA, US",48.75688667,-120.6664117,,,,,,,open,,subalpine larch,Larix lyallii,subalpine larch,Plantae,69848
64486474,9/24/20,2020-09-24 18:16:58 UTC,Pacific Time (US & Canada),246840,Paul Sieracki,2020-11-09 01:13:58 UTC,2023-01-07 20:18:26 UTC,research,CC-BY-NC,https://inaturalist-open-data.s3.amazonaws.com/photos/122840482/medium.jpeg,,,1,0,FALSE,2,"Boundary County, US-ID, US",48.63184973,-116.5716831,6,,,,6,,open,,subalpine larch,Larix lyallii,subalpine larch,Plantae,69848
64495802,9/6/20,2020-09-06 17:22:03 UTC,Pacific Time (US & Canada),8641,John Brew,2020-11-09 03:30:06 UTC,2022-04-19 12:07:35 UTC,research,CC-BY,https://inaturalist-open-data.s3.amazonaws.com/photos/103701697/medium.jpg,,,1,0,FALSE,3,"Okanogan-Wenatchee National Forest, Mazama, WA, US",48.76565,-120.66837,,,,,,,open,,subalpine larch,Larix lyallii,subalpine larch,Plantae,69848
64801498,9/6/20,2020-09-06 19:57:57 UTC,Pacific Time (US & Canada),8641,John Brew,2020-11-13 17:46:03 UTC,2020-12-05 21:59:52 UTC,research,CC-BY,https://inaturalist-open-data.s3.amazonaws.com/photos/104241598/medium.jpg,,,1,0,FALSE,3,"Okanogan-Wenatchee National Forest, Mazama, WA, US",48.77453,-120.6652883,,,,,,,open,,subalpine larch,Larix lyallii,subalpine larch,Plantae,69848
64890073,9/7/20,2020-09-07 17:28:40 UTC,Pacific Time (US & Canada),8641,John Brew,2020-11-14 22:19:52 UTC,2022-08-24 00:15:16 UTC,research,CC-BY,https://inaturalist-open-data.s3.amazonaws.com/photos/104393932/medium.jpg,,,2,0,FALSE,3,"Okanogan-Wenatchee National Forest, Mazama, WA, US",48.77310833,-120.7153633,,,,,,,open,,subalpine larch,Larix lyallii,subalpine larch,Plantae,69848
64905619,9/7/20,2020-09-07 17:57:13 UTC,Pacific Time (US & Canada),8641,John Brew,2020-11-15 02:31:12 UTC,2022-08-24 00:14:33 UTC,research,CC-BY,https://inaturalist-open-data.s3.amazonaws.com/photos/104421481/medium.jpg,,,1,0,FALSE,3,"Okanogan-Wenatchee National Forest, Mazama, WA, US",48.77881167,-120.7226083,,,,,,,open,,subalpine larch,Larix lyallii,subalpine larch,Plantae,69848
64906355,9/7/20,2020-09-07 18:02:13 UTC,Pacific Time (US & Canada),8641,John Brew,2020-11-15 02:46:11 UTC,2022-08-24 00:14:53 UTC,research,CC-BY,https://inaturalist-open-data.s3.amazonaws.com/photos/104422951/medium.jpg,,,2,0,FALSE,3,"Okanogan-Wenatchee National Forest, Mazama, WA, US",48.77832167,-120.7232667,,,,,,,open,,subalpine larch,Larix lyallii,subalpine larch,Plantae,69848
65024883,10/5/20,2020-10-05 18:31:00 UTC,Mountain Time (US & Canada),2705824,,2020-11-16 18:15:57 UTC,2024-06-27 06:16:25 UTC,research,CC-BY-NC,https://inaturalist-open-data.s3.amazonaws.com/photos/104624185/medium.jpeg,,,2,0,FALSE,,"Division No. 15, AB, Canada",51.297427,-116.088502,55,,,,55,,open,,subalpine larch,Larix lyallii,subalpine larch,Plantae,69848
65024891,10/5/20,2020-10-05 20:15:00 UTC,Mountain Time (US & Canada),2705824,,2020-11-16 18:15:59 UTC,2024-06-27 06:16:21 UTC,research,CC-BY-NC,https://inaturalist-open-data.s3.amazonaws.com/photos/104624692/medium.jpeg,,,1,0,FALSE,,"Division No. 15, AB, Canada",51.296984,-116.090254,82,,,,82,,open,,subalpine larch,Larix lyallii,subalpine larch,Plantae,69848
65024895,10/5/20,2020-10-05 20:25:00 UTC,Mountain Time (US & Canada),2705824,,2020-11-16 18:16:00 UTC,2024-06-27 06:16:11 UTC,research,CC-BY-NC,https://inaturalist-open-data.s3.amazonaws.com/photos/104624975/medium.jpeg,,,2,0,FALSE,,"Division No. 15, AB, Canada",51.297479,-116.08843,41,,,,41,,open,,subalpine larch,Larix lyallii,subalpine larch,Plantae,69848
65507711,8/29/17,2017-08-29 20:40:00 UTC,Pacific Time (US & Canada),196813,Maisie Borg,2020-11-24 02:54:12 UTC,2022-09-06 16:34:51 UTC,research,CC-BY-NC-SA,https://inaturalist-open-data.s3.amazonaws.com/photos/105448394/medium.jpg,,,1,0,FALSE,,"Whatcom, Washington, United States",48.73216944,-120.6772611,5,,,,5,,open,,subalpine larch,Larix lyallii,subalpine larch,Plantae,69848
65764430,8/3/17,2017-08-03 18:38:00 UTC,Pacific Time (US & Canada),46945,T. Abe Lloyd,2020-11-28 18:47:33 UTC,2022-09-06 04:16:24 UTC,research,CC-BY-NC,https://inaturalist-open-data.s3.amazonaws.com/photos/105901728/medium.jpeg,,,2,0,FALSE,,"Whatcom County, WA, USA",48.75926667,-120.85797,,,,,,,open,,subalpine larch,Larix lyallii,subalpine larch,Plantae,69848
65764437,8/3/17,2017-08-03 18:52:00 UTC,Pacific Time (US & Canada),46945,T. Abe Lloyd,2020-11-28 18:47:35 UTC,2022-04-19 18:29:16 UTC,research,CC-BY-NC,https://inaturalist-open-data.s3.amazonaws.com/photos/105902269/medium.jpeg,,,1,0,FALSE,,"Whatcom County, WA, USA",48.76120167,-120.8553333,,,,,,,open,,subalpine larch,Larix lyallii,subalpine larch,Plantae,69848
66282767,7/30/19,2019-07-30 14:51:00 UTC,UTC,3865852,Megan Sakuma,2020-12-08 06:24:12 UTC,2021-01-12 07:59:01 UTC,research,,https://static.inaturalist.org/photos/106809304/medium.jpg,,,1,0,FALSE,,"Yoho, Columbia-Shuswap, British Columbia, Canada",51.34156111,-116.3193194,,,,,,,open,,subalpine larch,Larix lyallii,subalpine larch,Plantae,69848
66365069,10/10/14,2014-10-10 13:22:00 UTC,UTC,3431757,,2020-12-10 06:13:55 UTC,2024-05-08 00:19:57 UTC,research,CC-BY-NC,https://inaturalist-open-data.s3.amazonaws.com/photos/106969983/medium.jpg,,,3,1,FALSE,,"Skagit County, WA, USA",48.55491721,-120.7010654,,,,,,,open,,subalpine larch,Larix lyallii,subalpine larch,Plantae,69848
66377855,9/19/14,2014-09-19 15:50:00 UTC,Central Time (US & Canada),765725,,2020-12-10 16:22:51 UTC,2024-06-27 06:16:06 UTC,research,,https://static.inaturalist.org/photos/106993099/medium.jpeg,,"Larch Valley near Lake Louise, AB.",1,0,FALSE,,"Division No. 15, AB, Canada",51.3613927,-116.2202831,2253,,,,2253,,open,,subalpine larch,Larix lyallii,subalpine larch,Plantae,69848
66489836,10/20/69,,Mountain Time (US & Canada),865603,,2020-12-12 23:21:10 UTC,2021-03-05 17:34:45 UTC,research,CC-BY-NC,https://inaturalist-open-data.s3.amazonaws.com/photos/107195818/medium.jpg,,,1,0,FALSE,,"Teton County, MT, USA",47.8236839,-112.8074867,61,,,,61,,open,,subalpine larch,Larix lyallii,subalpine larch,Plantae,69848
67894818,8/12/15,2015-08-12 22:49:00 UTC,Pacific Time (US & Canada),20158,Andrew Lie,2021-01-11 04:17:01 UTC,2024-05-08 11:41:37 UTC,research,CC-BY,https://inaturalist-open-data.s3.amazonaws.com/photos/109812227/medium.jpeg,,Pasaytan Wilderness  on the PCT approaching Tamarack Peak,3,0,FALSE,,"Okanogan County, WA, USA",48.77818333,-120.7247611,,,,,,,open,,subalpine larch,Larix lyallii,subalpine larch,Plantae,69848
68392123,10/3/20,2020-10-03 20:48:25 UTC,Pacific Time (US & Canada),2250776,,2021-01-21 02:54:20 UTC,2021-01-24 04:54:53 UTC,research,,https://inaturalist-open-data.s3.amazonaws.com/photos/110729953/medium.jpg,,,1,0,FALSE,3,"E. C. Manning Provincial Park, East Gate, BC, CA",49.01789167,-120.8318633,4,,,,4,,open,,subalpine larch,Larix lyallii,subalpine larch,Plantae,69848
68964383,9/8/20,2020-09-08 21:15:16 UTC,Pacific Time (US & Canada),1448507,Jenny Feick,2021-02-02 16:30:38 UTC,2021-02-03 14:03:53 UTC,research,CC-BY-NC,https://inaturalist-open-data.s3.amazonaws.com/photos/111799382/medium.jpg,,,2,0,FALSE,3,"Elbow-Sheep Wildland Provincial Park, Water Valley, AB, CA",50.59803,-114.9662783,5,,,,5,,open,,subalpine larch,Larix lyallii,subalpine larch,Plantae,69848
69072649,2/4/21,2021-02-04 21:01:02 UTC,Mountain Time (US & Canada),785779,Matt Wallace,2021-02-04 23:48:13 UTC,2024-06-27 06:15:59 UTC,research,,https://static.inaturalist.org/photos/111998127/medium.jpeg,,,1,0,FALSE,2,"Improvement District No. 9, AB T0L, Canada",51.43708462,-116.1035549,10,,,,10,,open,gps,subalpine larch,Larix lyallii,subalpine larch,Plantae,69848
69394393,8/12/18,2018-08-12 07:29:00 UTC,Pacific Time (US & Canada),46945,T. Abe Lloyd,2021-02-11 02:46:30 UTC,2022-09-06 04:25:26 UTC,research,CC-BY-NC,https://inaturalist-open-data.s3.amazonaws.com/photos/112576496/medium.jpeg,,,1,0,FALSE,,"Okanogan County, WA, USA",48.73521249,-120.671583,4,,,,4,,open,,subalpine larch,Larix lyallii,subalpine larch,Plantae,69848
69422488,8/16/18,2018-08-16 09:21:00 UTC,Pacific Time (US & Canada),46945,T. Abe Lloyd,2021-02-11 19:40:38 UTC,2021-02-13 01:04:55 UTC,research,CC-BY-NC,https://inaturalist-open-data.s3.amazonaws.com/photos/112633578/medium.jpeg,,,2,0,FALSE,,"Whatcom County, WA, USA",48.77300166,-120.7214361,31,,,,31,,open,,subalpine larch,Larix lyallii,subalpine larch,Plantae,69848
69842332,2/19/21,2021-02-19 20:27:14 UTC,Mountain Time (US & Canada),785779,Matt Wallace,2021-02-20 03:20:46 UTC,2024-06-27 06:15:54 UTC,research,,https://static.inaturalist.org/photos/113425354/medium.jpeg,,,1,0,FALSE,2,"Improvement District No. 9, AB T0L, Canada",51.43766481,-116.1009699,10,,,,10,,open,gps,subalpine larch,Larix lyallii,subalpine larch,Plantae,69848
70127703,7/13/20,2020-07-13 22:49:00 UTC,Pacific Time (US & Canada),3396573,Steve Ansell,2021-02-25 03:21:18 UTC,2022-01-21 22:27:49 UTC,research,CC-BY-NC,https://inaturalist-open-data.s3.amazonaws.com/photos/113944528/medium.jpeg,,Lower needles growing later as snowpack melts,1,0,FALSE,,"Cathedral PP, Okanagan-Similkameen, BC, Canada",49.05997222,-120.2030639,12,,,,12,,open,,subalpine larch,Larix lyallii,subalpine larch,Plantae,69848
70627077,10/17/13,2013-10-17 21:14:00 UTC,Pacific Time (US & Canada),400025,Tuoichen,2021-03-05 21:18:29 UTC,2023-08-01 01:43:15 UTC,research,CC-BY-NC,https://inaturalist-open-data.s3.amazonaws.com/photos/114852165/medium.jpg,,The photos are from Blue Lake and the trail to it from the North Cascades Highway.,1,0,FALSE,,"Blue Lake, Chelan County, WA, USA",48.51271782,-120.670784,800,,,,800,,open,,subalpine larch,Larix lyallii,subalpine larch,Plantae,69848
70716926,9/24/20,2020-09-24 18:01:17 UTC,Pacific Time (US & Canada),1412723,Adrian Leslie,2021-03-07 05:03:57 UTC,2021-03-07 15:09:10 UTC,research,CC-BY-NC,https://inaturalist-open-data.s3.amazonaws.com/photos/115014395/medium.jpg,,,2,0,FALSE,3,"Invermere, BC, CA",50.42566667,-116.5023417,10,,,,10,,open,,subalpine larch,Larix lyallii,subalpine larch,Plantae,69848
70717003,9/22/20,2020-09-22 21:05:56 UTC,Pacific Time (US & Canada),1412723,Adrian Leslie,2021-03-07 05:06:48 UTC,2021-03-07 15:08:51 UTC,research,CC-BY-NC,https://inaturalist-open-data.s3.amazonaws.com/photos/115014594/medium.jpg,,,2,0,FALSE,3,"Invermere, BC, CA",50.35578,-116.61618,10,,,,10,,open,,subalpine larch,Larix lyallii,subalpine larch,Plantae,69848
70958255,9/19/18,2018-09-19 13:48:11 UTC,Mountain Time (US & Canada),3964300,Bryce Pease (she/they),2021-03-10 20:12:41 UTC,2023-01-16 02:31:57 UTC,research,CC-BY-NC,https://inaturalist-open-data.s3.amazonaws.com/photos/115447125/medium.jpg,,,1,0,FALSE,3,"Okanogan-Wenatchee National Forest, Stehekin, WA, US",48.242745,-120.7901083,10,,,,10,,open,,subalpine larch,Larix lyallii,subalpine larch,Plantae,69848
71287785,9/14/19,2019-09-14 18:01:09 UTC,Eastern Time (US & Canada),7414,DapplerOfMuch,2021-03-15 08:06:14 UTC,2024-06-27 06:15:48 UTC,research,CC-BY,https://static.inaturalist.org/photos/116041321/medium.jpg,,Larches are a magnificent sight after the grey of high altitudes. ,1,0,FALSE,3,"Banff National Park, Lake Louise, AB, CA",51.32627833,-116.2096417,6,,,,6,,open,,subalpine larch,Larix lyallii,subalpine larch,Plantae,69848
71675721,3/11/21,2021-03-11 20:30:00 UTC,Mountain Time (US & Canada),1717149,,2021-03-21 02:37:17 UTC,2024-06-27 06:15:41 UTC,research,CC-BY-NC,https://inaturalist-open-data.s3.amazonaws.com/photos/116730304/medium.jpeg,,,1,0,FALSE,,"Division No. 15, AB, Canada",51.08958833,-115.8453917,,,,,,,open,,subalpine larch,Larix lyallii,subalpine larch,Plantae,69848
72725993,8/20/09,2009-08-20 13:41:00 UTC,UTC,586591,Lexi Menth,2021-04-02 22:06:18 UTC,2023-01-16 08:01:40 UTC,research,CC-BY-NC,https://inaturalist-open-data.s3.amazonaws.com/photos/118621888/medium.jpeg,,,1,0,FALSE,,"Mazama, WA 98833, USA",48.721052,-120.6699618,180,,,,180,,open,,subalpine larch,Larix lyallii,subalpine larch,Plantae,69848
72854148,7/7/14,2014-07-06 22:55:00 UTC,Brisbane,108966,Pete Woodall,2021-04-04 02:10:44 UTC,2024-06-27 06:15:35 UTC,research,CC-BY-NC,https://inaturalist-open-data.s3.amazonaws.com/photos/118860300/medium.jpeg,,3/4/52,2,0,FALSE,,"Sunshine Meadows, Division No. 15, AB, Canada",51.077,-115.784,500,,,,500,,open,,subalpine larch,Larix lyallii,subalpine larch,Plantae,69848
73414623,10/6/17,2017-10-06 18:42:12 UTC,Mountain Time (US & Canada),3961145,,2021-04-09 18:57:36 UTC,2021-04-09 22:44:30 UTC,research,CC-BY-NC,https://inaturalist-open-data.s3.amazonaws.com/photos/119850854/medium.jpg,,Alpine larch trees (golden yellow coloured trees),1,0,FALSE,3,"Peter Lougheed Provincial Park, Water Valley, AB, CA",50.76118,-115.3696217,24,,,,24,,open,,subalpine larch,Larix lyallii,subalpine larch,Plantae,69848
73450756,8/22/20,2020-08-22 18:23:17 UTC,Mountain Time (US & Canada),3225266,Scott Mincemoyer,2021-04-10 01:45:54 UTC,2021-04-10 12:45:46 UTC,research,CC-BY-NC,https://inaturalist-open-data.s3.amazonaws.com/photos/119915780/medium.jpg,,,1,0,FALSE,3,"Helena-Lewis and Clark National Forest, Choteau, MT, US",47.93303667,-112.88488,5,,,,5,,open,,subalpine larch,Larix lyallii,subalpine larch,Plantae,69848
74995463,10/6/20,2020-10-06 21:35:57 UTC,Pacific Time (US & Canada),4270021,,2021-04-24 01:42:30 UTC,2024-01-14 22:36:29 UTC,research,CC-BY-NC,https://inaturalist-open-data.s3.amazonaws.com/photos/122640214/medium.jpg,,,3,1,FALSE,3,"E.C. Manning Provincial Park, East Gate, BC, CA",49.0242,-120.8308717,6,,,,6,,open,,subalpine larch,Larix lyallii,subalpine larch,Plantae,69848
75110542,7/8/17,2017-07-08 18:00:00 UTC,Mountain Time (US & Canada),4018130,Radd Icenoggle,2021-04-24 23:36:35 UTC,2023-02-08 13:35:17 UTC,research,CC-BY-NC,https://inaturalist-open-data.s3.amazonaws.com/photos/122836322/medium.jpg,"Alpine larch, Bitterroot Mountains, Bitterroot National Forest, Jeff Smith, Larix lyallii, Trapper Peak",Alpine Larch (Larix lyallii) on the flanks of Trapper Peak,1,0,FALSE,,"Ravalli County, MT, USA",45.88948846,-114.2964818,,,,,,,open,,subalpine larch,Larix lyallii,subalpine larch,Plantae,69848
75474585,7/21/17,2017-07-21 16:33:00 UTC,Chihuahua,3808250,Lyrae,2021-04-27 21:41:57 UTC,2021-12-07 00:56:07 UTC,research,CC-BY-NC,https://inaturalist-open-data.s3.amazonaws.com/photos/123476561/medium.jpg,,,2,0,FALSE,,"Peter Lougheed, Division No. 15, Alberta, Canada",50.59570833,-114.9854333,,,,,,,open,,Larix lyallii,Larix lyallii,subalpine larch,Plantae,69848
77453969,9/24/17,2017-09-24 18:22:00 UTC,UTC,4358941,,2021-05-05 14:32:55 UTC,2021-06-12 06:47:23 UTC,research,CC-BY-NC,https://inaturalist-open-data.s3.amazonaws.com/photos/126672271/medium.jpeg,,,3,0,FALSE,2,"Manning Park, BC V0X 1R0, Canada",49.02539375,-120.8313056,189,,,,189,,open,gps,subalpine larch,Larix lyallii,subalpine larch,Plantae,69848
81354085,10/15/11,2011-10-15 21:06:00 UTC,Pacific Time (US & Canada),2944460,Matt Below,2021-06-02 21:11:02 UTC,2022-04-19 12:42:59 UTC,research,,https://static.inaturalist.org/photos/133429060/medium.jpg,,,1,0,FALSE,,"Okanogan County, WA, USA",48.18146818,-120.3463549,322,,,,322,,open,,subalpine larch,Larix lyallii,subalpine larch,Plantae,69848
81955478,6/6/21,2021-06-06 17:28:19 UTC,Mountain Time (US & Canada),825808,Spencer Quayle,2021-06-07 00:20:16 UTC,2021-10-19 17:04:07 UTC,research,CC0,https://inaturalist-open-data.s3.amazonaws.com/photos/134463897/medium.jpg,,,2,0,FALSE,3,"Waterton Lakes National Park, Waterton Park, AB, CA",49.037525,-113.8010717,95,,,,95,,open,,subalpine larch,Larix lyallii,subalpine larch,Plantae,69848
83161729,10/28/19,2019-10-28 05:13:00 UTC,Taipei,1054732,Jacy Chen,2021-06-15 18:05:36 UTC,2023-09-05 19:28:56 UTC,research,CC-BY,https://inaturalist-open-data.s3.amazonaws.com/photos/136556340/medium.jpeg,,,1,0,FALSE,,,47.45938278,-120.9355638,,,,,,,open,,subalpine larch,Larix lyallii,subalpine larch,Plantae,69848
84143226,6/22/21,2021-06-23 02:11:33 UTC,Mountain Time (US & Canada),825808,Spencer Quayle,2021-06-23 04:08:05 UTC,2021-10-19 17:04:07 UTC,research,CC0,https://inaturalist-open-data.s3.amazonaws.com/photos/138265624/medium.jpg,,,1,0,FALSE,3,"Waterton Lakes National Park, Waterton Park, AB, CA",49.0838555,-114.0070583,7,,,,7,,open,,subalpine larch,Larix lyallii,subalpine larch,Plantae,69848
84563217,6/22/21,2021-06-22 21:07:28 UTC,Mountain Time (US & Canada),1781642,Caleb Catto,2021-06-26 15:48:11 UTC,2021-09-06 22:57:52 UTC,research,CC-BY,https://inaturalist-open-data.s3.amazonaws.com/photos/138998663/medium.jpg,,,1,0,FALSE,3,"Waterton Lakes National Park, Waterton Park, AB, CA",49.0227305,-114.0003889,4,,,,4,,open,,subalpine larch,Larix lyallii,subalpine larch,Plantae,69848
84777919,6/26/21,2021-06-26 17:41:33 UTC,Mountain Time (US & Canada),1287370,Carrie Voss,2021-06-27 22:57:26 UTC,2024-01-10 05:32:10 UTC,research,CC-BY-NC-SA,https://inaturalist-open-data.s3.amazonaws.com/photos/139378124/medium.jpeg,,,1,0,FALSE,2,"Flathead County, US-MT, US",48.77720574,-114.5895489,8,,,,8,,open,,subalpine larch,Larix lyallii,subalpine larch,Plantae,69848
85018058,6/29/21,2021-06-29 20:51:04 UTC,Mountain Time (US & Canada),4530648,,2021-06-29 20:51:07 UTC,2022-05-17 20:40:34 UTC,research,CC-BY-NC,https://inaturalist-open-data.s3.amazonaws.com/photos/139811870/medium.jpg,,Weird tree!,1,0,FALSE,3,"Bitterroot National Forest, Stevensville, MT, US",46.5034,-114.24282,5,,,,5,,open,,subalpine larch,Larix lyallii,subalpine larch,Plantae,69848
85684203,7/2/21,2021-07-02 17:22:00 UTC,Hawaii,275602,,2021-07-04 21:48:24 UTC,2023-09-24 18:07:38 UTC,research,CC-BY-NC,https://inaturalist-open-data.s3.amazonaws.com/photos/140972738/medium.jpeg,,,1,0,FALSE,,"Central Kootenay, BC, Canada",49.76138474,-117.2097004,257,,,,257,,open,,subalpine larch,Larix lyallii,subalpine larch,Plantae,69848
85710926,7/4/21,2021-07-04 21:05:28 UTC,Mountain Time (US & Canada),825808,Spencer Quayle,2021-07-05 01:31:11 UTC,2021-10-19 17:04:07 UTC,research,CC0,https://inaturalist-open-data.s3.amazonaws.com/photos/141069357/medium.jpg,,,1,0,FALSE,3,"Waterton Lakes National Park, Waterton Park, AB, CA",49.03138617,-113.9922467,7,,,,7,,open,,subalpine larch,Larix lyallii,subalpine larch,Plantae,69848
85792534,7/3/21,2021-07-03 17:32:00 UTC,Pacific Time (US & Canada),2944460,Matt Below,2021-07-05 17:33:16 UTC,2022-04-19 12:35:48 UTC,research,,https://static.inaturalist.org/photos/141216817/medium.jpeg,,,1,0,FALSE,,"Skagit County, WA, USA",48.54776912,-120.7308426,38,,,,38,,open,,subalpine larch,Larix lyallii,subalpine larch,Plantae,69848
86001893,7/6/21,2021-07-07 02:09:00 UTC,Mountain Time (US & Canada),4692431,,2021-07-07 05:10:53 UTC,2024-06-27 06:15:26 UTC,research,CC-BY-NC,https://inaturalist-open-data.s3.amazonaws.com/photos/141603562/medium.jpg,,,2,0,FALSE,3,"Banff National Park, Lake Louise, AB, CA",51.32536333,-116.2131283,10,,,,10,,open,,subalpine larch,Larix lyallii,subalpine larch,Plantae,69848
86175619,7/5/21,2021-07-06 00:11:28 UTC,Mountain Time (US & Canada),892855,,2021-07-08 16:31:47 UTC,2023-02-08 13:32:17 UTC,research,,https://static.inaturalist.org/photos/141919797/medium.jpg,,Found near top of St. Marys peak. Elevation suggests subalpine larch,1,0,FALSE,3,"Bitterroot National Forest, Stevensville, MT, US",46.51172,-114.2425533,6,,,,6,,open,,subalpine larch,Larix lyallii,subalpine larch,Plantae,69848
86360559,7/8/21,2021-07-08 19:35:32 UTC,Mountain Time (US & Canada),1658303,Paul Grieve,2021-07-10 02:48:06 UTC,2024-06-27 06:15:18 UTC,research,,https://static.inaturalist.org/photos/142257929/medium.jpg,,,2,0,FALSE,3,"Banff National Park, Banff, CA-AB-FN, CA-AB, CA",50.87932,-115.5898217,40,,,,40,,open,,subalpine larch,Larix lyallii,subalpine larch,Plantae,69848
86648315,7/11/21,2021-07-11 16:11:08 UTC,Mountain Time (US & Canada),4343127,Stephen Hunter,2021-07-11 23:49:16 UTC,2021-09-14 19:55:16 UTC,research,,https://static.inaturalist.org/photos/142778896/medium.jpeg,,,2,0,FALSE,2,"Kananaskis, AB T0L, Canada",50.5972448,-114.9884392,,,,,,,open,,subalpine larch,Larix lyallii,subalpine larch,Plantae,69848
86776455,7/11/21,2021-07-11 20:02:43 UTC,Pacific Time (US & Canada),286069,Nolan Exe,2021-07-12 21:31:44 UTC,2022-04-19 12:31:46 UTC,research,CC-BY,https://inaturalist-open-data.s3.amazonaws.com/photos/143011966/medium.jpeg,,,1,0,FALSE,2,"Winthrop, WA 98862, USA",48.55413997,-120.598156,,,,,,,open,gps,subalpine larch,Larix lyallii,subalpine larch,Plantae,69848
87159205,7/14/21,2021-07-14 19:11:04 UTC,Mountain Time (US & Canada),4420442,,2021-07-15 16:51:00 UTC,2021-07-15 20:00:09 UTC,research,CC-BY-NC,https://inaturalist-open-data.s3.amazonaws.com/photos/143653148/medium.jpg,,Seen at Goldie Lake on McKay Trail near Panorama BC,1,0,FALSE,3,"Invermere, BC, CA",50.42144854,-116.1805215,120,,,,120,,open,,subalpine larch,Larix lyallii,subalpine larch,Plantae,69848
87214868,7/15/21,2021-07-15 17:36:29 UTC,Mountain Time (US & Canada),1038881,,2021-07-16 00:51:17 UTC,2021-07-16 03:18:13 UTC,research,,https://static.inaturalist.org/photos/143753127/medium.jpg,,,1,0,FALSE,3,"Peter Lougheed, CA-AB-FN, CA-AB, CA",50.60337532,-114.9834644,8,,,,8,,open,,subalpine larch,Larix lyallii,subalpine larch,Plantae,69848
87297525,7/13/21,2021-07-13 13:02:53 UTC,Mountain Time (US & Canada),1781642,Caleb Catto,2021-07-16 18:10:02 UTC,2024-06-27 06:15:11 UTC,research,CC-BY,https://inaturalist-open-data.s3.amazonaws.com/photos/143904838/medium.jpg,,,1,0,FALSE,3,"Banff National Park, Lake Louise, AB, CA",51.420455,-116.239145,4,,,,4,,open,,subalpine larch,Larix lyallii,subalpine larch,Plantae,69848
87301605,7/13/21,2021-07-13 13:50:47 UTC,Mountain Time (US & Canada),1781642,Caleb Catto,2021-07-16 18:44:20 UTC,2024-06-27 06:15:03 UTC,research,CC-BY,https://inaturalist-open-data.s3.amazonaws.com/photos/143913032/medium.jpg,,,1,0,FALSE,3,"Banff National Park, Lake Louise, AB, CA",51.421525,-116.2494967,4,,,,4,,open,,subalpine larch,Larix lyallii,subalpine larch,Plantae,69848
87314627,7/6/21,2021-07-06 17:37:00 UTC,Mountain Time (US & Canada),614085,Mike Andersen,2021-07-16 20:43:07 UTC,2021-12-18 22:18:37 UTC,research,CC-BY-NC-ND,https://inaturalist-open-data.s3.amazonaws.com/photos/143937766/medium.jpg,,I presume this is Larix lyallii based on elevation.,1,0,FALSE,,"Glacier County, MT, USA",48.71239722,-113.6528028,4,,,,4,,open,,subalpine larch,Larix lyallii,subalpine larch,Plantae,69848
87314699,7/14/21,2021-07-14 12:42:19 UTC,Mountain Time (US & Canada),1781642,Caleb Catto,2021-07-16 20:43:36 UTC,2024-06-27 06:14:58 UTC,research,CC-BY,https://inaturalist-open-data.s3.amazonaws.com/photos/143938011/medium.jpg,,,1,0,FALSE,3,"Banff National Park, Lake Louise, AB, CA",51.32666333,-116.2038283,4,,,,4,,open,,subalpine larch,Larix lyallii,subalpine larch,Plantae,69848
87474772,7/17/21,2021-07-17 17:04:41 UTC,Mountain Time (US & Canada),825808,Spencer Quayle,2021-07-17 23:12:59 UTC,2021-10-19 17:04:07 UTC,research,CC0,https://inaturalist-open-data.s3.amazonaws.com/photos/144225131/medium.jpg,,,1,0,FALSE,3,"Waterton Park, AB, CA",49.01467222,-114.0624555,4,,,,4,,open,,subalpine larch,Larix lyallii,subalpine larch,Plantae,69848
87795464,8/23/15,2015-08-23 20:57:00 UTC,Pacific Time (US & Canada),825722,FreckLes,2021-07-20 00:57:59 UTC,2021-09-14 17:13:18 UTC,research,CC-BY-NC,https://inaturalist-open-data.s3.amazonaws.com/photos/144784700/medium.jpeg,,,1,0,FALSE,,"Central Kootenay, BC, Canada",49.76223711,-117.2052269,1066,,,,1066,,open,,subalpine larch,Larix lyallii,subalpine larch,Plantae,69848
87795467,8/23/15,2015-08-23 23:08:00 UTC,Pacific Time (US & Canada),825722,FreckLes,2021-07-20 00:58:00 UTC,2021-09-14 17:12:33 UTC,research,CC-BY-NC,https://inaturalist-open-data.s3.amazonaws.com/photos/144785360/medium.jpeg,,,1,0,FALSE,,"Central Kootenay, BC, Canada",49.76223711,-117.2052269,1066,,,,1066,,open,,subalpine larch,Larix lyallii,subalpine larch,Plantae,69848
87945308,7/12/21,2021-07-12 20:07:34 UTC,Pacific Time (US & Canada),1641019,Shane Johnson,2021-07-21 03:00:02 UTC,2023-07-08 05:23:30 UTC,research,CC0,https://inaturalist-open-data.s3.amazonaws.com/photos/145050745/medium.jpeg,,,1,0,FALSE,2,"Okanagan-Similkameen, CA-BC, CA",49.07405501,-120.1944105,7,,,,7,,open,,subalpine larch,Larix lyallii,subalpine larch,Plantae,69848
87981134,7/12/21,2021-07-12 22:23:31 UTC,Pacific Time (US & Canada),1641019,Shane Johnson,2021-07-21 12:40:42 UTC,2023-07-08 05:06:15 UTC,research,CC0,https://inaturalist-open-data.s3.amazonaws.com/photos/145112646/medium.jpeg,,,1,0,FALSE,2,"Okanagan-Similkameen, CA-BC, CA",49.06787527,-120.2187652,9,,,,9,,open,,subalpine larch,Larix lyallii,subalpine larch,Plantae,69848
87982383,7/13/21,2021-07-13 14:33:41 UTC,Pacific Time (US & Canada),1641019,Shane Johnson,2021-07-21 12:55:14 UTC,2023-07-08 05:10:29 UTC,research,CC0,https://inaturalist-open-data.s3.amazonaws.com/photos/145114767/medium.jpeg,,,1,0,FALSE,2,"Okanagan-Similkameen, CA-BC, CA",49.0612884,-120.2002302,8,,,,8,,open,,subalpine larch,Larix lyallii,subalpine larch,Plantae,69848
88196247,7/22/21,2021-07-23 00:05:54 UTC,Mountain Time (US & Canada),1117168,,2021-07-23 00:06:57 UTC,2021-11-23 01:59:43 UTC,research,CC-BY-NC,https://inaturalist-open-data.s3.amazonaws.com/photos/146728174/medium.jpeg,,,2,0,FALSE,2,"Pincher Creek No. 9, AB, Canada",49.357975,-114.2624056,,,,,,,open,gps,subalpine larch,Larix lyallii,subalpine larch,Plantae,69848
88307782,7/10/21,2021-07-10 22:37:00 UTC,Pacific Time (US & Canada),515751,Brian Starzomski,2021-07-23 21:02:51 UTC,2021-09-14 15:48:45 UTC,research,CC0,https://inaturalist-open-data.s3.amazonaws.com/photos/145679392/medium.jpeg,,,1,0,FALSE,,"East Kootenay, British Columbia, Canada",50.10701389,-114.7780694,6,,,,6,,open,,subalpine larch,Larix lyallii,subalpine larch,Plantae,69848
88307784,7/10/21,2021-07-10 22:37:00 UTC,Pacific Time (US & Canada),515751,Brian Starzomski,2021-07-23 21:02:51 UTC,2021-09-14 15:47:25 UTC,research,CC0,https://inaturalist-open-data.s3.amazonaws.com/photos/145679491/medium.jpeg,,,1,0,FALSE,,"East Kootenay, British Columbia, Canada",50.10696389,-114.7779778,18,,,,18,,open,,subalpine larch,Larix lyallii,subalpine larch,Plantae,69848
88307791,7/10/21,2021-07-10 22:34:00 UTC,Pacific Time (US & Canada),515751,Brian Starzomski,2021-07-23 21:02:52 UTC,2021-09-14 15:45:15 UTC,research,CC0,https://inaturalist-open-data.s3.amazonaws.com/photos/145679778/medium.jpeg,,,1,0,FALSE,,"East Kootenay, British Columbia, Canada",50.10693333,-114.7780222,7,,,,7,,open,,subalpine larch,Larix lyallii,subalpine larch,Plantae,69848
88313320,7/10/21,2021-07-10 22:43:00 UTC,Pacific Time (US & Canada),515751,Brian Starzomski,2021-07-23 21:55:02 UTC,2021-07-24 15:25:56 UTC,research,CC0,https://inaturalist-open-data.s3.amazonaws.com/photos/145688568/medium.jpeg,,,1,0,FALSE,,"East Kootenay, BC, Canada",50.10692222,-114.7785417,44,,,,44,,open,,subalpine larch,Larix lyallii,subalpine larch,Plantae,69848
88313327,7/10/21,2021-07-10 22:42:00 UTC,Pacific Time (US & Canada),515751,Brian Starzomski,2021-07-23 21:55:04 UTC,2021-07-24 15:25:44 UTC,research,CC0,https://inaturalist-open-data.s3.amazonaws.com/photos/145688759/medium.jpeg,,,1,0,FALSE,,"East Kootenay, BC, Canada",50.10696389,-114.7784278,6,,,,6,,open,,subalpine larch,Larix lyallii,subalpine larch,Plantae,69848
88313336,7/10/21,2021-07-10 22:40:00 UTC,Pacific Time (US & Canada),515751,Brian Starzomski,2021-07-23 21:55:06 UTC,2021-07-24 15:25:01 UTC,research,CC0,https://inaturalist-open-data.s3.amazonaws.com/photos/145688922/medium.jpeg,,,1,0,FALSE,,"East Kootenay, BC, Canada",50.10696389,-114.7782444,8,,,,8,,open,,subalpine larch,Larix lyallii,subalpine larch,Plantae,69848
88313343,7/10/21,2021-07-10 22:40:00 UTC,Pacific Time (US & Canada),515751,Brian Starzomski,2021-07-23 21:55:10 UTC,2021-07-24 15:24:58 UTC,research,CC0,https://inaturalist-open-data.s3.amazonaws.com/photos/145688941/medium.jpeg,,,1,0,FALSE,,"East Kootenay, British Columbia, Canada",50.10694167,-114.778175,18,,,,18,,open,,subalpine larch,Larix lyallii,subalpine larch,Plantae,69848
88313358,7/10/21,2021-07-10 22:38:00 UTC,Pacific Time (US & Canada),515751,Brian Starzomski,2021-07-23 21:55:22 UTC,2021-07-24 15:24:42 UTC,research,CC0,https://inaturalist-open-data.s3.amazonaws.com/photos/145689173/medium.jpeg,,,1,0,FALSE,,"East Kootenay, BC, Canada",50.10697222,-114.7781444,4,,,,4,,open,,subalpine larch,Larix lyallii,subalpine larch,Plantae,69848
88313362,7/10/21,2021-07-10 22:38:00 UTC,Pacific Time (US & Canada),515751,Brian Starzomski,2021-07-23 21:55:24 UTC,2021-07-24 15:24:37 UTC,research,CC0,https://inaturalist-open-data.s3.amazonaws.com/photos/145689272/medium.jpeg,,,1,0,FALSE,,"East Kootenay, BC, Canada",50.10699444,-114.7781222,10,,,,10,,open,,subalpine larch,Larix lyallii,subalpine larch,Plantae,69848
88404406,7/23/21,2021-07-24 01:32:22 UTC,Pacific Time (US & Canada),3299937,,2021-07-24 16:05:25 UTC,2023-09-01 20:13:05 UTC,research,CC-BY-NC,https://inaturalist-open-data.s3.amazonaws.com/photos/145855581/medium.jpeg,,,1,0,FALSE,333,Leavenworth,47.60050201,-121.0416946,11229,,,,11229,,open,,subalpine larch,Larix lyallii,subalpine larch,Plantae,69848
88418506,7/10/21,2021-07-10 16:13:00 UTC,Pacific Time (US & Canada),459348,John D Reynolds,2021-07-24 17:37:43 UTC,2023-03-23 21:25:58 UTC,research,CC-BY,https://inaturalist-open-data.s3.amazonaws.com/photos/145856430/medium.jpg,"2021, BC, Canada, Kootenays","Banner Long Ridge, Elk Valley, Kootenays, BC, Canada",1,0,FALSE,,"East Kootenay, British Columbia, Canada",50.01788056,-114.7557139,4,,,,4,,open,,subalpine larch,Larix lyallii,subalpine larch,Plantae,69848
88418516,7/10/21,2021-07-10 18:07:00 UTC,Pacific Time (US & Canada),459348,John D Reynolds,2021-07-24 17:37:44 UTC,2023-03-23 21:25:58 UTC,research,CC-BY,https://inaturalist-open-data.s3.amazonaws.com/photos/145856469/medium.jpg,"2021, BC, Canada, Kootenays","Banner Long Ridge, Elk Valley, Kootenays, BC, Canada",1,0,FALSE,,"East Kootenay, British Columbia, Canada",50.01818056,-114.7556833,4,,,,4,,open,,subalpine larch,Larix lyallii,subalpine larch,Plantae,69848
88418517,7/10/21,2021-07-10 18:08:00 UTC,Pacific Time (US & Canada),459348,John D Reynolds,2021-07-24 17:37:45 UTC,2023-03-23 21:25:58 UTC,research,CC-BY,https://inaturalist-open-data.s3.amazonaws.com/photos/145856570/medium.jpg,"2021, BC, Canada, Kootenays","Banner Long Ridge, Elk Valley, Kootenays, BC, Canada",1,0,FALSE,,"East Kootenay, British Columbia, Canada",50.01818056,-114.7557972,4,,,,4,,open,,subalpine larch,Larix lyallii,subalpine larch,Plantae,69848
88418526,7/10/21,2021-07-10 18:36:00 UTC,Pacific Time (US & Canada),459348,John D Reynolds,2021-07-24 17:37:45 UTC,2023-03-23 21:25:58 UTC,research,CC-BY,https://inaturalist-open-data.s3.amazonaws.com/photos/145856637/medium.jpg,"2021, BC, Canada, Kootenays","Banner Long Ridge, Elk Valley, Kootenays, BC, Canada",1,0,FALSE,,"East Kootenay, British Columbia, Canada",50.01826389,-114.7571417,4,,,,4,,open,,subalpine larch,Larix lyallii,subalpine larch,Plantae,69848
88418527,7/10/21,2021-07-10 20:30:00 UTC,Pacific Time (US & Canada),459348,John D Reynolds,2021-07-24 17:37:45 UTC,2023-03-23 21:25:58 UTC,research,CC-BY,https://inaturalist-open-data.s3.amazonaws.com/photos/145856732/medium.jpg,"2021, BC, Canada, Kootenays","Banner Long Ridge, Elk Valley, Kootenays, BC, Canada",1,0,FALSE,,"East Kootenay, British Columbia, Canada",50.01905,-114.7597806,4,,,,4,,open,,subalpine larch,Larix lyallii,subalpine larch,Plantae,69848
89069486,7/15/21,2021-07-15 18:18:40 UTC,Pacific Time (US & Canada),693721,Lindsey Salmonson,2021-07-29 15:26:00 UTC,2023-06-21 00:54:48 UTC,research,CC-BY,https://inaturalist-open-data.s3.amazonaws.com/photos/147042891/medium.jpg,,,2,0,FALSE,3,"Okanogan County, US-WA, US",48.96435987,-119.7916084,5,,,,5,,open,,subalpine larch,Larix lyallii,subalpine larch,Plantae,69848
89255955,7/30/21,2021-07-30 15:50:52 UTC,Mountain Time (US & Canada),2395431,,2021-07-30 23:14:11 UTC,2024-06-27 06:14:55 UTC,research,CC-BY-NC,https://inaturalist-open-data.s3.amazonaws.com/photos/147374911/medium.jpg,,,1,0,FALSE,3,"Banff National Park, Lake Louise, AB, CA",51.326725,-116.2055667,4,,,,4,,open,,subalpine larch,Larix lyallii,subalpine larch,Plantae,69848
89635919,7/31/21,2021-07-31 20:09:15 UTC,Mountain Time (US & Canada),825808,Spencer Quayle,2021-08-02 14:00:52 UTC,2021-10-19 17:04:07 UTC,research,CC0,https://inaturalist-open-data.s3.amazonaws.com/photos/148045703/medium.jpg,,,1,0,FALSE,3,Canada,49.19971682,-114.0741251,22,,,,26582,obscured,open,,subalpine larch,Larix lyallii,subalpine larch,Plantae,69848
89666149,7/10/21,2021-07-10 20:00:00 UTC,Pacific Time (US & Canada),459348,John D Reynolds,2021-08-02 17:38:39 UTC,2023-03-23 21:25:58 UTC,research,CC-BY,https://inaturalist-open-data.s3.amazonaws.com/photos/148091923/medium.jpg,"2021, BC, Canada, Kootenays, plant","Banner Long Ridge, Elk Valley, Kootenays, BC, Canada",1,0,FALSE,,"East Kootenay, British Columbia, Canada",50.01763,-114.759725,,,,,,,open,,subalpine larch,Larix lyallii,subalpine larch,Plantae,69848
89909229,8/3/21,2021-08-03 18:58:40 UTC,Mountain Time (US & Canada),1527919,,2021-08-04 14:42:15 UTC,2024-06-27 06:14:48 UTC,research,CC-BY-NC,https://inaturalist-open-data.s3.amazonaws.com/photos/148523911/medium.jpg,,,1,0,FALSE,3,"Banff National Park, Banff, AB, CA",51.13234717,-115.8026417,4,,,,4,,open,,subalpine larch,Larix lyallii,subalpine larch,Plantae,69848
90162060,8/2/21,2021-08-02 23:13:57 UTC,Mountain Time (US & Canada),1781642,Caleb Catto,2021-08-06 17:07:37 UTC,2021-09-03 17:08:10 UTC,research,CC-BY,https://inaturalist-open-data.s3.amazonaws.com/photos/148978945/medium.jpg,,,1,0,FALSE,3,"Yoho National Park, Field, BC, CA",51.34218667,-116.3120283,4,,,,4,,open,,subalpine larch,Larix lyallii,subalpine larch,Plantae,69848
90400149,7/11/21,2021-07-11 19:49:00 UTC,Pacific Time (US & Canada),459348,John D Reynolds,2021-08-08 15:19:03 UTC,2023-03-23 21:25:58 UTC,research,CC-BY,https://inaturalist-open-data.s3.amazonaws.com/photos/149395918/medium.jpg,"2021, BC, Canada, Kootenays","Brownie, Elk Valley, Kootenays, BC, Canada",1,0,FALSE,,"East Kootenay, British Columbia, Canada",49.99668611,-114.7524722,4,,,,4,,open,,subalpine larch,Larix lyallii,subalpine larch,Plantae,69848
90400152,7/11/21,2021-07-11 22:29:00 UTC,Pacific Time (US & Canada),459348,John D Reynolds,2021-08-08 15:19:03 UTC,2023-03-23 21:25:58 UTC,research,CC-BY,https://inaturalist-open-data.s3.amazonaws.com/photos/149395944/medium.jpg,"2021, BC, Canada, Kootenays","Castle Mountain, Elk Valley, BC, Canada",1,0,FALSE,,"East Kootenay, British Columbia, Canada",50.15994167,-114.8263028,4,,,,4,,open,,subalpine larch,Larix lyallii,subalpine larch,Plantae,69848
90400154,7/11/21,2021-07-11 19:51:00 UTC,Pacific Time (US & Canada),459348,John D Reynolds,2021-08-08 15:19:04 UTC,2023-03-23 21:25:58 UTC,research,CC-BY,https://inaturalist-open-data.s3.amazonaws.com/photos/149395966/medium.jpg,"2021, BC, Canada, Kootenays","Brownie, Elk Valley, Kootenays, BC, Canada",1,0,FALSE,,"East Kootenay, British Columbia, Canada",49.99694722,-114.751975,5,,,,5,,open,,subalpine larch,Larix lyallii,subalpine larch,Plantae,69848
90400157,7/11/21,2021-07-11 19:51:00 UTC,Pacific Time (US & Canada),459348,John D Reynolds,2021-08-08 15:19:04 UTC,2023-03-23 21:25:58 UTC,research,CC-BY,https://inaturalist-open-data.s3.amazonaws.com/photos/149395996/medium.jpg,"2021, BC, Canada, Kootenays","Brownie, Elk Valley, Kootenays, BC, Canada",1,0,FALSE,,"East Kootenay, British Columbia, Canada",49.99694167,-114.7519611,8,,,,8,,open,,subalpine larch,Larix lyallii,subalpine larch,Plantae,69848
90400159,7/11/21,2021-07-11 22:29:00 UTC,Pacific Time (US & Canada),459348,John D Reynolds,2021-08-08 15:19:05 UTC,2023-03-23 21:25:58 UTC,research,CC-BY,https://inaturalist-open-data.s3.amazonaws.com/photos/149396012/medium.jpg,"2021, BC, Canada, Kootenays","Castle Mountain, Elk Valley, BC, Canada",1,0,FALSE,,"East Kootenay, British Columbia, Canada",50.15995,-114.826325,4,,,,4,,open,,subalpine larch,Larix lyallii,subalpine larch,Plantae,69848
90578382,8/6/21,2021-08-06 17:32:40 UTC,Mountain Time (US & Canada),3151007,,2021-08-09 20:25:42 UTC,2021-09-14 14:06:33 UTC,research,CC-BY-NC,https://inaturalist-open-data.s3.amazonaws.com/photos/149715242/medium.jpg,,,2,0,FALSE,3,"Mount Assiniboine, CA-BC-EK, CA-BC, CA",50.93369053,-115.7184197,6,,,,6,,open,,subalpine larch,Larix lyallii,subalpine larch,Plantae,69848
91207107,7/12/21,2021-07-12 18:44:00 UTC,Pacific Time (US & Canada),459348,John D Reynolds,2021-08-15 02:06:01 UTC,2023-03-23 21:25:58 UTC,research,CC-BY,https://inaturalist-open-data.s3.amazonaws.com/photos/150822128/medium.jpg,"2021, BC, Canada, Kootenays","Green Hills repeater station, Elk Valley, Kootenays, BC, Canada",1,0,FALSE,,"East Kootenay, British Columbia, Canada",50.19986667,-114.9379667,4,,,,4,,open,,subalpine larch,Larix lyallii,subalpine larch,Plantae,69848
91207108,7/12/21,2021-07-12 18:59:00 UTC,Pacific Time (US & Canada),459348,John D Reynolds,2021-08-15 02:06:03 UTC,2023-03-23 21:25:58 UTC,research,CC-BY,https://inaturalist-open-data.s3.amazonaws.com/photos/150822146/medium.jpg,"2021, BC, Canada, Kootenays","Green Hills repeater station, Elk Valley, Kootenays, BC, Canada",1,0,FALSE,,"East Kootenay, British Columbia, Canada",50.20032778,-114.9376,4,,,,4,,open,,subalpine larch,Larix lyallii,subalpine larch,Plantae,69848
91207109,7/12/21,2021-07-12 19:20:00 UTC,Pacific Time (US & Canada),459348,John D Reynolds,2021-08-15 02:06:03 UTC,2023-03-23 21:25:58 UTC,research,CC-BY,https://inaturalist-open-data.s3.amazonaws.com/photos/150822164/medium.jpg,"2021, BC, Canada, Kootenays","Green Hills repeater station, Elk Valley, Kootenays, BC, Canada",1,0,FALSE,,"East Kootenay, British Columbia, Canada",50.20065,-114.9372417,4,,,,4,,open,,subalpine larch,Larix lyallii,subalpine larch,Plantae,69848
91207111,7/12/21,2021-07-12 19:17:00 UTC,Pacific Time (US & Canada),459348,John D Reynolds,2021-08-15 02:06:03 UTC,2023-03-23 21:25:58 UTC,research,CC-BY,https://inaturalist-open-data.s3.amazonaws.com/photos/150822194/medium.jpg,"2021, BC, Canada, Kootenays","Green Hills repeater station, Elk Valley, Kootenays, BC, Canada",1,0,FALSE,,"East Kootenay, British Columbia, Canada",50.20049167,-114.9372111,4,,,,4,,open,,subalpine larch,Larix lyallii,subalpine larch,Plantae,69848
91207113,7/12/21,2021-07-12 19:23:00 UTC,Pacific Time (US & Canada),459348,John D Reynolds,2021-08-15 02:06:04 UTC,2023-03-23 21:25:58 UTC,research,CC-BY,https://inaturalist-open-data.s3.amazonaws.com/photos/150822207/medium.jpg,"2021, BC, Canada, Kootenays","Green Hills repeater station, Elk Valley, Kootenays, BC, Canada",1,0,FALSE,,"East Kootenay, British Columbia, Canada",50.20051667,-114.9369417,4,,,,4,,open,,subalpine larch,Larix lyallii,subalpine larch,Plantae,69848
91319716,8/6/21,2021-08-07 01:05:16 UTC,Pacific Time (US & Canada),4870864,Ellie Place,2021-08-15 20:38:56 UTC,2023-01-06 04:59:12 UTC,research,,https://static.inaturalist.org/photos/151029769/medium.jpg,,,3,1,FALSE,3,"Okanogan-Wenatchee National Forest, Leavenworth, WA, US",47.48323,-120.79615,5,,,,5,,open,,subalpine larch,Larix lyallii,subalpine larch,Plantae,69848
92199956,8/21/21,2021-08-21 20:24:22 UTC,Pacific Time (US & Canada),3448676,,2021-08-23 03:55:43 UTC,2023-08-18 05:22:04 UTC,research,CC-BY-NC,https://inaturalist-open-data.s3.amazonaws.com/photos/152624420/medium.jpg,,,2,0,FALSE,3,"Okanogan-Wenatchee National Forest, Leavenworth, WA, US",48.12756383,-120.8141467,4,,,,4,,open,,subalpine larch,Larix lyallii,subalpine larch,Plantae,69848
92320971,7/18/21,2021-07-18 15:03:00 UTC,Pacific Time (US & Canada),134551,Ryan Durand,2021-08-24 04:02:09 UTC,2023-04-23 21:43:37 UTC,research,CC-BY-NC,https://inaturalist-open-data.s3.amazonaws.com/photos/152845844/medium.jpeg,,,1,0,FALSE,,"Central Kootenay, BC, Canada",49.67236667,-117.0473111,5,,,,5,,open,,subalpine larch,Larix lyallii,subalpine larch,Plantae,69848
92509962,8/25/21,2021-08-25 19:14:18 UTC,Eastern Time (US & Canada),2225959,Katia Forgues,2021-08-25 21:28:07 UTC,2021-09-14 19:55:32 UTC,research,,https://static.inaturalist.org/photos/153184725/medium.jpeg,,,2,0,FALSE,2,"Division No. 3, CA-AB, CA",49.35898679,-114.2607638,4,,,,4,,open,,subalpine larch,Larix lyallii,subalpine larch,Plantae,69848
92866991,8/25/21,2021-08-25 16:28:51 UTC,Pacific Time (US & Canada),996342,Christine Hahn Vertical,2021-08-29 03:40:40 UTC,2022-07-20 03:50:03 UTC,research,,https://static.inaturalist.org/photos/153832027/medium.jpg,,,1,0,FALSE,3,"Okanogan County, US-WA, US",48.88195377,-120.763039,14,,,,14,,open,,subalpine larch,Larix lyallii,subalpine larch,Plantae,69848
92866999,8/25/21,2021-08-25 16:29:15 UTC,Pacific Time (US & Canada),996342,Christine Hahn Vertical,2021-08-29 03:40:51 UTC,2022-05-08 03:24:16 UTC,research,,https://static.inaturalist.org/photos/153832046/medium.jpg,,,1,0,FALSE,3,"Okanogan County, US-WA, US",48.88195396,-120.7630706,10,,,,10,,open,,subalpine larch,Larix lyallii,subalpine larch,Plantae,69848
93132976,8/23/10,2010-08-23 08:08:00 UTC,Paris,4660910,Martin A. Prinz,2021-08-31 09:41:42 UTC,2024-06-27 06:14:45 UTC,research,CC-BY-NC,https://inaturalist-open-data.s3.amazonaws.com/photos/154314904/medium.jpg,,,1,0,FALSE,,"Improvement District No. 9, AB T0L, Kanada",51.32657622,-116.2043138,15,,,,15,,open,,subalpine larch,Larix lyallii,subalpine larch,Plantae,69848
93225480,8/28/21,2021-08-28 17:27:00 UTC,UTC,4327716,,2021-09-01 03:54:39 UTC,2022-04-19 12:09:40 UTC,research,CC-BY-NC,https://inaturalist-open-data.s3.amazonaws.com/photos/154480483/medium.jpg,,,1,0,FALSE,,"Skagit County, WA, USA",48.57202495,-120.8444916,75,,,,75,,open,,subalpine larch,Larix lyallii,subalpine larch,Plantae,69848
93276694,9/25/16,2016-09-25 09:58:00 UTC,UTC,504345,,2021-09-01 17:44:52 UTC,2024-06-27 06:14:41 UTC,research,,https://static.inaturalist.org/photos/154570150/medium.jpeg,,,1,0,FALSE,,"Improvement District No. 9, AB T0L, Canada",51.33953788,-116.2330489,3507,,,,3507,,open,,subalpine larch,Larix lyallii,subalpine larch,Plantae,69848
93802350,9/3/21,2021-09-03 16:22:28 UTC,Pacific Time (US & Canada),1285263,,2021-09-06 00:41:41 UTC,2021-09-14 14:13:22 UTC,research,CC0,https://inaturalist-open-data.s3.amazonaws.com/photos/155516304/medium.jpg,,,1,0,FALSE,3,"Bugaboo Provincial Park, Spillimacheen, BC, CA",50.73913667,-116.7694083,4,,,,4,,open,,subalpine larch,Larix lyallii,subalpine larch,Plantae,69848
93802385,9/3/21,2021-09-03 16:22:02 UTC,Pacific Time (US & Canada),1285263,,2021-09-06 00:42:00 UTC,2021-09-14 14:07:54 UTC,research,CC0,https://inaturalist-open-data.s3.amazonaws.com/photos/155516377/medium.jpg,,,1,0,FALSE,3,"Bugaboo Provincial Park, Spillimacheen, BC, CA",50.739105,-116.7694167,5,,,,5,,open,,subalpine larch,Larix lyallii,subalpine larch,Plantae,69848
93910026,7/10/21,2021-07-10 18:17:00 UTC,Pacific Time (US & Canada),515751,Brian Starzomski,2021-09-06 20:37:18 UTC,2021-09-14 14:05:13 UTC,research,CC0,https://inaturalist-open-data.s3.amazonaws.com/photos/155703536/medium.jpeg,,,1,0,FALSE,,"East Kootenay, British Columbia, Canada",50.215824,-114.860054,,,,,,,open,,subalpine larch,Larix lyallii,subalpine larch,Plantae,69848
93918732,9/5/21,2021-09-05 19:42:24 UTC,Mountain Time (US & Canada),4591979,,2021-09-06 21:36:01 UTC,2023-02-08 13:29:47 UTC,research,CC-BY-NC,https://inaturalist-open-data.s3.amazonaws.com/photos/155726168/medium.jpg,,"Larch at Lake of the Isles, Anaconda Pintler, Montana",2,0,FALSE,3,"Deer Lodge County, US-MT, US",46.07234335,-113.1887908,5,,,,5,,open,,subalpine larch,Larix lyallii,subalpine larch,Plantae,69848
94237305,9/8/21,2021-09-08 18:45:00 UTC,Mountain Time (US & Canada),4321824,,2021-09-09 18:04:02 UTC,2021-09-09 19:06:51 UTC,research,CC-BY-NC,https://inaturalist-open-data.s3.amazonaws.com/photos/156298807/medium.jpg,,,1,0,FALSE,,"Ruby Ridge, Waterton Lakes National Park of Canada, Alberta 5, Waterton Park, AB, Canada",49.08423258,-114.0059309,110,,,,110,,open,,subalpine larch,Larix lyallii,subalpine larch,Plantae,69848
94488818,7/31/21,2021-08-01 00:16:23 UTC,Pacific Time (US & Canada),3162861,Isla Francis,2021-09-11 20:44:34 UTC,2024-06-27 06:14:38 UTC,research,,https://static.inaturalist.org/photos/156745857/medium.jpg,,,1,0,FALSE,3,"Banff National Park, Banff, AB, CA",51.0456195,-115.7571417,4,,,,4,,open,,subalpine larch,Larix lyallii,subalpine larch,Plantae,69848
94743592,7/12/21,2021-07-12 17:11:00 UTC,Pacific Time (US & Canada),515751,Brian Starzomski,2021-09-13 19:39:59 UTC,2021-09-13 20:43:08 UTC,research,CC0,https://inaturalist-open-data.s3.amazonaws.com/photos/157195203/medium.jpeg,,,1,0,FALSE,,"East Kootenay, BC, Canada",50.01688889,-114.7626889,12,,,,12,,open,,subalpine larch,Larix lyallii,subalpine larch,Plantae,69848
94743594,7/12/21,2021-07-12 17:10:00 UTC,Pacific Time (US & Canada),515751,Brian Starzomski,2021-09-13 19:39:59 UTC,2021-09-13 20:43:00 UTC,research,CC0,https://inaturalist-open-data.s3.amazonaws.com/photos/157195127/medium.jpeg,,,1,0,FALSE,,"East Kootenay, British Columbia, Canada",50.01689444,-114.7626889,4,,,,4,,open,,subalpine larch,Larix lyallii,subalpine larch,Plantae,69848
94743610,7/12/21,2021-07-12 17:12:00 UTC,Pacific Time (US & Canada),515751,Brian Starzomski,2021-09-13 19:40:02 UTC,2021-09-13 20:42:46 UTC,research,CC0,https://inaturalist-open-data.s3.amazonaws.com/photos/157195342/medium.jpeg,,,1,0,FALSE,,"East Kootenay, British Columbia, Canada",50.01691944,-114.7625583,7,,,,7,,open,,subalpine larch,Larix lyallii,subalpine larch,Plantae,69848
94743612,7/12/21,2021-07-12 17:12:00 UTC,Pacific Time (US & Canada),515751,Brian Starzomski,2021-09-13 19:40:03 UTC,2021-09-13 20:42:14 UTC,research,CC0,https://inaturalist-open-data.s3.amazonaws.com/photos/157195360/medium.jpeg,,,1,0,FALSE,,"East Kootenay, British Columbia, Canada",50.01690556,-114.7625194,17,,,,17,,open,,subalpine larch,Larix lyallii,subalpine larch,Plantae,69848
94743613,7/12/21,2021-07-12 17:12:00 UTC,Pacific Time (US & Canada),515751,Brian Starzomski,2021-09-13 19:40:03 UTC,2021-09-13 20:42:10 UTC,research,CC0,https://inaturalist-open-data.s3.amazonaws.com/photos/157195371/medium.jpeg,,,1,0,FALSE,,"East Kootenay, BC, Canada",50.016925,-114.7625583,8,,,,8,,open,,subalpine larch,Larix lyallii,subalpine larch,Plantae,69848
94743636,7/12/21,2021-07-12 17:15:00 UTC,Pacific Time (US & Canada),515751,Brian Starzomski,2021-09-13 19:40:13 UTC,2021-09-13 20:41:20 UTC,research,CC0,https://inaturalist-open-data.s3.amazonaws.com/photos/157195806/medium.jpeg,,,1,0,FALSE,,"East Kootenay, BC, Canada",50.01699722,-114.7623528,4,,,,4,,open,,subalpine larch,Larix lyallii,subalpine larch,Plantae,69848
94743646,7/12/21,2021-07-12 17:17:00 UTC,Pacific Time (US & Canada),515751,Brian Starzomski,2021-09-13 19:40:15 UTC,2021-09-13 20:40:23 UTC,research,CC0,https://inaturalist-open-data.s3.amazonaws.com/photos/157195971/medium.jpeg,,,1,0,FALSE,,"East Kootenay, BC, Canada",50.01693333,-114.7626194,73,,,,73,,open,,subalpine larch,Larix lyallii,subalpine larch,Plantae,69848
94743656,7/12/21,2021-07-12 17:19:00 UTC,Pacific Time (US & Canada),515751,Brian Starzomski,2021-09-13 19:40:18 UTC,2021-09-13 20:40:06 UTC,research,CC0,https://inaturalist-open-data.s3.amazonaws.com/photos/157196239/medium.jpeg,,,1,0,FALSE,,"East Kootenay, BC, Canada",50.01700556,-114.7623667,4,,,,4,,open,,subalpine larch,Larix lyallii,subalpine larch,Plantae,69848
94743668,7/12/21,2021-07-12 17:24:00 UTC,Pacific Time (US & Canada),515751,Brian Starzomski,2021-09-13 19:40:22 UTC,2021-09-13 20:40:36 UTC,research,CC0,https://inaturalist-open-data.s3.amazonaws.com/photos/157196469/medium.jpeg,,,1,0,FALSE,,"East Kootenay, British Columbia, Canada",50.01688056,-114.7626417,5,,,,5,,open,,subalpine larch,Larix lyallii,subalpine larch,Plantae,69848
94748543,9/12/21,2021-09-12 22:52:21 UTC,Pacific Time (US & Canada),1544976,Gino,2021-09-13 20:25:44 UTC,2022-04-19 12:10:43 UTC,research,CC-BY-NC,https://inaturalist-open-data.s3.amazonaws.com/photos/157210991/medium.jpeg,,,1,0,FALSE,2,"Skagit County, US-WA, US",48.5100064,-120.7661405,4,,,,4,,open,,subalpine larch,Larix lyallii,subalpine larch,Plantae,69848
94766339,7/12/21,2021-07-12 17:46:00 UTC,Pacific Time (US & Canada),515751,Brian Starzomski,2021-09-13 23:20:06 UTC,2021-09-14 15:32:39 UTC,research,CC0,https://inaturalist-open-data.s3.amazonaws.com/photos/157231045/medium.jpeg,,,1,0,FALSE,,"East Kootenay, British Columbia, Canada",50.0169,-114.7635333,6,,,,6,,open,,subalpine larch,Larix lyallii,subalpine larch,Plantae,69848
94766341,7/12/21,2021-07-12 17:46:00 UTC,Pacific Time (US & Canada),515751,Brian Starzomski,2021-09-13 23:20:06 UTC,2021-09-14 14:03:59 UTC,research,CC0,https://inaturalist-open-data.s3.amazonaws.com/photos/157231092/medium.jpeg,,,1,0,FALSE,,"East Kootenay, British Columbia, Canada",50.01688333,-114.763625,4,,,,4,,open,,subalpine larch,Larix lyallii,subalpine larch,Plantae,69848
94766344,7/12/21,2021-07-12 17:48:00 UTC,Pacific Time (US & Canada),515751,Brian Starzomski,2021-09-13 23:20:07 UTC,2021-09-14 14:02:02 UTC,research,CC0,https://inaturalist-open-data.s3.amazonaws.com/photos/157231197/medium.jpeg,,,1,0,FALSE,,"East Kootenay, BC, Canada",50.01681389,-114.7641056,5,,,,5,,open,,subalpine larch,Larix lyallii,subalpine larch,Plantae,69848
94766350,7/12/21,2021-07-12 17:49:00 UTC,Pacific Time (US & Canada),515751,Brian Starzomski,2021-09-13 23:20:09 UTC,2021-09-14 03:59:32 UTC,research,CC0,https://inaturalist-open-data.s3.amazonaws.com/photos/157231344/medium.jpeg,,,1,0,FALSE,,"East Kootenay, BC, Canada",50.0168,-114.7641222,4,,,,4,,open,,subalpine larch,Larix lyallii,subalpine larch,Plantae,69848
94766354,7/12/21,2021-07-12 17:49:00 UTC,Pacific Time (US & Canada),515751,Brian Starzomski,2021-09-13 23:20:10 UTC,2021-09-14 03:59:29 UTC,research,CC0,https://inaturalist-open-data.s3.amazonaws.com/photos/157231419/medium.jpeg,,,1,0,FALSE,,"East Kootenay, BC, Canada",50.01678889,-114.7641611,4,,,,4,,open,,subalpine larch,Larix lyallii,subalpine larch,Plantae,69848
94766365,7/12/21,2021-07-12 17:50:00 UTC,Pacific Time (US & Canada),515751,Brian Starzomski,2021-09-13 23:20:14 UTC,2021-09-14 15:30:55 UTC,research,CC0,https://inaturalist-open-data.s3.amazonaws.com/photos/157231661/medium.jpeg,,,1,0,FALSE,,"East Kootenay, BC, Canada",50.01677778,-114.7642139,4,,,,4,,open,,subalpine larch,Larix lyallii,subalpine larch,Plantae,69848
94766372,7/12/21,2021-07-12 17:53:00 UTC,Pacific Time (US & Canada),515751,Brian Starzomski,2021-09-13 23:20:16 UTC,2021-09-14 15:30:53 UTC,research,CC0,https://inaturalist-open-data.s3.amazonaws.com/photos/157232132/medium.jpeg,,,1,0,FALSE,,"East Kootenay, British Columbia, Canada",50.01676667,-114.7642833,4,,,,4,,open,,subalpine larch,Larix lyallii,subalpine larch,Plantae,69848
94766376,7/12/21,2021-07-12 17:57:00 UTC,Pacific Time (US & Canada),515751,Brian Starzomski,2021-09-13 23:20:17 UTC,2021-09-14 15:44:08 UTC,research,CC0,https://inaturalist-open-data.s3.amazonaws.com/photos/157232192/medium.jpeg,,,1,0,FALSE,,"East Kootenay, British Columbia, Canada",50.01673056,-114.7642889,40,,,,40,,open,,subalpine larch,Larix lyallii,subalpine larch,Plantae,69848
94766402,7/12/21,2021-07-12 18:11:00 UTC,Pacific Time (US & Canada),515751,Brian Starzomski,2021-09-13 23:20:23 UTC,2021-09-14 03:56:30 UTC,research,CC0,https://inaturalist-open-data.s3.amazonaws.com/photos/157233248/medium.jpeg,,,1,0,FALSE,,"East Kootenay, BC, Canada",50.01665833,-114.7646556,13,,,,13,,open,,subalpine larch,Larix lyallii,subalpine larch,Plantae,69848
94766403,7/12/21,2021-07-12 18:11:00 UTC,Pacific Time (US & Canada),515751,Brian Starzomski,2021-09-13 23:20:24 UTC,2021-09-14 03:56:29 UTC,research,CC0,https://inaturalist-open-data.s3.amazonaws.com/photos/157233271/medium.jpeg,,,1,0,FALSE,,"East Kootenay, BC, Canada",50.01666944,-114.7646778,7,,,,7,,open,,subalpine larch,Larix lyallii,subalpine larch,Plantae,69848
94831587,9/14/21,2021-09-14 14:35:39 UTC,UTC,4274663,Scott Walmsley,2021-09-14 15:52:41 UTC,2024-06-27 06:14:33 UTC,research,,https://static.inaturalist.org/photos/157356282/medium.jpeg,,,2,0,FALSE,2,"Lake Agnes Trail View Point, Lake Agnes Trail, AB T0L, Canada",51.41748095,-116.2390621,3,,,,3,,open,,subalpine larch,Larix lyallii,subalpine larch,Plantae,69848
94880359,7/12/21,2021-07-12 16:54:00 UTC,Pacific Time (US & Canada),515751,Brian Starzomski,2021-09-14 23:40:44 UTC,2021-09-14 23:51:28 UTC,research,CC0,https://inaturalist-open-data.s3.amazonaws.com/photos/157441236/medium.jpeg,,,1,0,FALSE,,"East Kootenay, BC, Canada",50.009083,-114.748894,,,,,,,open,,subalpine larch,Larix lyallii,subalpine larch,Plantae,69848
94883559,7/12/21,2021-07-12 17:20:00 UTC,Pacific Time (US & Canada),515751,Brian Starzomski,2021-09-15 00:27:20 UTC,2021-09-17 18:05:35 UTC,research,CC0,https://inaturalist-open-data.s3.amazonaws.com/photos/157448641/medium.jpeg,,,1,0,FALSE,,"East Kootenay, BC, Canada",50.016983,-114.76236,,,,,,,open,,subalpine larch,Larix lyallii,subalpine larch,Plantae,69848
94883560,7/12/21,2021-07-12 17:16:00 UTC,Pacific Time (US & Canada),515751,Brian Starzomski,2021-09-15 00:27:21 UTC,2021-09-17 18:05:34 UTC,research,CC0,https://inaturalist-open-data.s3.amazonaws.com/photos/157448661/medium.jpeg,,,1,0,FALSE,,"East Kootenay, British Columbia, Canada",50.016983,-114.76236,,,,,,,open,,subalpine larch,Larix lyallii,subalpine larch,Plantae,69848
94883561,7/12/21,2021-07-12 17:18:00 UTC,Pacific Time (US & Canada),515751,Brian Starzomski,2021-09-15 00:27:21 UTC,2021-09-17 18:05:33 UTC,research,CC0,https://inaturalist-open-data.s3.amazonaws.com/photos/157448670/medium.jpeg,,,1,0,FALSE,,"East Kootenay, British Columbia, Canada",50.016983,-114.76236,,,,,,,open,,subalpine larch,Larix lyallii,subalpine larch,Plantae,69848
94883563,7/12/21,2021-07-12 17:16:00 UTC,Pacific Time (US & Canada),515751,Brian Starzomski,2021-09-15 00:27:22 UTC,2021-09-17 18:05:32 UTC,research,CC0,https://inaturalist-open-data.s3.amazonaws.com/photos/157448679/medium.jpeg,,,1,0,FALSE,,"East Kootenay, British Columbia, Canada",50.016983,-114.76236,,,,,,,open,,subalpine larch,Larix lyallii,subalpine larch,Plantae,69848
94883564,7/12/21,2021-07-12 17:16:00 UTC,Pacific Time (US & Canada),515751,Brian Starzomski,2021-09-15 00:27:22 UTC,2021-09-17 18:05:31 UTC,research,CC0,https://inaturalist-open-data.s3.amazonaws.com/photos/157448691/medium.jpeg,,,1,0,FALSE,,"East Kootenay, BC, Canada",50.016983,-114.76236,,,,,,,open,,subalpine larch,Larix lyallii,subalpine larch,Plantae,69848
94883575,7/12/21,2021-07-12 17:09:00 UTC,Pacific Time (US & Canada),515751,Brian Starzomski,2021-09-15 00:27:24 UTC,2021-09-17 18:05:24 UTC,research,CC0,https://inaturalist-open-data.s3.amazonaws.com/photos/157448788/medium.jpeg,,,1,0,FALSE,,"East Kootenay, British Columbia, Canada",50.016884,-114.762589,,,,,,,open,,subalpine larch,Larix lyallii,subalpine larch,Plantae,69848
94883577,7/12/21,2021-07-12 17:08:00 UTC,Pacific Time (US & Canada),515751,Brian Starzomski,2021-09-15 00:27:24 UTC,2021-09-17 18:05:21 UTC,research,CC0,https://inaturalist-open-data.s3.amazonaws.com/photos/157448814/medium.jpeg,,,1,0,FALSE,,"East Kootenay, British Columbia, Canada",50.016884,-114.762589,,,,,,,open,,subalpine larch,Larix lyallii,subalpine larch,Plantae,69848
95008574,7/18/21,2021-07-18 06:43:00 UTC,UTC,777397,,2021-09-16 05:54:07 UTC,2023-07-08 06:25:13 UTC,research,CC-BY,https://inaturalist-open-data.s3.amazonaws.com/photos/157671764/medium.jpeg,,,2,0,FALSE,,"East Kootenay, BC, Canada",50.90521111,-115.6409694,15,,,,15,,open,,subalpine larch,Larix lyallii,subalpine larch,Plantae,69848
95076925,7/12/21,2021-07-12 21:00:00 UTC,Pacific Time (US & Canada),515751,Brian Starzomski,2021-09-16 20:49:07 UTC,2021-09-17 14:57:52 UTC,research,CC0,https://inaturalist-open-data.s3.amazonaws.com/photos/157794258/medium.jpeg,,,1,0,FALSE,,"East Kootenay, British Columbia, Canada",50.037994,-114.780022,,,,,,,open,,subalpine larch,Larix lyallii,subalpine larch,Plantae,69848
95076929,7/12/21,2021-07-12 21:00:00 UTC,Pacific Time (US & Canada),515751,Brian Starzomski,2021-09-16 20:49:08 UTC,2021-09-17 14:57:51 UTC,research,CC0,https://inaturalist-open-data.s3.amazonaws.com/photos/157794301/medium.jpeg,,,1,0,FALSE,,"East Kootenay, British Columbia, Canada",50.037994,-114.780022,,,,,,,open,,subalpine larch,Larix lyallii,subalpine larch,Plantae,69848
95084399,7/12/21,2021-07-12 21:29:00 UTC,Pacific Time (US & Canada),515751,Brian Starzomski,2021-09-16 22:07:27 UTC,2021-09-17 12:36:22 UTC,research,CC0,https://inaturalist-open-data.s3.amazonaws.com/photos/157808982/medium.jpeg,,,1,0,FALSE,,"East Kootenay, British Columbia, Canada",50.038841,-114.780441,,,,,,,open,,subalpine larch,Larix lyallii,subalpine larch,Plantae,69848
95107482,9/14/21,2021-09-14 22:05:48 UTC,Mountain Time (US & Canada),1791402,dugald,2021-09-17 02:42:29 UTC,2023-06-13 15:03:30 UTC,research,CC0,https://inaturalist-open-data.s3.amazonaws.com/photos/157853115/medium.jpg,,,2,0,FALSE,3,"Peter Lougheed, CA-AB-FN, CA-AB, CA",50.8057419,-115.293086,16,,,,16,,open,,subalpine larch,Larix lyallii,subalpine larch,Plantae,69848
95186296,9/17/21,2021-09-17 17:24:18 UTC,Mountain Time (US & Canada),1658303,Paul Grieve,2021-09-17 20:25:51 UTC,2024-06-27 06:14:24 UTC,research,,https://static.inaturalist.org/photos/157991577/medium.jpg,,,2,0,FALSE,3,"Banff National Park, Lake Louise, AB, CA",51.32881667,-116.2164383,6,,,,6,,open,,subalpine larch,Larix lyallii,subalpine larch,Plantae,69848
95209709,9/14/21,2021-09-14 14:35:50 UTC,Pacific Time (US & Canada),315891,Jessica,2021-09-18 00:04:06 UTC,2024-06-27 06:14:20 UTC,research,CC-BY-NC,https://inaturalist-open-data.s3.amazonaws.com/photos/158033863/medium.jpeg,,,1,0,FALSE,2,"Lake Agnes Trail View Point, Lake Agnes Trail, AB T0L, Canada",51.41742222,-116.2390833,,,,,,,open,gps,subalpine larch,Larix lyallii,subalpine larch,Plantae,69848
95224192,9/11/21,2021-09-11 16:35:00 UTC,Mountain Time (US & Canada),232932,Sydney Gerig,2021-09-18 02:57:07 UTC,2024-06-27 06:14:10 UTC,research,CC-BY-NC,https://inaturalist-open-data.s3.amazonaws.com/photos/158053910/medium.jpg,,,2,0,FALSE,,"Larch Valley Trail - Banff NP, AB",51.328606,-116.197699,334,,,,334,,open,manual,subalpine larch,Larix lyallii,subalpine larch,Plantae,69848
95224210,9/11/21,2021-09-11 17:04:00 UTC,Mountain Time (US & Canada),232932,Sydney Gerig,2021-09-18 02:57:12 UTC,2024-06-27 06:12:44 UTC,research,CC-BY-NC,https://inaturalist-open-data.s3.amazonaws.com/photos/158054080/medium.jpg,,,2,0,FALSE,,"Larch Valley Trail - Banff NP, AB",51.326444,-116.20748,364,,,,364,,open,manual,subalpine larch,Larix lyallii,subalpine larch,Plantae,69848
95224261,9/11/21,2021-09-11 20:40:00 UTC,Mountain Time (US & Canada),232932,Sydney Gerig,2021-09-18 02:57:34 UTC,2024-06-27 06:12:36 UTC,research,CC-BY-NC,https://inaturalist-open-data.s3.amazonaws.com/photos/158054619/medium.jpg,,,2,0,FALSE,,"Larch Valley Trail - Banff NP, AB",51.328944,-116.21687,478,,,,478,,open,,subalpine larch,Larix lyallii,subalpine larch,Plantae,69848
95347016,9/18/21,2021-09-18 21:32:01 UTC,Pacific Time (US & Canada),350245,Mark Robinson,2021-09-19 01:29:27 UTC,2022-05-06 22:47:14 UTC,research,CC-BY-NC,https://inaturalist-open-data.s3.amazonaws.com/photos/158277800/medium.jpg,,,1,0,FALSE,3,"Okanogan - Wenatchee National Forest, Mazama, WA, US",48.54291167,-120.6791617,6,,,,6,,open,,subalpine larch,Larix lyallii,subalpine larch,Plantae,69848
95466488,9/18/21,2021-09-18 18:22:44 UTC,UTC,2680405,Alex Niese,2021-09-19 22:29:10 UTC,2021-09-25 18:55:48 UTC,research,,https://static.inaturalist.org/photos/158491046/medium.jpeg,,,1,0,FALSE,2,"Millarville, AB T0L 1K0, Canada",50.5976156,-114.9677756,,,,,,,open,gps,subalpine larch,Larix lyallii,subalpine larch,Plantae,69848
95478004,9/19/21,2021-09-19 20:27:17 UTC,Mountain Time (US & Canada),4303527,,2021-09-20 00:06:03 UTC,2024-06-27 06:12:31 UTC,research,CC-BY-NC,https://inaturalist-open-data.s3.amazonaws.com/photos/158511442/medium.jpeg,,,1,0,FALSE,2,"Banff National Park, Banff, CA-AB-FN, CA-AB, CA",51.1400868,-115.7862668,6,,,,6,,open,,subalpine larch,Larix lyallii,subalpine larch,Plantae,69848
95720994,9/21/21,2021-09-21 21:31:22 UTC,Pacific Time (US & Canada),4742353,,2021-09-22 02:01:23 UTC,2024-05-08 00:16:21 UTC,research,CC-BY-NC,https://inaturalist-open-data.s3.amazonaws.com/photos/158943114/medium.jpeg,,,3,1,FALSE,333,"Chelan County, US-WA, US",48.50751877,-120.7667694,4,,,,4,,open,,subalpine larch,Larix lyallii,subalpine larch,Plantae,69848
95820660,9/22/21,2021-09-22 19:30:00 UTC,Mountain Time (US & Canada),4530648,,2021-09-23 02:20:21 UTC,2021-09-24 23:02:04 UTC,research,CC-BY-NC,https://inaturalist-open-data.s3.amazonaws.com/photos/159120447/medium.jpg,,,1,0,FALSE,3,"Bitterroot National Forest, Darby, MT, US",45.88267167,-114.2763217,5,,,,5,,open,,subalpine larch,Larix lyallii,subalpine larch,Plantae,69848
96084791,9/24/21,2021-09-24 20:05:55 UTC,Mountain Time (US & Canada),1448507,Jenny Feick,2021-09-25 14:24:30 UTC,2024-06-27 06:12:27 UTC,research,CC-BY-NC,https://inaturalist-open-data.s3.amazonaws.com/photos/159584801/medium.jpg,,,1,0,FALSE,3,"Banff National Park, Banff, AB, CA",51.232495,-116.0041583,4,,,,4,,open,,subalpine larch,Larix lyallii,subalpine larch,Plantae,69848
96124556,9/25/21,2021-09-25 16:27:07 UTC,America/Edmonton,3970847,,2021-09-25 19:16:01 UTC,2021-11-30 08:06:27 UTC,research,CC-BY-NC,https://inaturalist-open-data.s3.amazonaws.com/photos/159652438/medium.jpeg,,,3,0,FALSE,333,"Peter Lougheed, CA-AB-FN, CA-AB, CA",50.59479523,-115.1477127,10,,,,10,,open,,subalpine larch,Larix lyallii,subalpine larch,Plantae,69848
96171588,9/25/21,2021-09-25 20:29:02 UTC,Mountain Time (US & Canada),2476609,Ian Adams,2021-09-26 01:29:50 UTC,2021-10-10 01:02:09 UTC,research,CC-BY,https://inaturalist-open-data.s3.amazonaws.com/photos/159737492/medium.jpeg,,Old vet just hangin' on!,2,0,FALSE,2,Jumbo Pass trail,50.35556675,-116.6113728,,,,,,,open,gps,subalpine larch,Larix lyallii,subalpine larch,Plantae,69848
96173225,9/25/21,2021-09-25 18:21:28 UTC,Mountain Time (US & Canada),2476609,Ian Adams,2021-09-26 01:46:12 UTC,2021-10-10 01:01:25 UTC,research,CC-BY,https://inaturalist-open-data.s3.amazonaws.com/photos/159740625/medium.jpeg,,Very large burl,2,0,FALSE,2,Jumbo Pass Trail,50.35559926,-116.6131658,,,,,,,open,gps,subalpine larch,Larix lyallii,subalpine larch,Plantae,69848
96179812,9/25/21,2021-09-25 18:45:54 UTC,Pacific Time (US & Canada),3114887,Jack Robert Thomas,2021-09-26 02:59:49 UTC,2024-05-08 00:16:10 UTC,research,,https://static.inaturalist.org/photos/159753258/medium.jpeg,,,2,1,FALSE,2,Hart's Pass Campground,48.72054075,-120.6697941,1435,,,,1435,,open,gps,subalpine larch,Larix lyallii,subalpine larch,Plantae,69848
96184999,9/25/21,2021-09-25 21:14:48 UTC,Pacific Time (US & Canada),36788,David Robichaud,2021-09-26 04:03:56 UTC,2023-01-02 19:13:38 UTC,research,CC-BY-NC,https://inaturalist-open-data.s3.amazonaws.com/photos/159762968/medium.jpg,,,1,0,FALSE,3,"Okanogan - Wenatchee National Forest, Stehekin, WA, US",48.50734667,-120.6731117,5,,,,5,,open,,subalpine larch,Larix lyallii,subalpine larch,Plantae,69848
96185019,9/25/21,2021-09-25 17:46:51 UTC,Pacific Time (US & Canada),36788,David Robichaud,2021-09-26 04:04:23 UTC,2023-01-02 19:13:36 UTC,research,CC-BY-NC,https://inaturalist-open-data.s3.amazonaws.com/photos/159763043/medium.jpg,,,1,0,FALSE,3,"Okanogan - Wenatchee National Forest, Stehekin, WA, US",48.51308833,-120.6658167,5,,,,5,,open,,subalpine larch,Larix lyallii,subalpine larch,Plantae,69848
96185096,9/24/21,2021-09-24 21:23:12 UTC,Pacific Time (US & Canada),36788,David Robichaud,2021-09-26 04:05:29 UTC,2023-01-02 19:13:31 UTC,research,CC-BY-NC,https://inaturalist-open-data.s3.amazonaws.com/photos/159763212/medium.jpg,,,1,0,FALSE,3,"North Cascades National Park, Stehekin, WA, US",48.49962,-120.7612617,5,,,,5,,open,,subalpine larch,Larix lyallii,subalpine larch,Plantae,69848
96262966,9/25/21,2021-09-25 17:33:11 UTC,Mountain Time (US & Canada),4987260,Gavin Qu,2021-09-26 18:40:34 UTC,2024-06-27 06:12:24 UTC,research,,https://static.inaturalist.org/photos/159898484/medium.jpg,,,1,0,FALSE,3,"Banff National Park, Lake Louise, AB, CA",51.41553265,-116.2376996,372,,,,372,,open,,subalpine larch,Larix lyallii,subalpine larch,Plantae,69848
96286976,9/26/21,2021-09-26 18:13:44 UTC,Mountain Time (US & Canada),3493234,,2021-09-26 21:23:56 UTC,2024-06-27 06:12:20 UTC,research,CC-BY-NC,https://inaturalist-open-data.s3.amazonaws.com/photos/159940437/medium.jpg,,,1,0,FALSE,3,"Banff National Park, Banff, CA-AB-FN, CA-AB, CA",51.09456956,-115.855511,8,,,,8,,open,,subalpine larch,Larix lyallii,subalpine larch,Plantae,69848
96332109,9/26/21,2021-09-26 21:46:00 UTC,Mountain Time (US & Canada),449500,Blake Weis,2021-09-27 04:30:00 UTC,2021-09-27 05:39:19 UTC,research,CC-BY-NC,https://inaturalist-open-data.s3.amazonaws.com/photos/160023353/medium.jpg,,,1,0,FALSE,,"Kananaskis, AB T0L, Canada",50.82044165,-115.3698474,180,,,,180,,open,,subalpine larch,Larix lyallii,subalpine larch,Plantae,69848
96332704,9/26/21,2021-09-26 19:16:54 UTC,UTC,3601329,,2021-09-27 04:40:58 UTC,2024-06-27 06:12:16 UTC,research,CC-BY-NC,https://inaturalist-open-data.s3.amazonaws.com/photos/160025742/medium.jpeg,,,1,0,FALSE,2,"Improvement District No. 9, AB T0L, Canada",51.329897,-116.21796,,,,,,,open,gps,subalpine larch,Larix lyallii,subalpine larch,Plantae,69848
96403539,9/25/21,2021-09-25 09:39:00 UTC,UTC,777397,,2021-09-27 20:35:22 UTC,2023-07-08 06:14:09 UTC,research,CC-BY,https://inaturalist-open-data.s3.amazonaws.com/photos/160150619/medium.jpeg,,,1,0,FALSE,,"Fraser Valley, BC, Canada",49.02783889,-120.8321,10,,,,10,,open,,subalpine larch,Larix lyallii,subalpine larch,Plantae,69848
96444981,8/25/21,2021-08-25 21:03:00 UTC,Pacific Time (US & Canada),1601123,Adrian de Groot,2021-09-28 04:25:05 UTC,2021-10-26 20:35:08 UTC,research,CC-BY-NC,https://inaturalist-open-data.s3.amazonaws.com/photos/160228739/medium.jpeg,,,1,0,FALSE,,,,,5,,,,26454,private,open,,Subalpine Larch,Larix lyallii,subalpine larch,Plantae,69848
96680252,9/29/21,2021-09-29 16:41:41 UTC,Mountain Time (US & Canada),1658303,Paul Grieve,2021-09-30 13:25:04 UTC,2024-06-27 06:12:12 UTC,research,,https://static.inaturalist.org/photos/160651921/medium.jpg,,,1,0,FALSE,3,"Banff National Park, Banff, AB, CA",51.11005283,-115.751725,4,,,,4,,open,,subalpine larch,Larix lyallii,subalpine larch,Plantae,69848
96690229,9/29/21,2021-09-29 18:22:10 UTC,Mountain Time (US & Canada),785779,Matt Wallace,2021-09-30 15:31:06 UTC,2021-10-15 17:23:34 UTC,research,,https://static.inaturalist.org/photos/160668672/medium.jpeg,,,1,0,FALSE,2,"Exshaw, AB T0L 2C0, Canada",50.760445,-115.3313117,,,,,,,open,gps,subalpine larch,Larix lyallii,subalpine larch,Plantae,69848
96726460,9/25/21,2021-09-25 21:07:38 UTC,Pacific Time (US & Canada),5064061,Matt Huston,2021-09-30 21:19:51 UTC,2022-12-31 05:11:11 UTC,research,,https://static.inaturalist.org/photos/160735925/medium.jpeg,,,1,0,FALSE,333,Mazama,48.63274002,-120.4035797,,,,,,,open,,subalpine larch,Larix lyallii,subalpine larch,Plantae,69848
96815412,9/24/21,2021-09-24 19:07:00 UTC,Mountain Time (US & Canada),457523,Tony Wood,2021-10-01 19:28:22 UTC,2024-06-27 06:12:09 UTC,research,CC0,https://inaturalist-open-data.s3.amazonaws.com/photos/160893916/medium.jpg,,,1,0,FALSE,,"Improvement District No. 9, AB T0L, Canada",51.3558434,-116.2302322,,,,,,,open,,subalpine larch,Larix lyallii,subalpine larch,Plantae,69848
96861166,10/1/21,2021-10-01 20:12:44 UTC,Pacific Time (US & Canada),2611942,,2021-10-02 05:00:31 UTC,2022-12-31 05:08:49 UTC,research,CC-BY-NC,https://inaturalist-open-data.s3.amazonaws.com/photos/160978945/medium.jpg,,,1,0,FALSE,3,"Okanogan - Wenatchee National Forest, Marblemount, WA, US",48.51607832,-120.7623852,7010,,,,7010,,open,,subalpine larch,Larix lyallii,subalpine larch,Plantae,69848
96924104,9/23/21,2021-09-23 17:45:00 UTC,Pacific Time (US & Canada),103699,Mary Sanseverino,2021-10-02 18:52:30 UTC,2021-10-03 13:34:16 UTC,research,CC-BY-NC,https://inaturalist-open-data.s3.amazonaws.com/photos/161088617/medium.jpg,,,1,0,FALSE,,"East Kootenay, BC, Canada",50.37730833,-116.2118917,4,,,,4,,open,,subalpine larch,Larix lyallii,subalpine larch,Plantae,69848
96949900,10/1/21,2021-10-01 18:04:00 UTC,Central Time (US & Canada),21884,Mike Merchant,2021-10-02 22:16:29 UTC,2024-05-08 00:16:00 UTC,research,CC-BY-NC,https://inaturalist-open-data.s3.amazonaws.com/photos/161130387/medium.jpeg,,"Near tree line on Maple Pass Trail, North Cascades.  
",2,0,FALSE,,"Chelan County, WA, USA",48.49963056,-120.7612611,4,,,,4,,open,,subalpine larch,Larix lyallii,subalpine larch,Plantae,69848
97104026,10/2/21,2021-10-02 23:17:27 UTC,Pacific Time (US & Canada),3448676,,2021-10-04 02:19:13 UTC,2022-05-06 22:46:55 UTC,research,CC-BY-NC,https://inaturalist-open-data.s3.amazonaws.com/photos/161421894/medium.jpg,,this years growth densely tomatose ,1,0,FALSE,3,"Okanogan - Wenatchee National Forest, Leavenworth, WA, US",48.05645283,-120.7337633,6,,,,6,,open,,subalpine larch,Larix lyallii,subalpine larch,Plantae,69848
97150926,10/2/21,2021-10-02 16:44:00 UTC,Pacific Time (US & Canada),1657037,Christopher J. Earle,2021-10-04 15:37:10 UTC,2021-10-05 15:59:08 UTC,research,CC-BY-NC,https://inaturalist-open-data.s3.amazonaws.com/photos/161510056/medium.jpg,"Autumn-color, Forest, in-habitat, whole-plant","Tree 31m tall, one of the tallest I've seen here (laser height), DBH approx. 50 cm.",1,0,FALSE,,"Chelan, Washington, United States",48.51152086,-120.6672621,,,,,,,open,,subalpine larch,Larix lyallii,subalpine larch,Plantae,69848
97150927,10/2/21,2021-10-02 16:41:00 UTC,Pacific Time (US & Canada),1657037,Christopher J. Earle,2021-10-04 15:37:10 UTC,2021-10-05 15:58:36 UTC,research,CC-BY-NC,https://inaturalist-open-data.s3.amazonaws.com/photos/161510037/medium.jpg,"Autumn-color, Forest, in-habitat, whole-plant","An alpine larch that was bent over, probably by a snow load, and now has multiple leaders. This species has a propensity for independent apical dominance as well as ready epicormic branching, so many trees have multiple leaders and irregular crowns.",1,0,FALSE,,"Chelan, Washington, United States",48.51220661,-120.6660109,,,,,,,open,,subalpine larch,Larix lyallii,subalpine larch,Plantae,69848
97150929,10/2/21,2021-10-02 16:52:00 UTC,Pacific Time (US & Canada),1657037,Christopher J. Earle,2021-10-04 15:37:11 UTC,2021-10-05 15:58:02 UTC,research,CC-BY-NC,https://inaturalist-open-data.s3.amazonaws.com/photos/161510093/medium.jpg,"bark, in-habitat","Exceptionally large burl on a large mature larch; bag shown is approx. 30 cm wide, 20 cm tall.",1,0,FALSE,,"Chelan, Washington, United States",48.50976205,-120.6697114,,,,,,,open,,subalpine larch,Larix lyallii,subalpine larch,Plantae,69848
97150935,10/2/21,2021-10-02 17:29:00 UTC,Pacific Time (US & Canada),1657037,Christopher J. Earle,2021-10-04 15:37:13 UTC,2021-10-05 15:55:32 UTC,research,CC-BY-NC,https://inaturalist-open-data.s3.amazonaws.com/photos/161510168/medium.jpg,"Autumn-color, Forest, Landscape, Mountain-Cascades, in-habitat, whole-plant",Larch forest featuring two large trees with multiple tops and lots of epicormic branches,1,0,FALSE,,"Chelan, Washington, United States",48.50854409,-120.6676081,,,,,,,open,,subalpine larch,Larix lyallii,subalpine larch,Plantae,69848
97150938,10/2/21,2021-10-02 17:18:00 UTC,Pacific Time (US & Canada),1657037,Christopher J. Earle,2021-10-04 15:37:14 UTC,2022-12-31 05:03:08 UTC,research,CC-BY-NC,https://inaturalist-open-data.s3.amazonaws.com/photos/161510991/medium.jpg,"Autumn-color, foliage, in-habitat, seedling, whole-plant","Seedlings of larch and subalpine fir, growing in a patch of Cassiope",1,0,FALSE,,"Chelan County, WA, USA",48.50758849,-120.6690522,,,,,,,open,,subalpine larch,Larix lyallii,subalpine larch,Plantae,69848
97157121,10/3/21,2021-10-03 23:04:49 UTC,Pacific Time (US & Canada),244027,,2021-10-04 16:40:37 UTC,2024-05-17 20:03:52 UTC,research,CC-BY-NC,https://inaturalist-open-data.s3.amazonaws.com/photos/161522953/medium.jpg,,,4,0,FALSE,3,"Chelan County, US-WA, US",48.50804939,-120.672261,4,,,,4,,open,,subalpine larch,Larix lyallii,subalpine larch,Plantae,69848
97213423,10/3/21,2021-10-03 19:35:24 UTC,Pacific Time (US & Canada),1955525,Yanik Nill,2021-10-05 03:26:03 UTC,2021-10-05 03:30:15 UTC,research,CC-BY-NC,https://inaturalist-open-data.s3.amazonaws.com/photos/161631964/medium.jpeg,,,1,0,FALSE,2,"Manning Park, BC V0X 1R0, Canada",49.01043915,-120.8350272,16,,,,16,,open,gps,subalpine larch,Larix lyallii,subalpine larch,Plantae,69848
97213490,10/3/21,2021-10-03 21:07:57 UTC,Pacific Time (US & Canada),1955525,Yanik Nill,2021-10-05 03:27:13 UTC,2021-10-05 03:30:01 UTC,research,CC-BY-NC,https://inaturalist-open-data.s3.amazonaws.com/photos/161632113/medium.jpeg,,,1,0,FALSE,2,"Manning Park, BC V0X 1R0, Canada",49.01169199,-120.8323018,15,,,,15,,open,gps,subalpine larch,Larix lyallii,subalpine larch,Plantae,69848
97214827,10/3/21,2021-10-03 18:00:00 UTC,UTC,1945923,Matthew Koons,2021-10-05 03:51:24 UTC,2022-04-24 14:26:28 UTC,research,CC-BY-ND,https://inaturalist-open-data.s3.amazonaws.com/photos/161620796/medium.jpeg,,,2,0,FALSE,,"Chelan County, WA, USA",47.44951098,-120.924198,15,,,,15,,open,,subalpine larch,Larix lyallii,subalpine larch,Plantae,69848
97218483,10/4/21,2021-10-04 18:41:37 UTC,Pacific Time (US & Canada),313852,Kate Pfeilschiefter,2021-10-05 04:50:59 UTC,2022-04-19 12:23:21 UTC,research,CC-BY-NC,https://inaturalist-open-data.s3.amazonaws.com/photos/161641718/medium.jpg,,,2,0,FALSE,3,"Okanogan - Wenatchee National Forest, Leavenworth, WA, US",47.46368,-120.9448,13,,,,13,,open,,subalpine larch,Larix lyallii,subalpine larch,Plantae,69848
97218674,10/3/21,2021-10-03 19:18:52 UTC,Pacific Time (US & Canada),313852,Kate Pfeilschiefter,2021-10-05 04:54:23 UTC,2022-04-22 00:00:04 UTC,research,CC-BY-NC,https://inaturalist-open-data.s3.amazonaws.com/photos/161642041/medium.jpg,,,1,0,FALSE,3,"Okanogan - Wenatchee National Forest, Cle Elum, WA, US",47.45933,-120.9354467,4,,,,4,,open,,subalpine larch,Larix lyallii,subalpine larch,Plantae,69848
97222957,10/2/21,2021-10-02 19:48:47 UTC,Pacific Time (US & Canada),112785,Sam Herniman,2021-10-05 06:33:15 UTC,2022-01-08 22:16:35 UTC,research,CC0,https://inaturalist-open-data.s3.amazonaws.com/photos/161650024/medium.jpg,,,1,0,FALSE,3,"E.C. Manning Provincial Park, East Gate, BC, CA",49.02457191,-120.8295051,695,,,,695,,open,,subalpine larch,Larix lyallii,subalpine larch,Plantae,69848
97248289,9/26/21,2021-09-26 19:32:41 UTC,Pacific Time (US & Canada),2608877,,2021-10-05 15:01:29 UTC,2021-10-13 14:45:02 UTC,research,,https://static.inaturalist.org/photos/161696985/medium.jpg,,,1,0,FALSE,3,"E.C. Manning Provincial Park, East Gate, BC, CA",49.01517778,-120.8324883,16,,,,16,,open,,subalpine larch,Larix lyallii,subalpine larch,Plantae,69848
97318818,10/4/21,2021-10-04 19:43:00 UTC,Pacific Time (US & Canada),238247,John Leszczynski,2021-10-06 04:32:47 UTC,2021-10-08 02:34:18 UTC,research,CC-BY,https://inaturalist-open-data.s3.amazonaws.com/photos/161830202/medium.jpg,"Alpine Lake Wilderness, United States of America, Washington",,1,0,FALSE,,"Chelan County, WA, USA",47.45924667,-120.9351317,,,,,,,open,,subalpine larch,Larix lyallii,subalpine larch,Plantae,69848
97467128,10/5/21,2021-10-05 20:04:00 UTC,Mountain Time (US & Canada),1517762,Devoncox,2021-10-07 18:13:33 UTC,2022-04-19 12:21:14 UTC,research,CC-BY-NC,https://inaturalist-open-data.s3.amazonaws.com/photos/162102755/medium.jpeg,,,1,0,FALSE,,"Chelan County, WA, USA",48.50957027,-120.6710838,61,,,,61,,open,,subalpine larch,Larix lyallii,subalpine larch,Plantae,69848
97677208,9/24/21,2021-09-24 19:59:00 UTC,Pacific Time (US & Canada),103699,Mary Sanseverino,2021-10-09 18:38:30 UTC,2024-06-27 06:12:06 UTC,research,CC-BY-NC,https://inaturalist-open-data.s3.amazonaws.com/photos/162481592/medium.jpg,,"A stand at the NW corner of Arnica Lake, Banff NP. ",1,0,FALSE,,"Banff National Park, Banff, Division No. 15, Alberta, Canada",51.2242486,-115.9974316,4,,,,4,,open,,subalpine larch,Larix lyallii,subalpine larch,Plantae,69848
97677209,9/24/21,2021-09-24 20:22:00 UTC,Pacific Time (US & Canada),103699,Mary Sanseverino,2021-10-09 18:38:31 UTC,2024-06-27 06:11:55 UTC,research,CC-BY-NC,https://inaturalist-open-data.s3.amazonaws.com/photos/162481765/medium.jpg,,"Arnica Lake, Banff NP. ",1,0,FALSE,,"Banff National Park, Banff, Division No. 15, Alberta, Canada",51.22295833,-115.9969944,4,,,,4,,open,,subalpine larch,Larix lyallii,subalpine larch,Plantae,69848
97677210,9/24/21,2021-09-24 20:40:00 UTC,Pacific Time (US & Canada),103699,Mary Sanseverino,2021-10-09 18:38:31 UTC,2024-06-27 06:11:50 UTC,research,CC-BY-NC,https://inaturalist-open-data.s3.amazonaws.com/photos/162482180/medium.jpg,,Habitat shot - NW corner of Arnica Lake on a shoulder of Storm Mountain. ,1,0,FALSE,,"Improvement District No. 9, AB T0L, Canada",51.22424933,-115.997511,4,,,,4,,open,,subalpine larch,Larix lyallii,subalpine larch,Plantae,69848
97709356,10/9/21,2021-10-09 16:13:35 UTC,Mountain Time (US & Canada),4126075,,2021-10-09 23:05:30 UTC,2024-06-27 06:11:45 UTC,research,CC-BY-NC,https://inaturalist-open-data.s3.amazonaws.com/photos/162542075/medium.jpg,,,1,0,FALSE,3,"Banff National Park, Lake Louise, AB, CA",51.32662,-116.2051,4,,,,4,,open,,subalpine larch,Larix lyallii,subalpine larch,Plantae,69848
97739031,10/9/21,2021-10-09 20:07:35 UTC,Pacific Time (US & Canada),1794691,Russ Teeter,2021-10-10 05:46:26 UTC,2021-10-25 21:02:13 UTC,research,,https://static.inaturalist.org/photos/162600491/medium.jpeg,,,1,0,FALSE,2,"Chelan County, US-WA, US",47.48262326,-120.7948935,4,,,,4,,open,,subalpine larch,Larix lyallii,subalpine larch,Plantae,69848
97784208,10/9/21,2021-10-09 16:13:39 UTC,Mountain Time (US & Canada),144533,Sam Jolly,2021-10-10 16:22:34 UTC,2024-06-27 06:11:42 UTC,research,CC-BY-NC,https://inaturalist-open-data.s3.amazonaws.com/photos/162682023/medium.jpg,,,1,0,FALSE,3,"Banff National Park, Lake Louise, AB, CA",51.3266,-116.2051467,5,,,,5,,open,,subalpine larch,Larix lyallii,subalpine larch,Plantae,69848
97826221,9/24/21,2021-09-24 20:43:00 UTC,Mountain Time (US & Canada),88044,BioBlitz,2021-10-10 21:38:33 UTC,2024-06-27 06:11:38 UTC,research,CC-BY-ND,https://inaturalist-open-data.s3.amazonaws.com/photos/162757828/medium.jpeg,,Panorama Ridge,1,0,FALSE,,"Improvement District No. 9, AB T0L, Canada",51.30264882,-116.1005996,632,,,,632,,open,,subalpine larch,Larix lyallii,subalpine larch,Plantae,69848
97833431,10/7/21,2021-10-07 22:32:49 UTC,Pacific Time (US & Canada),1261924,Angela,2021-10-10 22:39:37 UTC,2021-10-10 22:45:00 UTC,research,,https://static.inaturalist.org/photos/162771325/medium.jpeg,,,1,0,FALSE,2,"Skagit County, WA, USA",48.554813,-120.7046345,,,,,,,open,gps,subalpine larch,Larix lyallii,subalpine larch,Plantae,69848
97833494,10/6/21,2021-10-06 19:59:22 UTC,Pacific Time (US & Canada),1261924,Angela,2021-10-10 22:40:14 UTC,2022-04-19 12:19:16 UTC,research,,https://static.inaturalist.org/photos/162771467/medium.jpeg,,,1,0,FALSE,2,"Leavenworth, WA 98826, USA",47.4616802,-120.9399641,,,,,,,open,gps,subalpine larch,Larix lyallii,subalpine larch,Plantae,69848
97860631,9/17/20,2020-09-17 22:58:13 UTC,Pacific Time (US & Canada),5109034,,2021-10-11 03:29:06 UTC,2021-10-13 00:51:32 UTC,research,CC-BY-NC,https://inaturalist-open-data.s3.amazonaws.com/photos/162822945/medium.jpg,,,2,0,FALSE,3,"Kootenay National Park, Harrogate, BC, CA",51.28809396,-116.1710496,147508,,,,147508,,open,,subalpine larch,Larix lyallii,subalpine larch,Plantae,69848
98292114,9/29/21,2021-09-29 17:30:00 UTC,Mountain Time (US & Canada),785779,Matt Wallace,2021-10-15 17:13:23 UTC,2021-10-15 17:22:48 UTC,research,,https://static.inaturalist.org/photos/163609659/medium.jpeg,,,1,0,FALSE,,"Kananaskis, AB T0L, Canada",50.770176,-115.336004,,,,,,,open,,subalpine larch,Larix lyallii,subalpine larch,Plantae,69848
98292121,9/29/21,2021-09-29 17:41:00 UTC,Mountain Time (US & Canada),785779,Matt Wallace,2021-10-15 17:13:26 UTC,2021-10-15 17:24:07 UTC,research,,https://static.inaturalist.org/photos/163610212/medium.jpeg,,,1,0,FALSE,,"Kananaskis, AB T0L, Canada",50.767687,-115.335181,,,,,,,open,,subalpine larch,Larix lyallii,subalpine larch,Plantae,69848
98292122,9/29/21,2021-09-29 18:00:00 UTC,Mountain Time (US & Canada),785779,Matt Wallace,2021-10-15 17:13:27 UTC,2021-10-15 17:23:08 UTC,research,,https://static.inaturalist.org/photos/163611795/medium.jpeg,,,1,0,FALSE,,"Peter Lougheed, Division No. 15, Alberta, Canada",50.7647655,-115.3329445,,,,,,,open,,subalpine larch,Larix lyallii,subalpine larch,Plantae,69848
98434613,9/24/21,2021-09-24 16:14:00 UTC,Pacific Time (US & Canada),104905,Joan Septembre,2021-10-16 23:38:15 UTC,2021-11-22 05:51:55 UTC,research,CC-BY-NC-ND,https://static.inaturalist.org/photos/163882340/medium.jpg,,,2,0,FALSE,,"East Kootenay, BC, Canada",51.05865516,-116.1396559,547,,,,547,,open,,subalpine larch,Larix lyallii,subalpine larch,Plantae,69848
98435167,9/25/21,2021-09-25 18:00:00 UTC,Pacific Time (US & Canada),104905,Joan Septembre,2021-10-16 23:46:00 UTC,2021-11-07 04:05:49 UTC,research,CC-BY-NC-ND,https://static.inaturalist.org/photos/163883623/medium.jpg,,,1,0,FALSE,,"Columbia-Shuswap, BC, Canada",51.34294866,-116.3208307,334,,,,334,,open,,subalpine larch,Larix lyallii,subalpine larch,Plantae,69848
98539014,10/1/21,2021-10-01 18:37:08 UTC,Pacific Time (US & Canada),4925076,,2021-10-17 21:14:57 UTC,2022-04-19 12:17:22 UTC,research,CC-BY-NC,https://inaturalist-open-data.s3.amazonaws.com/photos/164082057/medium.jpg,,,1,0,FALSE,3,"Okanogan - Wenatchee National Forest, Mazama, WA, US",48.69362167,-120.706445,5,,,,5,,open,,subalpine larch,Larix lyallii,subalpine larch,Plantae,69848
98572179,10/13/21,2021-10-13 21:03:00 UTC,Hawaii,916839,Leshell,2021-10-18 03:04:56 UTC,2023-07-08 06:46:32 UTC,research,CC-BY-NC,https://inaturalist-open-data.s3.amazonaws.com/photos/164145349/medium.jpeg,,,1,0,FALSE,,"Chelan, Washington, United States",48.50878,-120.7547531,,,,,,,open,,subalpine larch,Larix lyallii,subalpine larch,Plantae,69848
98576337,9/16/20,2020-09-16 14:54:00 UTC,UTC,1008203,Bio Bro,2021-10-18 04:00:18 UTC,2024-06-27 06:11:33 UTC,research,,https://static.inaturalist.org/photos/164153022/medium.jpg,,,1,0,FALSE,,"Improvement District No. 9, AB T0L, Canada",51.32135445,-116.2361167,61,,,,61,,open,,subalpine larch,Larix lyallii,subalpine larch,Plantae,69848
98614393,9/29/21,2021-09-29 18:37:00 UTC,Mountain Time (US & Canada),785779,Matt Wallace,2021-10-18 16:00:59 UTC,2021-10-19 15:33:07 UTC,research,,https://static.inaturalist.org/photos/164216196/medium.jpeg,,,1,0,FALSE,,"Kananaskis, AB T0L, Canada",50.76199625,-115.3355151,100,,,,100,,open,,subalpine larch,Larix lyallii,subalpine larch,Plantae,69848
98614399,9/29/21,2021-09-29 18:35:00 UTC,Mountain Time (US & Canada),785779,Matt Wallace,2021-10-18 16:01:01 UTC,2021-10-19 15:34:33 UTC,research,,https://static.inaturalist.org/photos/164216420/medium.jpeg,,,1,0,FALSE,,"Kananaskis, AB T0L, Canada",50.75987238,-115.3353276,50,,,,50,,open,,subalpine larch,Larix lyallii,subalpine larch,Plantae,69848
98614400,9/29/21,2021-09-29 18:36:00 UTC,Mountain Time (US & Canada),785779,Matt Wallace,2021-10-18 16:01:01 UTC,2021-10-19 15:35:05 UTC,research,,https://static.inaturalist.org/photos/164216547/medium.jpeg,,,1,0,FALSE,,"Kananaskis, AB T0L, Canada",50.76241482,-115.3334169,100,,,,100,,open,,subalpine larch,Larix lyallii,subalpine larch,Plantae,69848
98614405,9/29/21,2021-09-29 18:41:00 UTC,Mountain Time (US & Canada),785779,Matt Wallace,2021-10-18 16:01:02 UTC,2021-10-19 15:35:17 UTC,research,,https://static.inaturalist.org/photos/164217149/medium.jpeg,,,1,0,FALSE,,"Kananaskis, AB T0L, Canada",50.7597,-115.331409,,,,,,,open,,subalpine larch,Larix lyallii,subalpine larch,Plantae,69848
98614411,9/29/21,2021-09-29 19:20:00 UTC,Mountain Time (US & Canada),785779,Matt Wallace,2021-10-18 16:01:04 UTC,2021-10-19 02:13:14 UTC,research,,https://static.inaturalist.org/photos/164219763/medium.jpeg,,,1,0,FALSE,,"Kananaskis, AB T0L, Canada",50.75070966,-115.3258233,100,,,,100,,open,,subalpine larch,Larix lyallii,subalpine larch,Plantae,69848
98650912,9/29/21,2021-09-29 19:56:00 UTC,Mountain Time (US & Canada),785779,Matt Wallace,2021-10-18 22:40:44 UTC,2021-10-19 02:07:46 UTC,research,,https://static.inaturalist.org/photos/164289109/medium.jpeg,,,1,0,FALSE,,"Kananaskis, AB T0L, Canada",50.755324,-115.329063,,,,,,,open,,subalpine larch,Larix lyallii,subalpine larch,Plantae,69848
98654277,9/29/21,2021-09-29 20:25:00 UTC,Mountain Time (US & Canada),785779,Matt Wallace,2021-10-18 23:21:43 UTC,2021-10-19 02:03:30 UTC,research,,https://static.inaturalist.org/photos/164294101/medium.jpeg,,,1,0,FALSE,,"Kananaskis, AB T0L, Canada",50.76288197,-115.3315672,15,,,,15,,open,,subalpine larch,Larix lyallii,subalpine larch,Plantae,69848
98654278,9/29/21,2021-09-29 20:32:00 UTC,Mountain Time (US & Canada),785779,Matt Wallace,2021-10-18 23:21:43 UTC,2021-10-19 02:03:21 UTC,research,,https://static.inaturalist.org/photos/164294283/medium.jpeg,,,1,0,FALSE,,"Kananaskis, AB T0L, Canada",50.76576724,-115.3325521,31,,,,31,,open,,subalpine larch,Larix lyallii,subalpine larch,Plantae,69848
98808342,10/20/21,2021-10-20 17:53:00 UTC,Arizona,76726,Chris Rohrer,2021-10-20 17:53:42 UTC,2022-04-19 12:16:28 UTC,research,CC-BY,https://inaturalist-open-data.s3.amazonaws.com/photos/164592242/medium.jpg,,,1,0,FALSE,,"Hart's Pass Campground, Washington 98833, USA",48.7205416,-120.669794,1431,,,,1431,,open,,subalpine larch,Larix lyallii,subalpine larch,Plantae,69848
98808407,10/16/21,2021-10-16 19:36:00 UTC,Arizona,76726,Chris Rohrer,2021-10-20 17:54:52 UTC,2022-04-19 12:06:21 UTC,research,CC-BY,https://inaturalist-open-data.s3.amazonaws.com/photos/164592411/medium.jpeg,,,1,0,FALSE,,"Hart's Pass Campground, Washington 98833, USA",48.7205416,-120.669794,1431,,,,1431,,open,,subalpine larch,Larix lyallii,subalpine larch,Plantae,69848
99150323,10/21/21,2021-10-21 21:10:15 UTC,Pacific Time (US & Canada),2570539,Elisa Weiss,2021-10-23 23:47:05 UTC,2022-07-19 06:12:59 UTC,research,,https://static.inaturalist.org/photos/165392428/medium.jpg,,,1,0,FALSE,3,"North Cascades National Park, Stehekin, WA, US",48.50111333,-120.7675467,8,,,,8,,open,,subalpine larch,Larix lyallii,subalpine larch,Plantae,69848
99155144,10/23/21,2021-10-23 18:58:44 UTC,Pacific Time (US & Canada),3352889,,2021-10-24 00:37:43 UTC,2021-10-25 21:04:17 UTC,research,CC-BY-NC,https://inaturalist-open-data.s3.amazonaws.com/photos/165233599/medium.jpeg,,,1,0,FALSE,2,"Chelan County, US-WA, US",47.45955243,-120.935989,4,,,,4,,open,,subalpine larch,Larix lyallii,subalpine larch,Plantae,69848
99380136,10/2/21,2021-10-02 17:31:00 UTC,Pacific Time (US & Canada),1429048,rebecca bachman,2021-10-25 19:50:43 UTC,2023-01-27 22:07:20 UTC,research,CC0,https://inaturalist-open-data.s3.amazonaws.com/photos/165653039/medium.jpeg,,,2,0,FALSE,,"Chelan County, WA, USA",47.48316111,-120.795775,5,,,,5,,open,,subalpine larch,Larix lyallii,subalpine larch,Plantae,69848
99686964,9/19/21,2021-09-19 22:23:51 UTC,Pacific Time (US & Canada),350245,Mark Robinson,2021-10-29 06:54:37 UTC,2022-04-19 12:01:09 UTC,research,CC-BY-NC,https://inaturalist-open-data.s3.amazonaws.com/photos/166234004/medium.jpg,,,1,0,FALSE,3,"Okanogan - Wenatchee National Forest, Stehekin, WA, US",48.50982167,-120.6669833,5,,,,5,,open,,subalpine larch,Larix lyallii,subalpine larch,Plantae,69848
99686988,9/19/21,2021-09-19 21:04:30 UTC,Pacific Time (US & Canada),350245,Mark Robinson,2021-10-29 06:55:10 UTC,2021-10-29 16:51:25 UTC,research,CC-BY-NC,https://inaturalist-open-data.s3.amazonaws.com/photos/166234042/medium.jpg,,,1,0,FALSE,3,"Okanogan - Wenatchee National Forest, Stehekin, WA, US",48.51273,-120.665755,4,,,,4,,open,,subalpine larch,Larix lyallii,subalpine larch,Plantae,69848
101693055,9/26/21,2021-09-26 20:08:00 UTC,Mountain Time (US & Canada),449500,Blake Weis,2021-11-22 09:07:52 UTC,2021-11-22 13:20:13 UTC,research,CC-BY-NC,https://inaturalist-open-data.s3.amazonaws.com/photos/169848865/medium.jpg,,,1,0,FALSE,,"Kananaskis, AB T0L, Canada",50.82946923,-115.3668308,147,,,,147,,open,,subalpine larch,Larix lyallii,subalpine larch,Plantae,69848
102064895,10/9/21,2021-10-09 20:38:00 UTC,Pacific Time (US & Canada),515751,Brian Starzomski,2021-11-28 05:57:03 UTC,2021-11-28 16:23:00 UTC,research,CC0,https://inaturalist-open-data.s3.amazonaws.com/photos/170542481/medium.jpeg,,,1,0,FALSE,,"E.C. Manning, Fraser Valley, British Columbia, Canada",49.026825,-120.829895,9,,,,9,,open,,subalpine larch,Larix lyallii,subalpine larch,Plantae,69848
102064899,10/9/21,2021-10-09 20:08:00 UTC,Pacific Time (US & Canada),515751,Brian Starzomski,2021-11-28 05:57:04 UTC,2021-11-28 16:22:51 UTC,research,CC0,https://inaturalist-open-data.s3.amazonaws.com/photos/170542562/medium.jpeg,,,1,0,FALSE,,"E.C. Manning, Fraser Valley, British Columbia, Canada",49.026245,-120.830307,30,,,,30,,open,,subalpine larch,Larix lyallii,subalpine larch,Plantae,69848
102064901,10/9/21,2021-10-09 20:01:00 UTC,Pacific Time (US & Canada),515751,Brian Starzomski,2021-11-28 05:57:05 UTC,2021-11-28 16:22:46 UTC,research,CC0,https://inaturalist-open-data.s3.amazonaws.com/photos/170542568/medium.jpeg,,,1,0,FALSE,,"E.C. Manning, Fraser Valley, British Columbia, Canada",49.027042,-120.829842,10,,,,10,,open,,subalpine larch,Larix lyallii,subalpine larch,Plantae,69848
102064903,10/9/21,2021-10-09 19:57:00 UTC,Pacific Time (US & Canada),515751,Brian Starzomski,2021-11-28 05:57:07 UTC,2021-11-28 16:22:36 UTC,research,CC0,https://inaturalist-open-data.s3.amazonaws.com/photos/170542576/medium.jpeg,,,1,0,FALSE,,"Fraser Valley, BC, Canada",49.028072,-120.829758,17,,,,17,,open,,subalpine larch,Larix lyallii,subalpine larch,Plantae,69848
102064931,10/9/21,2021-10-09 19:55:00 UTC,Pacific Time (US & Canada),515751,Brian Starzomski,2021-11-28 05:57:45 UTC,2021-11-28 16:22:23 UTC,research,CC0,https://inaturalist-open-data.s3.amazonaws.com/photos/170542628/medium.jpeg,,,1,0,FALSE,,"Fraser Valley, BC, Canada",49.028206,-120.830421,7,,,,7,,open,,subalpine larch,Larix lyallii,subalpine larch,Plantae,69848
102249855,10/11/21,2021-10-11 21:49:00 UTC,Pacific Time (US & Canada),5239267,Pearly_Baker,2021-11-30 18:19:49 UTC,2022-02-04 03:44:24 UTC,research,CC-BY-NC,https://inaturalist-open-data.s3.amazonaws.com/photos/170882171/medium.jpg,,,1,0,FALSE,,"Chelan County, WA, USA",48.50885833,-120.7547361,,,,,,,open,,subalpine larch,Larix lyallii,subalpine larch,Plantae,69848
102310693,9/20/21,2021-09-20 19:46:00 UTC,Mountain Time (US & Canada),1079214,Lori Skulski,2021-12-01 18:36:10 UTC,2021-12-02 13:59:51 UTC,research,,https://static.inaturalist.org/photos/170995866/medium.jpeg,,,1,0,FALSE,,"Kananaskis, AB T0L, Canada",50.88028889,-115.2948194,,,,,,,open,,subalpine larch,Larix lyallii,subalpine larch,Plantae,69848
102425602,3/28/05,2005-03-28 11:26:00 UTC,Pacific Time (US & Canada),3376483,danm123,2021-12-03 20:27:54 UTC,2022-01-05 15:49:16 UTC,research,CC-BY-NC,https://inaturalist-open-data.s3.amazonaws.com/photos/171211728/medium.jpeg,,,1,0,FALSE,,"Leavenworth, WA 98826, USA",47.4785403,-120.8192444,181,,,,181,,open,,subalpine larch,Larix lyallii,subalpine larch,Plantae,69848
102537334,10/2/21,2021-10-02 16:29:00 UTC,Pacific Time (US & Canada),1657037,Christopher J. Earle,2021-12-05 16:04:37 UTC,2021-12-07 05:15:45 UTC,research,CC-BY-NC,https://inaturalist-open-data.s3.amazonaws.com/photos/171428388/medium.jpg,"Autumn-color, Forest, Mountain-Cascades, Mountains, in-habitat, whole-plant",Large specimen near the species' lower elevation limit in this area,2,0,FALSE,,"Chelan, Washington, United States",48.51372213,-120.6659853,,,,,,,open,,subalpine larch,Larix lyallii,subalpine larch,Plantae,69848
102756946,10/2/21,2021-10-02 19:32:25 UTC,Pacific Time (US & Canada),5004195,Shayla,2021-12-09 07:20:19 UTC,2022-09-07 02:12:48 UTC,research,CC-BY-NC,https://inaturalist-open-data.s3.amazonaws.com/photos/171838655/medium.jpeg,,,1,0,FALSE,2,"Manning Park, BC V0X 1R0, Canada",49.027985,-120.829741,,,,,,,open,gps,subalpine larch,Larix lyallii,subalpine larch,Plantae,69848
102791859,12/9/21,2021-12-09 19:13:12 UTC,UTC,3637268,Jon Reberlio,2021-12-10 00:04:25 UTC,2024-06-27 06:11:29 UTC,research,,https://static.inaturalist.org/photos/171906716/medium.jpeg,,Doing a transect looking for P. Albicaulis. This ridge I could only find larch spruce and one little lodgepole pine,1,0,FALSE,2,"Exshaw, AB T0L 2C0, Canada",51.1013751,-115.8621398,,,,,,,open,gps,subalpine larch,Larix lyallii,subalpine larch,Plantae,69848
102796870,9/30/16,2016-09-30 17:56:00 UTC,Eastern Time (US & Canada),242433,Tulipifera-ike,2021-12-10 02:24:16 UTC,2022-04-19 12:00:27 UTC,research,CC-BY-NC,https://inaturalist-open-data.s3.amazonaws.com/photos/171916330/medium.jpeg,,,1,0,FALSE,,"Chelan County, WA, USA",48.319325,-120.7277361,,,,,,,open,,subalpine larch,Larix lyallii,subalpine larch,Plantae,69848
103047953,8/1/21,2021-08-01 19:04:00 UTC,Pacific Time (US & Canada),1657037,Christopher J. Earle,2021-12-14 15:10:44 UTC,2021-12-14 17:09:46 UTC,research,CC-BY-NC,https://inaturalist-open-data.s3.amazonaws.com/photos/172382580/medium.jpg,"in-habitat, whole-plant","Larix lyallii, all alone; seed source is at considerably higher elevation",1,0,FALSE,,"Chelan County, WA, USA",48.21449676,-120.9500812,,,,,,,open,,subalpine larch,Larix lyallii,subalpine larch,Plantae,69848
103047962,8/1/21,2021-08-01 20:14:00 UTC,Pacific Time (US & Canada),1657037,Christopher J. Earle,2021-12-14 15:10:49 UTC,2021-12-14 17:09:56 UTC,research,CC-BY-NC,https://inaturalist-open-data.s3.amazonaws.com/photos/172382650/medium.jpg,"in-habitat, whole-plant","Sapling of Larix lyallii, only one in the area; stands are nearby at considerably higher elevations",1,0,FALSE,,"Chelan, Washington, United States",48.23165229,-120.9480733,,,,,,,open,,subalpine larch,Larix lyallii,subalpine larch,Plantae,69848
103276268,9/2/21,2021-09-02 23:53:00 UTC,Pacific Time (US & Canada),1285263,,2021-12-18 23:03:21 UTC,2021-12-23 14:01:31 UTC,research,CC0,https://inaturalist-open-data.s3.amazonaws.com/photos/172805112/medium.jpeg,,,1,0,FALSE,,"East Kootenay, BC, Canada",50.73923889,-116.7638639,4,,,,4,,open,,subalpine larch,Larix lyallii,subalpine larch,Plantae,69848
103276290,9/2/21,2021-09-03 00:05:00 UTC,Pacific Time (US & Canada),1285263,,2021-12-18 23:03:30 UTC,2022-01-15 14:43:30 UTC,research,CC0,https://inaturalist-open-data.s3.amazonaws.com/photos/172805376/medium.jpeg,,,1,0,FALSE,,"East Kootenay, BC, Canada",50.73834167,-116.7664806,10,,,,10,,open,,subalpine larch,Larix lyallii,subalpine larch,Plantae,69848
103353780,8/4/14,2014-08-04 14:35:00 UTC,UTC,2147595,Sean Daniels,2021-12-20 06:49:22 UTC,2022-04-19 11:55:39 UTC,research,CC-BY-NC,https://inaturalist-open-data.s3.amazonaws.com/photos/172739214/medium.jpeg,,,1,0,FALSE,,"Chelan County, WA, USA",48.50825567,-120.7644775,15,,,,15,,open,,subalpine larch,Larix lyallii,subalpine larch,Plantae,69848
103353790,8/4/14,2014-08-04 16:14:00 UTC,UTC,2147595,Sean Daniels,2021-12-20 06:49:25 UTC,2022-04-19 11:55:19 UTC,research,CC-BY-NC,https://inaturalist-open-data.s3.amazonaws.com/photos/172739376/medium.jpeg,,,1,0,FALSE,,"Chelan County, WA, USA",48.50168906,-120.7512284,8,,,,8,,open,,subalpine larch,Larix lyallii,subalpine larch,Plantae,69848
103484037,10/14/15,2015-10-14 20:42:00 UTC,Pacific Time (US & Canada),728554,Peter Abrahamsen,2021-12-22 19:16:34 UTC,2024-06-26 02:54:50 UTC,research,CC-BY,https://inaturalist-open-data.s3.amazonaws.com/photos/173207140/medium.jpeg,,,1,0,FALSE,,"Chelan County, WA, USA",47.46137222,-120.9396833,5,,,,5,,open,,subalpine larch,Larix lyallii,subalpine larch,Plantae,69848
104314830,6/16/21,2021-06-16 19:59:00 UTC,Mountain Time (US & Canada),1087911,Greg Pohl,2022-01-04 01:35:24 UTC,2022-01-04 01:44:24 UTC,research,CC-BY-NC,https://inaturalist-open-data.s3.amazonaws.com/photos/174761527/medium.jpeg,,,1,0,FALSE,,"Table Mtn. summit, Pincher Creek No. 9, AB, Canada",49.3585572,-114.2683201,232,,,,232,,open,,subalpine larch,Larix lyallii,subalpine larch,Plantae,69848
104961155,10/3/21,2021-10-03 15:21:06 UTC,Pacific Time (US & Canada),5304727,Sonia Landwehr,2022-01-15 08:22:08 UTC,2022-09-07 02:14:04 UTC,research,,https://static.inaturalist.org/photos/175995230/medium.jpg,,,3,1,FALSE,3,"E.C. Manning Provincial Park, Fraser Valley, BC, CA",49.01764167,-120.8318633,3,,,,3,,open,,subalpine larch,Larix lyallii,subalpine larch,Plantae,69848
105240172,9/26/21,2021-09-26 19:23:00 UTC,Pacific Time (US & Canada),1256862,Julia Carr,2022-01-20 01:44:22 UTC,2022-11-25 18:25:36 UTC,research,CC0,https://inaturalist-open-data.s3.amazonaws.com/photos/176523388/medium.jpg,,,1,0,FALSE,,"East Kootenay, BC, Canada",50.90925097,-115.617983,,,,,,,open,,subalpine larch,Larix lyallii,subalpine larch,Plantae,69848
105240173,9/26/21,2021-09-26 19:32:00 UTC,Pacific Time (US & Canada),1256862,Julia Carr,2022-01-20 01:44:22 UTC,2022-11-25 18:25:36 UTC,research,CC0,https://inaturalist-open-data.s3.amazonaws.com/photos/176523568/medium.jpg,,,1,0,FALSE,,"East Kootenay, BC, Canada",50.91202497,-115.621044,,,,,,,open,,subalpine larch,Larix lyallii,subalpine larch,Plantae,69848
105240174,9/26/21,2021-09-26 19:23:00 UTC,Pacific Time (US & Canada),1256862,Julia Carr,2022-01-20 01:44:22 UTC,2022-11-25 18:25:36 UTC,research,CC0,https://inaturalist-open-data.s3.amazonaws.com/photos/176523499/medium.jpg,,,1,0,FALSE,,"East Kootenay, BC, Canada",50.909131,-115.618102,,,,,,,open,,subalpine larch,Larix lyallii,subalpine larch,Plantae,69848
105240177,9/26/21,2021-09-26 20:25:00 UTC,Pacific Time (US & Canada),1256862,Julia Carr,2022-01-20 01:44:23 UTC,2022-11-25 18:25:36 UTC,research,CC0,https://inaturalist-open-data.s3.amazonaws.com/photos/176523587/medium.jpg,,,1,0,FALSE,,"Mount Assiniboine, East Kootenay, British Columbia, Canada",50.94290397,-115.635851,,,,,,,open,,subalpine larch,Larix lyallii,subalpine larch,Plantae,69848
105240186,9/26/21,2021-09-27 00:09:00 UTC,Pacific Time (US & Canada),1256862,Julia Carr,2022-01-20 01:44:25 UTC,2022-11-25 18:25:36 UTC,research,CC0,https://inaturalist-open-data.s3.amazonaws.com/photos/176523693/medium.jpg,,,1,0,FALSE,,"Mount Assiniboine, East Kootenay, British Columbia, Canada",50.95358997,-115.632492,,,,,,,open,,subalpine larch,Larix lyallii,subalpine larch,Plantae,69848
105240196,9/27/21,2021-09-27 21:06:00 UTC,Pacific Time (US & Canada),1256862,Julia Carr,2022-01-20 01:44:28 UTC,2022-11-25 18:25:36 UTC,research,CC0,https://inaturalist-open-data.s3.amazonaws.com/photos/176523842/medium.jpg,,,1,0,FALSE,,"East Kootenay, BC, Canada",50.91019148,-115.6225958,917,,,,917,,open,,subalpine larch,Larix lyallii,subalpine larch,Plantae,69848
105240197,9/27/21,2021-09-27 21:06:00 UTC,Pacific Time (US & Canada),1256862,Julia Carr,2022-01-20 01:44:29 UTC,2022-11-25 18:25:36 UTC,research,CC0,https://inaturalist-open-data.s3.amazonaws.com/photos/176523855/medium.jpg,,,1,0,FALSE,,"East Kootenay, BC, Canada",50.91019148,-115.6225958,917,,,,917,,open,,subalpine larch,Larix lyallii,subalpine larch,Plantae,69848
105240206,9/28/21,2021-09-28 23:23:00 UTC,Pacific Time (US & Canada),1256862,Julia Carr,2022-01-20 01:44:31 UTC,2022-11-25 18:25:36 UTC,research,CC0,https://inaturalist-open-data.s3.amazonaws.com/photos/176524021/medium.jpg,,,1,0,FALSE,,"East Kootenay, BC, Canada",50.91019148,-115.6225958,917,,,,917,,open,,subalpine larch,Larix lyallii,subalpine larch,Plantae,69848
105240224,10/1/21,2021-10-01 21:14:00 UTC,Pacific Time (US & Canada),1256862,Julia Carr,2022-01-20 01:44:37 UTC,2024-06-27 06:11:11 UTC,research,CC0,https://inaturalist-open-data.s3.amazonaws.com/photos/176524385/medium.jpg,,,1,0,FALSE,,"Improvement District No. 9, AB T0L, Canada",50.88138,-115.590272,,,,,,,open,,subalpine larch,Larix lyallii,subalpine larch,Plantae,69848
105276086,9/16/21,2021-09-16 21:56:00 UTC,Pacific Time (US & Canada),4985354,,2022-01-20 19:41:44 UTC,2022-01-21 21:47:49 UTC,research,CC-BY-NC,https://inaturalist-open-data.s3.amazonaws.com/photos/176602763/medium.jpg,,Cathedral provincial park ,1,0,FALSE,3,"Cathedral Provincial Park and Protected Area, Okanagan-Similkameen, BC, CA",49.05101775,-120.1844618,489,,,,489,,open,,subalpine larch,Larix lyallii,subalpine larch,Plantae,69848
105673280,10/24/21,2021-10-24 21:37:00 UTC,Mountain Time (US & Canada),2573924,Sarah Hirtle,2022-01-27 18:31:39 UTC,2022-01-28 02:44:05 UTC,research,,https://static.inaturalist.org/photos/177355983/medium.jpeg,,,1,0,FALSE,,"Improvement District No. 4, AB T0K, Canada",49.05130784,-114.056769,83,,,,83,,open,,subalpine larch,Larix lyallii,subalpine larch,Plantae,69848
105815304,1/29/22,2022-01-29 21:50:25 UTC,UTC,3637268,Jon Reberlio,2022-01-30 03:20:21 UTC,2024-06-27 06:11:06 UTC,research,,https://static.inaturalist.org/photos/177630481/medium.jpeg,,,1,0,FALSE,2,"Harrogate, BC V0A 1J0, Canada",51.2510534,-116.0969169,,,,,,,open,gps,subalpine larch,Larix lyallii,subalpine larch,Plantae,69848
105816161,1/29/22,2022-01-29 21:15:20 UTC,UTC,3637268,Jon Reberlio,2022-01-30 03:37:52 UTC,2022-02-05 05:58:32 UTC,research,,https://static.inaturalist.org/photos/177632553/medium.jpeg,,,1,0,FALSE,2,"Harrogate, BC V0A 1J0, Canada",51.2473892,-116.0974103,,,,,,,open,gps,subalpine larch,Larix lyallii,subalpine larch,Plantae,69848
105816387,1/29/22,2022-01-29 20:58:46 UTC,UTC,3637268,Jon Reberlio,2022-01-30 03:42:00 UTC,2022-02-05 05:58:32 UTC,research,,https://static.inaturalist.org/photos/177632922/medium.jpeg,,,1,0,FALSE,2,"Harrogate, BC V0A 1J0, Canada",51.2458568,-116.0982228,,,,,,,open,gps,subalpine larch,Larix lyallii,subalpine larch,Plantae,69848
106339940,10/2/04,2004-10-02 18:19:00 UTC,Central Time (US & Canada),1339029,James Riser,2022-02-07 22:10:15 UTC,2023-02-08 13:26:36 UTC,research,,https://static.inaturalist.org/photos/178618351/medium.jpg,,,1,0,FALSE,,"Darby, MT 59829, USA",45.8916052,-114.2623201,33,,,,33,,open,,subalpine larch,Larix lyallii,subalpine larch,Plantae,69848
106365725,9/29/21,2021-09-29 16:40:00 UTC,Pacific Time (US & Canada),1256862,Julia Carr,2022-02-08 07:41:23 UTC,2022-11-25 18:25:36 UTC,research,CC0,https://inaturalist-open-data.s3.amazonaws.com/photos/178647981/medium.jpeg,,,1,0,FALSE,,"East Kootenay, BC, Canada",50.90601354,-115.6393379,271,,,,271,,open,,subalpine larch,Larix lyallii,subalpine larch,Plantae,69848
106657580,9/19/21,2021-09-20 04:15:00 UTC,Mountain Time (US & Canada),5359430,,2022-02-13 05:11:49 UTC,2022-04-06 23:40:35 UTC,research,CC-BY-NC,https://inaturalist-open-data.s3.amazonaws.com/photos/179217967/medium.jpg,,,3,1,FALSE,,"East Kootenay, BC, Canada",49.01697277,-114.1035202,31,,,,31,,open,,subalpine larch,Larix lyallii,subalpine larch,Plantae,69848
107273859,6/21/04,2004-06-21 19:30:00 UTC,Central Time (US & Canada),1339029,James Riser,2022-02-22 20:44:16 UTC,2022-03-05 16:51:27 UTC,research,,https://static.inaturalist.org/photos/180387743/medium.jpg,,"Location approximate above Baker Lake, MT.",1,0,FALSE,,"Ravalli County, MT, USA",45.89224286,-114.2740415,189,,,,189,,open,,subalpine larch,Larix lyallii,subalpine larch,Plantae,69848
107273860,6/21/04,2004-06-21 19:33:00 UTC,Central Time (US & Canada),1339029,James Riser,2022-02-22 20:44:17 UTC,2022-03-05 16:51:46 UTC,research,,https://static.inaturalist.org/photos/180387749/medium.jpg,,"Location approximate above Baker Lake, MT.",1,0,FALSE,,"Ravalli County, MT, USA",45.89074096,-114.2764222,180,,,,180,,open,,subalpine larch,Larix lyallii,subalpine larch,Plantae,69848
107502277,2/18/22,2022-02-18 19:15:00 UTC,Mountain Time (US & Canada),705651,Mathis Natvik,2022-02-26 20:31:42 UTC,2022-02-27 16:49:25 UTC,research,,https://static.inaturalist.org/photos/180818011/medium.jpg,,,1,0,FALSE,,"Kananaskis, AB T0L, Canada",50.94638762,-115.1884417,4,,,,4,,open,,subalpine larch,Larix lyallii,subalpine larch,Plantae,69848
107670118,7/7/14,2014-07-06 20:56:00 UTC,Brisbane,412258,,2022-03-01 01:10:25 UTC,2024-06-27 06:11:03 UTC,research,CC-BY-NC,https://inaturalist-open-data.s3.amazonaws.com/photos/181135873/medium.jpeg,,5309/10,1,0,FALSE,,"Sunshine Meadows, Improvement District No. 9, AB T0L, Canada",51.077,-115.784,500,,,,500,,open,,subalpine larch,Larix lyallii,subalpine larch,Plantae,69848
107769865,8/1/21,2021-08-01 18:55:11 UTC,Mountain Time (US & Canada),743422,Nick Ramsey,2022-03-02 17:07:44 UTC,2022-03-05 16:47:22 UTC,research,CC-BY-NC,https://inaturalist-open-data.s3.amazonaws.com/photos/181322760/medium.jpg,,,1,0,FALSE,3,"Bitterroot National Forest, Stevensville, MT, US",46.63532167,-114.2609717,30,,,,30,,open,,subalpine larch,Larix lyallii,subalpine larch,Plantae,69848
107770131,8/1/21,2021-08-01 19:22:29 UTC,Mountain Time (US & Canada),743422,Nick Ramsey,2022-03-02 17:12:53 UTC,2022-03-02 18:32:21 UTC,research,CC-BY-NC,https://inaturalist-open-data.s3.amazonaws.com/photos/181323233/medium.jpg,,,1,0,FALSE,3,"Bitterroot National Forest, Stevensville, MT, US",46.63575333,-114.26088,4,,,,4,,open,,subalpine larch,Larix lyallii,subalpine larch,Plantae,69848
108403330,10/4/03,2003-10-04 22:47:00 UTC,Pacific Time (US & Canada),3396573,Steve Ansell,2022-03-12 02:04:42 UTC,2022-03-12 05:07:57 UTC,research,CC-BY-NC,https://inaturalist-open-data.s3.amazonaws.com/photos/182508062/medium.jpeg,,,1,0,FALSE,,"Fraser Valley, BC, Canada",49.02339136,-120.8306118,250,,,,250,,open,,subalpine larch,Larix lyallii,subalpine larch,Plantae,69848
108958558,8/7/04,2004-08-07 22:09:00 UTC,Pacific Time (US & Canada),3396573,Steve Ansell,2022-03-19 16:16:31 UTC,2022-03-23 21:24:17 UTC,research,CC-BY-NC,https://inaturalist-open-data.s3.amazonaws.com/photos/183551594/medium.jpeg,,,1,0,FALSE,,"Okanagan-Similkameen, BC, Canada",49.04778524,-120.1994691,25,,,,25,,open,,subalpine larch,Larix lyallii,subalpine larch,Plantae,69848
108967180,10/2/04,2004-10-02 21:35:00 UTC,Pacific Time (US & Canada),3396573,Steve Ansell,2022-03-19 17:50:12 UTC,2022-03-23 21:18:15 UTC,research,CC-BY-NC,https://inaturalist-open-data.s3.amazonaws.com/photos/183567762/medium.jpeg,,,1,0,FALSE,,"Fraser Valley, BC, Canada",49.01940897,-120.8317856,25,,,,25,,open,,subalpine larch,Larix lyallii,subalpine larch,Plantae,69848
109149673,8/29/21,2021-08-30 00:05:22 UTC,Pacific Time (US & Canada),3938277,,2022-03-21 15:50:45 UTC,2024-06-27 06:10:57 UTC,research,CC-BY-NC,https://inaturalist-open-data.s3.amazonaws.com/photos/183910294/medium.jpg,,,2,0,FALSE,3,"Banff National Park, Banff, CA-AB-FN, CA-AB, CA",51.22782141,-115.5876762,4,,,,4,,open,,subalpine larch,Larix lyallii,subalpine larch,Plantae,69848
109250341,7/23/20,2020-07-23 11:26:00 UTC,UTC,859367,,2022-03-22 20:30:26 UTC,2022-04-19 11:50:16 UTC,research,,https://static.inaturalist.org/photos/184095483/medium.jpeg,,,1,0,FALSE,,"Whatcom County, WA, USA",48.75211262,-120.8673553,488,,,,488,,open,,subalpine larch,Larix lyallii,subalpine larch,Plantae,69848
109329507,3/23/22,2022-03-23 21:10:36 UTC,Pacific Time (US & Canada),3237957,Zach Coury,2022-03-23 23:08:40 UTC,2022-12-22 21:21:56 UTC,research,CC-BY-NC,https://inaturalist-open-data.s3.amazonaws.com/photos/184256662/medium.jpg,,,1,0,FALSE,3,"Central Kootenay, CA-BC, CA",50.25335,-117.127175,9,,,,9,,open,,subalpine larch,Larix lyallii,subalpine larch,Plantae,69848
109342455,10/3/21,2021-10-03 21:31:42 UTC,Pacific Time (US & Canada),5439072,Robyn Pryor,2022-03-24 02:21:06 UTC,2022-04-19 11:49:58 UTC,research,,https://static.inaturalist.org/photos/184271313/medium.jpg,,,1,0,FALSE,3,"Okanogan - Wenatchee National Forest, Mazama, WA, US",48.50273,-120.6231467,6,,,,6,,open,,subalpine larch,Larix lyallii,subalpine larch,Plantae,69848
111957603,9/2/21,2021-09-02 15:12:00 UTC,UTC,2755646,,2022-04-18 18:56:57 UTC,2022-04-20 14:17:21 UTC,research,CC-BY-NC,https://inaturalist-open-data.s3.amazonaws.com/photos/189061701/medium.jpeg,,,1,0,FALSE,,"AB-5, Waterton Park, AB T0K 2M0, Canada",49.0833333,-113.9166667,30633,,,,30633,,open,,subalpine larch,Larix lyallii,subalpine larch,Plantae,69848
113300147,4/25/22,2022-04-25 17:48:26 UTC,America/Edmonton,5504396,,2022-04-29 01:58:54 UTC,2024-06-27 06:10:53 UTC,research,CC-BY-NC,https://inaturalist-open-data.s3.amazonaws.com/photos/191443836/medium.jpg,,,1,0,FALSE,3,"Banff National Park, Improvement District No. 9 Banff, AB, CA",51.44948667,-116.09655,4,,,,4,,open,,subalpine larch,Larix lyallii,subalpine larch,Plantae,69848
113479853,9/16/21,2021-09-16 15:05:00 UTC,America/Edmonton,5550039,Theo Batchelor,2022-04-29 17:37:57 UTC,2024-06-27 06:10:45 UTC,research,,https://static.inaturalist.org/photos/191716618/medium.jpeg,,,1,0,FALSE,2,Moraine Lake,51.33268407,-116.2089559,824,,,,824,,open,gps,subalpine larch,Larix lyallii,subalpine larch,Plantae,69848
119811124,8/21/21,2021-08-21 16:02:11 UTC,Pacific Time (US & Canada),5754134,,2022-06-02 00:38:07 UTC,2023-11-19 04:19:21 UTC,research,CC-BY-NC,https://inaturalist-open-data.s3.amazonaws.com/photos/202577431/medium.jpeg,,Picket Range - western-most reported location at this time,2,0,FALSE,2,"Rockport, WA 98283, USA",48.82116597,-121.27907,,,,,,,open,,subalpine larch,Larix lyallii,subalpine larch,Plantae,69848
120623367,6/5/22,2022-06-05 18:48:16 UTC,America/Edmonton,3637268,Jon Reberlio,2022-06-07 04:40:15 UTC,2022-10-14 14:40:00 UTC,research,,https://static.inaturalist.org/photos/204038419/medium.jpeg,,,1,0,FALSE,2,"Grasmere, BC V0B 1R0, Canada",49.0439489,-114.0653528,,,,,,,open,gps,subalpine larch,Larix lyallii,subalpine larch,Plantae,69848
121789115,6/3/22,,Mountain Time (US & Canada),4311882,V. Lohr,2022-06-14 21:09:39 UTC,2022-08-06 21:47:28 UTC,research,CC-BY-NC,https://inaturalist-open-data.s3.amazonaws.com/photos/206131749/medium.jpeg,,Very distinctive bark and upright cones.  Could it be *L. lyallii*?,1,0,FALSE,,"Glacier NP, Flathead County, MT, USA",48.64150871,-113.8670538,200,,,,200,,open,,subalpine larch,Larix lyallii,subalpine larch,Plantae,69848
122711877,6/19/22,2022-06-19 16:32:51 UTC,Pacific Time (US & Canada),2208962,,2022-06-20 21:13:23 UTC,2024-05-08 00:14:49 UTC,research,CC-BY-NC,https://inaturalist-open-data.s3.amazonaws.com/photos/207841713/medium.jpg,,,1,0,FALSE,3,"Okanogan - Wenatchee National Forest, Leavenworth, WA, US",47.48926667,-120.8380667,3,,,,3,,open,,subalpine larch,Larix lyallii,subalpine larch,Plantae,69848
123109055,10/4/21,2021-10-04 19:06:50 UTC,Pacific Time (US & Canada),93866,Alex Patia,2022-06-23 17:30:34 UTC,2022-11-28 07:01:08 UTC,research,CC-BY-NC,https://inaturalist-open-data.s3.amazonaws.com/photos/208519410/medium.jpg,,,1,0,FALSE,3,"Okanogan - Wenatchee National Forest, Marblemount, WA, US",48.550495,-120.7090217,8,,,,8,,open,,subalpine larch,Larix lyallii,subalpine larch,Plantae,69848
123110529,10/3/21,2021-10-03 18:53:35 UTC,Pacific Time (US & Canada),93866,Alex Patia,2022-06-23 17:41:45 UTC,2022-07-20 01:20:43 UTC,research,CC-BY-NC,https://inaturalist-open-data.s3.amazonaws.com/photos/208521777/medium.jpg,,,1,0,FALSE,3,"Okanogan - Wenatchee National Forest, Mazama, WA, US",48.74401333,-120.6848967,3,,,,3,,open,,subalpine larch,Larix lyallii,subalpine larch,Plantae,69848
123472054,6/21/22,2022-06-21 20:44:48 UTC,America/Edmonton,3470333,,2022-06-26 03:29:44 UTC,2024-06-27 06:10:36 UTC,research,CC-BY-NC,https://inaturalist-open-data.s3.amazonaws.com/photos/209175337/medium.jpg,,,1,0,FALSE,3,"Banff National Park, Improvement District No. 9 Banff, AB, CA",51.414595,-116.2431867,48,,,,48,,open,,subalpine larch,Larix lyallii,subalpine larch,Plantae,69848
123964979,6/27/22,2022-06-27 16:25:59 UTC,America/Edmonton,367962,Elizabeth Robin,2022-06-29 13:50:14 UTC,2024-06-27 06:10:26 UTC,research,,https://static.inaturalist.org/photos/210067756/medium.jpg,,,1,0,FALSE,3,"Banff National Park, Improvement District No. 9 Banff, AB, CA",51.32608,-116.2005383,11,,,,11,,open,,subalpine larch,Larix lyallii,subalpine larch,Plantae,69848
124039517,6/27/22,2022-06-28 03:59:29 UTC,America/Vancouver,3431757,,2022-06-29 23:33:03 UTC,2022-10-14 14:39:28 UTC,research,CC-BY-NC,https://inaturalist-open-data.s3.amazonaws.com/photos/210201473/medium.jpg,,,2,0,FALSE,3,"Cathedral Provincial Park and Protected Area, Okanagan-Similkameen, BC, CA",49.0815055,-120.1724167,1172,,,,1172,,open,,subalpine larch,Larix lyallii,subalpine larch,Plantae,69848
124209943,6/28/22,2022-06-28 19:56:00 UTC,America/Vancouver,3431757,,2022-07-01 05:34:29 UTC,2022-07-11 07:10:36 UTC,research,CC-BY-NC,https://inaturalist-open-data.s3.amazonaws.com/photos/210508786/medium.jpg,,,1,0,FALSE,,"Okanagan-Similkameen, BC, Canada",49.05642222,-120.2106167,4,,,,4,,open,,subalpine larch,Larix lyallii,subalpine larch,Plantae,69848
124264629,6/28/22,2022-06-28 17:06:00 UTC,America/Edmonton,4321824,,2022-07-01 16:42:00 UTC,2022-07-01 17:09:31 UTC,research,CC-BY-NC,https://inaturalist-open-data.s3.amazonaws.com/photos/210604213/medium.jpeg,,,1,0,FALSE,,"Southfork Lakes, Alberta T0K 1C0, Canada",49.3311189,-114.3799016,333,,,,333,,open,,subalpine larch,Larix lyallii,subalpine larch,Plantae,69848
124305951,7/1/22,2022-07-01 17:32:23 UTC,America/Edmonton,1527919,,2022-07-01 22:05:28 UTC,2022-07-02 02:56:00 UTC,research,CC-BY-NC,https://inaturalist-open-data.s3.amazonaws.com/photos/210681058/medium.jpg,,,1,0,FALSE,3,"Bow Valley Provincial Park, Kananaskis, AB, CA",50.923695,-115.2870417,12,,,,12,,open,,subalpine larch,Larix lyallii,subalpine larch,Plantae,69848
124643141,7/1/22,2022-07-02 01:56:10 UTC,Pacific Time (US & Canada),307244,Chase Green,2022-07-03 23:05:16 UTC,2024-05-09 01:34:00 UTC,research,,https://static.inaturalist.org/photos/211284838/medium.jpeg,,,2,0,FALSE,2,"Okanogan County, US-WA, US",48.723884,-120.675411,349,,,,349,,open,,subalpine larch,Larix lyallii,subalpine larch,Plantae,69848
125131034,7/6/22,2022-07-06 21:05:21 UTC,America/Edmonton,3397907,Michael Gallo,2022-07-07 06:11:33 UTC,2024-06-27 06:10:17 UTC,research,,https://static.inaturalist.org/photos/212177182/medium.jpg,,,1,0,FALSE,3,"Banff National Park, Improvement District No. 9 Banff, AB, CA",51.41531667,-116.2499167,4,,,,4,,open,,subalpine larch,Larix lyallii,subalpine larch,Plantae,69848
125168653,7/6/22,2022-07-06 19:14:33 UTC,America/Edmonton,1527919,,2022-07-07 14:35:38 UTC,2024-06-27 06:10:12 UTC,research,CC-BY-NC,https://inaturalist-open-data.s3.amazonaws.com/photos/212244326/medium.jpg,,,1,0,FALSE,3,"Banff National Park, Improvement District No. 9 Banff, AB, CA",51.302655,-116.1015028,6,,,,6,,open,,subalpine larch,Larix lyallii,subalpine larch,Plantae,69848
125168737,7/6/22,2022-07-06 19:14:40 UTC,America/Edmonton,1527919,,2022-07-07 14:36:01 UTC,2024-06-27 06:10:08 UTC,research,CC-BY-NC,https://inaturalist-open-data.s3.amazonaws.com/photos/212244405/medium.jpg,,,1,0,FALSE,3,"Banff National Park, Improvement District No. 9 Banff, AB, CA",51.30263667,-116.1014945,6,,,,6,,open,,subalpine larch,Larix lyallii,subalpine larch,Plantae,69848
125395544,7/6/22,2022-07-07 03:17:48 UTC,America/Edmonton,4176908,,2022-07-09 03:07:28 UTC,2024-06-27 06:10:05 UTC,research,CC-BY-NC,https://inaturalist-open-data.s3.amazonaws.com/photos/212647765/medium.jpg,,,1,0,FALSE,3,"Banff National Park, Improvement District No. 9 Banff, AB, CA",51.49335833,-116.0280833,31,,,,31,,open,,subalpine larch,Larix lyallii,subalpine larch,Plantae,69848
125408463,7/6/22,2022-07-07 03:18:30 UTC,America/Edmonton,5821439,,2022-07-09 06:22:35 UTC,2024-06-27 06:09:59 UTC,research,CC-BY-NC,https://inaturalist-open-data.s3.amazonaws.com/photos/212671272/medium.jpg,,,1,0,FALSE,3,"Banff National Park, Improvement District No. 9 Banff, AB, CA",51.49318,-116.0280612,10,,,,10,,open,,subalpine larch,Larix lyallii,subalpine larch,Plantae,69848
125557625,7/9/22,2022-07-09 18:12:37 UTC,Pacific Time (US & Canada),238247,John Leszczynski,2022-07-10 03:49:14 UTC,2022-11-28 06:10:01 UTC,research,CC-BY,https://inaturalist-open-data.s3.amazonaws.com/photos/212936856/medium.jpg,,,1,0,FALSE,3,"Okanogan - Wenatchee National Forest, Tonasket, WA, US",48.662475,-119.9404133,4,,,,4,,open,,subalpine larch,Larix lyallii,subalpine larch,Plantae,69848
125664014,6/24/22,2022-06-25 00:06:00 UTC,America/Vancouver,323802,judith holm,2022-07-10 19:38:45 UTC,2022-08-15 18:42:24 UTC,research,CC-BY-NC-ND,https://inaturalist-open-data.s3.amazonaws.com/photos/213125569/medium.jpeg,,"Lakeview Trail
high subalpine parkland",1,0,FALSE,,"Cathedral Provincial Park, Okanagan-Similkameen, BC, Canada",49.07587167,-120.1914333,,,,,,,open,,subalpine larch,Larix lyallii,subalpine larch,Plantae,69848
125686841,6/25/22,2022-06-25 17:15:00 UTC,America/Vancouver,323802,judith holm,2022-07-10 21:52:39 UTC,2022-08-15 17:14:48 UTC,research,CC-BY-NC-ND,https://inaturalist-open-data.s3.amazonaws.com/photos/213167585/medium.jpeg,,"by Lake of the Woods trail, about 2000 metres",1,0,FALSE,,"Cathedral Provincial Park, Okanagan-Similkameen, BC, Canada",49.0615447,-120.1840093,61,,,,61,,open,,subalpine larch,Larix lyallii,subalpine larch,Plantae,69848
125736137,6/25/22,2022-06-25 19:32:00 UTC,America/Vancouver,323802,judith holm,2022-07-11 04:17:46 UTC,2022-07-11 07:39:56 UTC,research,CC-BY-NC-ND,https://inaturalist-open-data.s3.amazonaws.com/photos/213260661/medium.jpeg,,,1,0,FALSE,,"Cathedral Provincial Park, Okanagan-Similkameen, BC, Canada",49.05232667,-120.1879667,,,,,,,open,,subalpine larch,Larix lyallii,subalpine larch,Plantae,69848
125816921,6/25/22,2022-06-25 19:40:00 UTC,America/Vancouver,323802,judith holm,2022-07-11 18:29:17 UTC,2022-08-15 17:09:22 UTC,research,CC-BY-NC-ND,https://inaturalist-open-data.s3.amazonaws.com/photos/213405291/medium.jpeg,,"first photo view south toward Grimface Mtn.
second photo better shows Giant Cleft and part of Ladyslipper Lake",1,0,FALSE,,"Cathedral Provincial Park, Okanagan-Similkameen, BC, Canada",49.05168833,-120.18881,,,,,,,open,,subalpine larch,Larix lyallii,subalpine larch,Plantae,69848
125853866,7/9/22,2022-07-09 15:12:38 UTC,America/Edmonton,5138026,Dustin Snider,2022-07-11 23:21:06 UTC,2024-02-27 04:38:17 UTC,research,,https://inaturalist-open-data.s3.amazonaws.com/photos/213473654/medium.jpg,,,2,0,FALSE,3,"Ranchland No. 66, AB, CA",50.1002695,-114.699455,11,,,,11,,open,,subalpine larch,Larix lyallii,subalpine larch,Plantae,69848
126407614,7/10/22,2022-07-10 17:58:24 UTC,America/Edmonton,3367509,Robin Holm,2022-07-15 23:04:50 UTC,2022-10-17 21:23:31 UTC,research,CC-BY-SA,https://inaturalist-open-data.s3.amazonaws.com/photos/214475156/medium.jpeg,,,2,0,FALSE,2,"Waterton Park, AB T0K 2M0, Canada",49.13160556,-114.1568806,,,,,,,open,,subalpine larch,Larix lyallii,subalpine larch,Plantae,69848
126425329,7/11/22,2022-07-11 23:17:36 UTC,America/Edmonton,602267,Riley,2022-07-16 02:09:24 UTC,2022-08-15 16:05:54 UTC,research,CC-BY-NC,https://inaturalist-open-data.s3.amazonaws.com/photos/214508683/medium.jpeg,,,1,0,FALSE,2,"Kootenay, CA-BC-EK, CA-BC, CA",51.18288056,-116.0439361,,,,,,,open,gps,subalpine larch,Larix lyallii,subalpine larch,Plantae,69848
126492002,7/15/22,2022-07-15 21:08:17 UTC,America/Edmonton,1448507,Jenny Feick,2022-07-16 15:45:39 UTC,2022-10-14 14:38:40 UTC,research,CC-BY-NC,https://inaturalist-open-data.s3.amazonaws.com/photos/214627949/medium.jpg,,,1,0,FALSE,3,"East Kootenay, BC, CA",50.36937,-116.2235633,4,,,,4,,open,,subalpine larch,Larix lyallii,subalpine larch,Plantae,69848
126513957,7/13/22,2022-07-13 22:22:09 UTC,America/Edmonton,3255392,,2022-07-16 18:06:05 UTC,2024-06-27 06:09:34 UTC,research,CC-BY-NC,https://inaturalist-open-data.s3.amazonaws.com/photos/214666745/medium.jpg,,,2,0,FALSE,3,"Banff National Park, Improvement District No. 9 Banff, AB, CA",51.08924167,-115.85167,32,,,,32,,open,,subalpine larch,Larix lyallii,subalpine larch,Plantae,69848
126668773,7/16/22,2022-07-16 16:43:00 UTC,Pacific Time (US & Canada),307244,Chase Green,2022-07-17 16:50:38 UTC,2022-11-28 03:46:13 UTC,research,,https://static.inaturalist.org/photos/214944968/medium.jpeg,,,1,0,FALSE,,"Chelan County, WA, USA",47.47871433,-120.817399,915,,,,915,,open,,subalpine larch,Larix lyallii,subalpine larch,Plantae,69848
126748729,7/17/22,2022-07-17 19:47:14 UTC,America/Edmonton,1448507,Jenny Feick,2022-07-18 01:36:01 UTC,2022-10-14 14:38:06 UTC,research,CC-BY-NC,https://inaturalist-open-data.s3.amazonaws.com/photos/215093642/medium.jpg,,,1,0,FALSE,3,"East Kootenay, BC, CA",50.44078,-115.7794283,5,,,,5,,open,,subalpine larch,Larix lyallii,subalpine larch,Plantae,69848
126894724,7/16/22,2022-07-16 21:12:00 UTC,America/Edmonton,2151194,,2022-07-19 00:53:39 UTC,2022-10-15 14:56:47 UTC,research,CC-BY-NC,https://inaturalist-open-data.s3.amazonaws.com/photos/215359867/medium.jpeg,,,2,0,FALSE,,"Kananaskis, AB T0L, Canada",50.15876111,-114.598625,18,,,,18,,open,,subalpine larch,Larix lyallii,subalpine larch,Plantae,69848
126991276,7/18/22,2022-07-18 20:24:30 UTC,Pacific Time (US & Canada),330904,David Govatski,2022-07-19 18:41:51 UTC,2022-11-28 03:25:45 UTC,research,CC-BY-NC,https://inaturalist-open-data.s3.amazonaws.com/photos/215537437/medium.jpg,,Blue Lake.,1,0,FALSE,3,"Okanogan - Wenatchee National Forest, Stehekin, WA, US",48.50698333,-120.6725467,4,,,,4,,open,,subalpine larch,Larix lyallii,subalpine larch,Plantae,69848
127020711,7/16/22,2022-07-16 16:56:44 UTC,Mountain Time (US & Canada),4599928,Reed Kraemer,2022-07-19 22:53:59 UTC,2023-02-08 13:19:15 UTC,research,,https://static.inaturalist.org/photos/215591498/medium.jpeg,,,1,0,FALSE,2,"Deer Lodge County, US-MT, US",46.08495653,-113.0317827,7,,,,7,,open,,subalpine larch,Larix lyallii,subalpine larch,Plantae,69848
127163829,7/20/22,2022-07-20 17:16:00 UTC,Pacific Time (US & Canada),330904,David Govatski,2022-07-21 00:33:21 UTC,2022-09-06 04:26:41 UTC,research,CC-BY-NC,https://inaturalist-open-data.s3.amazonaws.com/photos/215856245/medium.jpg,,,1,0,FALSE,3,"Okanogan - Wenatchee National Forest, Mazama, WA, US",48.70228358,-120.6730213,46,,,,46,,open,,subalpine larch,Larix lyallii,subalpine larch,Plantae,69848
127164520,7/20/22,2022-07-20 17:43:19 UTC,Pacific Time (US & Canada),330904,David Govatski,2022-07-21 00:41:58 UTC,2022-09-06 04:26:47 UTC,research,CC-BY-NC,https://inaturalist-open-data.s3.amazonaws.com/photos/215856766/medium.jpg,,"Pacific Crest Trail two miles south of Hart Pass. Elevation around 6,500 feet.",1,0,FALSE,3,"Okanogan - Wenatchee National Forest, Mazama, WA, US",48.70163667,-120.673875,3,,,,3,,open,,subalpine larch,Larix lyallii,subalpine larch,Plantae,69848
127283706,7/18/22,2022-07-18 20:50:00 UTC,America/Vancouver,59776,Adam Huggins,2022-07-21 22:08:39 UTC,2022-08-13 13:10:12 UTC,research,CC-BY-NC,https://inaturalist-open-data.s3.amazonaws.com/photos/216071828/medium.jpeg,,,1,0,FALSE,,"Okanagan-Similkameen, BC, Canada",49.07614444,-120.1936194,10,,,,10,,open,,subalpine larch,Larix lyallii,subalpine larch,Plantae,69848
127300099,7/21/22,2022-07-21 16:16:36 UTC,Pacific Time (US & Canada),330904,David Govatski,2022-07-22 00:48:18 UTC,2022-09-19 03:37:15 UTC,research,CC-BY-NC,https://inaturalist-open-data.s3.amazonaws.com/photos/216104364/medium.jpg,,Cutthroat Lake shoreline.,1,0,FALSE,3,"Okanogan - Wenatchee National Forest, Mazama, WA, US",48.54180637,-120.6796338,52,,,,52,,open,,subalpine larch,Larix lyallii,subalpine larch,Plantae,69848
127306009,7/19/22,2022-07-19 20:50:07 UTC,America/Edmonton,969095,Scott Wilson,2022-07-22 01:50:42 UTC,2022-07-22 04:14:43 UTC,research,CC-BY-NC,https://inaturalist-open-data.s3.amazonaws.com/photos/216115232/medium.jpg,,,1,0,FALSE,3,"Elbow - Sheep Wildland Provincial Park, Kananaskis, AB, CA",50.60254997,-114.9852678,118,,,,118,,open,,subalpine larch,Larix lyallii,subalpine larch,Plantae,69848
127327527,7/18/22,2022-07-19 01:26:00 UTC,America/Vancouver,59776,Adam Huggins,2022-07-22 07:03:00 UTC,2022-08-13 06:15:02 UTC,research,CC-BY-NC,https://inaturalist-open-data.s3.amazonaws.com/photos/216154178/medium.jpeg,,,1,0,FALSE,,"Okanagan-Similkameen, BC, Canada",49.05579722,-120.2126389,5,,,,5,,open,,subalpine larch,Larix lyallii,subalpine larch,Plantae,69848
127435555,7/22/22,2022-07-22 21:10:31 UTC,Pacific Time (US & Canada),330904,David Govatski,2022-07-23 00:20:01 UTC,2024-05-08 00:13:51 UTC,research,CC-BY-NC,https://inaturalist-open-data.s3.amazonaws.com/photos/216349229/medium.jpg,,Growing along the North Cascade Scenic Byway at a pullout just east of Washington Pass. ,1,0,FALSE,3,"Okanogan - Wenatchee National Forest, Mazama, WA, US",48.51843495,-120.6459041,46,,,,46,,open,,subalpine larch,Larix lyallii,subalpine larch,Plantae,69848
127442855,7/19/22,2022-07-19 20:44:00 UTC,America/Vancouver,59776,Adam Huggins,2022-07-23 01:32:06 UTC,2022-08-13 04:24:41 UTC,research,CC-BY-NC,https://inaturalist-open-data.s3.amazonaws.com/photos/216356435/medium.jpeg,,,1,0,FALSE,,"Okanagan-Similkameen, BC, Canada",49.03309336,-120.160073,190,,,,190,,open,,subalpine larch,Larix lyallii,subalpine larch,Plantae,69848
127537136,7/22/22,2022-07-22 21:26:21 UTC,America/Vancouver,5654296,,2022-07-23 17:32:36 UTC,2022-08-14 21:42:44 UTC,research,CC-BY-NC,https://inaturalist-open-data.s3.amazonaws.com/photos/216529225/medium.jpg,,,1,0,FALSE,3,"E.C. Manning Provincial Park, Okanagan-Similkameen, BC, CA",49.01512704,-120.8326032,3,,,,3,,open,,subalpine larch,Larix lyallii,subalpine larch,Plantae,69848
127780351,7/24/22,2022-07-24 17:54:53 UTC,America/Vancouver,2581598,Craig Sandvig,2022-07-25 01:39:39 UTC,2022-07-25 23:08:00 UTC,research,,https://static.inaturalist.org/photos/216969631/medium.jpeg,,,1,0,FALSE,2,"Central Kootenay, CA-BC, CA",50.08885467,-117.1625545,3,,,,3,,open,,subalpine larch,Larix lyallii,subalpine larch,Plantae,69848
127805171,7/24/22,2022-07-24 19:09:47 UTC,Pacific Time (US & Canada),5931366,,2022-07-25 06:00:11 UTC,2022-09-23 16:52:32 UTC,research,CC-BY-NC,https://inaturalist-open-data.s3.amazonaws.com/photos/217016863/medium.jpg,,,1,0,FALSE,3,"Okanogan - Wenatchee National Forest, Marblemount, WA, US",48.61267915,-120.8752915,7292,,,,7292,,open,,subalpine larch,Larix lyallii,subalpine larch,Plantae,69848
127806375,7/24/22,2022-07-24 23:27:20 UTC,America/Edmonton,3397907,Michael Gallo,2022-07-25 06:19:00 UTC,2022-08-01 17:45:50 UTC,research,,https://static.inaturalist.org/photos/217019395/medium.jpg,,,1,0,FALSE,3,"Yoho National Park, Columbia Shuswap, BC, CA",51.34903667,-116.3293617,4,,,,4,,open,,subalpine larch,Larix lyallii,subalpine larch,Plantae,69848
127877411,7/24/22,2022-07-24 18:42:51 UTC,America/Edmonton,3222030,,2022-07-25 18:18:35 UTC,2024-06-27 06:09:23 UTC,research,CC-BY-NC,https://inaturalist-open-data.s3.amazonaws.com/photos/217146360/medium.jpg,,,1,0,FALSE,3,"Banff National Park, Improvement District No. 9 Banff, AB, CA",51.0891695,-115.85163,10,,,,10,,open,,subalpine larch,Larix lyallii,subalpine larch,Plantae,69848
128084824,7/26/22,2022-07-26 18:35:30 UTC,Mountain Time (US & Canada),5785267,Mason,2022-07-27 01:41:13 UTC,2023-02-08 13:18:31 UTC,research,,https://static.inaturalist.org/photos/217528851/medium.jpeg,,,1,0,FALSE,2,"Browning, MT 59417, USA",48.71230119,-113.6524006,,,,,,,open,gps,subalpine larch,Larix lyallii,subalpine larch,Plantae,69848
128215118,7/22/22,2022-07-23 02:04:00 UTC,Pacific Time (US & Canada),521910,Adam Schneider,2022-07-27 22:46:16 UTC,2022-09-06 04:26:57 UTC,research,CC-BY,https://inaturalist-open-data.s3.amazonaws.com/photos/217763436/medium.jpg,,Brand new cones.,1,0,FALSE,,"PCT south of Harts Pass, Okanogan County, WA, USA",48.69432592,-120.6720782,,,,,,,open,,subalpine larch,Larix lyallii,subalpine larch,Plantae,69848
128550907,7/18/22,2022-07-18 19:54:00 UTC,America/Edmonton,417378,Joshua Eastlake,2022-07-30 02:42:13 UTC,2024-06-27 06:09:19 UTC,research,CC-BY-NC,https://inaturalist-open-data.s3.amazonaws.com/photos/218365440/medium.jpeg,,,2,0,FALSE,,"Bourgeau Lake, Alberta, CA",51.15210165,-115.7628206,3025,,,,3025,,open,,subalpine larch,Larix lyallii,subalpine larch,Plantae,69848
128729568,7/23/22,2022-07-23 12:39:00 UTC,America/Edmonton,1641019,Shane Johnson,2022-07-31 02:20:24 UTC,2023-07-08 09:15:48 UTC,research,CC0,https://inaturalist-open-data.s3.amazonaws.com/photos/218677888/medium.jpeg,,,1,0,FALSE,,"East Kootenay, BC, Canada",50.52640333,-115.2393717,,,,,,,open,,subalpine larch,Larix lyallii,subalpine larch,Plantae,69848
128731983,7/23/22,2022-07-23 14:38:00 UTC,America/Edmonton,1641019,Shane Johnson,2022-07-31 02:41:25 UTC,2023-07-08 09:22:12 UTC,research,CC0,https://inaturalist-open-data.s3.amazonaws.com/photos/218687061/medium.jpeg,,,1,0,FALSE,,"East Kootenay, British Columbia, Canada",50.52015833,-115.2421367,,,,,,,open,,subalpine larch,Larix lyallii,subalpine larch,Plantae,69848
128734186,7/23/22,2022-07-23 14:44:00 UTC,America/Edmonton,1641019,Shane Johnson,2022-07-31 03:00:14 UTC,2023-07-08 09:22:46 UTC,research,CC0,https://inaturalist-open-data.s3.amazonaws.com/photos/218688293/medium.jpeg,,,1,0,FALSE,,"East Kootenay, British Columbia, Canada",50.51787,-115.242615,,,,,,,open,,subalpine larch,Larix lyallii,subalpine larch,Plantae,69848
128734196,7/23/22,2022-07-23 14:56:00 UTC,America/Edmonton,1641019,Shane Johnson,2022-07-31 03:00:17 UTC,2023-07-08 09:23:30 UTC,research,CC0,https://inaturalist-open-data.s3.amazonaws.com/photos/218689335/medium.jpeg,,,1,0,FALSE,,"East Kootenay, BC, Canada",50.514,-115.2416533,,,,,,,open,,subalpine larch,Larix lyallii,subalpine larch,Plantae,69848
128734207,7/23/22,2022-07-23 15:13:00 UTC,America/Edmonton,1641019,Shane Johnson,2022-07-31 03:00:19 UTC,2023-07-08 09:25:07 UTC,research,CC0,https://inaturalist-open-data.s3.amazonaws.com/photos/218691175/medium.jpeg,,,1,0,FALSE,,"East Kootenay, British Columbia, Canada",50.50959167,-115.2401683,,,,,,,open,,subalpine larch,Larix lyallii,subalpine larch,Plantae,69848
128737251,7/23/22,2022-07-23 15:21:00 UTC,America/Edmonton,1641019,Shane Johnson,2022-07-31 03:26:59 UTC,2023-07-08 09:27:09 UTC,research,CC0,https://inaturalist-open-data.s3.amazonaws.com/photos/218693228/medium.jpeg,,,1,0,FALSE,,"East Kootenay, British Columbia, Canada",50.50761,-115.2390283,,,,,,,open,,subalpine larch,Larix lyallii,subalpine larch,Plantae,69848
128737261,7/23/22,2022-07-23 15:36:00 UTC,America/Edmonton,1641019,Shane Johnson,2022-07-31 03:27:02 UTC,2023-07-08 09:28:14 UTC,research,CC0,https://inaturalist-open-data.s3.amazonaws.com/photos/218694920/medium.jpeg,,,1,0,FALSE,,"East Kootenay, British Columbia, Canada",50.503465,-115.2364783,,,,,,,open,,subalpine larch,Larix lyallii,subalpine larch,Plantae,69848
128792245,7/28/22,2022-07-28 18:07:37 UTC,Mountain Time (US & Canada),1349967,Viktoria Wagner,2022-07-31 13:50:23 UTC,2022-09-09 17:27:24 UTC,research,CC-BY-NC,https://inaturalist-open-data.s3.amazonaws.com/photos/218795708/medium.jpg,,,1,0,FALSE,3,"Kootenai National Forest, Eureka, MT, US",48.95593667,-114.9252617,24,,,,24,,open,,subalpine larch,Larix lyallii,subalpine larch,Plantae,69848
128794652,7/23/22,2022-07-23 20:45:00 UTC,America/Edmonton,1641019,Shane Johnson,2022-07-31 14:06:37 UTC,2023-07-08 09:52:31 UTC,research,CC0,https://inaturalist-open-data.s3.amazonaws.com/photos/218792425/medium.jpeg,,,1,0,FALSE,,"East Kootenay, British Columbia, Canada",50.47466667,-115.236095,,,,,,,open,,subalpine larch,Larix lyallii,subalpine larch,Plantae,69848
128797448,7/23/22,2022-07-23 21:47:00 UTC,America/Edmonton,1641019,Shane Johnson,2022-07-31 14:24:15 UTC,2023-07-08 08:56:49 UTC,research,CC0,https://inaturalist-open-data.s3.amazonaws.com/photos/218800909/medium.jpeg,,,1,0,FALSE,,"East Kootenay, BC, Canada",50.47332833,-115.2413583,,,,,,,open,,subalpine larch,Larix lyallii,subalpine larch,Plantae,69848
128814218,7/24/22,2022-07-24 14:50:00 UTC,America/Edmonton,1641019,Shane Johnson,2022-07-31 16:01:27 UTC,2023-07-08 09:04:16 UTC,research,CC0,https://inaturalist-open-data.s3.amazonaws.com/photos/218820580/medium.jpeg,,,1,0,FALSE,,"East Kootenay, British Columbia, Canada",50.47990333,-115.24608,,,,,,,open,,subalpine larch,Larix lyallii,subalpine larch,Plantae,69848
128819533,7/24/22,2022-07-24 15:19:00 UTC,America/Edmonton,1641019,Shane Johnson,2022-07-31 16:28:59 UTC,2023-07-08 09:09:37 UTC,research,CC0,https://inaturalist-open-data.s3.amazonaws.com/photos/218836535/medium.jpeg,,,1,0,FALSE,,"East Kootenay, BC, Canada",50.47934167,-115.2532833,,,,,,,open,,subalpine larch,Larix lyallii,subalpine larch,Plantae,69848
128823343,7/24/22,2022-07-24 17:09:00 UTC,America/Edmonton,1641019,Shane Johnson,2022-07-31 16:47:35 UTC,2023-07-08 09:13:39 UTC,research,CC0,https://inaturalist-open-data.s3.amazonaws.com/photos/218847153/medium.jpeg,,,1,0,FALSE,,"East Kootenay, British Columbia, Canada",50.4815,-115.2626183,,,,,,,open,,subalpine larch,Larix lyallii,subalpine larch,Plantae,69848
128845987,7/18/22,2022-07-18 20:09:48 UTC,Pacific Time (US & Canada),3243807,,2022-07-31 18:55:31 UTC,2022-09-06 04:30:24 UTC,research,CC-BY-NC,https://inaturalist-open-data.s3.amazonaws.com/photos/218889781/medium.jpg,,,1,0,FALSE,3,"Okanogan - Wenatchee National Forest, Marblemount, WA, US",48.551625,-120.70658,7,,,,7,,open,,subalpine larch,Larix lyallii,subalpine larch,Plantae,69848
128931982,7/31/22,2022-07-31 19:18:32 UTC,Pacific Time (US & Canada),1510020,Aaron Wells,2022-08-01 04:28:49 UTC,2022-08-21 16:51:16 UTC,research,CC-BY-NC,https://inaturalist-open-data.s3.amazonaws.com/photos/219048130/medium.jpg,,,1,0,FALSE,3,"Okanogan - Wenatchee National Forest, Deming, WA, US",48.73750333,-120.6785283,4,,,,4,,open,,subalpine larch,Larix lyallii,subalpine larch,Plantae,69848
129012128,7/31/22,2022-07-31 19:27:00 UTC,America/Edmonton,1403418,,2022-08-01 18:00:32 UTC,2024-06-27 06:09:15 UTC,research,CC-BY-SA,https://inaturalist-open-data.s3.amazonaws.com/photos/219190611/medium.jpeg,,,1,0,FALSE,,"Improvement District No. 9, AB T0L, Canada",51.3105959,-115.9303238,123,,,,123,,open,,subalpine larch,Larix lyallii,subalpine larch,Plantae,69848
129234266,10/2/16,2016-10-02 22:41:00 UTC,America/Vancouver,2980912,Drew Brayshaw,2022-08-03 03:41:34 UTC,2022-09-07 02:12:53 UTC,research,CC-BY-NC-SA,https://inaturalist-open-data.s3.amazonaws.com/photos/219596097/medium.jpeg,frosty,,1,0,FALSE,,"Fraser Valley, BC, Canada",49.02713658,-120.8308652,122,,,,122,,open,,subalpine larch,Larix lyallii,subalpine larch,Plantae,69848
129346939,7/25/22,2022-07-25 17:19:10 UTC,America/Edmonton,1205273,,2022-08-03 23:48:33 UTC,2022-10-14 14:14:47 UTC,research,CC-BY-NC,https://inaturalist-open-data.s3.amazonaws.com/photos/219800248/medium.jpg,,,1,0,FALSE,3,"Spray Valley Provincial Park, Kananaskis, AB, CA",50.82963667,-115.36332,16,,,,16,,open,,subalpine larch,Larix lyallii,subalpine larch,Plantae,69848
129363796,8/3/22,2022-08-03 16:25:45 UTC,America/Edmonton,1899738,,2022-08-04 02:24:54 UTC,2024-06-27 06:09:09 UTC,research,CC-BY-NC,https://inaturalist-open-data.s3.amazonaws.com/photos/219830302/medium.jpg,,,1,0,FALSE,3,"Banff National Park, Banff, CA-AB-FN, CA-AB, CA",50.94397286,-115.5927739,8,,,,8,,open,,subalpine larch,Larix lyallii,subalpine larch,Plantae,69848
129502956,7/30/22,2022-07-30 20:05:42 UTC,America/Edmonton,3938277,,2022-08-05 04:07:52 UTC,2024-06-27 06:09:04 UTC,research,CC-BY-NC,https://inaturalist-open-data.s3.amazonaws.com/photos/220086134/medium.jpg,,,1,0,FALSE,3,"Banff National Park, Improvement District No. 9 Banff, AB, CA",51.41256794,-116.2465145,4,,,,4,,open,,subalpine larch,Larix lyallii,subalpine larch,Plantae,69848
129626269,8/5/22,2022-08-05 19:03:28 UTC,Pacific Time (US & Canada),3487880,Alexander Geragotelis,2022-08-06 02:51:24 UTC,2023-08-18 05:19:44 UTC,research,CC-BY-NC,https://inaturalist-open-data.s3.amazonaws.com/photos/220315133/medium.jpeg,,,2,0,FALSE,2,"Comt de Skagit, Washington, tats-Unis",48.50834656,-120.7674942,,,,,,,open,gps,subalpine larch,Larix lyallii,subalpine larch,Plantae,69848
129924562,8/6/22,2022-08-06 23:59:55 UTC,America/Edmonton,3615306,Shawn Brescia,2022-08-08 02:07:23 UTC,2022-10-14 14:37:14 UTC,research,CC-BY-NC,https://inaturalist-open-data.s3.amazonaws.com/photos/220869738/medium.jpg,,,1,0,FALSE,3,"Yoho National Park, Columbia Shuswap, BC, CA",51.3542566,-116.3392329,141,,,,141,,open,,subalpine larch,Larix lyallii,subalpine larch,Plantae,69848
129932910,7/28/22,2022-07-28 22:12:08 UTC,America/Edmonton,3919300,Suhei Castro,2022-08-08 03:19:21 UTC,2022-08-09 15:12:44 UTC,research,CC-BY-NC,https://inaturalist-open-data.s3.amazonaws.com/photos/220884300/medium.jpg,,,1,0,FALSE,3,"East Kootenay, BC, CA",50.45277833,-116.5990133,10,,,,10,,open,,subalpine larch,Larix lyallii,subalpine larch,Plantae,69848
129939477,8/7/22,2022-08-07 18:50:00 UTC,America/Edmonton,2476609,Ian Adams,2022-08-08 04:42:34 UTC,2022-08-09 00:12:49 UTC,research,CC-BY,https://inaturalist-open-data.s3.amazonaws.com/photos/220894431/medium.jpg,,,1,0,FALSE,,"East Kootenay, BC, Canada",50.434542,-115.787665,,,,,,,open,,subalpine larch,Larix lyallii,subalpine larch,Plantae,69848
130033757,8/7/22,2022-08-07 21:17:43 UTC,Pacific Time (US & Canada),3448676,,2022-08-08 21:38:08 UTC,2023-06-21 00:54:13 UTC,research,CC-BY-NC,https://inaturalist-open-data.s3.amazonaws.com/photos/221074212/medium.jpg,,Pubescent new growth,2,0,FALSE,3,"Okanogan - Wenatchee National Forest, Loomis, WA, US",48.916005,-119.968545,4,,,,4,,open,,subalpine larch,Larix lyallii,subalpine larch,Plantae,69848
130182121,8/8/22,2022-08-08 17:39:36 UTC,Pacific Time (US & Canada),205708,Remington Jackson,2022-08-10 00:17:20 UTC,2022-11-24 20:13:35 UTC,research,CC-BY-NC,https://inaturalist-open-data.s3.amazonaws.com/photos/221350223/medium.jpg,,,1,0,FALSE,3,"Chelan County, US-WA, US",47.47701667,-120.8132467,3,,,,3,,open,,subalpine larch,Larix lyallii,subalpine larch,Plantae,69848
130182211,8/8/22,2022-08-08 19:40:00 UTC,Pacific Time (US & Canada),205708,Remington Jackson,2022-08-10 00:18:13 UTC,2022-11-24 20:13:22 UTC,research,CC-BY-NC,https://inaturalist-open-data.s3.amazonaws.com/photos/221350383/medium.jpg,,,1,0,FALSE,3,"Chelan County, US-WA, US",47.48070833,-120.7835833,10,,,,10,,open,,subalpine larch,Larix lyallii,subalpine larch,Plantae,69848
130187470,8/8/22,2022-08-09 00:53:09 UTC,Pacific Time (US & Canada),205708,Remington Jackson,2022-08-10 01:12:07 UTC,2022-11-24 20:12:38 UTC,research,CC-BY-NC,https://inaturalist-open-data.s3.amazonaws.com/photos/221360516/medium.jpg,,,1,0,FALSE,3,"Chelan County, US-WA, US",47.48537,-120.824805,21,,,,21,,open,,subalpine larch,Larix lyallii,subalpine larch,Plantae,69848
130187563,8/8/22,2022-08-09 00:45:55 UTC,Pacific Time (US & Canada),205708,Remington Jackson,2022-08-10 01:13:25 UTC,2022-11-24 20:12:28 UTC,research,CC-BY-NC,https://inaturalist-open-data.s3.amazonaws.com/photos/221360771/medium.jpg,,,1,0,FALSE,3,"Chelan County, US-WA, US",47.48492833,-120.8247967,28,,,,28,,open,,subalpine larch,Larix lyallii,subalpine larch,Plantae,69848
130189895,8/8/22,2022-08-08 23:12:36 UTC,Pacific Time (US & Canada),205708,Remington Jackson,2022-08-10 01:38:57 UTC,2022-11-24 20:10:53 UTC,research,CC-BY-NC,https://inaturalist-open-data.s3.amazonaws.com/photos/221365689/medium.jpg,,,1,0,FALSE,3,"Okanogan - Wenatchee National Forest, Leavenworth, WA, US",47.48098333,-120.8195117,3,,,,3,,open,,subalpine larch,Larix lyallii,subalpine larch,Plantae,69848
130191471,8/8/22,2022-08-08 21:30:03 UTC,Pacific Time (US & Canada),205708,Remington Jackson,2022-08-10 01:57:00 UTC,2022-11-24 20:10:33 UTC,research,CC-BY-NC,https://inaturalist-open-data.s3.amazonaws.com/photos/221369030/medium.jpg,,,1,0,FALSE,3,"Okanogan - Wenatchee National Forest, Leavenworth, WA, US",47.47748667,-120.8109583,4,,,,4,,open,,subalpine larch,Larix lyallii,subalpine larch,Plantae,69848
130191595,8/8/22,2022-08-08 21:19:43 UTC,Pacific Time (US & Canada),205708,Remington Jackson,2022-08-10 01:58:25 UTC,2022-11-24 20:10:24 UTC,research,CC-BY-NC,https://inaturalist-open-data.s3.amazonaws.com/photos/221369288/medium.jpg,,,1,0,FALSE,3,"Okanogan - Wenatchee National Forest, Leavenworth, WA, US",47.47746333,-120.8070967,10,,,,10,,open,,subalpine larch,Larix lyallii,subalpine larch,Plantae,69848
130192278,8/8/22,2022-08-08 20:43:19 UTC,Pacific Time (US & Canada),205708,Remington Jackson,2022-08-10 02:06:01 UTC,2022-11-24 20:10:13 UTC,research,CC-BY-NC,https://inaturalist-open-data.s3.amazonaws.com/photos/221370519/medium.jpg,,,1,0,FALSE,3,"Okanogan - Wenatchee National Forest, Leavenworth, WA, US",47.481645,-120.79953,27,,,,27,,open,,subalpine larch,Larix lyallii,subalpine larch,Plantae,69848
130192337,8/8/22,2022-08-08 20:55:30 UTC,Pacific Time (US & Canada),205708,Remington Jackson,2022-08-10 02:06:34 UTC,2022-11-24 20:09:36 UTC,research,CC-BY-NC,https://inaturalist-open-data.s3.amazonaws.com/photos/221370616/medium.jpg,,,1,0,FALSE,3,"Okanogan - Wenatchee National Forest, Leavenworth, WA, US",47.48037833,-120.8014133,4,,,,4,,open,,subalpine larch,Larix lyallii,subalpine larch,Plantae,69848
130192458,8/8/22,2022-08-08 20:18:58 UTC,Pacific Time (US & Canada),205708,Remington Jackson,2022-08-10 02:08:24 UTC,2022-11-24 20:08:37 UTC,research,CC-BY-NC,https://inaturalist-open-data.s3.amazonaws.com/photos/221370890/medium.jpg,,,1,0,FALSE,3,"Okanogan - Wenatchee National Forest, Leavenworth, WA, US",47.47916667,-120.7954467,4,,,,4,,open,,subalpine larch,Larix lyallii,subalpine larch,Plantae,69848
130192566,8/8/22,2022-08-08 20:09:25 UTC,Pacific Time (US & Canada),205708,Remington Jackson,2022-08-10 02:09:38 UTC,2022-11-24 20:08:13 UTC,research,CC-BY-NC,https://inaturalist-open-data.s3.amazonaws.com/photos/221371132/medium.jpg,,,1,0,FALSE,3,"Okanogan - Wenatchee National Forest, Leavenworth, WA, US",47.47923333,-120.7933967,6,,,,6,,open,,subalpine larch,Larix lyallii,subalpine larch,Plantae,69848
130193120,8/8/22,2022-08-08 19:52:02 UTC,Pacific Time (US & Canada),205708,Remington Jackson,2022-08-10 02:14:35 UTC,2022-11-24 20:06:37 UTC,research,CC-BY-NC,https://inaturalist-open-data.s3.amazonaws.com/photos/221371925/medium.jpg,,,1,0,FALSE,3,"Okanogan - Wenatchee National Forest, Leavenworth, WA, US",47.479855,-120.78602,6,,,,6,,open,,subalpine larch,Larix lyallii,subalpine larch,Plantae,69848
130193187,8/8/22,2022-08-08 19:46:01 UTC,Pacific Time (US & Canada),205708,Remington Jackson,2022-08-10 02:15:20 UTC,2022-11-24 20:06:18 UTC,research,CC-BY-NC,https://inaturalist-open-data.s3.amazonaws.com/photos/221372017/medium.jpg,,,1,0,FALSE,3,"Okanogan - Wenatchee National Forest, Leavenworth, WA, US",47.48068833,-120.784455,3,,,,3,,open,,subalpine larch,Larix lyallii,subalpine larch,Plantae,69848
130193210,8/8/22,2022-08-08 19:47:00 UTC,Pacific Time (US & Canada),205708,Remington Jackson,2022-08-10 02:15:41 UTC,2022-11-24 20:06:11 UTC,research,CC-BY-NC,https://inaturalist-open-data.s3.amazonaws.com/photos/221372087/medium.jpg,,,1,0,FALSE,3,"Okanogan - Wenatchee National Forest, Leavenworth, WA, US",47.48063333,-120.7845167,4,,,,4,,open,,subalpine larch,Larix lyallii,subalpine larch,Plantae,69848
130197983,8/8/22,2022-08-08 18:02:57 UTC,Pacific Time (US & Canada),205708,Remington Jackson,2022-08-10 03:12:46 UTC,2022-11-10 02:37:31 UTC,research,CC-BY-NC,https://inaturalist-open-data.s3.amazonaws.com/photos/221382268/medium.jpg,,,1,0,FALSE,3,"Okanogan - Wenatchee National Forest, Leavenworth, WA, US",47.47753,-120.8045667,4,,,,4,,open,,subalpine larch,Larix lyallii,subalpine larch,Plantae,69848
130198231,8/8/22,2022-08-08 17:55:01 UTC,Pacific Time (US & Canada),205708,Remington Jackson,2022-08-10 03:16:49 UTC,2022-11-24 20:06:02 UTC,research,CC-BY-NC,https://inaturalist-open-data.s3.amazonaws.com/photos/221382680/medium.jpg,,,1,0,FALSE,3,"Okanogan - Wenatchee National Forest, Leavenworth, WA, US",47.47798667,-120.8059083,3,,,,3,,open,,subalpine larch,Larix lyallii,subalpine larch,Plantae,69848
130238952,8/9/22,2022-08-09 18:36:56 UTC,America/Edmonton,1527919,,2022-08-10 13:40:34 UTC,2024-06-27 06:08:58 UTC,research,CC-BY-NC,https://inaturalist-open-data.s3.amazonaws.com/photos/221457433/medium.jpg,,,1,0,FALSE,3,"Banff National Park, Improvement District No. 9 Banff, AB, CA",51.098948,-115.866108,165,,,,165,,open,,subalpine larch,Larix lyallii,subalpine larch,Plantae,69848
130275189,8/8/22,2022-08-08 16:10:29 UTC,Pacific Time (US & Canada),205708,Remington Jackson,2022-08-10 18:34:05 UTC,2022-11-24 20:02:18 UTC,research,CC-BY-NC,https://inaturalist-open-data.s3.amazonaws.com/photos/221523834/medium.jpg,,,1,0,FALSE,3,"Okanogan - Wenatchee National Forest, Leavenworth, WA, US",47.47996167,-120.820175,7,,,,7,,open,,subalpine larch,Larix lyallii,subalpine larch,Plantae,69848
130305730,8/9/22,2022-08-09 20:02:49 UTC,America/Edmonton,3222030,,2022-08-10 22:51:18 UTC,2024-06-27 06:08:54 UTC,research,CC-BY-NC,https://inaturalist-open-data.s3.amazonaws.com/photos/221581535/medium.jpg,,,1,0,FALSE,3,"Banff National Park, Improvement District No. 9 Banff, AB, CA",51.31210833,-115.928825,24,,,,24,,open,,subalpine larch,Larix lyallii,subalpine larch,Plantae,69848
130318428,8/8/22,2022-08-08 15:38:39 UTC,Pacific Time (US & Canada),205708,Remington Jackson,2022-08-11 00:58:44 UTC,2022-11-24 19:59:31 UTC,research,CC-BY-NC,https://inaturalist-open-data.s3.amazonaws.com/photos/221605321/medium.jpg,,,1,0,FALSE,3,"Okanogan - Wenatchee National Forest, Leavenworth, WA, US",47.482875,-120.823325,4,,,,4,,open,,subalpine larch,Larix lyallii,subalpine larch,Plantae,69848
130578036,8/10/22,2022-08-10 18:12:06 UTC,America/Edmonton,1285263,,2022-08-13 02:00:54 UTC,2022-10-14 14:12:20 UTC,research,CC0,https://inaturalist-open-data.s3.amazonaws.com/photos/222090254/medium.jpg,,,1,0,FALSE,3,"Elbow - Sheep Wildland Provincial Park, Kananaskis, AB, CA",50.60315333,-114.98542,4,,,,4,,open,,subalpine larch,Larix lyallii,subalpine larch,Plantae,69848
130578093,8/10/22,2022-08-10 18:10:40 UTC,America/Edmonton,1285263,,2022-08-13 02:01:17 UTC,2022-10-14 14:12:12 UTC,research,CC0,https://inaturalist-open-data.s3.amazonaws.com/photos/222090335/medium.jpg,,,1,0,FALSE,3,"Elbow - Sheep Wildland Provincial Park, Kananaskis, AB, CA",50.602725,-114.9859,4,,,,4,,open,,subalpine larch,Larix lyallii,subalpine larch,Plantae,69848
131008924,8/15/22,2022-08-15 21:04:09 UTC,Pacific Time (US & Canada),2772686,,2022-08-16 00:21:25 UTC,2022-11-24 19:29:58 UTC,research,CC-BY-NC,https://inaturalist-open-data.s3.amazonaws.com/photos/222880818/medium.jpeg,,,1,0,FALSE,2,"Chelan County, WA, USA",48.50349444,-120.7473056,,,,,,,open,gps,subalpine larch,Larix lyallii,subalpine larch,Plantae,69848
131267996,8/17/22,2022-08-17 16:29:22 UTC,America/Edmonton,3591772,,2022-08-17 23:33:58 UTC,2022-08-20 13:45:13 UTC,research,CC-BY-NC,https://inaturalist-open-data.s3.amazonaws.com/photos/223358589/medium.jpg,,,1,0,FALSE,3,"Mount Assiniboine Provincial Park, East Kootenay, BC, CA",51.06773333,-115.7898467,7,,,,7,,open,,subalpine larch,Larix lyallii,subalpine larch,Plantae,69848
131269162,8/17/22,2022-08-17 19:05:05 UTC,America/Edmonton,2820795,,2022-08-17 23:46:50 UTC,2023-08-02 14:03:02 UTC,research,CC-BY-NC,https://inaturalist-open-data.s3.amazonaws.com/photos/223361189/medium.jpeg,,,2,0,FALSE,2,"Peter Lougheed, CA-AB-FN, CA-AB, CA",50.76674934,-115.3686022,9,,,,9,,open,,subalpine larch,Larix lyallii,subalpine larch,Plantae,69848
131277856,7/4/11,2011-07-04 18:29:00 UTC,America/Edmonton,1041255,Jeremiah Kennedy,2022-08-18 01:10:44 UTC,2022-10-14 14:10:42 UTC,research,,https://static.inaturalist.org/photos/223375769/medium.jpg,,,1,0,FALSE,,"Waterton Park, AB T0K 2M0, Canada",49.05096,-113.908563,7984,,,,7984,,open,,subalpine larch,Larix lyallii,subalpine larch,Plantae,69848
131408213,8/10/22,2022-08-10 16:06:28 UTC,Pacific Time (US & Canada),5941342,Hannah Thorp,2022-08-19 02:01:57 UTC,2022-09-09 16:35:19 UTC,research,,https://static.inaturalist.org/photos/223623036/medium.jpg,,Growing in rocky terrain at high elevation,1,0,FALSE,3,"Okanogan County, US-WA, US",48.77577966,-120.7266635,3,,,,3,,open,,subalpine larch,Larix lyallii,subalpine larch,Plantae,69848
131484152,8/18/22,2022-08-18 21:49:55 UTC,Pacific Time (US & Canada),5780438,,2022-08-19 18:45:54 UTC,2022-11-24 19:15:03 UTC,research,CC-BY-NC,https://inaturalist-open-data.s3.amazonaws.com/photos/223764697/medium.jpg,,,1,0,FALSE,3,"Okanogan - Wenatchee National Forest, Leavenworth, WA, US",47.480705,-120.7831283,5,,,,5,,open,,subalpine larch,Larix lyallii,subalpine larch,Plantae,69848
131505060,8/19/22,2022-08-19 16:52:00 UTC,America/Edmonton,1527919,,2022-08-19 21:53:50 UTC,2022-08-20 04:03:26 UTC,research,CC-BY-NC,https://inaturalist-open-data.s3.amazonaws.com/photos/223802688/medium.jpg,,,1,0,FALSE,3,"Peter Lougheed Provincial Park, Kananaskis, AB, CA",50.59186167,-115.0074306,64,,,,64,,open,,subalpine larch,Larix lyallii,subalpine larch,Plantae,69848
131530130,8/10/22,2022-08-10 15:36:16 UTC,Pacific Time (US & Canada),3871321,Betsy Knutson-Keller,2022-08-20 02:12:05 UTC,2022-11-24 19:11:37 UTC,research,,https://static.inaturalist.org/photos/223850531/medium.jpg,,"On dry mountainside 
",2,0,FALSE,3,"Okanogan County, US-WA, US",48.77828812,-120.7234009,9,,,,9,,open,,subalpine larch,Larix lyallii,subalpine larch,Plantae,69848
131593102,8/9/22,2022-08-09 21:55:00 UTC,Pacific Time (US & Canada),36788,David Robichaud,2022-08-20 15:40:55 UTC,2022-08-21 14:43:30 UTC,research,CC-BY-NC,https://inaturalist-open-data.s3.amazonaws.com/photos/223960940/medium.jpg,Slate Peak,,1,0,FALSE,,"Whatcom, Washington, United States",48.73756389,-120.6785444,4,,,,4,,open,,subalpine larch,Larix lyallii,subalpine larch,Plantae,69848
131620584,8/10/22,2022-08-10 16:34:07 UTC,Pacific Time (US & Canada),5962405,,2022-08-20 18:52:19 UTC,2022-09-09 15:32:34 UTC,research,CC-BY-NC,https://inaturalist-open-data.s3.amazonaws.com/photos/224012952/medium.jpg,,"Very soft needles in bunches along the branch. Upward growing cones. I believe it to be a Larch, growing at very high elevation ",1,0,FALSE,3,"Okanogan - Wenatchee National Forest, Mazama, WA, US",48.77593333,-120.7265917,49,,,,49,,open,,subalpine larch,Larix lyallii,subalpine larch,Plantae,69848
131685435,8/18/22,2022-08-18 20:35:18 UTC,America/Edmonton,1448507,Jenny Feick,2022-08-21 04:03:22 UTC,2022-08-23 14:15:32 UTC,research,CC-BY-NC,https://inaturalist-open-data.s3.amazonaws.com/photos/224135558/medium.jpg,,,1,0,FALSE,3,"Top of the World Provincial Park, East Kootenay, BC, CA",49.825945,-115.43235,13,,,,13,,open,,subalpine larch,Larix lyallii,subalpine larch,Plantae,69848
131721903,8/20/22,2022-08-20 20:23:00 UTC,Pacific Time (US & Canada),5354436,Dave Drum,2022-08-21 12:53:32 UTC,2022-09-06 04:29:58 UTC,research,CC-BY-NC,https://inaturalist-open-data.s3.amazonaws.com/photos/225448189/medium.jpeg,,"Elevation is around 6500 feet, cones have long whiskers as shown in 2nd and 3rd photos and needles are longer than Western Larch as seen in last photo.",1,0,FALSE,,"Skagit County, WA, USA",48.55418949,-120.7008798,2,,,,2,,open,,subalpine larch,Larix lyallii,subalpine larch,Plantae,69848
131844416,8/20/22,2022-08-20 18:43:25 UTC,America/Edmonton,550285,,2022-08-22 03:46:58 UTC,2024-06-27 06:08:50 UTC,research,CC-BY,https://inaturalist-open-data.s3.amazonaws.com/photos/224432195/medium.jpg,,,2,0,FALSE,3,"Banff National Park, Improvement District No. 9 Banff, AB, CA",51.346395,-116.2278367,10,,,,10,,open,,subalpine larch,Larix lyallii,subalpine larch,Plantae,69848
131969958,8/20/22,2022-08-20 18:19:58 UTC,America/Edmonton,2010053,,2022-08-23 03:31:00 UTC,2022-08-23 14:03:14 UTC,research,CC-BY-NC,https://inaturalist-open-data.s3.amazonaws.com/photos/224668435/medium.jpg,,,1,0,FALSE,3,"Elk Lakes Provincial Park, East Kootenay, BC, CA",50.57560833,-115.0994555,15,,,,15,,open,,subalpine larch,Larix lyallii,subalpine larch,Plantae,69848
132101311,6/26/22,2022-06-26 18:30:00 UTC,America/Vancouver,323802,judith holm,2022-08-24 04:14:17 UTC,2022-10-14 14:36:46 UTC,research,CC-BY-NC-ND,https://inaturalist-open-data.s3.amazonaws.com/photos/224912077/medium.jpeg,,,1,0,FALSE,,"Cathedral Provincial Park, Okanagan-Similkameen, BC, Canada",49.063945,-120.20602,,,,,,,open,,subalpine larch,Larix lyallii,subalpine larch,Plantae,69848
132168265,8/8/09,2009-08-08 18:25:00 UTC,America/Edmonton,6025579,,2022-08-24 17:56:03 UTC,2023-06-29 17:40:12 UTC,research,CC-BY-NC,https://static.inaturalist.org/photos/225034112/medium.jpeg,,,2,0,FALSE,,"Alberta T0L, Canada",51.4968464,-115.9280561,169344,,,,169344,,open,,subalpine larch,Larix lyallii,subalpine larch,Plantae,69848
132319761,8/25/22,2022-08-25 17:47:15 UTC,America/Edmonton,1099002,,2022-08-25 20:13:15 UTC,2024-06-27 06:08:46 UTC,research,,https://static.inaturalist.org/photos/241472825/medium.jpg,,,1,0,FALSE,3,"Banff National Park, Improvement District No. 9 Banff, AB, CA",51.32842042,-116.2158527,3,,,,3,,open,,subalpine larch,Larix lyallii,subalpine larch,Plantae,69848
132325222,8/25/22,2022-08-25 18:44:03 UTC,America/Edmonton,2376382,,2022-08-25 20:54:26 UTC,2022-10-14 14:07:50 UTC,research,CC-BY-NC,https://inaturalist-open-data.s3.amazonaws.com/photos/225324758/medium.jpg,,,1,0,FALSE,3,"Peter Lougheed, CA-AB-FN, CA-AB, CA",50.59856193,-114.9905599,20,,,,20,,open,,subalpine larch,Larix lyallii,subalpine larch,Plantae,69848
132347616,8/22/22,2022-08-22 18:27:00 UTC,Pacific Time (US & Canada),3816611,Alana Mullen,2022-08-26 00:19:52 UTC,2023-07-08 09:28:27 UTC,research,,https://inaturalist-open-data.s3.amazonaws.com/photos/225367533/medium.jpeg,,,2,0,FALSE,2,"Leavenworth, WA 98826, USA",47.47712406,-120.8120286,60,,,,60,,open,,subalpine larch,Larix lyallii,subalpine larch,Plantae,69848
132432368,6/26/22,2022-06-26 20:16:00 UTC,America/Vancouver,323802,judith holm,2022-08-26 16:34:39 UTC,2022-10-14 14:36:19 UTC,research,CC-BY-NC-ND,https://inaturalist-open-data.s3.amazonaws.com/photos/225511578/medium.jpeg,,,1,0,FALSE,,"Okanagan-Similkameen, BC, Canada",49.06106833,-120.2018967,,,,,,,open,,subalpine larch,Larix lyallii,subalpine larch,Plantae,69848
132761386,8/9/22,2022-08-09 23:42:18 UTC,Pacific Time (US & Canada),46945,T. Abe Lloyd,2022-08-29 03:36:37 UTC,2022-09-06 04:25:39 UTC,research,CC-BY-NC,https://inaturalist-open-data.s3.amazonaws.com/photos/226044407/medium.jpeg,,,1,0,FALSE,2,"Whatcom County, US-WA, US",48.73353601,-120.678493,6,,,,6,,open,,subalpine larch,Larix lyallii,subalpine larch,Plantae,69848
132775389,8/10/22,2022-08-10 15:33:51 UTC,Pacific Time (US & Canada),46945,T. Abe Lloyd,2022-08-29 04:54:55 UTC,2022-09-18 03:45:59 UTC,research,CC-BY-NC,https://inaturalist-open-data.s3.amazonaws.com/photos/226059074/medium.jpeg,,,1,0,FALSE,2,"Okanogan County, US-WA, US",48.77889539,-120.7224817,8,,,,8,,open,,subalpine larch,Larix lyallii,subalpine larch,Plantae,69848
132781270,8/14/22,2022-08-14 21:24:02 UTC,Pacific Time (US & Canada),46945,T. Abe Lloyd,2022-08-29 06:18:58 UTC,2022-09-18 03:46:00 UTC,research,CC-BY-NC,https://inaturalist-open-data.s3.amazonaws.com/photos/226071053/medium.jpeg,,,1,0,FALSE,2,"Okanogan County, US-WA, US",48.82392302,-120.5983813,3,,,,3,,open,,subalpine larch,Larix lyallii,subalpine larch,Plantae,69848
132781797,8/14/22,2022-08-14 22:54:31 UTC,Pacific Time (US & Canada),46945,T. Abe Lloyd,2022-08-29 06:27:01 UTC,2022-09-06 04:54:03 UTC,research,CC-BY-NC,https://inaturalist-open-data.s3.amazonaws.com/photos/226072000/medium.jpeg,,,1,0,FALSE,2,"Okanogan County, US-WA, US",48.8236357,-120.5996402,4,,,,4,,open,,subalpine larch,Larix lyallii,subalpine larch,Plantae,69848
132890883,8/10/22,2022-08-10 17:44:58 UTC,Pacific Time (US & Canada),5101910,Tess Reeber,2022-08-30 00:14:50 UTC,2024-05-08 00:09:45 UTC,research,,https://static.inaturalist.org/photos/226274812/medium.jpg,,subalpine forest,3,1,FALSE,3,"Okanogan County, US-WA, US",48.77968833,-120.7287217,4,,,,4,,open,,subalpine larch,Larix lyallii,subalpine larch,Plantae,69848
132950802,8/29/22,2022-08-29 22:20:12 UTC,Pacific Time (US & Canada),4926511,,2022-08-30 14:24:19 UTC,2022-09-19 03:36:58 UTC,research,CC-BY-NC,https://inaturalist-open-data.s3.amazonaws.com/photos/226387956/medium.jpg,,,1,0,FALSE,3,"Okanogan - Wenatchee National Forest, Marblemount, WA, US",48.57190821,-120.8026262,2005,,,,2005,,open,,subalpine larch,Larix lyallii,subalpine larch,Plantae,69848
132969741,8/8/09,2009-08-08 18:25:00 UTC,America/Edmonton,6025579,,2022-08-30 17:05:40 UTC,2023-06-29 17:47:31 UTC,research,CC-BY-NC,https://static.inaturalist.org/photos/226421929/medium.jpeg,,,1,0,FALSE,,"Alberta T0L, Canada",51.4968464,-115.9280561,169344,,,,169344,,open,,subalpine larch,Larix lyallii,subalpine larch,Plantae,69848
133166932,8/26/22,2022-08-26 17:41:00 UTC,America/Edmonton,1493104,Larry Halverson,2022-09-01 03:46:32 UTC,2022-10-14 14:35:54 UTC,research,CC-BY-NC,https://static.inaturalist.org/photos/226787553/medium.jpg,,,1,0,FALSE,,"East Kootenay, BC, Canada",50.44338611,-115.7779528,4,,,,4,,open,,subalpine larch,Larix lyallii,subalpine larch,Plantae,69848
133168654,8/26/22,2022-08-26 18:48:00 UTC,America/Edmonton,1493104,Larry Halverson,2022-09-01 04:11:17 UTC,2022-10-14 14:35:31 UTC,research,CC-BY-NC,https://static.inaturalist.org/photos/226792011/medium.jpg,,,1,0,FALSE,,"East Kootenay, BC, Canada",50.43703333,-115.7844306,6,,,,6,,open,,subalpine larch,Larix lyallii,subalpine larch,Plantae,69848
133216112,8/31/22,2022-08-31 20:13:01 UTC,America/Edmonton,4055698,,2022-09-01 15:28:07 UTC,2024-06-27 06:08:43 UTC,research,CC-BY-NC,https://inaturalist-open-data.s3.amazonaws.com/photos/226877092/medium.jpg,,,1,0,FALSE,3,"Banff National Park, Improvement District No. 9 Banff, AB, CA",51.32983,-116.2176967,11,,,,11,,open,,subalpine larch,Larix lyallii,subalpine larch,Plantae,69848
133303163,8/10/22,2022-08-10 16:34:51 UTC,Pacific Time (US & Canada),5099016,,2022-09-02 06:08:15 UTC,2022-09-09 03:37:23 UTC,research,CC-BY-NC,https://inaturalist-open-data.s3.amazonaws.com/photos/227043732/medium.jpg,,,1,0,FALSE,3,"Okanogan County, US-WA, US",48.77591939,-120.7265473,6,,,,6,,open,,subalpine larch,Larix lyallii,subalpine larch,Plantae,69848
133384605,7/16/20,2020-07-16 21:34:00 UTC,Pacific Time (US & Canada),1016558,Brendan McGarry,2022-09-02 21:04:56 UTC,2022-09-06 04:30:14 UTC,research,,https://static.inaturalist.org/photos/227188446/medium.jpg,"Brendan McGarry, Cutthroat Pass, Mountains, Natural History Photography, North Cascades, Pacific Crest Trail, Wingtrip.org, alpine",,1,0,FALSE,,"Skagit County, WA, USA",48.55220084,-120.7055802,15,,,,15,,open,,subalpine larch,Larix lyallii,subalpine larch,Plantae,69848
133415139,7/30/22,2022-07-30 18:32:54 UTC,Mountain Time (US & Canada),968023,Mitch Van Dyke,2022-09-03 02:29:52 UTC,2023-07-08 09:38:30 UTC,research,CC-BY,https://inaturalist-open-data.s3.amazonaws.com/photos/227248818/medium.jpeg,,,1,0,FALSE,2,"West Glacier, MT 59936, USA",48.96558581,-114.0636253,419,,,,419,,open,gps,subalpine larch,Larix lyallii,subalpine larch,Plantae,69848
133725427,8/26/22,2022-08-26 16:12:57 UTC,Pacific Time (US & Canada),1174719,Drew Parker,2022-09-05 04:47:23 UTC,2023-01-07 13:37:12 UTC,research,CC-BY-NC,https://inaturalist-open-data.s3.amazonaws.com/photos/227824262/medium.jpg,,,1,0,FALSE,3,"Boundary County, US-ID, US",48.63599971,-116.582222,18,,,,18,,open,,subalpine larch,Larix lyallii,subalpine larch,Plantae,69848
133787877,9/4/22,2022-09-04 18:57:00 UTC,America/Edmonton,1970111,Jason Cooper,2022-09-05 17:18:01 UTC,2024-06-27 06:08:29 UTC,research,CC-BY-NC,https://inaturalist-open-data.s3.amazonaws.com/photos/227930443/medium.jpeg,,,2,0,FALSE,,"Improvement District No. 9, AB T0L, Canada",51.41746944,-116.2390389,,,,,,,open,,subalpine larch,Larix lyallii,subalpine larch,Plantae,69848
133788002,9/4/22,2022-09-04 20:28:00 UTC,America/Edmonton,1970111,Jason Cooper,2022-09-05 17:18:24 UTC,2024-06-27 06:08:24 UTC,research,CC-BY-NC,https://inaturalist-open-data.s3.amazonaws.com/photos/227934142/medium.jpeg,,,2,0,FALSE,,"Banff National Park, Banff, Division No. 15, Alberta, Canada",51.41528889,-116.2499222,,,,,,,open,,subalpine larch,Larix lyallii,subalpine larch,Plantae,69848
133788044,9/4/22,2022-09-04 20:59:00 UTC,America/Edmonton,1970111,Jason Cooper,2022-09-05 17:18:33 UTC,2024-06-27 06:08:20 UTC,research,CC-BY-NC,https://inaturalist-open-data.s3.amazonaws.com/photos/227936259/medium.jpeg,,,2,0,FALSE,,"Improvement District No. 9, AB T0L, Canada",51.41506667,-116.2504517,,,,,,,open,,subalpine larch,Larix lyallii,subalpine larch,Plantae,69848
133821157,9/4/22,2022-09-04 18:39:29 UTC,Mountain Time (US & Canada),1287370,Carrie Voss,2022-09-05 20:47:29 UTC,2024-01-10 04:16:52 UTC,research,CC-BY-NC-SA,https://inaturalist-open-data.s3.amazonaws.com/photos/228002318/medium.jpeg,,,1,0,FALSE,2,"Ravalli County, US-MT, US",46.25382,-114.4594267,8,,,,8,,open,,subalpine larch,Larix lyallii,subalpine larch,Plantae,69848
133868387,8/30/22,2022-08-30 14:40:03 UTC,America/Edmonton,2700069,Marguerite Trost,2022-09-06 02:51:06 UTC,2024-06-27 06:08:16 UTC,research,,https://static.inaturalist.org/photos/228090771/medium.jpg,,,1,0,FALSE,3,"Banff National Park, Improvement District No. 9 Banff, AB, CA",51.12706667,-115.9892717,4,,,,4,,open,,subalpine larch,Larix lyallii,subalpine larch,Plantae,69848
134108338,9/6/22,2022-09-06 22:43:25 UTC,America/Edmonton,2331783,Jake Batters,2022-09-07 23:48:56 UTC,2022-09-09 16:54:20 UTC,research,CC-BY-NC,https://inaturalist-open-data.s3.amazonaws.com/photos/228537163/medium.jpeg,,,1,0,FALSE,2,"Exshaw, AB T0L 2C0, Canada",50.596738,-115.164305,,,,,,,open,gps,subalpine larch,Larix lyallii,subalpine larch,Plantae,69848
134514197,9/10/22,2022-09-10 20:25:39 UTC,Pacific Time (US & Canada),3244377,Dean Lyons,2022-09-11 00:52:06 UTC,2022-11-19 05:38:41 UTC,research,CC-BY-NC,https://inaturalist-open-data.s3.amazonaws.com/photos/229293430/medium.jpg,,,1,0,FALSE,3,"Okanogan - Wenatchee National Forest, Stehekin, WA, US",48.50882833,-120.7658867,24,,,,24,,open,,subalpine larch,Larix lyallii,subalpine larch,Plantae,69848
134799699,7/16/22,2022-07-16 20:11:23 UTC,America/Vancouver,6137996,Nathan Jean,2022-09-12 23:57:34 UTC,2024-01-06 20:09:02 UTC,research,,https://static.inaturalist.org/photos/229829217/medium.jpg,,,2,0,FALSE,3,"E.C. Manning Provincial Park, Fraser Valley, BC, CA",49.026025,-120.8304967,4,,,,4,,open,,subalpine larch,Larix lyallii,subalpine larch,Plantae,69848
134940889,9/12/22,2022-09-12 21:33:16 UTC,America/Edmonton,1729025,J Floer,2022-09-14 01:52:24 UTC,2022-09-14 16:27:27 UTC,research,CC-BY-NC,https://inaturalist-open-data.s3.amazonaws.com/photos/230092438/medium.jpeg,,,1,0,FALSE,2,"Hillcrest Mines, AB T0K 1C0, Canada",49.35016397,-114.397188,,,,,,,open,gps,subalpine larch,Larix lyallii,subalpine larch,Plantae,69848
135064274,9/14/22,2022-09-14 18:48:14 UTC,America/Edmonton,1448507,Jenny Feick,2022-09-15 01:04:25 UTC,2022-09-15 01:30:52 UTC,research,CC-BY-NC,https://inaturalist-open-data.s3.amazonaws.com/photos/230317643/medium.jpg,,,1,0,FALSE,3,"Kootenay National Park, East Kootenay, BC, CA",51.18337833,-116.0431278,15,,,,15,,open,,subalpine larch,Larix lyallii,subalpine larch,Plantae,69848
135136317,9/4/22,2022-09-04 17:53:00 UTC,America/Edmonton,2151194,,2022-09-15 16:50:43 UTC,2022-10-15 14:56:58 UTC,research,CC-BY-NC,https://inaturalist-open-data.s3.amazonaws.com/photos/230446400/medium.jpeg,,,2,0,FALSE,,"Pincher Creek No. 9, AB, Canada",49.35790556,-114.264075,26,,,,26,,open,,subalpine larch,Larix lyallii,subalpine larch,Plantae,69848
135310010,9/16/22,2022-09-16 17:37:51 UTC,America/Edmonton,1527919,,2022-09-16 23:11:58 UTC,2024-06-27 06:08:10 UTC,research,CC-BY-NC,https://inaturalist-open-data.s3.amazonaws.com/photos/230763466/medium.jpg,,,1,0,FALSE,3,"Banff National Park, Improvement District No. 9 Banff, AB, CA",51.32558,-116.24727,64,,,,64,,open,,subalpine larch,Larix lyallii,subalpine larch,Plantae,69848
135311449,9/16/22,2022-09-16 17:52:24 UTC,America/Edmonton,1076022,Randy Huey,2022-09-16 23:27:24 UTC,2024-06-27 06:08:05 UTC,research,CC-BY-NC,https://inaturalist-open-data.s3.amazonaws.com/photos/230766912/medium.jpeg,,,1,0,FALSE,2,"Improvement District No. 9, AB T0L, Canada",51.332533,-116.2198613,,,,,,,open,gps,subalpine larch,Larix lyallii,subalpine larch,Plantae,69848
135463393,9/17/22,2022-09-17 21:02:59 UTC,America/Edmonton,501221,Rebeccah Schwab,2022-09-18 01:40:11 UTC,2024-06-28 02:16:28 UTC,research,,https://static.inaturalist.org/photos/231045450/medium.jpeg,,,1,0,FALSE,2,"Millarville, AB T0L 1K0, Canada",50.59207778,-114.9666917,,,,,,,open,gps,subalpine larch,Larix lyallii,subalpine larch,Plantae,69848
135611990,9/16/22,2022-09-16 19:52:50 UTC,America/Edmonton,1527919,,2022-09-19 01:37:39 UTC,2024-06-27 06:08:01 UTC,research,CC-BY-NC,https://inaturalist-open-data.s3.amazonaws.com/photos/231324658/medium.jpg,,,1,0,FALSE,3,"Banff National Park, Improvement District No. 9 Banff, AB, CA",51.32323333,-116.2621,24,,,,24,,open,,subalpine larch,Larix lyallii,subalpine larch,Plantae,69848
135711376,9/15/22,2022-09-15 16:27:00 UTC,America/Edmonton,1592656,David Severson,2022-09-19 21:18:17 UTC,2024-06-28 02:16:15 UTC,research,CC-BY-NC,https://inaturalist-open-data.s3.amazonaws.com/photos/231507997/medium.jpeg,,Alpine Larch; Highwood Pass,1,0,FALSE,,"Highwood Pass, Alberta T0L 1K0, Canada",50.599444,-114.987778,1377,,,,1377,,open,,subalpine larch,Larix lyallii,subalpine larch,Plantae,69848
135866180,9/4/20,2020-09-04 21:40:03 UTC,Pacific Time (US & Canada),5639435,Sam Beaumont,2022-09-21 02:12:58 UTC,2022-11-13 03:55:26 UTC,research,CC-BY,https://inaturalist-open-data.s3.amazonaws.com/photos/231798859/medium.jpg,,,1,0,FALSE,3,"Okanogan - Wenatchee National Forest, Leavenworth, WA, US",48.03677783,-120.8804867,5,,,,5,,open,,subalpine larch,Larix lyallii,subalpine larch,Plantae,69848
135867192,9/4/20,2020-09-04 21:47:25 UTC,Pacific Time (US & Canada),5639435,Sam Beaumont,2022-09-21 02:24:21 UTC,2022-11-13 03:52:20 UTC,research,CC-BY,https://inaturalist-open-data.s3.amazonaws.com/photos/231800832/medium.jpg,,Right,1,0,FALSE,3,"Okanogan - Wenatchee National Forest, Leavenworth, WA, US",48.03783333,-120.88188,30,,,,30,,open,,subalpine larch,Larix lyallii,subalpine larch,Plantae,69848
135867319,9/20/22,2022-09-20 20:32:00 UTC,America/Edmonton,264273,Rob Foster,2022-09-21 02:26:11 UTC,2024-06-27 06:07:52 UTC,research,CC-BY,https://inaturalist-open-data.s3.amazonaws.com/photos/231800531/medium.jpeg,,,1,0,FALSE,,"Banff National Park, Banff, Division No. 15, Alberta, Canada",51.417446,-116.239433,,,,,,,open,,subalpine larch,Larix lyallii,subalpine larch,Plantae,69848
135876145,9/21/20,2020-09-21 19:00:05 UTC,Pacific Time (US & Canada),5639435,Sam Beaumont,2022-09-21 04:20:33 UTC,2022-11-13 03:28:17 UTC,research,CC-BY,https://inaturalist-open-data.s3.amazonaws.com/photos/231818193/medium.jpg,,,1,0,FALSE,3,"Okanogan - Wenatchee National Forest, Marblemount, WA, US",48.57279667,-120.84085,5,,,,5,,open,,subalpine larch,Larix lyallii,subalpine larch,Plantae,69848
135876160,9/21/20,2020-09-21 19:03:42 UTC,Pacific Time (US & Canada),5639435,Sam Beaumont,2022-09-21 04:20:54 UTC,2022-11-13 03:28:14 UTC,research,CC-BY,https://inaturalist-open-data.s3.amazonaws.com/photos/231818235/medium.jpg,,,1,0,FALSE,3,"Okanogan - Wenatchee National Forest, Marblemount, WA, US",48.57261333,-120.8419033,10,,,,10,,open,,subalpine larch,Larix lyallii,subalpine larch,Plantae,69848
135876323,9/21/20,2020-09-21 19:09:33 UTC,Pacific Time (US & Canada),5639435,Sam Beaumont,2022-09-21 04:24:09 UTC,2022-11-13 03:28:12 UTC,research,CC-BY,https://inaturalist-open-data.s3.amazonaws.com/photos/231818616/medium.jpg,,,1,0,FALSE,3,"Okanogan - Wenatchee National Forest, Marblemount, WA, US",48.57215,-120.84292,10,,,,10,,open,,subalpine larch,Larix lyallii,subalpine larch,Plantae,69848
135876351,9/21/20,2020-09-21 19:10:39 UTC,Pacific Time (US & Canada),5639435,Sam Beaumont,2022-09-21 04:24:54 UTC,2022-11-13 03:28:10 UTC,research,CC-BY,https://inaturalist-open-data.s3.amazonaws.com/photos/231818736/medium.jpg,,,1,0,FALSE,3,"Okanogan - Wenatchee National Forest, Marblemount, WA, US",48.57203333,-120.84365,5,,,,5,,open,,subalpine larch,Larix lyallii,subalpine larch,Plantae,69848
135876383,9/21/20,2020-09-21 19:10:48 UTC,Pacific Time (US & Canada),5639435,Sam Beaumont,2022-09-21 04:25:54 UTC,2022-11-13 03:27:54 UTC,research,CC-BY,https://inaturalist-open-data.s3.amazonaws.com/photos/231818760/medium.jpg,,,1,0,FALSE,3,"Okanogan - Wenatchee National Forest, Marblemount, WA, US",48.57208667,-120.8434967,5,,,,5,,open,,subalpine larch,Larix lyallii,subalpine larch,Plantae,69848
135876432,9/21/20,2020-09-21 19:11:49 UTC,Pacific Time (US & Canada),5639435,Sam Beaumont,2022-09-21 04:27:05 UTC,2022-11-13 03:27:49 UTC,research,CC-BY,https://inaturalist-open-data.s3.amazonaws.com/photos/231818862/medium.jpg,,,1,0,FALSE,3,"North Cascades National Park, Marblemount, WA, US",48.572055,-120.844055,5,,,,5,,open,,subalpine larch,Larix lyallii,subalpine larch,Plantae,69848
135876485,9/21/20,2020-09-21 19:12:55 UTC,Pacific Time (US & Canada),5639435,Sam Beaumont,2022-09-21 04:28:36 UTC,2022-11-13 03:27:13 UTC,research,CC-BY,https://inaturalist-open-data.s3.amazonaws.com/photos/231818955/medium.jpg,,,1,0,FALSE,,"North Cascades National Park, Marblemount, WA, US",48.57210833,-120.844375,30,,,,30,,open,,subalpine larch,Larix lyallii,subalpine larch,Plantae,69848
135922948,9/20/22,2022-09-20 21:26:30 UTC,America/Edmonton,1448507,Jenny Feick,2022-09-21 15:42:54 UTC,2022-09-22 13:56:18 UTC,research,CC-BY-NC,https://inaturalist-open-data.s3.amazonaws.com/photos/231904118/medium.jpg,,,1,0,FALSE,3,"East Kootenay, BC, CA",50.52275333,-116.2372533,5,,,,5,,open,,subalpine larch,Larix lyallii,subalpine larch,Plantae,69848
135928773,9/21/20,2020-09-21 19:15:50 UTC,Pacific Time (US & Canada),5639435,Sam Beaumont,2022-09-21 16:25:59 UTC,2022-11-13 03:26:49 UTC,research,CC-BY,https://inaturalist-open-data.s3.amazonaws.com/photos/231913385/medium.jpg,,,1,0,FALSE,3,"North Cascades National Park, Marblemount, WA, US",48.57190333,-120.84548,5,,,,5,,open,,subalpine larch,Larix lyallii,subalpine larch,Plantae,69848
135945311,9/21/20,2020-09-21 21:21:11 UTC,Pacific Time (US & Canada),5639435,Sam Beaumont,2022-09-21 18:36:18 UTC,2022-11-13 03:22:19 UTC,research,CC-BY,https://inaturalist-open-data.s3.amazonaws.com/photos/231943375/medium.jpg,,,1,0,FALSE,3,"North Cascades National Park, Marblemount, WA, US",48.55489667,-120.8348833,50,,,,50,,open,,subalpine larch,Larix lyallii,subalpine larch,Plantae,69848
135946448,10/4/20,2020-10-04 19:41:39 UTC,Pacific Time (US & Canada),5639435,Sam Beaumont,2022-09-21 18:44:27 UTC,2022-11-13 03:16:37 UTC,research,CC-BY,https://inaturalist-open-data.s3.amazonaws.com/photos/231945657/medium.jpg,,,1,0,FALSE,3,"Okanogan - Wenatchee National Forest, Marblemount, WA, US",48.5524,-120.7097083,5,,,,5,,open,,subalpine larch,Larix lyallii,subalpine larch,Plantae,69848
135946549,10/4/20,2020-10-04 19:43:30 UTC,Pacific Time (US & Canada),5639435,Sam Beaumont,2022-09-21 18:45:09 UTC,2022-11-13 03:16:34 UTC,research,CC-BY,https://inaturalist-open-data.s3.amazonaws.com/photos/231945874/medium.jpg,,,1,0,FALSE,3,"Okanogan - Wenatchee National Forest, Marblemount, WA, US",48.55190333,-120.7086867,5,,,,5,,open,,subalpine larch,Larix lyallii,subalpine larch,Plantae,69848
135946917,10/4/20,2020-10-04 19:45:20 UTC,Pacific Time (US & Canada),5639435,Sam Beaumont,2022-09-21 18:47:01 UTC,2022-11-13 03:15:52 UTC,research,CC-BY,https://inaturalist-open-data.s3.amazonaws.com/photos/231946613/medium.jpg,,,1,0,FALSE,3,"Okanogan - Wenatchee National Forest, Marblemount, WA, US",48.55199167,-120.709205,5,,,,5,,open,,subalpine larch,Larix lyallii,subalpine larch,Plantae,69848
135959800,10/4/20,2020-10-04 19:45:44 UTC,Pacific Time (US & Canada),5639435,Sam Beaumont,2022-09-21 20:28:47 UTC,2022-11-13 03:14:55 UTC,research,CC-BY,https://inaturalist-open-data.s3.amazonaws.com/photos/231982912/medium.jpg,,,1,0,FALSE,3,"Okanogan - Wenatchee National Forest, Marblemount, WA, US",48.55204667,-120.7091967,5,,,,5,,open,,subalpine larch,Larix lyallii,subalpine larch,Plantae,69848
135967028,10/4/20,2020-10-04 19:49:03 UTC,Pacific Time (US & Canada),5639435,Sam Beaumont,2022-09-21 21:36:21 UTC,2022-11-13 03:13:47 UTC,research,CC-BY,https://inaturalist-open-data.s3.amazonaws.com/photos/231983187/medium.jpg,,,1,0,FALSE,3,"Okanogan - Wenatchee National Forest, Marblemount, WA, US",48.55205333,-120.7091533,5,,,,5,,open,,subalpine larch,Larix lyallii,subalpine larch,Plantae,69848
135967110,10/4/20,2020-10-04 19:50:56 UTC,Pacific Time (US & Canada),5639435,Sam Beaumont,2022-09-21 21:37:00 UTC,2022-11-13 03:13:45 UTC,research,CC-BY,https://inaturalist-open-data.s3.amazonaws.com/photos/231983317/medium.jpg,,,1,0,FALSE,3,"Okanogan - Wenatchee National Forest, Marblemount, WA, US",48.55178,-120.7087383,5,,,,5,,open,,subalpine larch,Larix lyallii,subalpine larch,Plantae,69848
135975435,10/4/20,2020-10-04 19:51:37 UTC,Pacific Time (US & Canada),5639435,Sam Beaumont,2022-09-21 22:54:00 UTC,2022-11-13 03:13:38 UTC,research,CC-BY,https://inaturalist-open-data.s3.amazonaws.com/photos/231998021/medium.jpg,,,1,0,FALSE,3,"Okanogan - Wenatchee National Forest, Marblemount, WA, US",48.5514,-120.7087333,5,,,,5,,open,,subalpine larch,Larix lyallii,subalpine larch,Plantae,69848
135975490,10/4/20,2020-10-04 19:52:27 UTC,Pacific Time (US & Canada),5639435,Sam Beaumont,2022-09-21 22:54:28 UTC,2022-11-13 03:13:34 UTC,research,CC-BY,https://inaturalist-open-data.s3.amazonaws.com/photos/231998118/medium.jpg,,,1,0,FALSE,3,"Okanogan - Wenatchee National Forest, Marblemount, WA, US",48.55082167,-120.7088,5,,,,5,,open,,subalpine larch,Larix lyallii,subalpine larch,Plantae,69848
135975642,10/4/20,2020-10-04 19:52:41 UTC,Pacific Time (US & Canada),5639435,Sam Beaumont,2022-09-21 22:56:01 UTC,2022-11-13 03:13:15 UTC,research,CC-BY,https://inaturalist-open-data.s3.amazonaws.com/photos/231998423/medium.jpg,,,1,0,FALSE,3,"Okanogan - Wenatchee National Forest, Marblemount, WA, US",48.55073667,-120.7088383,5,,,,5,,open,,subalpine larch,Larix lyallii,subalpine larch,Plantae,69848
135975694,10/4/20,2020-10-04 19:55:35 UTC,Pacific Time (US & Canada),5639435,Sam Beaumont,2022-09-21 22:56:34 UTC,2022-11-12 22:18:36 UTC,research,CC-BY,https://inaturalist-open-data.s3.amazonaws.com/photos/231998547/medium.jpg,,,1,0,FALSE,3,"Okanogan - Wenatchee National Forest, Marblemount, WA, US",48.550895,-120.7079167,5,,,,5,,open,,subalpine larch,Larix lyallii,subalpine larch,Plantae,69848
135975762,10/4/20,2020-10-04 19:55:39 UTC,Pacific Time (US & Canada),5639435,Sam Beaumont,2022-09-21 22:57:07 UTC,2022-11-12 22:18:33 UTC,research,CC-BY,https://inaturalist-open-data.s3.amazonaws.com/photos/231998669/medium.jpg,,,1,0,FALSE,3,"Okanogan - Wenatchee National Forest, Marblemount, WA, US",48.55091167,-120.707855,5,,,,5,,open,,subalpine larch,Larix lyallii,subalpine larch,Plantae,69848
135975843,10/4/20,2020-10-04 19:56:38 UTC,Pacific Time (US & Canada),5639435,Sam Beaumont,2022-09-21 22:58:03 UTC,2022-11-12 22:18:04 UTC,research,CC-BY,https://inaturalist-open-data.s3.amazonaws.com/photos/231998856/medium.jpg,,,1,0,FALSE,3,"Okanogan - Wenatchee National Forest, Marblemount, WA, US",48.55127,-120.7071217,5,,,,5,,open,,subalpine larch,Larix lyallii,subalpine larch,Plantae,69848
135975876,10/4/20,2020-10-04 19:56:52 UTC,Pacific Time (US & Canada),5639435,Sam Beaumont,2022-09-21 22:58:26 UTC,2022-11-12 22:18:01 UTC,research,CC-BY,https://inaturalist-open-data.s3.amazonaws.com/photos/231998934/medium.jpg,,,1,0,FALSE,3,"Okanogan - Wenatchee National Forest, Marblemount, WA, US",48.55138,-120.70697,5,,,,5,,open,,subalpine larch,Larix lyallii,subalpine larch,Plantae,69848
135976039,10/4/20,2020-10-04 19:58:22 UTC,Pacific Time (US & Canada),5639435,Sam Beaumont,2022-09-21 22:59:51 UTC,2022-11-12 22:17:50 UTC,research,CC-BY,https://inaturalist-open-data.s3.amazonaws.com/photos/231999216/medium.jpg,,,1,0,FALSE,3,"Okanogan - Wenatchee National Forest, Marblemount, WA, US",48.5519,-120.70627,5,,,,5,,open,,subalpine larch,Larix lyallii,subalpine larch,Plantae,69848
135976097,10/4/20,2020-10-04 20:03:49 UTC,Pacific Time (US & Canada),5639435,Sam Beaumont,2022-09-21 23:00:25 UTC,2022-11-12 22:17:46 UTC,research,CC-BY,https://inaturalist-open-data.s3.amazonaws.com/photos/231999318/medium.jpg,,,1,0,FALSE,3,"Okanogan - Wenatchee National Forest, Marblemount, WA, US",48.55173833,-120.7053133,5,,,,5,,open,,subalpine larch,Larix lyallii,subalpine larch,Plantae,69848
135976219,10/4/20,2020-10-04 20:05:30 UTC,Pacific Time (US & Canada),5639435,Sam Beaumont,2022-09-21 23:01:47 UTC,2022-11-12 22:17:42 UTC,research,CC-BY,https://inaturalist-open-data.s3.amazonaws.com/photos/231999583/medium.jpg,,,1,0,FALSE,3,"Okanogan - Wenatchee National Forest, Marblemount, WA, US",48.55275833,-120.7052917,5,,,,5,,open,,subalpine larch,Larix lyallii,subalpine larch,Plantae,69848
135976355,10/4/20,2020-10-04 20:10:11 UTC,Pacific Time (US & Canada),5639435,Sam Beaumont,2022-09-21 23:03:22 UTC,2022-11-12 22:17:12 UTC,research,CC-BY,https://inaturalist-open-data.s3.amazonaws.com/photos/231999918/medium.jpg,,Left,1,0,FALSE,3,"Okanogan - Wenatchee National Forest, Marblemount, WA, US",48.55264167,-120.7045967,5,,,,5,,open,,subalpine larch,Larix lyallii,subalpine larch,Plantae,69848
135976532,10/4/20,2020-10-04 20:12:17 UTC,Pacific Time (US & Canada),5639435,Sam Beaumont,2022-09-21 23:05:09 UTC,2022-11-12 22:16:37 UTC,research,CC-BY,https://inaturalist-open-data.s3.amazonaws.com/photos/232000378/medium.jpg,,,1,0,FALSE,3,"Okanogan - Wenatchee National Forest, Marblemount, WA, US",48.55277,-120.7043,5,,,,5,,open,,subalpine larch,Larix lyallii,subalpine larch,Plantae,69848
135976755,10/4/20,2020-10-04 20:13:52 UTC,Pacific Time (US & Canada),5639435,Sam Beaumont,2022-09-21 23:07:27 UTC,2022-11-12 22:14:18 UTC,research,CC-BY,https://inaturalist-open-data.s3.amazonaws.com/photos/232000818/medium.jpg,,,1,0,FALSE,3,"Okanogan - Wenatchee National Forest, Marblemount, WA, US",48.55357833,-120.7042783,5,,,,5,,open,,subalpine larch,Larix lyallii,subalpine larch,Plantae,69848
135976789,10/4/20,2020-10-04 20:14:31 UTC,Pacific Time (US & Canada),5639435,Sam Beaumont,2022-09-21 23:07:59 UTC,2022-11-12 22:14:14 UTC,research,CC-BY,https://inaturalist-open-data.s3.amazonaws.com/photos/232000933/medium.jpg,,,1,0,FALSE,3,"Okanogan - Wenatchee National Forest, Marblemount, WA, US",48.55381167,-120.70395,5,,,,5,,open,,subalpine larch,Larix lyallii,subalpine larch,Plantae,69848
135976814,10/4/20,2020-10-04 20:17:05 UTC,Pacific Time (US & Canada),5639435,Sam Beaumont,2022-09-21 23:08:22 UTC,2022-11-12 22:14:12 UTC,research,CC-BY,https://inaturalist-open-data.s3.amazonaws.com/photos/232001003/medium.jpg,,,1,0,FALSE,3,"Okanogan - Wenatchee National Forest, Marblemount, WA, US",48.55478667,-120.7045833,5,,,,5,,open,,subalpine larch,Larix lyallii,subalpine larch,Plantae,69848
135976869,10/4/20,2020-10-04 20:23:31 UTC,Pacific Time (US & Canada),5639435,Sam Beaumont,2022-09-21 23:09:07 UTC,2022-11-12 22:14:09 UTC,research,CC-BY,https://inaturalist-open-data.s3.amazonaws.com/photos/232001153/medium.jpg,,,1,0,FALSE,3,"Okanogan - Wenatchee National Forest, Marblemount, WA, US",48.55556167,-120.7022033,5,,,,5,,open,,subalpine larch,Larix lyallii,subalpine larch,Plantae,69848
135976910,10/4/20,2020-10-04 20:23:39 UTC,Pacific Time (US & Canada),5639435,Sam Beaumont,2022-09-21 23:09:39 UTC,2022-11-12 22:14:04 UTC,research,CC-BY,https://inaturalist-open-data.s3.amazonaws.com/photos/232001250/medium.jpg,,,1,0,FALSE,3,"Okanogan - Wenatchee National Forest, Marblemount, WA, US",48.55555,-120.7021867,5,,,,5,,open,,subalpine larch,Larix lyallii,subalpine larch,Plantae,69848
135976955,10/4/20,2020-10-04 21:12:37 UTC,Pacific Time (US & Canada),5639435,Sam Beaumont,2022-09-21 23:10:16 UTC,2022-11-12 22:14:01 UTC,research,CC-BY,https://inaturalist-open-data.s3.amazonaws.com/photos/232001354/medium.jpg,,,1,0,FALSE,3,"Okanogan - Wenatchee National Forest, Marblemount, WA, US",48.55483333,-120.700745,5,,,,5,,open,,subalpine larch,Larix lyallii,subalpine larch,Plantae,69848
135977060,10/4/20,2020-10-04 21:15:33 UTC,Pacific Time (US & Canada),5639435,Sam Beaumont,2022-09-21 23:11:20 UTC,2024-05-08 20:51:20 UTC,research,CC-BY,https://inaturalist-open-data.s3.amazonaws.com/photos/232001547/medium.jpg,,,4,0,FALSE,3,"Okanogan - Wenatchee National Forest, Marblemount, WA, US",48.55551667,-120.7013333,5,,,,5,,open,,subalpine larch,Larix lyallii,subalpine larch,Plantae,69848
135977109,10/4/20,2020-10-04 21:16:38 UTC,Pacific Time (US & Canada),5639435,Sam Beaumont,2022-09-21 23:11:52 UTC,2022-11-12 22:13:28 UTC,research,CC-BY,https://inaturalist-open-data.s3.amazonaws.com/photos/232001638/medium.jpg,,,1,0,FALSE,3,"Okanogan - Wenatchee National Forest, Marblemount, WA, US",48.555575,-120.7019583,5,,,,5,,open,,subalpine larch,Larix lyallii,subalpine larch,Plantae,69848
135977155,10/4/20,2020-10-04 21:24:25 UTC,Pacific Time (US & Canada),5639435,Sam Beaumont,2022-09-21 23:12:27 UTC,2022-11-12 22:13:26 UTC,research,CC-BY,https://inaturalist-open-data.s3.amazonaws.com/photos/232001744/medium.jpg,,,1,0,FALSE,3,"Okanogan - Wenatchee National Forest, Marblemount, WA, US",48.55443833,-120.7040117,5,,,,5,,open,,subalpine larch,Larix lyallii,subalpine larch,Plantae,69848
135977253,10/4/20,2020-10-04 21:24:27 UTC,Pacific Time (US & Canada),5639435,Sam Beaumont,2022-09-21 23:13:29 UTC,2022-11-12 22:13:15 UTC,research,CC-BY,https://inaturalist-open-data.s3.amazonaws.com/photos/232001937/medium.jpg,,,1,0,FALSE,3,"Okanogan - Wenatchee National Forest, Marblemount, WA, US",48.55443667,-120.7040117,5,,,,5,,open,,subalpine larch,Larix lyallii,subalpine larch,Plantae,69848
135977342,10/4/20,2020-10-04 21:25:56 UTC,Pacific Time (US & Canada),5639435,Sam Beaumont,2022-09-21 23:13:50 UTC,2022-11-12 22:13:13 UTC,research,CC-BY,https://inaturalist-open-data.s3.amazonaws.com/photos/232002007/medium.jpg,,,1,0,FALSE,3,"Okanogan - Wenatchee National Forest, Marblemount, WA, US",48.55371333,-120.70417,5,,,,5,,open,,subalpine larch,Larix lyallii,subalpine larch,Plantae,69848
135977454,10/4/20,2020-10-04 21:28:45 UTC,Pacific Time (US & Canada),5639435,Sam Beaumont,2022-09-21 23:14:37 UTC,2022-11-12 22:13:09 UTC,research,CC-BY,https://inaturalist-open-data.s3.amazonaws.com/photos/232002150/medium.jpg,,,1,0,FALSE,3,"Okanogan - Wenatchee National Forest, Marblemount, WA, US",48.55259667,-120.7042917,5,,,,5,,open,,subalpine larch,Larix lyallii,subalpine larch,Plantae,69848
135977507,10/4/20,2020-10-04 21:29:49 UTC,Pacific Time (US & Canada),5639435,Sam Beaumont,2022-09-21 23:15:17 UTC,2022-11-12 22:12:13 UTC,research,CC-BY,https://inaturalist-open-data.s3.amazonaws.com/photos/232002281/medium.jpg,,,1,0,FALSE,3,"Okanogan - Wenatchee National Forest, Marblemount, WA, US",48.55213,-120.70437,5,,,,5,,open,,subalpine larch,Larix lyallii,subalpine larch,Plantae,69848
135977602,10/4/20,2020-10-04 21:29:52 UTC,Pacific Time (US & Canada),5639435,Sam Beaumont,2022-09-21 23:16:18 UTC,2022-11-12 22:11:41 UTC,research,CC-BY,https://inaturalist-open-data.s3.amazonaws.com/photos/232002470/medium.jpg,,,1,0,FALSE,3,"Okanogan - Wenatchee National Forest, Marblemount, WA, US",48.55213,-120.70437,5,,,,5,,open,,subalpine larch,Larix lyallii,subalpine larch,Plantae,69848
135977642,10/4/20,2020-10-04 21:37:06 UTC,Pacific Time (US & Canada),5639435,Sam Beaumont,2022-09-21 23:16:40 UTC,2022-11-12 22:11:35 UTC,research,CC-BY,https://inaturalist-open-data.s3.amazonaws.com/photos/232002510/medium.jpg,,,1,0,FALSE,3,"Okanogan - Wenatchee National Forest, Marblemount, WA, US",48.55166167,-120.705475,5,,,,5,,open,,subalpine larch,Larix lyallii,subalpine larch,Plantae,69848
135977671,10/4/20,2020-10-04 21:37:25 UTC,Pacific Time (US & Canada),5639435,Sam Beaumont,2022-09-21 23:17:02 UTC,2022-11-12 22:11:32 UTC,research,CC-BY,https://inaturalist-open-data.s3.amazonaws.com/photos/232002589/medium.jpg,,,1,0,FALSE,3,"Okanogan - Wenatchee National Forest, Marblemount, WA, US",48.55153333,-120.7055967,5,,,,5,,open,,subalpine larch,Larix lyallii,subalpine larch,Plantae,69848
135977701,10/4/20,2020-10-04 21:40:42 UTC,Pacific Time (US & Canada),5639435,Sam Beaumont,2022-09-21 23:17:25 UTC,2022-11-12 22:11:27 UTC,research,CC-BY,https://inaturalist-open-data.s3.amazonaws.com/photos/232002664/medium.jpg,,,1,0,FALSE,3,"Okanogan - Wenatchee National Forest, Marblemount, WA, US",48.55103667,-120.70668,5,,,,5,,open,,subalpine larch,Larix lyallii,subalpine larch,Plantae,69848
135977735,10/4/20,2020-10-04 21:43:19 UTC,Pacific Time (US & Canada),5639435,Sam Beaumont,2022-09-21 23:17:47 UTC,2022-11-12 22:11:13 UTC,research,CC-BY,https://inaturalist-open-data.s3.amazonaws.com/photos/232002720/medium.jpg,,,1,0,FALSE,3,"Okanogan - Wenatchee National Forest, Marblemount, WA, US",48.55176167,-120.706505,5,,,,5,,open,,subalpine larch,Larix lyallii,subalpine larch,Plantae,69848
135977770,10/4/20,2020-10-04 21:43:53 UTC,Pacific Time (US & Canada),5639435,Sam Beaumont,2022-09-21 23:18:09 UTC,2022-11-12 22:11:08 UTC,research,CC-BY,https://inaturalist-open-data.s3.amazonaws.com/photos/232002784/medium.jpg,,,1,0,FALSE,3,"Okanogan - Wenatchee National Forest, Marblemount, WA, US",48.55148333,-120.7067867,5,,,,5,,open,,subalpine larch,Larix lyallii,subalpine larch,Plantae,69848
135977822,10/4/20,2020-10-04 21:44:46 UTC,Pacific Time (US & Canada),5639435,Sam Beaumont,2022-09-21 23:18:34 UTC,2022-11-12 22:11:01 UTC,research,CC-BY,https://inaturalist-open-data.s3.amazonaws.com/photos/232002873/medium.jpg,,,1,0,FALSE,3,"Okanogan - Wenatchee National Forest, Marblemount, WA, US",48.55117,-120.707505,5,,,,5,,open,,subalpine larch,Larix lyallii,subalpine larch,Plantae,69848
136114056,8/28/22,2022-08-28 20:07:00 UTC,America/Edmonton,1403418,,2022-09-23 02:13:56 UTC,2024-06-28 02:16:07 UTC,research,CC-BY-SA,https://inaturalist-open-data.s3.amazonaws.com/photos/232255782/medium.jpeg,,,1,0,FALSE,,"Kananaskis, AB T0L, Canada",50.59599663,-115.163122,61,,,,61,,open,,subalpine larch,Larix lyallii,subalpine larch,Plantae,69848
136120080,9/22/22,2022-09-22 20:36:00 UTC,America/Edmonton,264273,Rob Foster,2022-09-23 03:37:24 UTC,2024-06-27 06:07:44 UTC,research,CC-BY,https://inaturalist-open-data.s3.amazonaws.com/photos/232266647/medium.jpeg,,,1,0,FALSE,,"Improvement District No. 9, AB T0L, Canada",51.32663889,-116.2101253,61,,,,61,,open,,subalpine larch,Larix lyallii,subalpine larch,Plantae,69848
136186624,10/1/16,2016-10-01 20:22:04 UTC,America/Vancouver,3258959,arial,2022-09-23 18:31:11 UTC,2023-08-07 19:59:53 UTC,research,CC-BY-NC,https://inaturalist-open-data.s3.amazonaws.com/photos/232389137/medium.jpeg,,,1,0,FALSE,2,"Manning Park, BC V0X 1R0, Canada",49.01776793,-120.8333099,329,,,,329,,open,gps,subalpine larch,Larix lyallii,subalpine larch,Plantae,69848
136189891,7/27/22,2022-07-27 15:53:04 UTC,America/Edmonton,3151007,,2022-09-23 18:58:10 UTC,2023-02-08 14:27:07 UTC,research,CC-BY-NC,https://inaturalist-open-data.s3.amazonaws.com/photos/232394926/medium.jpg,,,2,0,FALSE,3,"Mount Assiniboine, CA-BC-EK, CA-BC, CA",50.90994406,-115.5908277,75,,,,75,,open,,subalpine larch,Larix lyallii,subalpine larch,Plantae,69848
136220953,9/23/22,2022-09-23 18:03:19 UTC,America/Edmonton,255231,Donna Thomas,2022-09-24 00:16:00 UTC,2024-06-27 06:07:40 UTC,research,CC-BY-NC,https://inaturalist-open-data.s3.amazonaws.com/photos/232454713/medium.jpg,,,2,0,FALSE,3,"Banff National Park, Improvement District No. 9 Banff, AB, CA",51.415975,-116.2437967,5,,,,5,,open,,subalpine larch,Larix lyallii,subalpine larch,Plantae,69848
136221936,9/14/18,2018-09-14 16:22:26 UTC,America/Vancouver,3258959,arial,2022-09-24 00:28:49 UTC,2023-08-07 19:59:53 UTC,research,CC-BY-NC,https://inaturalist-open-data.s3.amazonaws.com/photos/232456658/medium.jpeg,,,1,0,FALSE,2,"Keremeos, BC V0X 1N0, Canada",49.04119287,-120.2038324,902,,,,902,,open,gps,subalpine larch,Larix lyallii,subalpine larch,Plantae,69848
136341454,8/26/22,2022-08-27 01:43:00 UTC,Pacific Time (US & Canada),740297,Matt Berger,2022-09-24 21:41:00 UTC,2022-11-12 21:50:30 UTC,research,CC-BY,https://inaturalist-open-data.s3.amazonaws.com/photos/232617799/medium.jpeg,,,1,0,FALSE,,"Kittitas, Washington, United States",47.44720833,-120.9258806,4,,,,4,,open,,subalpine larch,Larix lyallii,subalpine larch,Plantae,69848
136353012,9/24/22,2022-09-24 20:25:40 UTC,America/Edmonton,1098201,,2022-09-24 23:08:51 UTC,2024-06-28 02:15:47 UTC,research,,https://static.inaturalist.org/photos/232694853/medium.jpg,,,2,0,FALSE,3,"Peter Lougheed Provincial Park, Kananaskis, AB, CA",50.59238,-115.0069417,3,,,,3,,open,,subalpine larch,Larix lyallii,subalpine larch,Plantae,69848
136363926,9/24/22,2022-09-24 21:52:54 UTC,Pacific Time (US & Canada),1510020,Aaron Wells,2022-09-25 00:53:45 UTC,2022-09-29 01:11:53 UTC,research,CC-BY-NC,https://inaturalist-open-data.s3.amazonaws.com/photos/232717457/medium.jpg,,,1,0,FALSE,3,"Okanogan - Wenatchee National Forest, Mazama, WA, US",48.55468667,-120.69233,23,,,,23,,open,,subalpine larch,Larix lyallii,subalpine larch,Plantae,69848
136417139,9/24/22,2022-09-24 15:59:52 UTC,America/Edmonton,3278981,,2022-09-25 12:44:56 UTC,2024-06-28 02:15:42 UTC,research,CC-BY-NC,https://inaturalist-open-data.s3.amazonaws.com/photos/232817664/medium.jpeg,,,1,0,FALSE,2,"Improvement District No. 9, AB T0L, Canada",51.39321797,-116.273569,,,,,,,open,gps,subalpine larch,Larix lyallii,subalpine larch,Plantae,69848
136426918,9/21/22,2022-09-21 20:27:00 UTC,Pacific Time (US & Canada),5351457,Ali Rogers,2022-09-25 14:12:05 UTC,2022-11-12 21:47:53 UTC,research,,https://static.inaturalist.org/photos/232835681/medium.jpeg,,,1,0,FALSE,,"Chelan, Washington, United States",48.49958889,-120.7612528,32,,,,32,,open,,subalpine larch,Larix lyallii,subalpine larch,Plantae,69848
136439805,9/3/22,2022-09-03 18:20:00 UTC,Pacific Time (US & Canada),740297,Matt Berger,2022-09-25 15:40:00 UTC,2022-11-12 21:47:48 UTC,research,CC-BY,https://inaturalist-open-data.s3.amazonaws.com/photos/232843202/medium.jpeg,,,1,0,FALSE,,"Okanogan, Washington, United States",48.51164722,-120.6468722,4,,,,4,,open,,subalpine larch,Larix lyallii,subalpine larch,Plantae,69848
136439832,9/3/22,2022-09-03 18:42:00 UTC,Pacific Time (US & Canada),740297,Matt Berger,2022-09-25 15:40:06 UTC,2022-11-12 21:47:40 UTC,research,CC-BY,https://inaturalist-open-data.s3.amazonaws.com/photos/232843749/medium.jpeg,,,1,0,FALSE,,"Okanogan, Washington, United States",48.51020556,-120.6492222,4,,,,4,,open,,subalpine larch,Larix lyallii,subalpine larch,Plantae,69848
136467692,9/4/22,2022-09-04 19:39:00 UTC,Pacific Time (US & Canada),740297,Matt Berger,2022-09-25 18:45:56 UTC,2022-11-12 21:46:41 UTC,research,CC-BY,https://inaturalist-open-data.s3.amazonaws.com/photos/232882208/medium.jpeg,,,1,0,FALSE,,"Skagit, Washington, United States",48.50915833,-120.7649,4,,,,4,,open,,subalpine larch,Larix lyallii,subalpine larch,Plantae,69848
136467704,9/4/22,2022-09-04 19:51:00 UTC,Pacific Time (US & Canada),740297,Matt Berger,2022-09-25 18:45:58 UTC,2022-11-12 21:46:30 UTC,research,CC-BY,https://inaturalist-open-data.s3.amazonaws.com/photos/232882283/medium.jpeg,,,1,0,FALSE,,"Chelan, Washington, United States",48.50436111,-120.7669611,4,,,,4,,open,,subalpine larch,Larix lyallii,subalpine larch,Plantae,69848
136467790,9/4/22,2022-09-04 21:06:00 UTC,Pacific Time (US & Canada),740297,Matt Berger,2022-09-25 18:46:16 UTC,2022-11-12 21:46:20 UTC,research,CC-BY,https://inaturalist-open-data.s3.amazonaws.com/photos/232883972/medium.jpeg,,,1,0,FALSE,,"Chelan, Washington, United States",48.49993611,-120.7574167,4,,,,4,,open,,subalpine larch,Larix lyallii,subalpine larch,Plantae,69848
136501978,9/23/22,2022-09-23 18:44:25 UTC,America/Edmonton,3236983,Sam Jeffery,2022-09-25 22:38:41 UTC,2024-06-27 06:07:26 UTC,research,CC-BY-NC,https://inaturalist-open-data.s3.amazonaws.com/photos/232974178/medium.jpeg,,,2,0,FALSE,2,"Exshaw, AB T0L 2C0, Canada",51.11266944,-115.9070806,,,,,,,open,,subalpine larch,Larix lyallii,subalpine larch,Plantae,69848
136502848,9/24/22,2022-09-24 15:51:47 UTC,America/Edmonton,5060316,,2022-09-25 22:45:31 UTC,2024-06-27 06:07:18 UTC,research,CC-BY-NC,https://inaturalist-open-data.s3.amazonaws.com/photos/232975778/medium.jpeg,,,2,0,FALSE,333,Improvement District No. 9 Banff,51.45142746,-116.1297836,,,,,,,open,,subalpine larch,Larix lyallii,subalpine larch,Plantae,69848
136523234,9/6/22,2022-09-06 21:50:00 UTC,Pacific Time (US & Canada),740297,Matt Berger,2022-09-26 01:46:01 UTC,2022-11-12 21:35:56 UTC,research,CC-BY,https://inaturalist-open-data.s3.amazonaws.com/photos/233012584/medium.jpeg,,,1,0,FALSE,,"Okanogan, Washington, United States",48.51238611,-120.6418694,17,,,,17,,open,,subalpine larch,Larix lyallii,subalpine larch,Plantae,69848
136527389,9/22/22,2022-09-22 18:25:00 UTC,America/Edmonton,3431757,,2022-09-26 02:25:33 UTC,2022-10-02 04:35:33 UTC,research,CC-BY-NC,https://inaturalist-open-data.s3.amazonaws.com/photos/233023051/medium.jpeg,,,2,0,FALSE,,"East Kootenay, BC, Canada",51.18634722,-116.2846139,4,,,,4,,open,,subalpine larch,Larix lyallii,subalpine larch,Plantae,69848
136539538,9/25/22,2022-09-25 17:23:00 UTC,America/Edmonton,2476609,Ian Adams,2022-09-26 05:07:03 UTC,2022-09-29 12:36:52 UTC,research,CC-BY,https://inaturalist-open-data.s3.amazonaws.com/photos/233047276/medium.jpeg,,,1,0,FALSE,,"East Kootenay, BC, Canada",49.6082939,-115.4539682,,,,,,,open,,subalpine larch,Larix lyallii,subalpine larch,Plantae,69848
136558258,9/23/22,2022-09-23 20:40:34 UTC,America/Edmonton,4212082,Carrie Lefebvre,2022-09-26 11:50:43 UTC,2024-06-28 02:15:23 UTC,research,CC-BY-NC,https://inaturalist-open-data.s3.amazonaws.com/photos/233082868/medium.jpg,,,2,0,FALSE,3,"Elbow - Sheep Wildland Provincial Park, Kananaskis, AB, CA",50.60255833,-114.9859867,8,,,,8,,open,,subalpine larch,Larix lyallii,subalpine larch,Plantae,69848
136591659,8/11/22,2022-08-11 22:31:44 UTC,Pacific Time (US & Canada),1021469,,2022-09-26 17:22:59 UTC,2022-11-12 21:34:57 UTC,research,,https://static.inaturalist.org/photos/233144663/medium.jpg,,,1,0,FALSE,3,"Okanogan - Wenatchee National Forest, Stehekin, WA, US",48.50655333,-120.73935,17,,,,17,,open,,subalpine larch,Larix lyallii,subalpine larch,Plantae,69848
136595236,9/25/22,2022-09-25 19:45:00 UTC,America/Edmonton,1970111,Jason Cooper,2022-09-26 17:50:25 UTC,2024-06-28 02:15:12 UTC,research,CC-BY-NC,https://inaturalist-open-data.s3.amazonaws.com/photos/233146118/medium.jpeg,,,1,0,FALSE,,"Kananaskis, AB T0L, Canada",50.592833,-115.1484389,50,,,,50,,open,,subalpine larch,Larix lyallii,subalpine larch,Plantae,69848
136595326,9/25/22,2022-09-25 19:37:00 UTC,America/Edmonton,3034708,Debborah Donnelly,2022-09-26 17:51:01 UTC,2024-06-28 02:14:51 UTC,research,CC-BY-NC,https://inaturalist-open-data.s3.amazonaws.com/photos/233149550/medium.jpg,,,1,0,FALSE,,"Kananaskis, AB T0L, Canada",50.83344699,-115.2978578,122,,,,122,,open,,subalpine larch,Larix lyallii,subalpine larch,Plantae,69848
136656649,9/25/22,2022-09-25 18:57:04 UTC,America/Edmonton,3407147,,2022-09-27 04:21:18 UTC,2024-06-28 02:14:46 UTC,research,CC-BY-NC,https://inaturalist-open-data.s3.amazonaws.com/photos/233266512/medium.jpg,,,1,0,FALSE,3,"Waterton Lakes National Park, Improvement District No. 4 Waterton, AB, CA",49.06685,-114.0671472,3,,,,3,,open,,subalpine larch,Larix lyallii,subalpine larch,Plantae,69848
136752769,9/23/22,2022-09-23 21:53:07 UTC,America/Edmonton,2787296,Taylor Justason,2022-09-27 23:59:14 UTC,2024-06-27 06:07:12 UTC,research,CC-BY-NC,https://inaturalist-open-data.s3.amazonaws.com/photos/233443177/medium.jpg,,,1,0,FALSE,3,"Banff National Park, Improvement District No. 9 Banff, AB, CA",51.244445,-115.5474617,4,,,,4,,open,,subalpine larch,Larix lyallii,subalpine larch,Plantae,69848
136850656,9/28/22,2022-09-28 17:26:15 UTC,Pacific Time (US & Canada),4591172,Bob,2022-09-28 21:28:07 UTC,2024-01-23 07:16:52 UTC,research,CC-BY-NC,https://inaturalist-open-data.s3.amazonaws.com/photos/233746853/medium.jpeg,,,3,1,FALSE,333,"Chelan County, US-WA, US",48.51274109,-120.6656418,4,,,,4,,open,,subalpine larch,Larix lyallii,subalpine larch,Plantae,69848
136955702,9/20/22,2022-09-20 21:14:00 UTC,Pacific Time (US & Canada),2627304,,2022-09-29 20:35:44 UTC,2022-10-14 23:47:15 UTC,research,CC-BY-NC,https://inaturalist-open-data.s3.amazonaws.com/photos/233818734/medium.jpeg,,,1,0,FALSE,,"Okanogan County, WA, USA",48.55594966,-120.6955299,61,,,,61,,open,,subalpine larch,Larix lyallii,subalpine larch,Plantae,69848
136968158,9/25/22,2022-09-25 18:39:00 UTC,America/Edmonton,2151194,,2022-09-29 22:40:36 UTC,2024-06-27 06:06:57 UTC,research,CC-BY-NC,https://inaturalist-open-data.s3.amazonaws.com/photos/233843220/medium.jpeg,,,2,0,FALSE,,"Improvement District No. 9, AB T0L, Canada",51.18705278,-115.9644389,10,,,,10,,open,,subalpine larch,Larix lyallii,subalpine larch,Plantae,69848
136990633,9/28/22,2022-09-28 20:57:28 UTC,America/Edmonton,1448507,Jenny Feick,2022-09-30 03:39:10 UTC,2024-06-28 02:14:33 UTC,research,CC-BY-NC,https://inaturalist-open-data.s3.amazonaws.com/photos/233887867/medium.jpg,,,1,0,FALSE,3,"Waterton Lakes National Park, Improvement District No. 4 Waterton, AB, CA",49.06688333,-114.0663305,4,,,,4,,open,,subalpine larch,Larix lyallii,subalpine larch,Plantae,69848
137237037,9/30/22,2022-09-30 16:16:06 UTC,Pacific Time (US & Canada),987296,Chris,2022-10-02 03:28:18 UTC,2023-06-21 01:08:44 UTC,research,,https://static.inaturalist.org/photos/234348704/medium.jpg,,,2,0,FALSE,3,"Chelan County, US-WA, US",48.27497126,-120.4732263,6,,,,6,,open,,subalpine larch,Larix lyallii,subalpine larch,Plantae,69848
137237368,9/30/22,2022-09-30 18:43:34 UTC,Pacific Time (US & Canada),987296,Chris,2022-10-02 03:34:27 UTC,2023-06-21 01:08:26 UTC,research,,https://static.inaturalist.org/photos/234349419/medium.jpg,,8285 near summit of Courtney Peak ,2,0,FALSE,3,"Okanogan County, US-WA, US",48.26060687,-120.4444007,4,,,,4,,open,,subalpine larch,Larix lyallii,subalpine larch,Plantae,69848
137242920,9/30/22,2022-09-30 21:14:53 UTC,Pacific Time (US & Canada),2846367,Creature_Librarian,2022-10-02 05:12:20 UTC,2022-11-05 19:25:55 UTC,research,CC-BY-NC,https://inaturalist-open-data.s3.amazonaws.com/photos/234360035/medium.jpg,,,1,0,FALSE,3,"Okanogan - Wenatchee National Forest, Stehekin, WA, US",48.50755333,-120.6723417,4,,,,4,,open,,subalpine larch,Larix lyallii,subalpine larch,Plantae,69848
137243158,9/30/22,2022-09-30 19:42:19 UTC,Pacific Time (US & Canada),2846367,Creature_Librarian,2022-10-02 05:16:45 UTC,2022-12-13 03:29:20 UTC,research,CC-BY-NC,https://inaturalist-open-data.s3.amazonaws.com/photos/234360426/medium.jpg,,,2,0,FALSE,3,"Okanogan - Wenatchee National Forest, Stehekin, WA, US",48.51246333,-120.6657417,24,,,,24,,open,,subalpine larch,Larix lyallii,subalpine larch,Plantae,69848
137243171,9/30/22,2022-09-30 19:38:33 UTC,Pacific Time (US & Canada),2846367,Creature_Librarian,2022-10-02 05:17:02 UTC,2023-08-18 05:18:51 UTC,research,CC-BY-NC,https://inaturalist-open-data.s3.amazonaws.com/photos/234360480/medium.jpg,,,2,0,FALSE,3,"Okanogan - Wenatchee National Forest, Stehekin, WA, US",48.5127,-120.6655667,48,,,,48,,open,,subalpine larch,Larix lyallii,subalpine larch,Plantae,69848
137328146,9/28/22,2022-09-28 17:51:00 UTC,America/Edmonton,499708,Jason Headley,2022-10-02 20:20:20 UTC,2022-10-04 17:13:18 UTC,research,CC-BY,https://inaturalist-open-data.s3.amazonaws.com/photos/234501495/medium.jpg,,,1,0,FALSE,,"Akamina-Kishinena, East Kootenay, British Columbia, Canada",49.02511111,-114.1773083,16,,,,16,,open,,subalpine larch,Larix lyallii,subalpine larch,Plantae,69848
137328219,9/28/22,2022-09-28 21:37:00 UTC,America/Edmonton,499708,Jason Headley,2022-10-02 20:20:31 UTC,2022-10-04 17:13:04 UTC,research,CC-BY,https://inaturalist-open-data.s3.amazonaws.com/photos/234507621/medium.jpg,,,1,0,FALSE,,"Akamina-Kishinena, East Kootenay, British Columbia, Canada",49.02450278,-114.1913444,16,,,,16,,open,,subalpine larch,Larix lyallii,subalpine larch,Plantae,69848
137328266,9/28/22,2022-09-28 22:59:00 UTC,America/Edmonton,499708,Jason Headley,2022-10-02 20:20:39 UTC,2022-10-04 17:12:34 UTC,research,CC-BY,https://inaturalist-open-data.s3.amazonaws.com/photos/234512489/medium.jpg,,,1,0,FALSE,,"Akamina-Kishinena, East Kootenay, British Columbia, Canada",49.02438333,-114.2047889,48,,,,48,,open,,subalpine larch,Larix lyallii,subalpine larch,Plantae,69848
137331490,9/29/22,2022-09-29 17:34:01 UTC,America/Edmonton,4028,john rawlings,2022-10-02 20:45:31 UTC,2024-06-28 02:14:24 UTC,research,,https://static.inaturalist.org/photos/234526554/medium.jpg,,,1,0,FALSE,3,"Elbow - Sheep Wildland Provincial Park, Kananaskis, AB, CA",50.603225,-114.98407,10,,,,10,,open,,subalpine larch,Larix lyallii,subalpine larch,Plantae,69848
137340379,9/28/22,2022-09-29 05:16:00 UTC,America/Edmonton,499708,Jason Headley,2022-10-02 21:50:55 UTC,2022-10-04 17:12:21 UTC,research,CC-BY,https://inaturalist-open-data.s3.amazonaws.com/photos/234522765/medium.jpg,,,1,0,FALSE,,"Akamina-Kishinena, East Kootenay, British Columbia, Canada",49.02275833,-114.2008222,16,,,,16,,open,,subalpine larch,Larix lyallii,subalpine larch,Plantae,69848
137340420,9/29/22,2022-09-29 16:43:00 UTC,America/Edmonton,499708,Jason Headley,2022-10-02 21:51:05 UTC,2022-10-04 17:11:25 UTC,research,CC-BY,https://inaturalist-open-data.s3.amazonaws.com/photos/234531636/medium.jpg,,,1,0,FALSE,,"Akamina-Kishinena, East Kootenay, British Columbia, Canada",49.02314722,-114.200775,8,,,,8,,open,,subalpine larch,Larix lyallii,subalpine larch,Plantae,69848
137372102,10/2/22,2022-10-02 19:25:32 UTC,America/Edmonton,1448507,Jenny Feick,2022-10-03 03:02:52 UTC,2022-10-04 17:07:24 UTC,research,CC-BY-NC,https://inaturalist-open-data.s3.amazonaws.com/photos/234608148/medium.jpg,,,1,0,FALSE,3,"East Kootenay, BC, CA",50.373295,-116.2239533,16,,,,16,,open,,subalpine larch,Larix lyallii,subalpine larch,Plantae,69848
137581025,10/1/22,2022-10-01 20:46:28 UTC,Pacific Time (US & Canada),4870864,Ellie Place,2022-10-04 23:23:12 UTC,2022-12-13 00:07:16 UTC,research,,https://static.inaturalist.org/photos/235000037/medium.jpg,,,3,1,FALSE,3,"Okanogan - Wenatchee National Forest, Marblemount, WA, US",48.55262,-120.7045833,126,,,,126,,open,,subalpine larch,Larix lyallii,subalpine larch,Plantae,69848
137645688,9/28/22,2022-09-28 17:26:15 UTC,Pacific Time (US & Canada),4591172,Bob,2022-10-05 15:51:29 UTC,2022-12-12 23:54:17 UTC,research,CC-BY-NC,https://inaturalist-open-data.s3.amazonaws.com/photos/235769996/medium.jpeg,,,1,0,FALSE,333,Stehekin,48.50106812,-120.7368011,2180,,,,2180,,open,,subalpine larch,Larix lyallii,subalpine larch,Plantae,69848
137711067,10/5/22,2022-10-05 20:30:05 UTC,Mountain Time (US & Canada),3734910,Annie Zell,2022-10-06 03:20:14 UTC,2022-10-07 04:59:56 UTC,research,CC-BY-NC,https://inaturalist-open-data.s3.amazonaws.com/photos/235247645/medium.jpg,,,1,0,FALSE,3,"Bitterroot National Forest, Stevensville, MT, US",46.50618333,-114.2271417,4,,,,4,,open,,subalpine larch,Larix lyallii,subalpine larch,Plantae,69848
137711173,10/5/22,2022-10-05 21:26:10 UTC,Mountain Time (US & Canada),3734910,Annie Zell,2022-10-06 03:22:13 UTC,2022-10-07 04:59:45 UTC,research,CC-BY-NC,https://inaturalist-open-data.s3.amazonaws.com/photos/235247884/medium.jpg,,,1,0,FALSE,3,"Bitterroot National Forest, Stevensville, MT, US",46.51158,-114.2425217,4,,,,4,,open,,subalpine larch,Larix lyallii,subalpine larch,Plantae,69848
137713259,10/5/22,2022-10-05 21:28:17 UTC,America/Edmonton,1448507,Jenny Feick,2022-10-06 03:55:31 UTC,2022-10-07 15:26:37 UTC,research,CC-BY-NC,https://inaturalist-open-data.s3.amazonaws.com/photos/235251496/medium.jpg,,,2,0,FALSE,3,"East Kootenay, BC, CA",50.89847167,-116.2410133,8,,,,8,,open,,subalpine larch,Larix lyallii,subalpine larch,Plantae,69848
137722359,10/1/22,2022-10-01 20:05:28 UTC,Pacific Time (US & Canada),36788,David Robichaud,2022-10-06 07:25:57 UTC,2022-12-12 23:54:07 UTC,research,CC-BY-NC,https://inaturalist-open-data.s3.amazonaws.com/photos/235269133/medium.jpg,,,1,0,FALSE,3,"Okanogan - Wenatchee National Forest, Mazama, WA, US",48.63232,-120.4037867,4,,,,4,,open,,subalpine larch,Larix lyallii,subalpine larch,Plantae,69848
137722547,10/1/22,2022-10-01 18:32:54 UTC,Pacific Time (US & Canada),36788,David Robichaud,2022-10-06 07:28:45 UTC,2022-11-05 18:56:55 UTC,research,CC-BY-NC,https://inaturalist-open-data.s3.amazonaws.com/photos/235269353/medium.jpg,,,1,0,FALSE,3,"Okanogan - Wenatchee National Forest, Mazama, WA, US",48.639105,-120.40217,4,,,,4,,open,,subalpine larch,Larix lyallii,subalpine larch,Plantae,69848
137722585,9/30/22,2022-09-30 21:39:34 UTC,Pacific Time (US & Canada),36788,David Robichaud,2022-10-06 07:29:11 UTC,2022-10-07 04:59:22 UTC,research,CC-BY-NC,https://inaturalist-open-data.s3.amazonaws.com/photos/235269397/medium.jpg,,,1,0,FALSE,3,"Okanogan - Wenatchee National Forest, Stehekin, WA, US",48.49966167,-120.756745,4,,,,4,,open,,subalpine larch,Larix lyallii,subalpine larch,Plantae,69848
137915454,7/27/22,2022-07-27 18:20:00 UTC,America/Vancouver,1014980,J Straka,2022-10-07 23:07:22 UTC,2022-10-08 15:53:37 UTC,research,CC-BY,https://inaturalist-open-data.s3.amazonaws.com/photos/235614728/medium.jpg,,Location obscured at request of land-owner.,1,0,FALSE,,"Central Kootenay, CA-BC, CA",49.32102682,-117.0516601,,,,,26550,obscured,open,,subalpine larch,Larix lyallii,subalpine larch,Plantae,69848
137915455,7/27/22,2022-07-27 18:20:00 UTC,America/Vancouver,1014980,J Straka,2022-10-07 23:07:23 UTC,2022-10-08 15:53:26 UTC,research,CC-BY,https://inaturalist-open-data.s3.amazonaws.com/photos/235614782/medium.jpg,,Location obscured at request of land-owner.,1,0,FALSE,,"Central Kootenay, CA-BC, CA",49.33810395,-117.0167151,,,,,26550,obscured,open,,subalpine larch,Larix lyallii,subalpine larch,Plantae,69848
137922347,9/24/22,2022-09-24 19:41:00 UTC,America/Vancouver,1641019,Shane Johnson,2022-10-08 00:26:02 UTC,2023-07-08 09:58:44 UTC,research,CC0,https://inaturalist-open-data.s3.amazonaws.com/photos/235639621/medium.jpeg,,,1,0,FALSE,,"Okanagan-Similkameen, BC, Canada",49.05488,-120.1872433,,,,,,,open,,subalpine larch,Larix lyallii,subalpine larch,Plantae,69848
137922355,9/24/22,2022-09-24 20:01:00 UTC,America/Vancouver,1641019,Shane Johnson,2022-10-08 00:26:04 UTC,2023-07-08 09:59:05 UTC,research,CC0,https://inaturalist-open-data.s3.amazonaws.com/photos/235640612/medium.jpeg,,,1,0,FALSE,,"Okanagan-Similkameen, British Columbia, Canada",49.05248667,-120.188125,,,,,,,open,,subalpine larch,Larix lyallii,subalpine larch,Plantae,69848
137924168,9/24/22,2022-09-24 20:55:00 UTC,America/Vancouver,1641019,Shane Johnson,2022-10-08 00:47:23 UTC,2023-07-08 10:00:59 UTC,research,CC0,https://inaturalist-open-data.s3.amazonaws.com/photos/235644081/medium.jpeg,,,1,0,FALSE,,"Okanagan-Similkameen, BC, Canada",49.04316167,-120.1919183,,,,,,,open,,subalpine larch,Larix lyallii,subalpine larch,Plantae,69848
137924174,9/24/22,2022-09-24 23:20:00 UTC,America/Vancouver,1641019,Shane Johnson,2022-10-08 00:47:24 UTC,2023-07-08 10:01:19 UTC,research,CC0,https://inaturalist-open-data.s3.amazonaws.com/photos/235644933/medium.jpeg,,,1,0,FALSE,,"Okanagan-Similkameen, British Columbia, Canada",49.05575667,-120.2157033,,,,,,,open,,subalpine larch,Larix lyallii,subalpine larch,Plantae,69848
138051091,10/8/22,2022-10-08 21:48:30 UTC,America/Edmonton,1448507,Jenny Feick,2022-10-08 23:44:02 UTC,2022-10-09 12:53:32 UTC,research,CC-BY-NC,https://inaturalist-open-data.s3.amazonaws.com/photos/235883085/medium.jpg,,,1,0,FALSE,3,"East Kootenay, BC, CA",50.44483,-115.7842033,14,,,,14,,open,,subalpine larch,Larix lyallii,subalpine larch,Plantae,69848
138143324,10/1/22,2022-10-02 01:21:44 UTC,America/Vancouver,3510606,Peter Tarleton,2022-10-09 17:28:00 UTC,2022-10-14 14:32:03 UTC,research,,https://static.inaturalist.org/photos/236057610/medium.jpeg,,,1,0,FALSE,2,"Manning Park, BC V0X 1R0, Canada",49.10469845,-120.758375,,,,,,,open,gps,subalpine larch,Larix lyallii,subalpine larch,Plantae,69848
138160272,10/4/22,2022-10-04 20:16:51 UTC,America/Edmonton,2331783,Jake Batters,2022-10-09 19:28:07 UTC,2024-06-27 06:06:49 UTC,research,CC-BY-NC,https://inaturalist-open-data.s3.amazonaws.com/photos/236089592/medium.jpg,,,3,1,FALSE,3,"Banff National Park, Improvement District No. 9 Banff, AB, CA",51.09226117,-115.8518133,4,,,,4,,open,,subalpine larch,Larix lyallii,subalpine larch,Plantae,69848
138160553,10/3/22,2022-10-04 00:04:14 UTC,America/Edmonton,2331783,Jake Batters,2022-10-09 19:30:06 UTC,2024-06-27 06:06:44 UTC,research,CC-BY-NC,https://inaturalist-open-data.s3.amazonaws.com/photos/236090733/medium.jpg,,,3,1,FALSE,3,"Banff National Park, Improvement District No. 9 Banff, AB, CA",51.392955,-116.21308,14,,,,14,,open,,subalpine larch,Larix lyallii,subalpine larch,Plantae,69848
138223553,10/9/22,2022-10-09 20:23:52 UTC,Pacific Time (US & Canada),6072140,,2022-10-10 05:09:44 UTC,2022-11-05 18:35:03 UTC,research,CC-BY-NC,https://inaturalist-open-data.s3.amazonaws.com/photos/236214481/medium.jpg,,,1,0,FALSE,3,"Okanogan - Wenatchee National Forest, Marblemount, WA, US",48.50926167,-120.7649083,4,,,,4,,open,,subalpine larch,Larix lyallii,subalpine larch,Plantae,69848
138224488,10/8/22,2022-10-08 19:55:07 UTC,Pacific Time (US & Canada),5639435,Sam Beaumont,2022-10-10 05:25:38 UTC,2022-11-05 18:34:29 UTC,research,CC-BY,https://inaturalist-open-data.s3.amazonaws.com/photos/236216287/medium.jpg,,,1,0,FALSE,3,"Okanogan - Wenatchee National Forest, Marblemount, WA, US",48.57226667,-120.8330533,50,,,,50,,open,,subalpine larch,Larix lyallii,subalpine larch,Plantae,69848
138224528,10/8/22,2022-10-08 20:34:21 UTC,Pacific Time (US & Canada),5639435,Sam Beaumont,2022-10-10 05:26:33 UTC,2022-11-05 18:34:18 UTC,research,CC-BY,https://inaturalist-open-data.s3.amazonaws.com/photos/236216389/medium.jpg,,,1,0,FALSE,3,"North Cascades National Park, Marblemount, WA, US",48.57203333,-120.844505,10,,,,10,,open,,subalpine larch,Larix lyallii,subalpine larch,Plantae,69848
138246722,10/8/22,2022-10-08 20:52:21 UTC,Pacific Time (US & Canada),5639435,Sam Beaumont,2022-10-10 12:30:01 UTC,2022-11-05 18:34:01 UTC,research,CC-BY,https://inaturalist-open-data.s3.amazonaws.com/photos/236258578/medium.jpg,,,1,0,FALSE,3,"North Cascades National Park, Marblemount, WA, US",48.57206667,-120.84497,10,,,,10,,open,,subalpine larch,Larix lyallii,subalpine larch,Plantae,69848
138246911,10/8/22,2022-10-08 20:53:09 UTC,Pacific Time (US & Canada),5639435,Sam Beaumont,2022-10-10 12:31:10 UTC,2022-11-05 18:33:58 UTC,research,CC-BY,https://inaturalist-open-data.s3.amazonaws.com/photos/236258739/medium.jpg,,,1,0,FALSE,3,"North Cascades National Park, Marblemount, WA, US",48.57201167,-120.8450917,5,,,,5,,open,,subalpine larch,Larix lyallii,subalpine larch,Plantae,69848
138246998,10/8/22,2022-10-08 20:55:26 UTC,Pacific Time (US & Canada),5639435,Sam Beaumont,2022-10-10 12:32:27 UTC,2022-11-05 18:33:47 UTC,research,CC-BY,https://inaturalist-open-data.s3.amazonaws.com/photos/236258902/medium.jpg,,,1,0,FALSE,3,"North Cascades National Park, Marblemount, WA, US",48.572025,-120.84527,5,,,,5,,open,,subalpine larch,Larix lyallii,subalpine larch,Plantae,69848
138289702,9/30/22,2022-09-30 22:37:30 UTC,Pacific Time (US & Canada),93866,Alex Patia,2022-10-10 18:43:38 UTC,2023-11-19 04:21:11 UTC,research,CC-BY-NC,https://inaturalist-open-data.s3.amazonaws.com/photos/236337527/medium.jpg,,,2,0,FALSE,3,"Okanogan - Wenatchee National Forest, Deming, WA, US",48.73240333,-120.6746883,4,,,,4,,open,,subalpine larch,Larix lyallii,subalpine larch,Plantae,69848
138290058,9/30/22,2022-09-30 21:26:16 UTC,Pacific Time (US & Canada),93866,Alex Patia,2022-10-10 18:46:11 UTC,2022-10-11 02:13:17 UTC,research,CC-BY-NC,https://inaturalist-open-data.s3.amazonaws.com/photos/236338216/medium.jpg,,,1,0,FALSE,3,"Okanogan - Wenatchee National Forest, Mazama, WA, US",48.74294167,-120.6827917,4,,,,4,,open,,subalpine larch,Larix lyallii,subalpine larch,Plantae,69848
138311031,10/9/22,2022-10-09 19:10:36 UTC,America/Edmonton,1448507,Jenny Feick,2022-10-10 21:21:23 UTC,2024-06-27 06:06:40 UTC,research,CC-BY-NC,https://inaturalist-open-data.s3.amazonaws.com/photos/236376380/medium.jpg,,,1,0,FALSE,3,"Banff National Park, Improvement District No. 9 Banff, AB, CA",51.22452,-115.9973833,15,,,,15,,open,,subalpine larch,Larix lyallii,subalpine larch,Plantae,69848
138327159,10/9/22,2022-10-09 18:12:06 UTC,America/Vancouver,59776,Adam Huggins,2022-10-10 23:48:56 UTC,2022-10-16 02:46:17 UTC,research,CC-BY-NC,https://inaturalist-open-data.s3.amazonaws.com/photos/236406007/medium.jpg,,,1,0,FALSE,3,"Central Kootenay, BC, CA",49.46195333,-117.1569362,4,,,,4,,open,,subalpine larch,Larix lyallii,subalpine larch,Plantae,69848
138348122,10/1/22,2022-10-01 22:00:11 UTC,Pacific Time (US & Canada),6179800,,2022-10-11 03:25:38 UTC,2023-09-01 20:00:22 UTC,research,CC-BY-NC,https://inaturalist-open-data.s3.amazonaws.com/photos/236445809/medium.jpeg,,,1,0,FALSE,2,"Leavenworth, WA 98826, USA",47.4795481,-120.7920266,,,,,,,open,gps,subalpine larch,Larix lyallii,subalpine larch,Plantae,69848
138384463,9/24/21,2021-09-24 23:06:37 UTC,Pacific Time (US & Canada),6205904,Cheryl Dill,2022-10-11 13:50:45 UTC,2022-11-25 00:31:53 UTC,research,,https://static.inaturalist.org/photos/236517084/medium.jpg,,,1,0,FALSE,3,"North Cascades National Park, Stehekin, WA, US",48.49952,-120.7612,24,,,,24,,open,,subalpine larch,Larix lyallii,subalpine larch,Plantae,69848
138529868,10/6/22,2022-10-06 17:13:35 UTC,Pacific Time (US & Canada),3154933,,2022-10-12 18:33:54 UTC,2022-11-05 18:22:23 UTC,research,CC-BY-NC,https://inaturalist-open-data.s3.amazonaws.com/photos/236794628/medium.jpg,,,1,0,FALSE,3,"Okanogan - Wenatchee National Forest, Leavenworth, WA, US",47.4965855,-120.8325734,139,,,,139,,open,,subalpine larch,Larix lyallii,subalpine larch,Plantae,69848
138581331,10/12/22,2022-10-12 19:47:54 UTC,Pacific Time (US & Canada),2710493,,2022-10-13 04:27:23 UTC,2022-12-12 23:51:13 UTC,research,CC-BY-NC,https://inaturalist-open-data.s3.amazonaws.com/photos/236892683/medium.jpg,,,2,0,FALSE,3,"Okanogan - Wenatchee National Forest, Stehekin, WA, US",48.50742,-120.673745,,,,,,,open,,subalpine larch,Larix lyallii,subalpine larch,Plantae,69848
138602697,10/6/22,2022-10-06 18:39:00 UTC,America/Edmonton,2151194,,2022-10-13 12:34:03 UTC,2024-06-27 06:06:32 UTC,research,CC-BY-NC,https://inaturalist-open-data.s3.amazonaws.com/photos/236933737/medium.jpeg,,,2,0,FALSE,,"Improvement District No. 9, AB T0L, Canada",51.47407778,-116.0982972,10,,,,10,,open,,subalpine larch,Larix lyallii,subalpine larch,Plantae,69848
138745133,10/12/22,2022-10-12 15:29:43 UTC,Pacific Time (US & Canada),6138730,,2022-10-14 18:16:17 UTC,2022-12-07 18:32:35 UTC,research,CC-BY,https://inaturalist-open-data.s3.amazonaws.com/photos/237186987/medium.jpeg,,,1,0,FALSE,2,"Chelan County, WA, USA",48.5084314,-120.7654096,,,,,,,open,,subalpine larch,Larix lyallii,subalpine larch,Plantae,69848
138752809,10/13/22,2022-10-13 16:29:17 UTC,Pacific Time (US & Canada),3154933,,2022-10-14 19:28:09 UTC,2022-11-05 18:18:45 UTC,research,CC-BY-NC,https://inaturalist-open-data.s3.amazonaws.com/photos/237201003/medium.jpg,,,1,0,FALSE,3,"Okanogan - Wenatchee National Forest, Leavenworth, WA, US",47.46104509,-120.9360184,357,,,,357,,open,,subalpine larch,Larix lyallii,subalpine larch,Plantae,69848
138780375,10/14/22,2022-10-14 17:20:50 UTC,Pacific Time (US & Canada),4622284,,2022-10-15 00:16:53 UTC,2024-01-23 06:20:24 UTC,research,CC-BY-NC,https://inaturalist-open-data.s3.amazonaws.com/photos/237255073/medium.jpeg,,,3,1,FALSE,333,"Kittitas County, US-WA, US",47.45739365,-120.9334259,3,,,,3,,open,,subalpine larch,Larix lyallii,subalpine larch,Plantae,69848
138802642,10/9/22,2022-10-09 20:22:00 UTC,Pacific Time (US & Canada),232932,Sydney Gerig,2022-10-15 05:30:52 UTC,2023-08-18 05:18:10 UTC,research,CC-BY-NC,https://inaturalist-open-data.s3.amazonaws.com/photos/237296497/medium.jpeg,,,2,0,FALSE,,"Blue Lake Trail - Okanogan-Wenatchee NF, Chelan County, WA",48.51314283,-120.671568,786,,,,786,,open,,subalpine larch,Larix lyallii,subalpine larch,Plantae,69848
138841566,10/13/22,2022-10-13 19:07:46 UTC,Pacific Time (US & Canada),25173,Daniel Mathews,2022-10-15 14:27:55 UTC,2022-11-05 18:05:48 UTC,research,,https://static.inaturalist.org/photos/237360555/medium.jpg,,,1,0,FALSE,3,"Okanogan - Wenatchee National Forest, Mazama, WA, US",48.48182,-120.6532667,3,,,,3,,open,,subalpine larch,Larix lyallii,subalpine larch,Plantae,69848
138856625,9/27/22,2022-09-27 20:24:00 UTC,America/Edmonton,88044,BioBlitz,2022-10-15 16:25:55 UTC,2024-06-27 06:06:30 UTC,research,CC-BY-ND,https://inaturalist-open-data.s3.amazonaws.com/photos/237387265/medium.jpeg,,Taylor Lake,2,0,FALSE,,"Improvement District No. 9, AB T0L, Canada",51.3082291,-116.112615,632,,,,632,,open,,subalpine larch,Larix lyallii,subalpine larch,Plantae,69848
139134285,10/15/22,2022-10-15 17:49:00 UTC,Pacific Time (US & Canada),6249723,,2022-10-17 17:12:57 UTC,2022-10-17 17:37:27 UTC,research,CC-BY-NC,https://inaturalist-open-data.s3.amazonaws.com/photos/237915219/medium.jpg,,,1,0,FALSE,,"Chelan County, WA, USA",47.46045997,-120.938275,,,,,,,open,,subalpine larch,Larix lyallii,subalpine larch,Plantae,69848
139196554,10/16/22,2022-10-16 21:24:51 UTC,Pacific Time (US & Canada),586591,Lexi Menth,2022-10-18 04:11:51 UTC,2022-11-05 21:46:09 UTC,research,CC-BY-NC,https://inaturalist-open-data.s3.amazonaws.com/photos/238037381/medium.jpg,,,1,0,FALSE,3,"Okanogan - Wenatchee National Forest, Mazama, WA, US",48.69921167,-120.675705,5,,,,5,,open,,subalpine larch,Larix lyallii,subalpine larch,Plantae,69848
139292375,10/8/22,,Pacific Time (US & Canada),6003752,Jessica Harvey,2022-10-19 02:02:01 UTC,2022-11-05 17:48:39 UTC,research,,https://static.inaturalist.org/photos/238217078/medium.jpeg,,,1,0,FALSE,2,"Winthrop, WA 98862, USA",48.50767741,-120.6729567,333,,,,333,,open,gps,subalpine larch,Larix lyallii,subalpine larch,Plantae,69848
139535785,9/27/22,2022-09-27 19:05:00 UTC,America/Edmonton,458238,,2022-10-21 16:26:32 UTC,2024-06-27 06:06:24 UTC,research,CC-BY-NC,https://inaturalist-open-data.s3.amazonaws.com/photos/238677700/medium.jpeg,,Taylor Lake,1,0,FALSE,,"Improvement District No. 9, AB T0L, Canada",51.30041265,-116.0959891,333,,,,333,,open,,subalpine larch,Larix lyallii,subalpine larch,Plantae,69848
139705902,10/22/22,2022-10-22 21:00:37 UTC,Pacific Time (US & Canada),1429048,rebecca bachman,2022-10-23 03:08:22 UTC,2023-01-27 22:07:20 UTC,research,CC0,https://inaturalist-open-data.s3.amazonaws.com/photos/239003307/medium.jpg,,,3,1,FALSE,3,"Bosque Nacional de Wenatchee, Leavenworth, WA, US",47.47282,-120.93712,4,,,,4,,open,,subalpine larch,Larix lyallii,subalpine larch,Plantae,69848
139810262,8/10/22,2022-08-11 00:43:00 UTC,America/Edmonton,4176670,Floyd E. Hayes,2022-10-23 22:54:35 UTC,2022-10-24 22:49:35 UTC,research,CC-BY-NC,https://inaturalist-open-data.s3.amazonaws.com/photos/239194040/medium.jpeg,,,1,0,FALSE,,"East Kootenay, BC, Canada",50.73882222,-116.7687917,4,,,,4,,open,,subalpine larch,Larix lyallii,subalpine larch,Plantae,69848
140002302,10/5/22,2022-10-05 19:39:47 UTC,America/Vancouver,1421387,Kate McKeown,2022-10-25 21:16:30 UTC,2023-01-25 21:08:22 UTC,research,CC0,https://inaturalist-open-data.s3.amazonaws.com/photos/239572606/medium.jpeg,,,1,0,FALSE,2,"Manning Park, BC V0X 1R0, Canada",49.01415278,-120.8323222,,,,,,,open,gps,subalpine larch,Larix lyallii,subalpine larch,Plantae,69848
140002346,10/5/22,2022-10-05 20:51:37 UTC,America/Vancouver,1421387,Kate McKeown,2022-10-25 21:17:12 UTC,2023-01-25 21:08:22 UTC,research,CC0,https://inaturalist-open-data.s3.amazonaws.com/photos/239572760/medium.jpeg,,,1,0,FALSE,2,"Manning Park, BC V0X 1R0, Canada",49.02603333,-120.8304917,,,,,,,open,gps,subalpine larch,Larix lyallii,subalpine larch,Plantae,69848
140419732,10/15/22,2022-10-15 22:09:05 UTC,America/Vancouver,4326759,,2022-10-29 19:56:56 UTC,2022-10-30 00:31:04 UTC,research,CC-BY-NC,https://inaturalist-open-data.s3.amazonaws.com/photos/240362951/medium.jpg,,,1,0,FALSE,3,"E.C. Manning Provincial Park, Fraser Valley, BC, CA",49.02631383,-120.8303967,14,,,,14,,open,,subalpine larch,Larix lyallii,subalpine larch,Plantae,69848
141655516,8/31/22,2022-08-31 19:42:00 UTC,Pacific Time (US & Canada),236267,Tynan Ramm-Granberg,2022-11-11 00:43:28 UTC,2022-11-12 19:19:52 UTC,research,CC-BY-NC,https://inaturalist-open-data.s3.amazonaws.com/photos/242728973/medium.jpg,,,1,0,FALSE,,"Chelan County, WA, USA",48.01856589,-120.7300699,473,,,,473,,open,,subalpine larch,Larix lyallii,subalpine larch,Plantae,69848
141824238,9/15/20,2020-09-15 17:19:00 UTC,America/Vancouver,6308759,Alan Burger,2022-11-12 21:53:32 UTC,2022-11-16 00:19:28 UTC,research,CC-BY-NC,https://inaturalist-open-data.s3.amazonaws.com/photos/243049307/medium.jpg,,,2,0,FALSE,,"Cathedral Park, BC, Canada",49.07205563,-120.1937221,61,,,,61,,open,,subalpine larch,Larix lyallii,subalpine larch,Plantae,69848
141930385,7/2/22,2022-07-02 20:24:00 UTC,Pacific Time (US & Canada),1657037,Christopher J. Earle,2022-11-13 21:57:41 UTC,2023-02-14 14:54:40 UTC,research,CC-BY-NC,https://inaturalist-open-data.s3.amazonaws.com/photos/243248718/medium.jpg,"foliage, in-habitat, seed-cone",fertile cones and young foliage,1,0,FALSE,,"Okanogan County, WA, USA",48.69636838,-120.6741121,,,,,,,open,,subalpine larch,Larix lyallii,subalpine larch,Plantae,69848
141930393,7/4/22,2022-07-04 16:59:00 UTC,Pacific Time (US & Canada),1657037,Christopher J. Earle,2022-11-13 21:57:42 UTC,2022-11-13 22:43:20 UTC,research,CC-BY-NC,https://inaturalist-open-data.s3.amazonaws.com/photos/243248821/medium.jpg,"Forest, Ice, Landscape, Mountain-Cascades, Mountains, in-habitat, whole-plant",also some fir and spruce,1,0,FALSE,,"Okanogan, Washington, United States",48.78042974,-120.7299635,,,,,,,open,,subalpine larch,Larix lyallii,subalpine larch,Plantae,69848
141930394,7/4/22,2022-07-04 17:37:00 UTC,Pacific Time (US & Canada),1657037,Christopher J. Earle,2022-11-13 21:57:43 UTC,2022-11-13 22:43:14 UTC,research,CC-BY-NC,https://inaturalist-open-data.s3.amazonaws.com/photos/243248851/medium.jpg,"Forest, Ice, Landscape, Mountain-Cascades, Mountains, People, in-habitat, whole-plant",,1,0,FALSE,,"Okanogan, Washington, United States",48.778447,-120.7231804,,,,,,,open,,subalpine larch,Larix lyallii,subalpine larch,Plantae,69848
141930402,7/4/22,2022-07-04 19:33:00 UTC,Pacific Time (US & Canada),1657037,Christopher J. Earle,2022-11-13 21:57:44 UTC,2023-12-29 02:08:47 UTC,research,CC-BY-NC,https://inaturalist-open-data.s3.amazonaws.com/photos/243248901/medium.jpg,"Ecology, Forest, Ice, Landscape, Mountain-Cascades, Mountains, Timberline, in-habitat, whole-plant","also spruce, fir",2,0,FALSE,,"Whatcom, Washington, United States",48.75355072,-120.6943377,,,,,,,open,,subalpine larch,Larix lyallii,subalpine larch,Plantae,69848
142329674,9/18/22,2022-09-19 00:41:00 UTC,America/Edmonton,5180443,,2022-11-19 00:49:01 UTC,2024-06-27 06:06:17 UTC,research,CC-BY-NC,https://inaturalist-open-data.s3.amazonaws.com/photos/243990752/medium.jpeg,,,2,0,FALSE,,"Improvement District No. 9, AB T0L, Canada",51.3282378,-116.2140792,176,,,,176,,open,,subalpine larch,Larix lyallii,subalpine larch,Plantae,69848
142329770,9/22/22,2022-09-23 01:15:00 UTC,America/Edmonton,5180443,,2022-11-19 00:50:55 UTC,2024-06-28 02:13:57 UTC,research,CC-BY-NC,https://inaturalist-open-data.s3.amazonaws.com/photos/243991035/medium.jpeg,,,2,0,FALSE,,"Tower of Babel, Improvement District No. 9, AB T0L, Canada",51.325,-116.17,1355,,,,1355,,open,,subalpine larch,Larix lyallii,subalpine larch,Plantae,69848
142330080,9/24/22,2022-09-24 16:48:00 UTC,America/Edmonton,5180443,,2022-11-19 00:54:58 UTC,2024-06-28 02:13:52 UTC,research,CC-BY-NC,https://inaturalist-open-data.s3.amazonaws.com/photos/243991363/medium.jpeg,,,2,0,FALSE,,"Improvement District No. 9, AB T0L, Canada",51.10845466,-115.8579292,1863,,,,1863,,open,,subalpine larch,Larix lyallii,subalpine larch,Plantae,69848
142330184,9/26/22,2022-09-26 23:38:00 UTC,America/Edmonton,5180443,,2022-11-19 00:57:11 UTC,2024-06-27 06:03:50 UTC,research,CC-BY-NC,https://inaturalist-open-data.s3.amazonaws.com/photos/243991516/medium.jpeg,,,2,0,FALSE,,"Improvement District No. 9, AB T0L, Canada",51.32621386,-116.2108737,612,,,,612,,open,,subalpine larch,Larix lyallii,subalpine larch,Plantae,69848
143237536,9/24/22,2022-09-24 19:32:41 UTC,Pacific Time (US & Canada),3797293,Lara Jansen,2022-11-29 03:17:54 UTC,2022-11-29 17:24:50 UTC,research,,https://static.inaturalist.org/photos/245628650/medium.jpg,,,1,0,FALSE,3,"Okanogan - Wenatchee National Forest, Leavenworth, WA, US",47.55123667,-120.8748383,7,,,,7,,open,,subalpine larch,Larix lyallii,subalpine larch,Plantae,69848
143470967,9/26/22,2022-09-26 22:52:14 UTC,America/Edmonton,4527805,Angie Sherstan,2022-12-02 03:02:24 UTC,2024-06-27 06:03:44 UTC,research,,https://static.inaturalist.org/photos/246257197/medium.jpg,,,1,0,FALSE,3,"Banff National Park, Improvement District No. 9 Banff, AB, CA",51.32818667,-116.2154467,10,,,,10,,open,,subalpine larch,Larix lyallii,subalpine larch,Plantae,69848
143545404,8/13/14,2014-08-14 02:26:00 UTC,America/Vancouver,6308759,Alan Burger,2022-12-03 05:51:58 UTC,2022-12-03 17:55:52 UTC,research,CC-BY-NC,https://inaturalist-open-data.s3.amazonaws.com/photos/246193919/medium.jpg,,,1,0,FALSE,,"Cathedral Park, Okanagan-Similkameen, BC, Canada",49.06075581,-120.2019583,300,,,,300,,open,,subalpine larch,Larix lyallii,subalpine larch,Plantae,69848
143568901,7/5/22,2022-07-05 18:00:00 UTC,Pacific Time (US & Canada),1657037,Christopher J. Earle,2022-12-03 15:49:15 UTC,2022-12-07 18:12:29 UTC,research,CC-BY-NC,https://inaturalist-open-data.s3.amazonaws.com/photos/246238747/medium.jpg,"Forest, in-habitat, whole-plant",Alpine larch (left) and whitebark pine (right),1,0,FALSE,,"Okanogan, Washington, United States",48.25569712,-120.325856,,,,,,,open,,subalpine larch,Larix lyallii,subalpine larch,Plantae,69848
143568902,7/5/22,2022-07-05 19:15:00 UTC,Pacific Time (US & Canada),1657037,Christopher J. Earle,2022-12-03 15:49:15 UTC,2023-02-14 14:53:13 UTC,research,CC-BY-NC,https://inaturalist-open-data.s3.amazonaws.com/photos/246238780/medium.jpg,"foliage, in-habitat, seed-cone","Alpine larch, fertile seed cones and young foliage, on a large and old tree.",1,0,FALSE,,"Okanogan, Washington, United States",48.24279361,-120.3373427,,,,,,,open,,subalpine larch,Larix lyallii,subalpine larch,Plantae,69848
143568903,7/5/22,2022-07-05 20:11:00 UTC,Pacific Time (US & Canada),1657037,Christopher J. Earle,2022-12-03 15:49:15 UTC,2023-06-21 01:08:17 UTC,research,CC-BY-NC,https://inaturalist-open-data.s3.amazonaws.com/photos/246238795/medium.jpg,"Ice, in-habitat, whole-plant","Alpine larch, an exceptionally old and large individual. Such trees are common at this site, though virtually all have pith rot.",2,0,FALSE,,"Okanogan, Washington, United States",48.24274105,-120.3382152,,,,,,,open,,subalpine larch,Larix lyallii,subalpine larch,Plantae,69848
143568907,7/5/22,2022-07-05 21:57:00 UTC,Pacific Time (US & Canada),1657037,Christopher J. Earle,2022-12-03 15:49:16 UTC,2023-06-21 01:07:18 UTC,research,CC-BY-NC,https://inaturalist-open-data.s3.amazonaws.com/photos/246238822/medium.jpg,"Forest, in-habitat, whole-plant","The lowest alpine larches we saw, in mixed forest with lodgepole pine, whitebark pine, subalpine fir, and Engelmann spruce",2,0,FALSE,,"Okanogan, Washington, United States",48.26472124,-120.3213844,,,,,,,open,,subalpine larch,Larix lyallii,subalpine larch,Plantae,69848
143705280,9/7/22,2022-09-07 21:07:40 UTC,America/Edmonton,1717149,,2022-12-05 05:38:20 UTC,2022-12-12 19:06:19 UTC,research,CC-BY-NC,https://inaturalist-open-data.s3.amazonaws.com/photos/246500924/medium.jpeg,,,1,0,FALSE,2,"Parson, BC V0A 1L0, Canada",51.3439216,-116.3220833,,,,,,,open,gps,subalpine larch,Larix lyallii,subalpine larch,Plantae,69848
144485581,9/7/22,2022-09-07 21:07:40 UTC,America/Edmonton,1717149,,2022-12-16 17:57:04 UTC,2022-12-29 16:54:26 UTC,research,CC-BY-NC,https://inaturalist-open-data.s3.amazonaws.com/photos/247990462/medium.jpeg,,,1,0,FALSE,2,"Parson, BC V0A 1L0, Canada",51.3439216,-116.3220833,,,,,,,open,gps,subalpine larch,Larix lyallii,subalpine larch,Plantae,69848
144491792,3/29/22,2022-03-29 20:06:31 UTC,America/Edmonton,1717149,,2022-12-16 20:10:51 UTC,2024-06-28 02:13:31 UTC,research,CC-BY-NC,https://inaturalist-open-data.s3.amazonaws.com/photos/248003359/medium.jpeg,,,1,0,FALSE,2,"Exshaw, AB T0L 2C0, Canada",50.7199616,-115.236705,,,,,,,open,gps,subalpine larch,Larix lyallii,subalpine larch,Plantae,69848
144491964,2/25/22,2022-02-25 23:04:00 UTC,America/Edmonton,1717149,,2022-12-16 20:14:11 UTC,2022-12-19 15:08:10 UTC,research,CC-BY-NC,https://inaturalist-open-data.s3.amazonaws.com/photos/248003820/medium.jpeg,,,1,0,FALSE,2,"Spillimacheen, BC V0A 1P0, Canada",50.90546033,-116.2443237,,,,,,,open,gps,subalpine larch,Larix lyallii,subalpine larch,Plantae,69848
144494707,10/16/22,2022-10-16 20:50:00 UTC,Pacific Time (US & Canada),1657037,Christopher J. Earle,2022-12-16 21:04:31 UTC,2022-12-24 18:08:01 UTC,research,CC-BY-NC,https://inaturalist-open-data.s3.amazonaws.com/photos/248009170/medium.jpg,"Autumn-color, Ecosystems, Landscape, Mountain-Cascades, Mountains, in-habitat, whole-plant",,1,0,FALSE,,"Okanogan, Washington, United States",48.55055732,-120.6894312,,,,,,,open,,subalpine larch,Larix lyallii,subalpine larch,Plantae,69848
144495492,10/16/22,2022-10-16 21:36:00 UTC,Pacific Time (US & Canada),1657037,Christopher J. Earle,2022-12-16 21:16:17 UTC,2022-12-16 22:02:08 UTC,research,CC-BY-NC,https://inaturalist-open-data.s3.amazonaws.com/photos/248009681/medium.jpg,"Autumn-color, Forest, Geologic ecology, Landscape, Mountain-Cascades, Mountains, Scenery, Timberline, in-habitat, whole-plant","Hinkhouse Peak, with larches",1,0,FALSE,,"Okanogan County, WA, USA",48.54912609,-120.6826298,,,,,,,open,,subalpine larch,Larix lyallii,subalpine larch,Plantae,69848
144619614,10/3/22,2022-10-03 20:41:50 UTC,America/Edmonton,962531,Ian Gazeley,2022-12-18 19:43:11 UTC,2024-06-28 02:13:27 UTC,research,CC-BY-NC,https://inaturalist-open-data.s3.amazonaws.com/photos/248251159/medium.jpg,,,1,0,FALSE,3,"Don Getty Wildland Provincial Park, Ranchland No. 66, AB, CA",50.16765299,-114.4116119,75,,,,75,,open,,subalpine larch,Larix lyallii,subalpine larch,Plantae,69848
144949331,9/22/11,2011-09-22 19:24:00 UTC,Mountain Time (US & Canada),15881,Nicholas J. Tucci,2022-12-23 23:05:26 UTC,2023-01-01 17:46:52 UTC,research,CC-BY-NC,https://inaturalist-open-data.s3.amazonaws.com/photos/248894557/medium.jpg,,,1,0,FALSE,,"Ravalli County, MT, USA",46.22957392,-113.7957727,3906,,,,3906,,open,,subalpine larch,Larix lyallii,subalpine larch,Plantae,69848
145027613,6/28/22,2022-06-28 19:17:00 UTC,America/Edmonton,1717149,,2022-12-25 05:57:40 UTC,2024-06-28 02:13:22 UTC,research,CC-BY-NC,https://inaturalist-open-data.s3.amazonaws.com/photos/249047725/medium.jpeg,,,1,0,FALSE,,"Kananaskis, AB T0L, Canada",50.75505286,-115.2228066,31,,,,31,,open,,subalpine larch,Larix lyallii,subalpine larch,Plantae,69848
145065320,8/6/22,2022-08-06 19:56:00 UTC,America/Edmonton,1031873,Hubert Szczygie,2022-12-25 21:04:50 UTC,2023-02-08 14:22:51 UTC,research,CC-BY-NC,https://static.inaturalist.org/photos/249109011/medium.jpg,iNaturalist Canada 2022,,1,0,FALSE,,"East Kootenay, British Columbia, Canada",50.49779333,-115.2387583,,,,,,,open,,subalpine larch,Larix lyallii,subalpine larch,Plantae,69848
145313655,8/2/09,2009-08-02 20:13:00 UTC,America/Edmonton,791207,James Kamstra,2022-12-29 04:17:52 UTC,2024-04-02 17:47:45 UTC,research,,https://static.inaturalist.org/photos/249593550/medium.jpeg,,,1,0,FALSE,,"East Kootenay, BC, Canada",51.05545502,-115.7931118,250,,,,250,,open,,subalpine larch,Larix lyallii,subalpine larch,Plantae,69848
145313676,8/2/09,2009-08-02 18:08:00 UTC,America/Edmonton,791207,James Kamstra,2022-12-29 04:17:56 UTC,2024-06-27 06:03:40 UTC,research,,https://static.inaturalist.org/photos/249593691/medium.jpeg,,,1,0,FALSE,,"Improvement District No. 9, AB T0L, Canada",51.07233352,-115.7795691,150,,,,150,,open,,subalpine larch,Larix lyallii,subalpine larch,Plantae,69848
146144226,9/13/22,2022-09-13 17:06:00 UTC,America/Edmonton,1717149,,2023-01-08 19:39:29 UTC,2024-06-28 02:13:12 UTC,research,CC-BY-NC,https://inaturalist-open-data.s3.amazonaws.com/photos/251192001/medium.jpeg,,,1,0,FALSE,,"Kananaskis, AB T0L, Canada",50.55314667,-114.8419833,,,,,,,open,,subalpine larch,Larix lyallii,subalpine larch,Plantae,69848
146428203,7/24/15,2015-07-25 00:57:59 UTC,Pacific Time (US & Canada),285289,Tina Marie Camp Scheff,2023-01-12 22:36:33 UTC,2024-07-06 13:24:54 UTC,research,CC-BY-NC,https://inaturalist-open-data.s3.amazonaws.com/photos/251743691/medium.jpeg,,,1,0,FALSE,2,"Chelan, WA 98816, USA",48.18371038,-120.8965514,1040,,,,1040,,open,gps,subalpine larch,Larix lyallii,subalpine larch,Plantae,69848
146429511,7/24/15,2015-07-25 00:38:02 UTC,Pacific Time (US & Canada),285289,Tina Marie Camp Scheff,2023-01-12 22:55:55 UTC,2024-07-06 13:24:54 UTC,research,CC-BY-NC,https://inaturalist-open-data.s3.amazonaws.com/photos/251745831/medium.jpeg,,,1,0,FALSE,2,"Chelan, WA 98816, USA",48.18516876,-120.901429,1144,,,,1144,,open,gps,subalpine larch,Larix lyallii,subalpine larch,Plantae,69848
147053928,9/26/09,2009-09-26 20:24:00 UTC,America/Vancouver,3396573,Steve Ansell,2023-01-21 21:14:45 UTC,2023-02-08 14:22:33 UTC,research,CC-BY-NC,https://inaturalist-open-data.s3.amazonaws.com/photos/252968202/medium.jpeg,,,1,0,FALSE,,"Fraser Valley, BC, Canada",49.02631853,-120.8304423,15,,,,15,,open,,subalpine larch,Larix lyallii,subalpine larch,Plantae,69848
147746916,10/9/22,2022-10-09 17:59:07 UTC,America/Edmonton,6213140,Ryan James,2023-01-31 05:48:22 UTC,2024-06-28 02:12:52 UTC,research,CC-BY-NC,https://inaturalist-open-data.s3.amazonaws.com/photos/254289062/medium.jpeg,,,1,0,FALSE,2,"Exshaw, AB T0L 2C0, Canada",50.59141919,-115.0135651,,,,,,,open,gps,subalpine larch,Larix lyallii,subalpine larch,Plantae,69848
149004527,7/24/22,2022-07-24 20:52:57 UTC,Mountain Time (US & Canada),5410415,,2023-02-18 00:50:50 UTC,2023-02-18 17:01:30 UTC,research,CC-BY-NC,https://inaturalist-open-data.s3.amazonaws.com/photos/256694258/medium.jpg,,,1,0,FALSE,3,"Flathead National Forest, Polebridge, MT, US",48.98233833,-114.5605783,5,,,,5,,open,,subalpine larch,Larix lyallii,subalpine larch,Plantae,69848
149334605,9/24/22,,America/Edmonton,6510038,Adam,2023-02-21 17:16:35 UTC,2024-06-28 02:12:47 UTC,research,,https://static.inaturalist.org/photos/257308964/medium.jpeg,,,1,0,FALSE,2,"Hillcrest Mines, AB T0K 1C0, Canada",49.33589698,-114.3800103,731,,,,731,,open,gps,subalpine larch,Larix lyallii,subalpine larch,Plantae,69848
150468474,3/6/23,2023-03-06 19:51:18 UTC,America/Edmonton,5981111,Claudiane Ouellet-Plamondon,2023-03-07 04:43:50 UTC,2024-06-27 06:03:34 UTC,research,CC-BY-NC,https://inaturalist-open-data.s3.amazonaws.com/photos/259464598/medium.jpg,,,1,0,FALSE,3,"Banff Sunshine Village, Improvement District No. 9 Banff, AB, CA",51.09019167,-115.756005,4,,,,4,,open,,subalpine larch,Larix lyallii,subalpine larch,Plantae,69848
150709150,7/5/18,2018-07-05 22:48:00 UTC,Pacific Time (US & Canada),106692,Loren Cassin Sackett,2023-03-10 04:15:53 UTC,2024-05-08 00:07:54 UTC,research,CC-BY-NC,https://inaturalist-open-data.s3.amazonaws.com/photos/259923596/medium.jpeg,,tree far right,2,0,FALSE,,"Chelan County, WA, USA",48.51268056,-120.6658944,10,,,,10,,open,,subalpine larch,Larix lyallii,subalpine larch,Plantae,69848
151330097,8/9/22,2022-08-09 16:59:22 UTC,America/Edmonton,5978502,,2023-03-16 20:48:24 UTC,2024-06-27 06:03:27 UTC,research,CC-BY-NC,https://inaturalist-open-data.s3.amazonaws.com/photos/261090529/medium.jpg,,,2,0,FALSE,3,"Banff National Park, Banff, CA-AB-FN, CA-AB, CA",51.41044424,-116.2523096,3397,,,,3397,,open,,mlze subalpin,Larix lyallii,subalpine larch,Plantae,69848
152568965,9/29/18,2018-09-29 20:10:00 UTC,America/Vancouver,1143245,Patrick Culbert,2023-03-28 00:30:53 UTC,2023-08-18 05:12:01 UTC,research,CC-BY-NC,https://inaturalist-open-data.s3.amazonaws.com/photos/263393836/medium.jpeg,,,1,0,FALSE,,"Fraser Valley, BC, Canada",49.02320443,-120.8306017,80,,,,80,,open,,subalpine larch,Larix lyallii,subalpine larch,Plantae,69848
153080815,8/11/21,2021-08-11 17:28:00 UTC,America/Edmonton,5217573,,2023-04-01 19:34:08 UTC,2023-04-02 15:40:22 UTC,research,CC-BY-NC,https://inaturalist-open-data.s3.amazonaws.com/photos/264346215/medium.jpeg,,,1,0,FALSE,,"East Kootenay, BC, Canada",50.23153082,-115.035214,1319,,,,1319,,open,,subalpine larch,Larix lyallii,subalpine larch,Plantae,69848
153190215,8/17/22,2022-08-17 21:48:00 UTC,America/Edmonton,1717149,,2023-04-02 15:50:47 UTC,2023-09-09 18:41:59 UTC,research,CC-BY-NC,https://inaturalist-open-data.s3.amazonaws.com/photos/264552768/medium.jpeg,,,1,0,FALSE,,"East Kootenay, BC, Canada",50.89809,-116.2355383,,,,,,,open,,subalpine larch,Larix lyallii,subalpine larch,Plantae,69848
159992750,7/2/22,2022-07-03 02:39:00 UTC,America/Vancouver,6836309,,2023-05-06 02:07:17 UTC,2023-05-22 23:04:00 UTC,research,CC-BY-NC,https://inaturalist-open-data.s3.amazonaws.com/photos/276434226/medium.jpg,,,1,0,FALSE,,"Okanagan-Similkameen, BC, Canada",49.15702132,-119.8933803,15,,,,15,,open,,subalpine larch,Larix lyallii,subalpine larch,Plantae,69848
159992777,7/10/22,2022-07-11 01:17:00 UTC,America/Vancouver,6836309,,2023-05-06 02:07:20 UTC,2023-05-22 23:03:32 UTC,research,CC-BY-NC,https://inaturalist-open-data.s3.amazonaws.com/photos/276434504/medium.jpg,,,1,0,FALSE,,"Okanagan-Similkameen, BC, Canada",49.0359841,-120.1127416,244,,,,244,,open,,subalpine larch,Larix lyallii,subalpine larch,Plantae,69848
161152737,9/26/16,2016-09-26 16:25:00 UTC,America/Edmonton,3575163,,2023-05-11 23:19:57 UTC,2024-06-27 06:03:24 UTC,research,CC-BY-NC,https://inaturalist-open-data.s3.amazonaws.com/photos/278530995/medium.jpg,,,2,0,FALSE,,"Improvement District No. 9, AB T0L, Canada",51.14495256,-115.5750961,,,,,,,open,,subalpine larch,Larix lyallii,subalpine larch,Plantae,69848
162137131,9/23/22,2022-09-23 18:20:20 UTC,Pacific Time (US & Canada),136661,Aaron Ellig,2023-05-17 14:35:39 UTC,2023-12-24 06:05:19 UTC,research,CC-BY-ND,https://inaturalist-open-data.s3.amazonaws.com/photos/280325334/medium.jpg,,,1,0,FALSE,3,"Okanogan - Wenatchee National Forest, Mazama, WA, US",48.63937541,-120.402327,39,,,,39,,open,,subalpine larch,Larix lyallii,subalpine larch,Plantae,69848
162737641,9/29/16,2016-09-29 22:54:00 UTC,America/Edmonton,3575163,,2023-05-20 20:03:24 UTC,2024-06-27 06:03:13 UTC,research,CC-BY-NC,https://inaturalist-open-data.s3.amazonaws.com/photos/281407045/medium.jpeg,,,2,0,FALSE,,"Improvement District No. 9, AB T0L, Canada",51.41795687,-116.2294463,1057,,,,1057,,open,,subalpine larch,Larix lyallii,subalpine larch,Plantae,69848
164682919,10/3/16,2016-10-03 20:28:00 UTC,America/Edmonton,3575163,,2023-05-30 19:23:58 UTC,2024-06-27 06:02:58 UTC,research,CC-BY-NC,https://inaturalist-open-data.s3.amazonaws.com/photos/284966012/medium.jpeg,,,2,0,FALSE,,"Improvement District No. 9, AB T0L, Canada",51.45844683,-116.1482375,96,,,,96,,open,,subalpine larch,Larix lyallii,subalpine larch,Plantae,69848
165602773,6/4/23,2023-06-04 18:18:12 UTC,Pacific Time (US & Canada),3146316,Eli Loftis,2023-06-04 21:42:43 UTC,2023-06-21 01:06:57 UTC,research,CC-BY-NC,https://inaturalist-open-data.s3.amazonaws.com/photos/286677245/medium.jpg,,,1,0,FALSE,3,"Okanogan - Wenatchee National Forest, Tonasket, WA, US",48.66214667,-119.94207,4,,,,4,,open,,subalpine larch,Larix lyallii,subalpine larch,Plantae,69848
165632353,6/4/23,2023-06-04 20:19:17 UTC,America/Edmonton,29860,Mark Conboy,2023-06-05 00:39:41 UTC,2024-06-28 02:12:31 UTC,research,CC-BY-NC,https://inaturalist-open-data.s3.amazonaws.com/photos/286732680/medium.jpg,,,1,0,FALSE,3,"Bow Valley Provincial Park, Kananaskis, AB, CA",50.92091333,-115.280905,24,,,,24,,open,,subalpine larch,Larix lyallii,subalpine larch,Plantae,69848
165668081,5/28/23,2023-05-28 19:45:26 UTC,Pacific Time (US & Canada),6688023,Lucas Lochner Bravo,2023-06-05 05:21:07 UTC,2024-05-08 00:07:17 UTC,research,CC-BY-NC,https://inaturalist-open-data.s3.amazonaws.com/photos/286802405/medium.jpg,,,1,0,FALSE,3,"Okanogan - Wenatchee National Forest, Mazama, WA, US",48.74595,-120.326125,9,,,,9,,open,,subalpine larch,Larix lyallii,subalpine larch,Plantae,69848
166431420,6/8/23,2023-06-08 18:18:59 UTC,America/Edmonton,872635,Cathy Fahey,2023-06-09 16:12:32 UTC,2024-06-28 02:12:21 UTC,research,CC-BY-NC,https://inaturalist-open-data.s3.amazonaws.com/photos/288210370/medium.jpg,,,2,0,FALSE,3,"Spray Valley Provincial Park, Kananaskis, AB, CA",50.829505,-115.3673383,10,,,,10,,open,,subalpine larch,Larix lyallii,subalpine larch,Plantae,69848
166882254,6/11/23,2023-06-11 17:04:31 UTC,America/Edmonton,5301116,,2023-06-11 20:25:35 UTC,2024-06-28 02:12:17 UTC,research,CC-BY-NC,https://inaturalist-open-data.s3.amazonaws.com/photos/289023210/medium.jpg,,,1,0,FALSE,3,"Waterton Lakes National Park, Improvement District No. 4 Waterton, AB, CA",49.054375,-114.0633862,48,,,,48,,open,,subalpine larch,Larix lyallii,subalpine larch,Plantae,69848
166965954,6/11/23,2023-06-11 14:41:00 UTC,Pacific Time (US & Canada),4327723,Jefferson Ashby,2023-06-12 05:55:14 UTC,2023-08-18 05:19:09 UTC,research,CC-BY-NC,https://inaturalist-open-data.s3.amazonaws.com/photos/289183353/medium.jpg,,,1,0,FALSE,,"Chelan County, WA, USA",48.51241667,-120.665175,,,,,,,open,,subalpine larch,Larix lyallii,subalpine larch,Plantae,69848
167266708,6/10/23,2023-06-10 21:39:00 UTC,America/Edmonton,705651,Mathis Natvik,2023-06-13 21:48:53 UTC,2024-06-28 02:12:13 UTC,research,,https://static.inaturalist.org/photos/289738357/medium.jpg,,,1,0,FALSE,,"Ranchland No. 66, AB, Canada",50.19594444,-114.4309139,,,,,,,open,,subalpine larch,Larix lyallii,subalpine larch,Plantae,69848
167394656,6/13/23,2023-06-13 20:51:14 UTC,America/Edmonton,872635,Cathy Fahey,2023-06-14 17:31:17 UTC,2024-06-27 06:02:53 UTC,research,CC-BY-NC,https://inaturalist-open-data.s3.amazonaws.com/photos/289976863/medium.jpg,,,2,0,FALSE,3,"Banff National Park, Improvement District No. 9 Banff, AB, CA",51.42067167,-116.247305,4,,,,4,,open,,subalpine larch,Larix lyallii,subalpine larch,Plantae,69848
167627130,6/15/23,2023-06-15 20:31:24 UTC,Pacific Time (US & Canada),8641,John Brew,2023-06-16 01:10:58 UTC,2023-07-23 22:21:18 UTC,research,CC-BY,https://inaturalist-open-data.s3.amazonaws.com/photos/290405748/medium.jpeg,,,1,0,FALSE,2,"Kittitas County, US-WA, US",47.46448538,-120.9610886,3,,,,3,,open,,subalpine larch,Larix lyallii,subalpine larch,Plantae,69848
167627467,6/15/23,2023-06-15 21:06:37 UTC,Pacific Time (US & Canada),8641,John Brew,2023-06-16 01:13:27 UTC,2023-07-23 22:21:08 UTC,research,CC-BY,https://inaturalist-open-data.s3.amazonaws.com/photos/290406324/medium.jpeg,,,1,0,FALSE,2,"Kittitas County, US-WA, US",47.46416724,-120.9599363,3,,,,3,,open,,subalpine larch,Larix lyallii,subalpine larch,Plantae,69848
168702092,6/21/23,2023-06-21 19:03:48 UTC,Mountain Time (US & Canada),7051294,,2023-06-21 19:03:54 UTC,2023-09-27 13:21:39 UTC,research,CC-BY-NC,https://inaturalist-open-data.s3.amazonaws.com/photos/292403501/medium.jpg,,,1,0,FALSE,3,"Glacier National Park, East Glacier Park, MT, US",48.45629621,-113.3575353,3,,,,3,,open,,subalpine larch,Larix lyallii,subalpine larch,Plantae,69848
169186297,6/23/23,2023-06-23 15:48:00 UTC,America/Edmonton,6592844,,2023-06-24 15:14:01 UTC,2023-06-27 03:07:30 UTC,research,CC-BY-NC,https://inaturalist-open-data.s3.amazonaws.com/photos/293293310/medium.jpeg,,IDd by seek,1,0,FALSE,333,"Kootenay, CA-BC-EK, CA-BC, CA",51.05386353,-116.1362686,4,,,,4,,open,,subalpine larch,Larix lyallii,subalpine larch,Plantae,69848
169319204,6/23/23,2023-06-23 15:48:00 UTC,America/Edmonton,6592844,,2023-06-25 04:31:54 UTC,2023-06-27 03:07:06 UTC,research,CC-BY-NC,https://inaturalist-open-data.s3.amazonaws.com/photos/293539130/medium.jpg,,Seen at floe lakes campground. Sorry for bad quality. IDd using seek ,1,0,FALSE,3,"Kootenay National Park, East Kootenay, BC, CA",51.0539668,-116.1364335,67,,,,67,,open,,subalpine larch,Larix lyallii,subalpine larch,Plantae,69848
169324794,6/20/23,2023-06-20 17:58:59 UTC,Pacific Time (US & Canada),3083986,,2023-06-25 05:31:28 UTC,2023-08-18 05:18:29 UTC,research,CC-BY-NC,https://inaturalist-open-data.s3.amazonaws.com/photos/293549736/medium.jpeg,,,1,0,FALSE,2,"Winthrop, WA 98862, USA",48.51277197,-120.665942,,,,,,,open,gps,subalpine larch,Larix lyallii,subalpine larch,Plantae,69848
169499536,6/25/23,2023-06-25 20:02:20 UTC,Pacific Time (US & Canada),3278658,,2023-06-26 00:16:14 UTC,2023-10-23 14:01:24 UTC,research,CC-BY-NC,https://inaturalist-open-data.s3.amazonaws.com/photos/293866353/medium.jpg,,,1,0,FALSE,3,"Okanogan - Wenatchee National Forest, Mazama, WA, US",48.54028333,-120.6815867,4,,,,4,,open,,subalpine larch,Larix lyallii,subalpine larch,Plantae,69848
169693444,6/26/23,2023-06-26 15:09:13 UTC,America/Vancouver,5717812,Spencer B,2023-06-27 01:37:53 UTC,2023-08-18 05:12:31 UTC,research,,https://static.inaturalist.org/photos/294231868/medium.jpeg,,,1,0,FALSE,2,"Manning Park, BC V0X 1R0, Canada",49.017074,-120.8317,,,,,,,open,gps,subalpine larch,Larix lyallii,subalpine larch,Plantae,69848
169719817,6/25/23,2023-06-25 20:09:16 UTC,America/Edmonton,1721740,Heidi van Vliet,2023-06-27 04:40:53 UTC,2024-06-27 06:02:49 UTC,research,,https://static.inaturalist.org/photos/294270769/medium.jpeg,,,1,0,FALSE,2,"Exshaw, AB T0L 2C0, Canada",51.07549444,-115.7933917,,,,,,,open,gps,subalpine larch,Larix lyallii,subalpine larch,Plantae,69848
169796624,6/26/23,2023-06-26 14:34:33 UTC,America/Vancouver,5653111,,2023-06-27 16:46:47 UTC,2023-12-21 04:57:08 UTC,research,CC-BY-NC,https://inaturalist-open-data.s3.amazonaws.com/photos/294410350/medium.jpg,,,1,0,FALSE,3,"E.C. Manning Park, Fraser Valley, BC, CA",49.02778883,-120.8320783,4,,,,4,,open,,subalpine larch,Larix lyallii,subalpine larch,Plantae,69848
169799100,6/26/23,2023-06-26 17:32:23 UTC,America/Vancouver,5653111,,2023-06-27 16:59:59 UTC,2023-08-18 05:13:06 UTC,research,CC-BY-NC,https://inaturalist-open-data.s3.amazonaws.com/photos/294414475/medium.jpg,,,1,0,FALSE,3,"E.C. Manning Park, Okanagan-Similkameen, BC, CA",49.01041388,-120.835175,4,,,,4,,open,,subalpine larch,Larix lyallii,subalpine larch,Plantae,69848
169829794,6/17/23,2023-06-17 23:59:00 UTC,America/Edmonton,705651,Mathis Natvik,2023-06-27 19:58:40 UTC,2024-06-28 02:12:00 UTC,research,,https://static.inaturalist.org/photos/294468528/medium.jpg,,,1,0,FALSE,,"Kananaskis, AB T0L, Canada",50.59207778,-114.9585944,,,,,,,open,,subalpine larch,Larix lyallii,subalpine larch,Plantae,69848
170554994,7/1/23,2023-07-01 17:07:34 UTC,America/Edmonton,6711226,,2023-07-02 00:22:54 UTC,2023-07-04 13:42:57 UTC,research,CC-BY-NC,https://inaturalist-open-data.s3.amazonaws.com/photos/295830690/medium.jpg,,,1,0,FALSE,3,"Mount Assiniboine, CA-BC-EK, CA-BC, CA",51.06827909,-115.7871339,3,,,,3,,open,,subalpine larch,Larix lyallii,subalpine larch,Plantae,69848
170555037,7/1/23,2023-07-01 17:08:08 UTC,America/Edmonton,6711226,,2023-07-02 00:23:02 UTC,2023-07-04 13:42:45 UTC,research,CC-BY-NC,https://inaturalist-open-data.s3.amazonaws.com/photos/295830742/medium.jpg,,,1,0,FALSE,3,"Mount Assiniboine, CA-BC-EK, CA-BC, CA",51.06842229,-115.7873352,5,,,,5,,open,,subalpine larch,Larix lyallii,subalpine larch,Plantae,69848
170764786,7/2/23,2023-07-02 17:30:53 UTC,Pacific Time (US & Canada),666179,,2023-07-03 01:30:27 UTC,2023-07-03 15:08:16 UTC,research,,https://static.inaturalist.org/photos/296229359/medium.jpg,,,1,0,FALSE,3,"Okanogan - Wenatchee National Forest, Stehekin, WA, US",48.499925,-120.7574167,4,,,,4,,open,,subalpine larch,Larix lyallii,subalpine larch,Plantae,69848
170788144,6/26/23,2023-06-26 14:34:39 UTC,America/Vancouver,6898480,,2023-07-03 05:08:45 UTC,2023-08-18 05:11:31 UTC,research,CC-BY-NC,https://inaturalist-open-data.s3.amazonaws.com/photos/296276171/medium.jpg,,,1,0,FALSE,3,"E.C. Manning Park, Fraser Valley, BC, CA",49.02775833,-120.8320467,7,,,,7,,open,,subalpine larch,Larix lyallii,subalpine larch,Plantae,69848
171105878,7/1/23,2023-07-01 20:36:00 UTC,Pacific Time (US & Canada),538622,Eric Jain,2023-07-04 22:07:04 UTC,2023-08-18 05:19:24 UTC,research,CC-BY-NC,https://inaturalist-open-data.s3.amazonaws.com/photos/296871009/medium.jpg,,,1,0,FALSE,,"Chelan County, WA, USA",48.50698,-120.673988,,,,,,,open,,subalpine larch,Larix lyallii,subalpine larch,Plantae,69848
171130948,7/2/23,2023-07-02 19:52:00 UTC,America/Edmonton,1403418,,2023-07-05 01:00:18 UTC,2024-06-27 06:02:45 UTC,research,CC-BY-SA,https://inaturalist-open-data.s3.amazonaws.com/photos/296919584/medium.jpeg,,,1,0,FALSE,,"Improvement District No. 9, AB T0L, Canada",51.22065457,-115.9889533,122,,,,122,,open,,subalpine larch,Larix lyallii,subalpine larch,Plantae,69848
171433592,6/28/23,2023-06-28 23:03:19 UTC,America/Edmonton,4976295,,2023-07-06 19:17:36 UTC,2024-06-27 06:02:41 UTC,research,CC-BY-NC,https://inaturalist-open-data.s3.amazonaws.com/photos/297477900/medium.jpg,,,2,0,FALSE,3,"Parc national de Banff, Improvement District No. 9 Banff, AB, CA",51.24492402,-115.54865,8,,,,8,,open,,mlze subalpin,Larix lyallii,subalpine larch,Plantae,69848
171768057,6/28/23,2023-06-29 00:24:00 UTC,Pacific Time (US & Canada),2165875,Toby Orzano,2023-07-08 16:21:16 UTC,2023-12-07 21:41:03 UTC,research,,https://static.inaturalist.org/photos/298098177/medium.jpg,,,1,0,FALSE,,"Pasayten Wilderness, WA, USA",48.93349202,-119.9747935,,,,,,,open,,subalpine larch,Larix lyallii,subalpine larch,Plantae,69848
172081634,7/2/23,2023-07-02 19:55:00 UTC,Mountain Time (US & Canada),2782928,Jeff Steele,2023-07-10 01:28:29 UTC,2023-09-27 13:22:08 UTC,research,CC-BY-NC,https://inaturalist-open-data.s3.amazonaws.com/photos/298678646/medium.jpeg,,,1,0,FALSE,,"Glacier County, MT, USA",48.43592317,-113.4399519,15,,,,15,,open,,subalpine larch,Larix lyallii,subalpine larch,Plantae,69848
172693178,7/9/23,2023-07-09 19:12:49 UTC,Mountain Time (US & Canada),507072,,2023-07-13 15:55:45 UTC,2023-09-27 13:23:56 UTC,research,CC-BY-NC,https://inaturalist-open-data.s3.amazonaws.com/photos/299820569/medium.jpg,,,1,0,FALSE,3,"Beaverhead-Deerlodge National Forest, Deer Lodge, MT, US",46.33730084,-112.9740505,4,,,,4,,open,,subalpine larch,Larix lyallii,subalpine larch,Plantae,69848
173223265,7/14/23,2023-07-14 21:18:00 UTC,America/Vancouver,1641019,Shane Johnson,2023-07-16 15:15:50 UTC,2023-09-30 13:46:28 UTC,research,CC0,https://inaturalist-open-data.s3.amazonaws.com/photos/300793278/medium.jpeg,,,1,0,FALSE,,"Okanagan-Similkameen, BC, Canada",49.07361167,-120.1946417,,,,,,,open,,subalpine larch,Larix lyallii,subalpine larch,Plantae,69848
173236353,7/15/23,2023-07-15 22:56:02 UTC,Mountain Time (US & Canada),3563405,,2023-07-16 16:20:20 UTC,2024-07-11 00:57:55 UTC,research,CC-BY-NC,https://inaturalist-open-data.s3.amazonaws.com/photos/300824313/medium.jpg,,,1,0,FALSE,3,"Idaho Panhandle National Forest, Troy, MT, US",48.24925333,-116.0472112,4,,,,4,,open,,subalpine larch,Larix lyallii,subalpine larch,Plantae,69848
173451528,7/15/23,2023-07-15 21:47:00 UTC,Pacific Time (US & Canada),5354436,Dave Drum,2023-07-17 17:54:55 UTC,2023-07-18 01:33:23 UTC,research,CC-BY-NC,https://inaturalist-open-data.s3.amazonaws.com/photos/301217773/medium.jpeg,,Elevation approximately 7200 feet.,1,0,FALSE,,"Okanogan County, WA, USA",48.94788856,-119.8978692,15,,,,15,,open,,subalpine larch,Larix lyallii,subalpine larch,Plantae,69848
173543230,7/15/23,2023-07-16 00:39:00 UTC,Pacific Time (US & Canada),538622,Eric Jain,2023-07-18 04:32:52 UTC,2023-07-19 14:37:28 UTC,research,CC-BY-NC,https://inaturalist-open-data.s3.amazonaws.com/photos/301388499/medium.jpg,,,1,0,FALSE,,"Whatcom County, WA, USA",48.759474,-120.858013,,,,,,,open,,subalpine larch,Larix lyallii,subalpine larch,Plantae,69848
173704357,7/12/23,2023-07-12 20:09:10 UTC,America/Edmonton,104905,Joan Septembre,2023-07-19 02:29:35 UTC,2024-06-27 06:02:37 UTC,research,CC-BY-NC-ND,https://static.inaturalist.org/photos/301688022/medium.jpg,,,1,0,FALSE,3,"Banff National Park, Improvement District No. 9 Banff, AB, CA",51.08917217,-115.8499667,10,,,,10,,open,,subalpine larch,Larix lyallii,subalpine larch,Plantae,69848
173843060,7/19/23,2023-07-19 18:16:24 UTC,America/Edmonton,371848,Dale Noonkester,2023-07-19 22:09:19 UTC,2023-09-09 18:37:14 UTC,research,,https://static.inaturalist.org/photos/301943739/medium.jpg,,,1,0,FALSE,3,"Mount Assiniboine Provincial Park, East Kootenay, BC, CA",51.0651945,-115.7845833,4,,,,4,,open,,subalpine larch,Larix lyallii,subalpine larch,Plantae,69848
173882273,7/19/23,2023-07-19 20:12:20 UTC,America/Edmonton,1448507,Jenny Feick,2023-07-20 03:34:24 UTC,2023-07-20 03:43:29 UTC,research,CC-BY-NC,https://inaturalist-open-data.s3.amazonaws.com/photos/302020121/medium.jpg,,,1,0,FALSE,3,"East Kootenay, BC, CA",50.73542,-116.631705,9,,,,9,,open,,subalpine larch,Larix lyallii,subalpine larch,Plantae,69848
173979929,7/11/23,2023-07-11 20:26:43 UTC,Pacific Time (US & Canada),158706,Joan,2023-07-20 18:50:43 UTC,2024-05-08 00:06:49 UTC,research,CC-BY-NC,https://inaturalist-open-data.s3.amazonaws.com/photos/302197579/medium.jpg,,,2,0,FALSE,3,"Skagit County, US-WA, US",48.58843503,-120.7162101,5,,,,5,,open,,subalpine larch,Larix lyallii,subalpine larch,Plantae,69848
173981386,7/17/23,2023-07-17 21:25:00 UTC,Pacific Time (US & Canada),5333646,,2023-07-20 18:58:58 UTC,2023-08-18 05:20:52 UTC,research,CC-BY-NC,https://inaturalist-open-data.s3.amazonaws.com/photos/302199963/medium.jpg,,,1,0,FALSE,,"Chelan County, WA, USA",48.50865,-120.7654,,,,,,,open,,subalpine larch,Larix lyallii,subalpine larch,Plantae,69848
173981953,7/18/23,2023-07-18 17:06:36 UTC,Pacific Time (US & Canada),158706,Joan,2023-07-20 19:02:47 UTC,2024-05-08 00:06:37 UTC,research,CC-BY-NC,https://inaturalist-open-data.s3.amazonaws.com/photos/302201329/medium.jpg,,larch,2,0,FALSE,3,"Okanogan County, US-WA, US",48.88482642,-120.76599,30,,,,30,,open,,subalpine larch,Larix lyallii,subalpine larch,Plantae,69848
173995097,7/19/23,2023-07-19 15:08:31 UTC,Pacific Time (US & Canada),577425,Dan Harville,2023-07-20 20:28:56 UTC,2023-08-18 05:15:32 UTC,research,CC-BY-NC,https://inaturalist-open-data.s3.amazonaws.com/photos/302225883/medium.jpg,,,1,0,FALSE,3,"Okanogan - Wenatchee National Forest, Marblemount, WA, US",48.551145,-120.7177633,4,,,,4,,open,,subalpine larch,Larix lyallii,subalpine larch,Plantae,69848
174104702,7/18/23,2023-07-18 20:57:01 UTC,Pacific Time (US & Canada),3868567,Finn Tobias,2023-07-21 14:53:20 UTC,2024-02-01 04:07:57 UTC,research,,https://static.inaturalist.org/photos/302431736/medium.jpg,,,3,1,FALSE,3,"Chelan County, US-WA, US",47.48258573,-120.7813536,52,,,,52,,open,,subalpine larch,Larix lyallii,subalpine larch,Plantae,69848
174154230,7/8/23,2023-07-08 16:49:11 UTC,Pacific Time (US & Canada),1187277,Katherine Macco,2023-07-21 20:02:58 UTC,2023-09-17 04:54:14 UTC,research,,https://static.inaturalist.org/photos/302525903/medium.jpeg,,,1,0,FALSE,2,"Whatcom County, US-WA, US",48.75198611,-120.6961944,,,,,,,open,gps,subalpine larch,Larix lyallii,subalpine larch,Plantae,69848
174172614,7/17/23,2023-07-17 15:59:00 UTC,America/Edmonton,3953235,Jag Athwal,2023-07-21 22:06:53 UTC,2023-09-09 18:36:36 UTC,research,CC-BY-NC,https://inaturalist-open-data.s3.amazonaws.com/photos/302557618/medium.jpg,,,1,0,FALSE,,"East Kootenay, BC, Canada",50.478096,-115.22876,,,,,,,open,,subalpine larch,Larix lyallii,subalpine larch,Plantae,69848
174182823,7/18/23,2023-07-18 18:25:00 UTC,America/Edmonton,1781642,Caleb Catto,2023-07-21 23:26:28 UTC,2024-06-28 02:11:51 UTC,research,CC-BY,https://inaturalist-open-data.s3.amazonaws.com/photos/302577178/medium.jpeg,,,1,0,FALSE,2,"Waterton Park, AB T0K 2M0, Canada",49.02286894,-114.0005296,11,,,,11,,open,gps,subalpine larch,Larix lyallii,subalpine larch,Plantae,69848
174186331,7/18/23,2023-07-18 19:08:00 UTC,America/Edmonton,1781642,Caleb Catto,2023-07-21 23:52:38 UTC,2024-06-28 02:11:46 UTC,research,CC-BY,https://inaturalist-open-data.s3.amazonaws.com/photos/302584037/medium.jpeg,,,1,0,FALSE,2,"Waterton Park, AB T0K 2M0, Canada",49.03142779,-113.9897167,140,,,,140,,open,gps,subalpine larch,Larix lyallii,subalpine larch,Plantae,69848
174186584,7/18/23,2023-07-18 19:05:54 UTC,America/Edmonton,1781642,Caleb Catto,2023-07-21 23:54:38 UTC,2024-06-28 02:11:42 UTC,research,CC-BY,https://inaturalist-open-data.s3.amazonaws.com/photos/302584611/medium.jpeg,,,1,0,FALSE,2,"Waterton Park, AB T0K 2M0, Canada",49.03158333,-113.992225,,,,,,,open,gps,subalpine larch,Larix lyallii,subalpine larch,Plantae,69848
174421119,7/11/23,2023-07-11 21:35:00 UTC,America/Edmonton,1717149,,2023-07-23 05:33:42 UTC,2024-06-28 02:11:37 UTC,research,CC-BY-NC,https://inaturalist-open-data.s3.amazonaws.com/photos/303017104/medium.jpeg,,,1,0,FALSE,,"Kananaskis, AB T0L, Canada",50.76287167,-115.3361267,,,,,,,open,,subalpine larch,Larix lyallii,subalpine larch,Plantae,69848
174592047,7/23/23,2023-07-23 20:41:32 UTC,Mountain Time (US & Canada),1162567,Fletcher Stone,2023-07-24 00:17:11 UTC,2023-09-27 13:24:29 UTC,research,CC-BY-NC,https://inaturalist-open-data.s3.amazonaws.com/photos/303330278/medium.jpg,,,1,0,FALSE,3,"Beaverhead-Deerlodge National Forest, Anaconda, MT, US",46.06650619,-113.2659267,64,,,,64,,open,,subalpine larch,Larix lyallii,subalpine larch,Plantae,69848
174808923,7/19/23,2023-07-19 15:01:00 UTC,America/Edmonton,1641019,Shane Johnson,2023-07-25 04:13:33 UTC,2023-09-09 18:36:12 UTC,research,CC0,https://inaturalist-open-data.s3.amazonaws.com/photos/303733381/medium.jpeg,,,1,0,FALSE,,"East Kootenay, BC, Canada",49.01478333,-114.0808667,,,,,,,open,,subalpine larch,Larix lyallii,subalpine larch,Plantae,69848
174808935,7/19/23,2023-07-19 15:08:00 UTC,America/Edmonton,1641019,Shane Johnson,2023-07-25 04:13:36 UTC,2023-09-09 18:35:39 UTC,research,CC0,https://inaturalist-open-data.s3.amazonaws.com/photos/303734582/medium.jpeg,,,1,0,FALSE,,"East Kootenay, BC, Canada",49.01471833,-114.0818067,,,,,,,open,,subalpine larch,Larix lyallii,subalpine larch,Plantae,69848
174851755,7/24/23,2023-07-24 20:07:09 UTC,America/Edmonton,1448507,Jenny Feick,2023-07-25 12:42:25 UTC,2023-07-31 16:15:24 UTC,research,CC-BY-NC,https://inaturalist-open-data.s3.amazonaws.com/photos/303813373/medium.jpg,,,1,0,FALSE,3,"Kootenay National Park, East Kootenay, BC, CA",51.12612217,-115.9894033,11,,,,11,,open,,subalpine larch,Larix lyallii,subalpine larch,Plantae,69848
174911743,7/15/23,2023-07-16 01:44:00 UTC,America/Vancouver,1695455,,2023-07-25 19:02:01 UTC,2023-07-28 01:22:44 UTC,research,CC-BY-NC,https://inaturalist-open-data.s3.amazonaws.com/photos/303915284/medium.jpg,,,1,0,FALSE,,"Okanagan-Similkameen, BC, Canada",49.0524,-120.2014,,,,,,,open,,subalpine larch,Larix lyallii,subalpine larch,Plantae,69848
174960278,7/19/23,2023-07-19 18:45:00 UTC,America/Edmonton,1641019,Shane Johnson,2023-07-26 00:40:43 UTC,2023-09-09 18:35:15 UTC,research,CC0,https://inaturalist-open-data.s3.amazonaws.com/photos/304012548/medium.jpeg,,,1,0,FALSE,,"East Kootenay, BC, Canada",49.011455,-114.11105,,,,,,,open,,subalpine larch,Larix lyallii,subalpine larch,Plantae,69848
174981706,7/19/23,2023-07-19 20:28:00 UTC,America/Edmonton,1641019,Shane Johnson,2023-07-26 03:49:31 UTC,2023-09-09 18:34:45 UTC,research,CC0,https://inaturalist-open-data.s3.amazonaws.com/photos/304054468/medium.jpeg,,,1,0,FALSE,,"East Kootenay, BC, Canada",49.01868964,-114.1096189,31,,,,31,,open,,subalpine larch,Larix lyallii,subalpine larch,Plantae,69848
175046459,7/20/23,2023-07-21 03:21:51 UTC,Pacific Time (US & Canada),2497963,Katy Storm,2023-07-26 15:05:32 UTC,2023-08-18 05:15:12 UTC,research,,https://static.inaturalist.org/photos/304174913/medium.jpg,,,1,0,FALSE,3,"Okanogan - Wenatchee National Forest, Mazama, WA, US",48.593175,-120.7240617,4,,,,4,,open,,subalpine larch,Larix lyallii,subalpine larch,Plantae,69848
175123321,7/23/23,2023-07-23 17:43:00 UTC,America/Edmonton,788181,Lada Malek,2023-07-26 23:35:36 UTC,2023-09-09 18:34:08 UTC,research,CC-BY-NC,https://inaturalist-open-data.s3.amazonaws.com/photos/304315170/medium.jpeg,,,1,0,FALSE,,"East Kootenay, BC, Canada",51.05643,-115.7925817,,,,,,,open,,subalpine larch,Larix lyallii,subalpine larch,Plantae,69848
175269293,7/27/23,2023-07-27 18:03:19 UTC,America/Edmonton,5699588,Alex Hejna,2023-07-27 20:56:20 UTC,2024-06-28 02:11:31 UTC,research,,https://static.inaturalist.org/photos/304580619/medium.jpeg,,,1,0,FALSE,2,"Waterton Park, AB T0K 2M0, Canada",49.03100556,-113.9896472,,,,,,,open,gps,subalpine larch,Larix lyallii,subalpine larch,Plantae,69848
175395109,7/23/23,2023-07-23 16:42:00 UTC,Pacific Time (US & Canada),2944460,Matt Below,2023-07-28 16:44:16 UTC,2023-08-18 05:11:13 UTC,research,,https://static.inaturalist.org/photos/304813092/medium.jpeg,,turning in July!,1,0,FALSE,,"Okanogan County, WA, USA",48.97615855,-120.211929,8,,,,8,,open,,subalpine larch,Larix lyallii,subalpine larch,Plantae,69848
175665901,7/29/23,2023-07-29 23:39:53 UTC,Pacific Time (US & Canada),3146316,Eli Loftis,2023-07-30 03:48:40 UTC,2023-07-30 16:54:32 UTC,research,CC-BY-NC,https://inaturalist-open-data.s3.amazonaws.com/photos/305309839/medium.jpg,,,1,0,FALSE,3,"Okanogan - Wenatchee National Forest, Stehekin, WA, US",48.509195,-120.6704167,4,,,,4,,open,,subalpine larch,Larix lyallii,subalpine larch,Plantae,69848
175806346,9/3/86,,America/Edmonton,825722,FreckLes,2023-07-30 20:31:17 UTC,2023-09-30 13:44:01 UTC,research,CC-BY-NC,https://inaturalist-open-data.s3.amazonaws.com/photos/305551567/medium.jpg,, ,1,0,FALSE,,"Columbia-Shuswap, BC, Canada",51.34314217,-116.3166398,305,,,,305,,open,,subalpine larch,Larix lyallii,subalpine larch,Plantae,69848
175979502,7/26/23,2023-07-26 19:19:37 UTC,Mountain Time (US & Canada),5767127,,2023-07-31 18:59:14 UTC,2023-09-27 13:26:24 UTC,research,CC-BY-NC,https://inaturalist-open-data.s3.amazonaws.com/photos/305892888/medium.jpeg,,,1,0,FALSE,2,"Eureka, MT 59917, USA",48.9412953,-114.9258474,,,,,,,open,gps,subalpine larch,Larix lyallii,subalpine larch,Plantae,69848
176266187,7/7/23,2023-07-07 23:12:55 UTC,America/Edmonton,1436085,,2023-08-02 13:15:04 UTC,2024-06-28 02:11:27 UTC,research,CC-BY-NC,https://inaturalist-open-data.s3.amazonaws.com/photos/306428789/medium.jpg,,,1,0,FALSE,3,"Peter Lougheed Provincial Park, Kananaskis, AB, CA",50.75868833,-115.3738633,3,,,,3,,open,,subalpine larch,Larix lyallii,subalpine larch,Plantae,69848
176699569,7/31/23,2023-08-01 03:19:27 UTC,Pacific Time (US & Canada),693721,Lindsey Salmonson,2023-08-05 01:20:42 UTC,2023-08-18 05:23:30 UTC,research,CC-BY,https://inaturalist-open-data.s3.amazonaws.com/photos/307234354/medium.jpg,,,1,0,FALSE,3,"Chelan County, US-WA, US",47.42092028,-120.8189729,5,,,,5,,open,,subalpine larch,Larix lyallii,subalpine larch,Plantae,69848
176793727,8/4/23,2023-08-04 23:09:26 UTC,Pacific Time (US & Canada),622611,Tiffa Theden,2023-08-05 16:26:05 UTC,2024-05-08 00:06:07 UTC,research,CC-BY-NC,https://inaturalist-open-data.s3.amazonaws.com/photos/307408460/medium.jpg,,,2,0,FALSE,3,"Okanogan County, US-WA, US",48.73820269,-120.6786075,4,,,,4,,open,,subalpine larch,Larix lyallii,subalpine larch,Plantae,69848
177029613,8/6/23,2023-08-06 16:50:46 UTC,America/Edmonton,1098154,,2023-08-06 19:37:07 UTC,2024-06-27 06:02:33 UTC,research,CC-BY-NC,https://inaturalist-open-data.s3.amazonaws.com/photos/307843272/medium.jpeg,,Sub Alpine larch/laryx,2,0,FALSE,2,"Exshaw, AB T0L 2C0, Canada",51.06810166,-115.7763357,854,,,,854,,open,gps,subalpine larch,Larix lyallii,subalpine larch,Plantae,69848
177113055,8/5/23,2023-08-05 21:42:03 UTC,Pacific Time (US & Canada),7232,Audrey Ragsac,2023-08-07 03:58:41 UTC,2023-08-07 15:58:06 UTC,research,CC-BY,https://static.inaturalist.org/photos/307999194/medium.jpeg,,,1,0,FALSE,2,"Mazama, WA 98833, USA",48.73511389,-120.6717861,,,,,,,open,gps,subalpine larch,Larix lyallii,subalpine larch,Plantae,69848
177996521,8/11/23,2023-08-11 19:49:10 UTC,America/Edmonton,5284930,Mathias Fenton,2023-08-12 14:38:57 UTC,2024-06-28 02:10:10 UTC,research,CC-BY-NC,https://inaturalist-open-data.s3.amazonaws.com/photos/309654866/medium.jpeg,,,2,0,FALSE,2,"Millarville, AB T0L 1K0, Canada",50.65586081,-114.9710937,87,,,,87,,open,gps,subalpine larch,Larix lyallii,subalpine larch,Plantae,69848
178073082,8/9/23,2023-08-09 17:15:45 UTC,Pacific Time (US & Canada),1491220,Eamonn Mazur,2023-08-12 22:08:01 UTC,2024-05-08 00:05:45 UTC,research,,https://static.inaturalist.org/photos/309796915/medium.jpeg,,,2,0,FALSE,2,"Winthrop, WA 98862, USA",48.5628631,-120.6879286,,,,,,,open,gps,subalpine larch,Larix lyallii,subalpine larch,Plantae,69848
178073210,8/9/23,2023-08-09 16:30:17 UTC,Pacific Time (US & Canada),1491220,Eamonn Mazur,2023-08-12 22:08:50 UTC,2023-09-03 20:15:00 UTC,research,,https://static.inaturalist.org/photos/309797187/medium.jpeg,,,2,0,FALSE,2,"Skagit County, WA, USA",48.5549698,-120.700903,,,,,,,open,gps,subalpine larch,Larix lyallii,subalpine larch,Plantae,69848
178179392,8/12/23,2023-08-12 15:36:18 UTC,America/Edmonton,2165687,Adam Holder,2023-08-13 14:17:22 UTC,2024-06-28 02:10:03 UTC,research,CC-BY-NC,https://inaturalist-open-data.s3.amazonaws.com/photos/310002877/medium.jpeg,,,1,0,FALSE,2,"Peter Lougheed, CA-AB-FN, CA-AB, CA",50.59795,-114.96805,,,,,,,open,gps,subalpine larch,Larix lyallii,subalpine larch,Plantae,69848
178180927,8/12/23,2023-08-12 14:23:59 UTC,America/Edmonton,2165687,Adam Holder,2023-08-13 14:25:25 UTC,2024-06-28 02:09:59 UTC,research,CC-BY-NC,https://inaturalist-open-data.s3.amazonaws.com/photos/310005349/medium.jpeg,,,1,0,FALSE,2,"Millarville, AB T0L 1K0, Canada",50.5979,-114.9681278,,,,,,,open,gps,subalpine larch,Larix lyallii,subalpine larch,Plantae,69848
178181304,8/12/23,2023-08-12 13:58:59 UTC,America/Edmonton,2165687,Adam Holder,2023-08-13 14:27:49 UTC,2024-06-28 02:09:54 UTC,research,CC-BY-NC,https://inaturalist-open-data.s3.amazonaws.com/photos/310006140/medium.jpeg,,,1,0,FALSE,2,"Millarville, AB T0L 1K0, Canada",50.59528611,-114.9679667,,,,,,,open,gps,subalpine larch,Larix lyallii,subalpine larch,Plantae,69848
178181922,8/12/23,2023-08-12 13:33:54 UTC,America/Edmonton,2165687,Adam Holder,2023-08-13 14:31:15 UTC,2024-06-28 02:09:50 UTC,research,CC-BY-NC,https://inaturalist-open-data.s3.amazonaws.com/photos/310007241/medium.jpeg,,,1,0,FALSE,2,"Millarville, AB T0L 1K0, Canada",50.59144444,-114.9691389,,,,,,,open,gps,subalpine larch,Larix lyallii,subalpine larch,Plantae,69848
178314110,8/10/23,2023-08-10 14:38:11 UTC,Mountain Time (US & Canada),31792,aarongunnar,2023-08-14 04:04:24 UTC,2023-08-14 04:39:31 UTC,research,CC-BY,https://inaturalist-open-data.s3.amazonaws.com/photos/310264955/medium.jpeg,,Elev: about 7050',1,0,FALSE,2,"Browning, MT 59417, USA",48.71226097,-113.652281,,,,,,,open,gps,subalpine larch,Larix lyallii,subalpine larch,Plantae,69848
178412189,8/8/23,2023-08-08 22:03:00 UTC,Pacific Time (US & Canada),1657037,Christopher J. Earle,2023-08-14 18:57:52 UTC,2023-08-18 05:14:17 UTC,research,CC-BY-NC,https://inaturalist-open-data.s3.amazonaws.com/photos/310450800/medium.jpg,"Ecology, Forest, Meadow, Meadow-Cascades+Olympics, Mountain-Cascades, Mountains, Plant, Timberline, in-habitat, landscape, whole-plant",,1,0,FALSE,,"Whatcom County, WA, USA",48.86893371,-120.752245,,,,,,,open,,subalpine larch,Larix lyallii,subalpine larch,Plantae,69848
178412190,8/8/23,2023-08-08 14:27:00 UTC,Pacific Time (US & Canada),1657037,Christopher J. Earle,2023-08-14 18:57:52 UTC,2023-08-18 05:14:41 UTC,research,CC-BY-NC,https://inaturalist-open-data.s3.amazonaws.com/photos/310450806/medium.jpg,"Ecology, Forest, Mountain-Cascades, Mountains, Plant, Timberline, in-habitat, landscape, whole-plant",Dense Larix lyallii regen.,1,0,FALSE,,"Whatcom County, WA, USA",48.7515084,-120.6960362,,,,,,,open,,subalpine larch,Larix lyallii,subalpine larch,Plantae,69848
178412194,8/9/23,2023-08-09 15:18:00 UTC,Pacific Time (US & Canada),1657037,Christopher J. Earle,2023-08-14 18:57:53 UTC,2023-08-18 05:13:57 UTC,research,CC-BY-NC,https://inaturalist-open-data.s3.amazonaws.com/photos/310450807/medium.jpg,"Plant, in-habitat, whole-plant","Sapling of Larix, sheltering a subalpine fir",1,0,FALSE,,"Okanogan County, WA, USA",48.91547813,-120.7708438,,,,,,,open,,subalpine larch,Larix lyallii,subalpine larch,Plantae,69848
178412203,8/10/23,2023-08-10 14:59:00 UTC,Pacific Time (US & Canada),1657037,Christopher J. Earle,2023-08-14 18:57:58 UTC,2023-08-18 05:13:30 UTC,research,CC-BY-NC,https://inaturalist-open-data.s3.amazonaws.com/photos/310450833/medium.jpg,"Plant, in-habitat, whole-plant",Mature alpine larch tree,1,0,FALSE,,"Okanogan County, WA, USA",48.96259544,-120.7584806,,,,,,,open,,subalpine larch,Larix lyallii,subalpine larch,Plantae,69848
178412224,8/11/23,2023-08-11 21:24:00 UTC,Pacific Time (US & Canada),1657037,Christopher J. Earle,2023-08-14 18:58:00 UTC,2023-12-03 21:09:35 UTC,research,CC-BY-NC,https://inaturalist-open-data.s3.amazonaws.com/photos/310450851/medium.jpg,"Ecology, Plant, Timberline, in-habitat, whole-plant",Mature alpine larch coring a clump of subalpine fir.,1,0,FALSE,,"Okanogan County, WA, USA",48.74026087,-120.6694997,,,,,,,open,,subalpine larch,Larix lyallii,subalpine larch,Plantae,69848
178428682,8/14/23,2023-08-14 17:16:17 UTC,Pacific Time (US & Canada),994387,Stefan,2023-08-14 20:48:36 UTC,2023-09-17 04:42:21 UTC,research,CC-BY-NC,https://inaturalist-open-data.s3.amazonaws.com/photos/310481514/medium.jpg,,,1,0,FALSE,3,"Okanogan County, US-WA, US",48.7376008,-120.678494,6,,,,6,,open,,subalpine larch,Larix lyallii,subalpine larch,Plantae,69848
178466469,8/14/23,2023-08-14 21:41:50 UTC,Pacific Time (US & Canada),907327,,2023-08-15 01:52:39 UTC,2023-08-15 15:14:11 UTC,research,CC-BY-NC,https://inaturalist-open-data.s3.amazonaws.com/photos/310554571/medium.jpg,,,1,0,FALSE,3,"Okanogan - Wenatchee National Forest, Stehekin, WA, US",48.508775,-120.7660133,4,,,,4,,open,,subalpine larch,Larix lyallii,subalpine larch,Plantae,69848
178481391,8/13/23,2023-08-14 02:27:59 UTC,Pacific Time (US & Canada),350245,Mark Robinson,2023-08-15 04:23:34 UTC,2023-12-03 21:02:36 UTC,research,CC-BY-NC,https://inaturalist-open-data.s3.amazonaws.com/photos/310584597/medium.jpg,,,1,0,FALSE,3,"Okanogan - Wenatchee National Forest, Mazama, WA, US",48.63903,-120.4027167,8,,,,8,,open,,subalpine larch,Larix lyallii,subalpine larch,Plantae,69848
178784077,8/11/23,2023-08-11 16:19:00 UTC,America/Edmonton,3791713,Julia Marshall,2023-08-17 02:27:02 UTC,2024-06-28 02:09:46 UTC,research,CC-BY-NC,https://inaturalist-open-data.s3.amazonaws.com/photos/311159449/medium.jpeg,,,1,0,FALSE,,"Kananaskis, AB T0L, Canada",50.59213507,-114.9652399,122,,,,122,,open,,subalpine larch,Larix lyallii,subalpine larch,Plantae,69848
178790659,8/11/23,2023-08-11 19:19:33 UTC,America/Edmonton,3364750,,2023-08-17 03:36:11 UTC,2024-06-28 02:09:41 UTC,research,CC-BY-NC,https://inaturalist-open-data.s3.amazonaws.com/photos/311173843/medium.jpg,,,2,0,FALSE,3,"Peter Lougheed Provincial Park, Kananaskis, AB, CA",50.59988247,-114.992542,20,,,,20,,open,,subalpine larch,Larix lyallii,subalpine larch,Plantae,69848
178928992,8/12/23,2023-08-12 18:14:51 UTC,Pacific Time (US & Canada),46945,T. Abe Lloyd,2023-08-18 01:47:32 UTC,2023-08-18 05:10:09 UTC,research,CC-BY-NC,https://inaturalist-open-data.s3.amazonaws.com/photos/311439509/medium.jpeg,,,1,0,FALSE,2,"Okanogan County, US-WA, US",48.9817775,-120.147518,,,,,,,open,gps,subalpine larch,Larix lyallii,subalpine larch,Plantae,69848
178931400,8/12/23,2023-08-12 23:18:42 UTC,Pacific Time (US & Canada),46945,T. Abe Lloyd,2023-08-18 02:11:10 UTC,2023-08-18 05:09:53 UTC,research,CC-BY-NC,https://inaturalist-open-data.s3.amazonaws.com/photos/311444844/medium.jpeg,,,1,0,FALSE,2,"Okanogan County, US-WA, US",48.98258377,-120.2013597,9,,,,9,,open,,subalpine larch,Larix lyallii,subalpine larch,Plantae,69848
178932088,8/12/23,2023-08-13 00:54:26 UTC,Pacific Time (US & Canada),46945,T. Abe Lloyd,2023-08-18 02:17:08 UTC,2024-03-12 02:21:04 UTC,research,CC-BY-NC,https://inaturalist-open-data.s3.amazonaws.com/photos/311446408/medium.jpeg,,,2,0,FALSE,2,"Okanogan County, US-WA, US",48.98165296,-120.1988546,8,,,,8,,open,,subalpine larch,Larix lyallii,subalpine larch,Plantae,69848
178936192,8/15/23,2023-08-15 16:56:35 UTC,Pacific Time (US & Canada),46945,T. Abe Lloyd,2023-08-18 02:52:18 UTC,2023-08-18 04:55:31 UTC,research,CC-BY-NC,https://inaturalist-open-data.s3.amazonaws.com/photos/311453885/medium.jpeg,,,1,0,FALSE,2,"Okanogan County, US-WA, US",48.92540434,-120.1704957,4,,,,4,,open,,subalpine larch,Larix lyallii,subalpine larch,Plantae,69848
179029562,8/13/23,2023-08-13 19:16:44 UTC,America/Edmonton,1527919,,2023-08-18 18:56:20 UTC,2024-06-28 02:09:28 UTC,research,CC-BY-NC,https://inaturalist-open-data.s3.amazonaws.com/photos/311629502/medium.jpg,,,1,0,FALSE,3,"Waterton Lakes National Park, Improvement District No. 4 Waterton, AB, CA",49.06680283,-114.0660945,9,,,,9,,open,,subalpine larch,Larix lyallii,subalpine larch,Plantae,69848
179064070,8/13/23,2023-08-13 21:46:00 UTC,America/Vancouver,59776,Adam Huggins,2023-08-18 23:16:13 UTC,2023-09-30 13:41:12 UTC,research,CC-BY-NC,https://inaturalist-open-data.s3.amazonaws.com/photos/311688878/medium.jpeg,,,1,0,FALSE,,"Central Kootenay, BC, Canada",49.76411944,-117.1770028,10,,,,10,,open,,subalpine larch,Larix lyallii,subalpine larch,Plantae,69848
179094064,5/28/23,2023-05-29 01:34:38 UTC,Pacific Time (US & Canada),6509760,Matt Donaldson,2023-08-19 03:56:22 UTC,2023-12-03 09:16:38 UTC,research,,https://static.inaturalist.org/photos/311752253/medium.jpeg,,On pnw trail in pasayten.,3,1,FALSE,2,"Okanogan County, US-WA, US",48.98164833,-120.1476933,13,,,,13,,open,,subalpine larch,Larix lyallii,subalpine larch,Plantae,69848
179343634,8/18/23,2023-08-18 17:54:19 UTC,America/Edmonton,683372,Alejandro Huereca Delgado,2023-08-20 14:14:21 UTC,2024-06-28 02:09:23 UTC,research,CC-BY-NC,https://inaturalist-open-data.s3.amazonaws.com/photos/312211765/medium.jpeg,,,1,0,FALSE,2,"Millarville, AB T0L 1K0, Canada",50.60106667,-114.9848083,,,,,,,open,gps,Larix lyallii,Larix lyallii,subalpine larch,Plantae,69848
179596947,8/19/23,2023-08-19 18:47:00 UTC,Pacific Time (US & Canada),5354436,Dave Drum,2023-08-21 22:44:19 UTC,2023-08-24 03:43:39 UTC,research,CC-BY-NC,https://inaturalist-open-data.s3.amazonaws.com/photos/312694959/medium.jpeg,,"Elevation 6200 feet, long cone whiskers.",1,0,FALSE,,"Kittitas County, WA, USA",47.46785063,-120.9582793,8,,,,8,,open,,subalpine larch,Larix lyallii,subalpine larch,Plantae,69848
179604425,8/18/23,2023-08-18 17:03:37 UTC,America/Edmonton,1756340,Arseniy Belosokhov (Mentis),2023-08-21 23:43:19 UTC,2024-06-28 02:09:12 UTC,research,CC-BY,https://inaturalist-open-data.s3.amazonaws.com/photos/312710935/medium.jpeg,,,2,0,FALSE,2,"Peter Lougheed, CA-AB-FN, CA-AB, CA",50.596614,-114.9876442,3,,,,3,,open,,subalpine larch,Larix lyallii,subalpine larch,Plantae,69848
179864560,7/12/17,2017-07-12 16:19:00 UTC,Pacific Time (US & Canada),25173,Daniel Mathews,2023-08-23 18:43:47 UTC,2023-12-03 07:50:58 UTC,research,,https://static.inaturalist.org/photos/313209745/medium.jpeg,,,1,0,FALSE,,"Skagit County, WA, USA",48.57135833,-120.842025,5,,,,5,,open,,subalpine larch,Larix lyallii,subalpine larch,Plantae,69848
180260983,8/23/23,2023-08-23 16:49:31 UTC,America/Edmonton,4828084,hardy_g,2023-08-26 13:06:54 UTC,2023-08-30 01:34:30 UTC,research,CC-BY-NC,https://inaturalist-open-data.s3.amazonaws.com/photos/313967766/medium.jpg,,,1,0,FALSE,3,"Peter Lougheed Provincial Park, Kananaskis, AB, CA",50.81110833,-115.2749633,4,,,,4,,open,,subalpine larch,Larix lyallii,subalpine larch,Plantae,69848
180670526,8/27/23,2023-08-27 19:52:30 UTC,Mountain Time (US & Canada),507072,,2023-08-28 20:11:39 UTC,2023-09-27 13:23:11 UTC,research,CC-BY-NC,https://inaturalist-open-data.s3.amazonaws.com/photos/314753869/medium.jpg,,,1,0,FALSE,3,"Bitterroot National Forest, Victor, MT, US",46.511955,-114.2995383,4,,,,4,,open,,subalpine larch,Larix lyallii,subalpine larch,Plantae,69848
180710765,8/12/23,2023-08-12 23:10:05 UTC,Pacific Time (US & Canada),5839154,Bryn Roth,2023-08-29 01:39:32 UTC,2023-12-02 19:54:44 UTC,research,CC-BY-NC,https://inaturalist-open-data.s3.amazonaws.com/photos/314833039/medium.jpg,,,1,0,FALSE,3,"Okanogan County, US-WA, US",48.98260567,-120.2014041,24,,,,24,,open,,subalpine larch,Larix lyallii,subalpine larch,Plantae,69848
180762283,8/27/23,2023-08-27 21:54:07 UTC,Mountain Time (US & Canada),237929,Bryce Maxell,2023-08-29 13:10:10 UTC,2023-09-27 13:25:31 UTC,research,CC-BY-NC,https://inaturalist-open-data.s3.amazonaws.com/photos/314933093/medium.jpg,,,1,0,FALSE,3,"Ravalli County, US-MT, US",46.01353701,-114.3785855,5,,,,5,,open,,subalpine larch,Larix lyallii,subalpine larch,Plantae,69848
180964351,8/18/23,2023-08-18 19:36:46 UTC,America/Edmonton,2602076,Simone L,2023-08-30 20:20:51 UTC,2024-06-28 02:08:58 UTC,research,CC-BY,https://static.inaturalist.org/photos/315314929/medium.jpeg,,,1,0,FALSE,2,"Location: 49.054500, -114.059000",49.05450003,-114.0590001,,,,,,,open,gps,subalpine larch,Larix lyallii,subalpine larch,Plantae,69848
181112384,8/29/23,2023-08-29 21:42:01 UTC,America/Edmonton,6639174,Devon Earl,2023-08-31 21:07:56 UTC,2024-06-28 02:08:54 UTC,research,CC-BY-NC,https://inaturalist-open-data.s3.amazonaws.com/photos/315598231/medium.jpeg,,,1,0,FALSE,2,"Coleman, AB T0K 0M0, Canada",50.0715294,-114.6437431,,,,,,,open,gps,subalpine larch,Larix lyallii,subalpine larch,Plantae,69848
181161098,8/31/23,2023-08-31 14:25:36 UTC,Pacific Time (US & Canada),7071191,,2023-09-01 05:48:22 UTC,2023-12-02 07:37:27 UTC,research,CC-BY-NC,https://inaturalist-open-data.s3.amazonaws.com/photos/315694684/medium.jpeg,,,1,0,FALSE,2,"Leavenworth, Washington 98826, USA",48.24305833,-120.7908528,,,,,,,open,,subalpine larch,Larix lyallii,subalpine larch,Plantae,69848
181281616,8/31/23,2023-08-31 19:01:29 UTC,America/Edmonton,5719007,,2023-09-02 00:01:25 UTC,2023-09-22 14:45:27 UTC,research,CC-BY-NC,https://inaturalist-open-data.s3.amazonaws.com/photos/315918069/medium.jpg,,,2,0,FALSE,3,"East Kootenay, BC, CA",50.43500381,-116.2070437,1335,,,,1335,,open,,subalpine larch,Larix lyallii,subalpine larch,Plantae,69848
181281641,8/31/23,2023-08-31 19:01:14 UTC,America/Edmonton,530663,Ethan Gosnell,2023-09-02 00:01:41 UTC,2023-09-05 03:32:37 UTC,research,CC-BY-NC,https://inaturalist-open-data.s3.amazonaws.com/photos/315918156/medium.jpeg,,,1,0,FALSE,2,"Invermere, BC V0A 1K5, Canada",50.43336105,-116.2100983,,,,,,,open,gps,subalpine larch,Larix lyallii,subalpine larch,Plantae,69848
181324047,8/12/23,2023-08-13 03:35:20 UTC,Pacific Time (US & Canada),4399887,,2023-09-02 08:05:37 UTC,2023-09-04 15:37:35 UTC,research,CC-BY-NC,https://inaturalist-open-data.s3.amazonaws.com/photos/315998297/medium.jpg,,"winter drought and cold temperatures on the East side of the cascades causes the trees to blow up in high altitude due to the chemical additions in cells/cytoplasm that lower the freezing point, then the roots freeze, and the needles exposed to sun still try and photosynthesize, the stomata opens and gas exchange occurs, water in leaf is forced to evaporation and therefore conifers are better at this larch looses its needles which is an adaptation to this and therefore dont have to photosynthesize when the roots are frozen but needles are exposed to sun. ",1,0,FALSE,3,"Okanogan - Wenatchee National Forest, Loomis, WA, US",48.98348833,-120.2021033,10,,,,10,,open,,subalpine larch,Larix lyallii,subalpine larch,Plantae,69848
181467673,9/2/23,2023-09-02 17:26:45 UTC,America/Edmonton,2476609,Ian Adams,2023-09-02 22:51:42 UTC,2023-09-03 04:20:12 UTC,research,CC-BY,https://inaturalist-open-data.s3.amazonaws.com/photos/316226573/medium.jpeg,,,1,0,FALSE,2,"Fort Steele, BC V0B 1N0, Canada",49.7701589,-115.4686131,,,,,,,open,gps,subalpine larch,Larix lyallii,subalpine larch,Plantae,69848
181694173,9/2/23,2023-09-02 23:27:13 UTC,Pacific Time (US & Canada),3448676,,2023-09-04 04:55:11 UTC,2023-12-02 04:11:04 UTC,research,CC-BY-NC,https://inaturalist-open-data.s3.amazonaws.com/photos/316656031/medium.jpg,,,1,0,FALSE,3,"Okanogan - Wenatchee National Forest, Twisp, WA, US",48.27083667,-120.463495,4,,,,4,,open,,subalpine larch,Larix lyallii,subalpine larch,Plantae,69848
181694612,9/2/23,2023-09-03 02:03:55 UTC,Pacific Time (US & Canada),3448676,,2023-09-04 05:00:39 UTC,2023-09-04 16:37:14 UTC,research,CC-BY-NC,https://inaturalist-open-data.s3.amazonaws.com/photos/316657029/medium.jpg,,,1,0,FALSE,3,"Okanogan - Wenatchee National Forest, Twisp, WA, US",48.27717,-120.4580217,4,,,,4,,open,,subalpine larch,Larix lyallii,subalpine larch,Plantae,69848
182401313,9/8/23,2023-09-08 15:53:21 UTC,America/Edmonton,2519127,,2023-09-09 01:03:46 UTC,2024-06-28 02:08:44 UTC,research,CC-BY-NC,https://inaturalist-open-data.s3.amazonaws.com/photos/318019897/medium.jpeg,,,1,0,FALSE,2,"Millarville, AB T0L 1K0, Canada",50.60349444,-114.9853333,,,,,,,open,gps,subalpine larch,Larix lyallii,subalpine larch,Plantae,69848
182706661,9/9/23,2023-09-09 23:32:07 UTC,America/Edmonton,3089683,JAson Copp,2023-09-10 21:03:52 UTC,2024-06-28 02:08:30 UTC,research,,https://static.inaturalist.org/photos/318607511/medium.jpeg,,,2,0,FALSE,2,"Peter Lougheed, CA-AB-FN, CA-AB, CA",50.81903928,-115.2783699,3,,,,3,,open,,subalpine larch,Larix lyallii,subalpine larch,Plantae,69848
182734311,9/9/23,2023-09-09 20:38:38 UTC,Pacific Time (US & Canada),3448676,,2023-09-11 00:20:14 UTC,2023-09-11 02:39:26 UTC,research,CC-BY-NC,https://inaturalist-open-data.s3.amazonaws.com/photos/318662535/medium.jpg,,,1,0,FALSE,3,"Okanogan - Wenatchee National Forest, Twisp, WA, US",48.20901167,-120.3407617,5,,,,5,,open,,subalpine larch,Larix lyallii,subalpine larch,Plantae,69848
182735761,9/9/23,2023-09-09 21:38:31 UTC,Pacific Time (US & Canada),3448676,,2023-09-11 00:31:43 UTC,2023-09-11 02:38:36 UTC,research,CC-BY-NC,https://inaturalist-open-data.s3.amazonaws.com/photos/318665890/medium.jpg,,,1,0,FALSE,3,"Okanogan - Wenatchee National Forest, Chelan, WA, US",48.20651167,-120.3541333,4,,,,4,,open,,subalpine larch,Larix lyallii,subalpine larch,Plantae,69848
182855785,9/6/23,2023-09-06 21:23:00 UTC,America/Edmonton,1218315,Nicola Rammell,2023-09-11 20:23:43 UTC,2024-05-19 06:05:34 UTC,research,CC-BY-NC,https://inaturalist-open-data.s3.amazonaws.com/photos/318901250/medium.jpeg,,,2,0,FALSE,,"East Kootenay, BC, Canada",50.5637859,-115.0887363,1237,,,,1237,,open,,subalpine larch,Larix lyallii,subalpine larch,Plantae,69848
182887859,9/9/23,2023-09-09 20:16:00 UTC,Pacific Time (US & Canada),538622,Eric Jain,2023-09-12 00:55:08 UTC,2024-05-08 00:04:49 UTC,research,CC-BY-NC,https://inaturalist-open-data.s3.amazonaws.com/photos/318960665/medium.jpg,,,1,0,FALSE,,"Chelan County, WA, USA",48.083841,-120.803792,,,,,,,open,,subalpine larch,Larix lyallii,subalpine larch,Plantae,69848
182887866,9/9/23,2023-09-09 22:11:00 UTC,Pacific Time (US & Canada),538622,Eric Jain,2023-09-12 00:55:10 UTC,2023-12-01 06:41:23 UTC,research,CC-BY-NC,https://inaturalist-open-data.s3.amazonaws.com/photos/318960717/medium.jpg,,,1,0,FALSE,,"Chelan County, WA, USA",48.091616,-120.798865,,,,,,,open,,subalpine larch,Larix lyallii,subalpine larch,Plantae,69848
182887881,9/9/23,2023-09-10 00:01:00 UTC,Pacific Time (US & Canada),538622,Eric Jain,2023-09-12 00:55:14 UTC,2023-12-01 06:40:51 UTC,research,CC-BY-NC,https://inaturalist-open-data.s3.amazonaws.com/photos/318960766/medium.jpg,,,1,0,FALSE,,"Chelan County, WA, USA",48.110524,-120.807531,,,,,,,open,,subalpine larch,Larix lyallii,subalpine larch,Plantae,69848
182887893,9/10/23,2023-09-10 14:15:00 UTC,Pacific Time (US & Canada),538622,Eric Jain,2023-09-12 00:55:16 UTC,2023-09-12 14:32:31 UTC,research,CC-BY-NC,https://inaturalist-open-data.s3.amazonaws.com/photos/318960823/medium.jpg,,,1,0,FALSE,,"Chelan County, WA, USA",48.129013,-120.797598,,,,,,,open,,subalpine larch,Larix lyallii,subalpine larch,Plantae,69848
182887915,9/10/23,2023-09-10 16:54:00 UTC,Pacific Time (US & Canada),538622,Eric Jain,2023-09-12 00:55:21 UTC,2023-12-01 06:40:48 UTC,research,CC-BY-NC,https://inaturalist-open-data.s3.amazonaws.com/photos/318961032/medium.jpg,,,1,0,FALSE,,"Chelan County, WA, USA",48.127535,-120.814613,,,,,,,open,,subalpine larch,Larix lyallii,subalpine larch,Plantae,69848
183022717,9/12/23,2023-09-12 18:52:38 UTC,America/Edmonton,1729025,J Floer,2023-09-13 00:50:23 UTC,2023-09-28 16:52:31 UTC,research,CC-BY-NC,https://inaturalist-open-data.s3.amazonaws.com/photos/319229934/medium.jpeg,,,1,0,FALSE,2,"Invermere, BC V0A 1K5, Canada",50.36155594,-116.6211538,1392,,,,1392,,open,gps,subalpine larch,Larix lyallii,subalpine larch,Plantae,69848
183156043,8/10/23,2023-08-10 22:11:34 UTC,Pacific Time (US & Canada),350245,Mark Robinson,2023-09-14 00:38:40 UTC,2024-05-08 00:04:30 UTC,research,CC-BY-NC,https://inaturalist-open-data.s3.amazonaws.com/photos/319490760/medium.jpg,,,1,0,FALSE,3,"Okanogan - Wenatchee National Forest, Mazama, WA, US",48.512325,-120.641725,4,,,,4,,open,,subalpine larch,Larix lyallii,subalpine larch,Plantae,69848
183309705,9/14/23,2023-09-14 17:31:41 UTC,America/Edmonton,2091939,,2023-09-15 03:05:05 UTC,2024-06-27 06:05:36 UTC,research,CC-BY-NC,https://inaturalist-open-data.s3.amazonaws.com/photos/319785267/medium.jpg,,,1,0,FALSE,3,"Banff National Park, Improvement District No. 9 Banff, AB, CA",51.42028833,-116.24215,7,,,,7,,open,,subalpine larch,Larix lyallii,subalpine larch,Plantae,69848
183317110,8/6/23,2023-08-06 23:03:42 UTC,Pacific Time (US & Canada),350245,Mark Robinson,2023-09-15 04:49:10 UTC,2024-05-08 00:04:12 UTC,research,CC-BY-NC,https://inaturalist-open-data.s3.amazonaws.com/photos/319800489/medium.jpg,,,1,0,FALSE,3,"Okanogan - Wenatchee National Forest, Mazama, WA, US",48.74528,-120.3253867,3,,,,3,,open,,subalpine larch,Larix lyallii,subalpine larch,Plantae,69848
183317123,8/6/23,2023-08-06 23:03:37 UTC,Pacific Time (US & Canada),350245,Mark Robinson,2023-09-15 04:49:25 UTC,2024-05-08 00:03:38 UTC,research,CC-BY-NC,https://inaturalist-open-data.s3.amazonaws.com/photos/319800526/medium.jpg,,,1,0,FALSE,3,"Okanogan - Wenatchee National Forest, Mazama, WA, US",48.74523833,-120.3253783,5,,,,5,,open,,subalpine larch,Larix lyallii,subalpine larch,Plantae,69848
183446592,9/15/23,2023-09-15 18:19:26 UTC,America/Edmonton,1448507,Jenny Feick,2023-09-16 02:07:01 UTC,2023-09-28 16:49:33 UTC,research,CC-BY-NC,https://inaturalist-open-data.s3.amazonaws.com/photos/320050450/medium.jpg,,,1,0,FALSE,3,"Kootenay National Park, East Kootenay, BC, CA",51.18307167,-116.0429305,16,,,,16,,open,,subalpine larch,Larix lyallii,subalpine larch,Plantae,69848
183514009,9/8/23,2023-09-08 14:53:00 UTC,America/Edmonton,42119,Randal,2023-09-16 15:39:49 UTC,2024-06-28 02:08:22 UTC,research,CC0,https://inaturalist-open-data.s3.amazonaws.com/photos/320153720/medium.jpeg,,,2,0,FALSE,,"Kananaskis, AB T0L, Canada",50.60229,-114.98605,,,,,,,open,,subalpine larch,Larix lyallii,subalpine larch,Plantae,69848
183617584,9/16/23,2023-09-16 20:15:43 UTC,America/Edmonton,1448507,Jenny Feick,2023-09-17 04:24:39 UTC,2023-09-18 17:52:04 UTC,research,CC-BY-NC,https://inaturalist-open-data.s3.amazonaws.com/photos/320373882/medium.jpg,,,1,0,FALSE,3,"East Kootenay, BC, CA",50.90729167,-116.2460333,6,,,,6,,open,,subalpine larch,Larix lyallii,subalpine larch,Plantae,69848
183681667,9/16/23,2023-09-16 16:27:04 UTC,Pacific Time (US & Canada),879703,,2023-09-17 15:45:37 UTC,2023-09-18 01:24:19 UTC,research,,https://static.inaturalist.org/photos/320497682/medium.jpg,,,1,0,FALSE,3,"Okanogan - Wenatchee National Forest, Leavenworth, WA, US",47.48302,-120.8237617,4,,,,4,,open,,subalpine larch,Larix lyallii,subalpine larch,Plantae,69848
183764718,9/16/23,2023-09-16 18:53:47 UTC,Pacific Time (US & Canada),3448676,,2023-09-18 00:02:45 UTC,2023-09-18 00:17:48 UTC,research,CC-BY-NC,https://inaturalist-open-data.s3.amazonaws.com/photos/320656336/medium.jpg,,,1,0,FALSE,3,"Okanogan - Wenatchee National Forest, Carlton, WA, US",48.15927783,-120.3542633,4,,,,4,,open,,subalpine larch,Larix lyallii,subalpine larch,Plantae,69848
183768636,9/16/23,2023-09-16 20:56:02 UTC,Pacific Time (US & Canada),3448676,,2023-09-18 00:11:19 UTC,2023-09-18 00:15:50 UTC,research,CC-BY-NC,https://inaturalist-open-data.s3.amazonaws.com/photos/320658767/medium.jpg,,,1,0,FALSE,3,"Okanogan - Wenatchee National Forest, Carlton, WA, US",48.17149667,-120.3567967,4,,,,4,,open,,subalpine larch,Larix lyallii,subalpine larch,Plantae,69848
183769678,9/16/23,2023-09-16 21:14:22 UTC,Pacific Time (US & Canada),3448676,,2023-09-18 00:16:36 UTC,2023-09-18 02:07:27 UTC,research,CC-BY-NC,https://inaturalist-open-data.s3.amazonaws.com/photos/320659836/medium.jpg,,,1,0,FALSE,3,"Okanogan - Wenatchee National Forest, Carlton, WA, US",48.174095,-120.35337,9,,,,9,,open,,subalpine larch,Larix lyallii,subalpine larch,Plantae,69848
183839247,9/16/23,2023-09-16 20:43:00 UTC,Pacific Time (US & Canada),5354436,Dave Drum,2023-09-18 13:26:53 UTC,2023-09-18 15:44:12 UTC,research,CC-BY-NC,https://inaturalist-open-data.s3.amazonaws.com/photos/320792244/medium.jpeg,,Elevation approximately 6700 feet.,1,0,FALSE,,"Chelan County, WA, USA",48.03774994,-120.8856137,15,,,,15,,open,,subalpine larch,Larix lyallii,subalpine larch,Plantae,69848
183913711,9/16/23,2023-09-16 18:22:06 UTC,America/Edmonton,5492459,V,2023-09-18 23:02:33 UTC,2024-06-28 02:08:18 UTC,research,CC-BY-NC,https://inaturalist-open-data.s3.amazonaws.com/photos/320938150/medium.jpg,,,1,0,FALSE,3,"Banff National Park, Improvement District No. 9 Banff, AB, CA",51.32912723,-116.2007304,804,,,,804,,open,,subalpine larch,Larix lyallii,subalpine larch,Plantae,69848
183942907,9/18/23,2023-09-18 19:23:36 UTC,America/Edmonton,64204,Mina Zaki,2023-09-19 04:07:55 UTC,2024-06-27 06:02:16 UTC,research,CC-BY-NC,https://inaturalist-open-data.s3.amazonaws.com/photos/321000180/medium.jpeg,,,2,0,FALSE,2,"Improvement District No. 9, AB T0L, Canada",51.41529111,-116.2503872,,,,,,,open,gps,subalpine larch,Larix lyallii,subalpine larch,Plantae,69848
183944073,9/18/23,2023-09-18 18:08:11 UTC,America/Edmonton,1448507,Jenny Feick,2023-09-19 04:24:39 UTC,2023-09-20 13:01:30 UTC,research,CC-BY-NC,https://inaturalist-open-data.s3.amazonaws.com/photos/321002495/medium.jpg,,,1,0,FALSE,3,"East Kootenay, BC, CA",50.36935,-116.2235333,9,,,,9,,open,,subalpine larch,Larix lyallii,subalpine larch,Plantae,69848
183975930,9/18/23,2023-09-18 20:18:46 UTC,America/Edmonton,1448507,Jenny Feick,2023-09-19 13:24:47 UTC,2023-09-20 02:23:00 UTC,research,CC-BY-NC,https://inaturalist-open-data.s3.amazonaws.com/photos/321067261/medium.jpg,,,1,0,FALSE,3,"East Kootenay, BC, CA",50.38112833,-116.216845,50,,,,50,,open,,subalpine larch,Larix lyallii,subalpine larch,Plantae,69848
183981660,9/18/23,2023-09-18 22:08:47 UTC,Pacific Time (US & Canada),168440,Brian Charles,2023-09-19 14:20:36 UTC,2024-05-08 00:02:13 UTC,research,CC-BY-NC,https://inaturalist-open-data.s3.amazonaws.com/photos/321078483/medium.jpeg,,"Found at 4900 ft elevation, morphological characters didn't make for clear ID.",2,0,FALSE,2,"Winthrop, WA 98862, USA",48.54148585,-120.679099,149,,,,149,,open,gps,subalpine larch,Larix lyallii,subalpine larch,Plantae,69848
184047708,8/25/23,,America/Edmonton,7397435,,2023-09-19 22:52:13 UTC,2024-06-28 02:08:02 UTC,research,CC-BY-NC,https://inaturalist-open-data.s3.amazonaws.com/photos/321183953/medium.jpg,,,1,0,FALSE,,"Kananaskis, AB T0L, Canada",50.60234181,-115.0098976,339,,,,339,,open,,subalpine larch,Larix lyallii,subalpine larch,Plantae,69848
184053810,9/19/23,2023-09-19 19:24:07 UTC,Pacific Time (US & Canada),168440,Brian Charles,2023-09-19 23:50:30 UTC,2023-09-20 15:44:29 UTC,research,CC-BY-NC,https://inaturalist-open-data.s3.amazonaws.com/photos/321212579/medium.jpeg,,,1,0,FALSE,2,"Skagit County, WA, USA",48.55076944,-120.7066694,,,,,,,open,gps,subalpine larch,Larix lyallii,subalpine larch,Plantae,69848
184105978,9/19/23,2023-09-19 17:53:53 UTC,America/Creston,1412723,Adrian Leslie,2023-09-20 12:04:36 UTC,2023-09-22 19:32:01 UTC,research,CC-BY-NC,https://inaturalist-open-data.s3.amazonaws.com/photos/321316227/medium.jpg,,,1,0,FALSE,3,"Central Kootenay, BC, CA",49.18614167,-116.8037033,4,,,,4,,open,,subalpine larch,Larix lyallii,subalpine larch,Plantae,69848
184198149,9/18/23,2023-09-18 23:15:49 UTC,America/Edmonton,1318846,mchong,2023-09-21 00:54:28 UTC,2024-06-27 06:02:05 UTC,research,,https://static.inaturalist.org/photos/321493302/medium.jpg,,,1,0,FALSE,3,"Banff National Park, Improvement District No. 9 Banff, AB, CA",51.10299167,-115.9021917,13,,,,13,,open,,subalpine larch,Larix lyallii,subalpine larch,Plantae,69848
184371791,9/21/23,2023-09-21 20:22:36 UTC,America/Edmonton,1559027,,2023-09-22 13:00:26 UTC,2024-06-27 06:01:59 UTC,research,CC-BY-NC,https://inaturalist-open-data.s3.amazonaws.com/photos/321824655/medium.jpg,,,1,0,FALSE,3,"Banff National Park, Improvement District No. 9 Banff, AB, CA",51.42113833,-116.2377033,4,,,,4,,open,,subalpine larch,Larix lyallii,subalpine larch,Plantae,69848
184438156,9/16/23,2023-09-16 16:33:00 UTC,America/Edmonton,353521,Patricia Teague,2023-09-22 21:05:57 UTC,2023-09-28 16:39:44 UTC,research,CC-BY,https://inaturalist-open-data.s3.amazonaws.com/photos/321943629/medium.jpeg,,,1,0,FALSE,,"East Kootenay, BC, Canada",51.20321112,-116.0726611,,,,,,,open,,subalpine larch,Larix lyallii,subalpine larch,Plantae,69848
184606937,9/23/23,2023-09-23 19:51:14 UTC,America/Edmonton,6854698,,2023-09-23 22:55:39 UTC,2024-06-28 02:07:52 UTC,research,CC-BY-NC,https://inaturalist-open-data.s3.amazonaws.com/photos/322269461/medium.jpg,,"Incredibly soft needles. Counted up to 36 needles per cluster. 


",1,0,FALSE,3,"Peter Lougheed, CA-AB-FN, CA-AB, CA",50.79732511,-115.3836394,12,,,,12,,open,,Larix lyallii,Larix lyallii,subalpine larch,Plantae,69848
184696169,9/23/23,2023-09-23 19:14:19 UTC,Pacific Time (US & Canada),5715899,,2023-09-24 14:20:20 UTC,2023-12-01 05:04:57 UTC,research,CC-BY-NC,https://inaturalist-open-data.s3.amazonaws.com/photos/322439029/medium.jpg,,,1,0,FALSE,3,"Okanogan - Wenatchee National Forest, Mazama, WA, US",48.55423333,-120.7006917,4,,,,4,,open,,subalpine larch,Larix lyallii,subalpine larch,Plantae,69848
184697200,9/23/23,2023-09-23 18:22:11 UTC,Pacific Time (US & Canada),5715899,,2023-09-24 14:27:48 UTC,2024-05-08 00:01:47 UTC,research,CC-BY-NC,https://inaturalist-open-data.s3.amazonaws.com/photos/322441162/medium.jpg,,,2,0,FALSE,3,"Okanogan - Wenatchee National Forest, Mazama, WA, US",48.55460333,-120.6909867,3,,,,3,,open,,subalpine larch,Larix lyallii,subalpine larch,Plantae,69848
184774747,9/24/23,2023-09-24 19:00:06 UTC,America/Edmonton,1592842,JF Amiot,2023-09-24 22:17:57 UTC,2024-06-28 02:07:48 UTC,research,CC-BY-NC,https://inaturalist-open-data.s3.amazonaws.com/photos/322584697/medium.jpg,,,2,0,FALSE,3,"Elbow - Sheep Wildland Provincial Park, Kananaskis, AB, CA",50.60348833,-114.9854667,8,,,,8,,open,,subalpine larch,Larix lyallii,subalpine larch,Plantae,69848
184779299,9/24/23,2023-09-24 21:10:43 UTC,America/Edmonton,6586137,,2023-09-24 22:51:02 UTC,2024-06-28 02:07:35 UTC,research,CC-BY-NC,https://inaturalist-open-data.s3.amazonaws.com/photos/322594602/medium.jpg,,,1,0,FALSE,3,"Elbow - Sheep Wildland Provincial Park, Kananaskis, AB, CA",50.59203333,-114.9667967,4,,,,4,,open,,subalpine larch,Larix lyallii,subalpine larch,Plantae,69848
184791950,9/23/23,2023-09-23 19:45:34 UTC,Pacific Time (US & Canada),3448676,,2023-09-25 00:36:57 UTC,2023-10-02 01:09:04 UTC,research,CC-BY-NC,https://inaturalist-open-data.s3.amazonaws.com/photos/322620106/medium.jpg,,,1,0,FALSE,3,"Okanogan - Wenatchee National Forest, Twisp, WA, US",48.24171167,-120.33783,4,,,,4,,open,,subalpine larch,Larix lyallii,subalpine larch,Plantae,69848
184802846,9/18/22,2022-09-18 17:39:00 UTC,America/Edmonton,3305576,Chris,2023-09-25 02:10:30 UTC,2024-06-27 06:01:55 UTC,research,CC-BY-NC,https://inaturalist-open-data.s3.amazonaws.com/photos/322641169/medium.jpg,,,1,0,FALSE,,"Improvement District No. 9, AB T0L, Canada",50.8480166,-115.5627628,,,,,,,open,,subalpine larch,Larix lyallii,subalpine larch,Plantae,69848
184960174,9/23/23,2023-09-23 20:20:00 UTC,America/Edmonton,4450215,Adam Kalab,2023-09-26 02:59:37 UTC,2024-06-22 01:31:17 UTC,research,CC-BY-NC,https://inaturalist-open-data.s3.amazonaws.com/photos/322937180/medium.jpeg,,,1,0,FALSE,,"East Kootenay, BC, Canada",49.01427455,-114.0705881,4,,,,4,,open,,subalpine larch,Larix lyallii,subalpine larch,Plantae,69848
185046125,9/24/23,2023-09-24 17:39:18 UTC,America/Edmonton,1598326,Jonathan Fearns,2023-09-26 19:18:51 UTC,2024-06-28 02:07:25 UTC,research,,https://static.inaturalist.org/photos/323106963/medium.jpg,,Observed at around 2400m,1,0,FALSE,3,"Elbow - Sheep Wildland Provincial Park, Kananaskis, AB, CA",50.568905,-114.935845,8,,,,8,,open,,subalpine larch,Larix lyallii,subalpine larch,Plantae,69848
185082165,9/24/23,2023-09-24 17:07:00 UTC,America/Edmonton,4450215,Adam Kalab,2023-09-27 00:18:58 UTC,2024-06-22 01:31:32 UTC,research,CC-BY-NC,https://inaturalist-open-data.s3.amazonaws.com/photos/323157758/medium.jpg,,,1,0,FALSE,,"Improvement District No. 4, AB T0K, Canada",49.05482222,-114.0703056,4,,,,4,,open,,subalpine larch,Larix lyallii,subalpine larch,Plantae,69848
185282892,9/23/23,2023-09-23 16:43:22 UTC,America/Edmonton,6557904,,2023-09-28 14:48:01 UTC,2024-06-28 02:07:18 UTC,research,CC-BY-NC,https://inaturalist-open-data.s3.amazonaws.com/photos/323569669/medium.jpg,,,1,0,FALSE,3,"Elbow - Sheep Wildland Provincial Park, Kananaskis, AB, CA",50.60331667,-114.9837033,9,,,,9,,open,,subalpine larch,Larix lyallii,subalpine larch,Plantae,69848
185372483,9/20/23,2023-09-20 15:24:52 UTC,Pacific Time (US & Canada),4914728,,2023-09-29 03:16:24 UTC,2023-12-01 04:24:17 UTC,research,CC-BY-NC,https://inaturalist-open-data.s3.amazonaws.com/photos/323741625/medium.jpeg,,,1,0,FALSE,2,"Chelan County, WA, USA",48.245625,-120.7943167,,,,,,,open,gps,subalpine larch,Larix lyallii,subalpine larch,Plantae,69848
185376662,9/19/23,2023-09-19 19:32:00 UTC,America/Edmonton,1606404,Alan Covington,2023-09-29 04:15:30 UTC,2024-06-28 02:07:11 UTC,research,CC-BY,https://inaturalist-open-data.s3.amazonaws.com/photos/323749369/medium.jpg,"Chester Lake, Engadine Lodge, Larch",,1,0,FALSE,,"Kananaskis, AB T0L, Canada",50.8182963,-115.2790325,127,,,,127,,open,,subalpine larch,Larix lyallii,subalpine larch,Plantae,69848
185615989,9/30/23,2023-09-30 15:59:55 UTC,America/Vancouver,3364750,,2023-09-30 19:11:56 UTC,2023-12-25 23:24:48 UTC,research,CC-BY-NC,https://inaturalist-open-data.s3.amazonaws.com/photos/324313202/medium.jpg,,,2,0,FALSE,3,"E.C. Manning Park, Okanagan-Similkameen, BC, CA",49.1045386,-120.7586101,20,,,,20,,open,,subalpine larch,Larix lyallii,subalpine larch,Plantae,69848
185679605,9/30/23,2023-09-30 18:26:56 UTC,America/Vancouver,6161928,beast_mode,2023-10-01 03:00:19 UTC,2023-10-15 16:52:48 UTC,research,CC-BY-NC,https://inaturalist-open-data.s3.amazonaws.com/photos/324326172/medium.jpeg,,,1,0,FALSE,2,"Ainsworth, BC V0G 1A0, Canada",49.7436372,-117.1714064,,,,,,,open,gps,subalpine larch,Larix lyallii,subalpine larch,Plantae,69848
185824268,10/1/23,2023-10-01 21:21:08 UTC,America/Edmonton,4547920,,2023-10-01 23:22:29 UTC,2024-06-28 02:07:08 UTC,research,CC-BY-NC,https://inaturalist-open-data.s3.amazonaws.com/photos/324605721/medium.jpg,,,1,0,FALSE,3,"Elbow - Sheep Wildland Provincial Park, Kananaskis, AB, CA",50.60294335,-114.9843489,189,,,,189,,open,,subalpine larch,Larix lyallii,subalpine larch,Plantae,69848
185824834,10/1/23,2023-10-01 20:51:19 UTC,America/Edmonton,4547920,,2023-10-01 23:26:31 UTC,2024-06-28 02:07:05 UTC,research,CC-BY-NC,https://inaturalist-open-data.s3.amazonaws.com/photos/324606796/medium.jpg,,,1,0,FALSE,3,"Elbow - Sheep Wildland Provincial Park, Kananaskis, AB, CA",50.60256311,-114.9862989,32,,,,32,,open,,subalpine larch,Larix lyallii,subalpine larch,Plantae,69848
185857651,10/1/23,2023-10-01 18:27:57 UTC,America/Edmonton,2641511,,2023-10-02 03:51:14 UTC,2024-06-27 06:01:49 UTC,research,CC-BY-NC,https://inaturalist-open-data.s3.amazonaws.com/photos/324673457/medium.jpg,,,1,0,FALSE,3,"Banff National Park, Improvement District No. 9 Banff, AB, CA",51.30225,-116.0940388,6,,,,6,,open,,subalpine larch,Larix lyallii,subalpine larch,Plantae,69848
185866813,9/25/23,2023-09-25 17:54:00 UTC,America/Edmonton,1493104,Larry Halverson,2023-10-02 05:54:53 UTC,2023-10-02 12:51:55 UTC,research,CC-BY-NC,https://static.inaturalist.org/photos/324689113/medium.jpg,,,1,0,FALSE,,"Columbia-Shuswap, BC, Canada",51.34606111,-116.3283,4,,,,4,,open,,subalpine larch,Larix lyallii,subalpine larch,Plantae,69848
185924869,10/1/23,2023-10-01 22:47:17 UTC,America/Vancouver,5561925,Gavin Petersen,2023-10-02 16:56:01 UTC,2023-10-02 19:15:20 UTC,research,,https://static.inaturalist.org/photos/324801027/medium.jpeg,,,1,0,FALSE,2,"Manning Park, BC V0X 1R0, Canada",49.01833333,-120.8308333,,,,,,,open,gps,Larix lyallii,Larix lyallii,subalpine larch,Plantae,69848
185960543,10/1/23,2023-10-01 19:07:04 UTC,Pacific Time (US & Canada),3222030,,2023-10-02 21:27:22 UTC,2023-12-01 03:50:03 UTC,research,CC-BY-NC,https://inaturalist-open-data.s3.amazonaws.com/photos/324871999/medium.jpg,,,1,0,FALSE,3,"Okanogan - Wenatchee National Forest, Stehekin, WA, US",48.50851167,-120.7662883,4,,,,4,,open,,subalpine larch,Larix lyallii,subalpine larch,Plantae,69848
185985019,10/2/23,2023-10-02 20:13:00 UTC,America/Edmonton,449500,Blake Weis,2023-10-03 01:23:05 UTC,2024-06-28 02:06:59 UTC,research,CC-BY-NC,https://inaturalist-open-data.s3.amazonaws.com/photos/324923022/medium.jpg,,,1,0,FALSE,,"Kananaskis, AB T0L, Canada",50.59750792,-114.9633972,,,,,,,open,,subalpine larch,Larix lyallii,subalpine larch,Plantae,69848
185989566,10/2/23,2023-10-02 23:15:04 UTC,America/Vancouver,5977084,,2023-10-03 02:12:13 UTC,2023-10-03 03:27:54 UTC,research,CC-BY-NC,https://inaturalist-open-data.s3.amazonaws.com/photos/324933296/medium.jpg,,,1,0,FALSE,3,"E.C. Manning Park, Okanagan-Similkameen, BC, CA",49.11152217,-120.7557533,11,,,,11,,open,,subalpine larch,Larix lyallii,subalpine larch,Plantae,69848
186118603,10/3/23,2023-10-03 19:22:22 UTC,Pacific Time (US & Canada),5911077,madeline mundt,2023-10-04 02:47:44 UTC,2023-12-01 03:43:10 UTC,research,,https://static.inaturalist.org/photos/325187457/medium.jpg,,,1,0,FALSE,3,"Okanogan - Wenatchee National Forest, Leavenworth, WA, US",47.46380333,-120.9442667,4,,,,4,,open,,subalpine larch,Larix lyallii,subalpine larch,Plantae,69848
186129979,10/1/23,2023-10-01 19:46:51 UTC,America/Vancouver,1955525,Yanik Nill,2023-10-04 05:50:24 UTC,2023-10-15 16:52:19 UTC,research,CC-BY-NC,https://inaturalist-open-data.s3.amazonaws.com/photos/325209637/medium.jpg,,,1,0,FALSE,3,"E.C. Manning Park, Fraser Valley, BC, CA",49.01802783,-120.8319033,4,,,,4,,open,,subalpine larch,Larix lyallii,subalpine larch,Plantae,69848
186129991,10/2/23,2023-10-02 19:48:48 UTC,America/Vancouver,1955525,Yanik Nill,2023-10-04 05:50:46 UTC,2023-10-07 01:26:35 UTC,research,CC-BY-NC,https://inaturalist-open-data.s3.amazonaws.com/photos/325209667/medium.jpg,,,1,0,FALSE,3,"Okanagan-Similkameen, BC, CA",49.107072,-120.759506,21,,,,21,,open,,subalpine larch,Larix lyallii,subalpine larch,Plantae,69848
186182382,9/30/23,2023-09-30 19:37:44 UTC,Pacific Time (US & Canada),1919032,Kate Goldenring,2023-10-04 17:34:01 UTC,2023-12-01 03:41:28 UTC,research,,https://static.inaturalist.org/photos/325309895/medium.jpg,,,1,0,FALSE,3,"Okanogan - Wenatchee National Forest, Leavenworth, WA, US",47.482545,-120.799195,15,,,,15,,open,,subalpine larch,Larix lyallii,subalpine larch,Plantae,69848
186231786,10/4/23,2023-10-04 18:51:42 UTC,Pacific Time (US & Canada),6565841,,2023-10-05 01:07:09 UTC,2023-12-01 03:38:30 UTC,research,CC-BY-NC,https://inaturalist-open-data.s3.amazonaws.com/photos/325408964/medium.jpeg,,Lake Ingalls Trail.,1,0,FALSE,2,"Leavenworth, WA 98826, USA",47.46108056,-120.9364583,,,,,,,open,gps,subalpine larch,Larix lyallii,subalpine larch,Plantae,69848
186246695,10/4/23,2023-10-04 19:16:08 UTC,Pacific Time (US & Canada),6651839,Ellie,2023-10-05 04:28:30 UTC,2023-12-01 03:38:24 UTC,research,,https://static.inaturalist.org/photos/325440282/medium.jpeg,,On Lake Ingalls trail.,1,0,FALSE,2,"Leavenworth, WA 98826, USA",47.464825,-120.9393111,,,,,,,open,gps,subalpine larch,Larix lyallii,subalpine larch,Plantae,69848
186348657,10/1/23,2023-10-01 14:37:00 UTC,America/Edmonton,4561503,Quinn,2023-10-06 00:03:06 UTC,2024-06-28 02:06:55 UTC,research,CC-BY-NC,https://inaturalist-open-data.s3.amazonaws.com/photos/325638867/medium.jpeg,,,1,0,FALSE,,"Kananaskis, AB T0L, Canada",50.60029178,-114.9840314,62,,,,62,,open,,subalpine larch,Larix lyallii,subalpine larch,Plantae,69848
186348660,10/1/23,2023-10-01 14:48:00 UTC,America/Edmonton,4561503,Quinn,2023-10-06 00:03:06 UTC,2024-06-28 02:06:50 UTC,research,CC-BY-NC,https://inaturalist-open-data.s3.amazonaws.com/photos/325639121/medium.jpeg,"Forest stand, Fall larch",,1,0,FALSE,,"Kananaskis, AB T0L, Canada",50.60280815,-114.9852023,212,,,,212,,open,,subalpine larch,Larix lyallii,subalpine larch,Plantae,69848
186348741,10/5/23,2023-10-05 20:13:14 UTC,America/Edmonton,1448507,Jenny Feick,2023-10-06 00:03:59 UTC,2024-06-27 06:01:45 UTC,research,CC-BY-NC,https://inaturalist-open-data.s3.amazonaws.com/photos/325639656/medium.jpg,,,1,0,FALSE,3,"Banff National Park, Improvement District No. 9 Banff, AB, CA",51.09551117,-115.8601133,6,,,,6,,open,,subalpine larch,Larix lyallii,subalpine larch,Plantae,69848
186348827,10/5/23,2023-10-05 19:27:01 UTC,America/Edmonton,1448507,Jenny Feick,2023-10-06 00:04:56 UTC,2024-06-27 06:01:41 UTC,research,CC-BY-NC,https://inaturalist-open-data.s3.amazonaws.com/photos/325639890/medium.jpg,,,1,0,FALSE,3,"Banff National Park, Improvement District No. 9 Banff, AB, CA",51.09791117,-115.8660283,4,,,,4,,open,,subalpine larch,Larix lyallii,subalpine larch,Plantae,69848
186349164,10/5/23,2023-10-05 19:08:48 UTC,America/Edmonton,1448507,Jenny Feick,2023-10-06 00:08:11 UTC,2024-06-27 06:01:36 UTC,research,CC-BY-NC,https://inaturalist-open-data.s3.amazonaws.com/photos/325640439/medium.jpg,,,1,0,FALSE,3,"Banff National Park, Improvement District No. 9 Banff, AB, CA",51.09529167,-115.8579783,4,,,,4,,open,,subalpine larch,Larix lyallii,subalpine larch,Plantae,69848
186370813,9/21/23,2023-09-21 19:13:00 UTC,America/Edmonton,1606404,Alan Covington,2023-10-06 05:19:54 UTC,2024-06-28 02:06:40 UTC,research,CC-BY,https://inaturalist-open-data.s3.amazonaws.com/photos/325686504/medium.jpg,"Engadine Lodge, Tent Ridge",or Alpine Larch or Larix lyallii,1,0,FALSE,,"Kananaskis, AB T0L, Canada",50.82042239,-115.3668163,97,,,,97,,open,,subalpine larch,Larix lyallii,subalpine larch,Plantae,69848
186642451,10/7/23,2023-10-07 22:42:02 UTC,Pacific Time (US & Canada),3071038,,2023-10-08 02:58:27 UTC,2023-10-08 05:11:03 UTC,research,CC-BY-NC,https://inaturalist-open-data.s3.amazonaws.com/photos/326217270/medium.jpg,,,1,0,FALSE,3,"Okanogan - Wenatchee National Forest, Ronald, WA, US",47.46452833,-120.961205,4,,,,4,,open,,subalpine larch,Larix lyallii,subalpine larch,Plantae,69848
186651223,10/6/23,2023-10-06 18:15:00 UTC,Pacific Time (US & Canada),232932,Sydney Gerig,2023-10-08 04:45:09 UTC,2023-12-01 03:24:08 UTC,research,CC-BY-NC,https://inaturalist-open-data.s3.amazonaws.com/photos/326228989/medium.jpg,,,2,0,FALSE,,"Maple Loop Pass - Okanogan-Wenatchee NF, WA, USA",48.50919602,-120.7648054,35,,,,35,,open,,subalpine larch,Larix lyallii,subalpine larch,Plantae,69848
186651237,10/6/23,2023-10-06 20:11:00 UTC,Pacific Time (US & Canada),232932,Sydney Gerig,2023-10-08 04:45:12 UTC,2023-10-23 14:05:56 UTC,research,CC-BY-NC,https://inaturalist-open-data.s3.amazonaws.com/photos/326229518/medium.jpg,,,2,0,FALSE,,"Maple Loop Pass - Okanogan-Wenatchee NF, WA, USA",48.50003972,-120.7556839,91,,,,91,,open,,subalpine larch,Larix lyallii,subalpine larch,Plantae,69848
186661714,10/7/23,2023-10-07 23:44:49 UTC,Pacific Time (US & Canada),6688023,Lucas Lochner Bravo,2023-10-08 07:34:11 UTC,2023-10-08 13:52:05 UTC,research,CC-BY-NC,https://inaturalist-open-data.s3.amazonaws.com/photos/326258163/medium.jpg,,,1,0,FALSE,3,"Okanogan - Wenatchee National Forest, Leavenworth, WA, US",48.17345,-120.8674,53,,,,53,,open,,subalpine larch,Larix lyallii,subalpine larch,Plantae,69848
186716662,10/7/23,2023-10-07 16:58:00 UTC,Pacific Time (US & Canada),2944460,Matt Below,2023-10-08 16:58:47 UTC,2023-10-23 14:04:11 UTC,research,,https://static.inaturalist.org/photos/326361374/medium.jpeg,,,1,0,FALSE,,"Chelan County, WA, USA",47.63397101,-120.8584992,4,,,,4,,open,,subalpine larch,Larix lyallii,subalpine larch,Plantae,69848
186790960,10/8/23,2023-10-08 21:47:23 UTC,Pacific Time (US & Canada),6252595,,2023-10-09 01:03:41 UTC,2023-10-23 14:02:49 UTC,research,CC-BY-NC,https://inaturalist-open-data.s3.amazonaws.com/photos/326506568/medium.jpeg,,,1,0,FALSE,2,"Winthrop, WA 98862, USA",48.51254097,-120.665695,,,,,,,open,gps,subalpine larch,Larix lyallii,subalpine larch,Plantae,69848
186792830,10/8/23,2023-10-08 19:19:52 UTC,Pacific Time (US & Canada),6932358,,2023-10-09 01:19:42 UTC,2023-10-23 14:02:22 UTC,research,CC-BY-NC,https://inaturalist-open-data.s3.amazonaws.com/photos/326510490/medium.jpg,,,1,0,FALSE,3,"Okanogan - Wenatchee National Forest, Leavenworth, WA, US",47.45967833,-120.9369367,8,,,,8,,open,,subalpine larch,Larix lyallii,subalpine larch,Plantae,69848
186797786,10/8/23,2023-10-08 22:02:08 UTC,Pacific Time (US & Canada),2354220,Max Beback,2023-10-09 02:03:19 UTC,2023-12-01 05:49:02 UTC,research,,https://static.inaturalist.org/photos/326520872/medium.jpg,,,2,0,FALSE,3,"Okanogan - Wenatchee National Forest, Mazama, WA, US",48.540295,-120.6791617,4,,,,4,,open,,subalpine larch,Larix lyallii,subalpine larch,Plantae,69848
186803051,10/8/23,2023-10-08 17:38:54 UTC,Pacific Time (US & Canada),7072181,,2023-10-09 02:53:11 UTC,2023-10-23 13:59:36 UTC,research,CC-BY-NC,https://inaturalist-open-data.s3.amazonaws.com/photos/326531184/medium.jpeg,,,1,0,FALSE,333,"Okanogan - Wenatchee National Forest, Leavenworth, WA, US",47.46455295,-120.9275515,129,,,,129,,open,,subalpine larch,Larix lyallii,subalpine larch,Plantae,69848
186812503,10/7/23,2023-10-08 00:44:00 UTC,Pacific Time (US & Canada),6992645,LuLu Callies,2023-10-09 04:45:34 UTC,2023-12-01 03:17:40 UTC,research,,https://static.inaturalist.org/photos/326551257/medium.jpg,,,2,0,FALSE,3,"Okanogan - Wenatchee National Forest, Cle Elum, WA, US",47.45296386,-120.9395122,319,,,,319,,open,,subalpine larch,Larix lyallii,subalpine larch,Plantae,69848
186846904,10/8/23,2023-10-08 22:55:17 UTC,Pacific Time (US & Canada),104905,Joan Septembre,2023-10-09 13:44:39 UTC,2023-10-23 13:58:02 UTC,research,CC-BY-NC-ND,https://static.inaturalist.org/photos/326621505/medium.jpg,,,1,0,FALSE,3,"Okanogan - Wenatchee National Forest, Marblemount, WA, US",48.50996167,-120.7659217,11,,,,11,,open,,subalpine larch,Larix lyallii,subalpine larch,Plantae,69848
186854181,10/8/23,2023-10-08 20:43:03 UTC,Pacific Time (US & Canada),879703,,2023-10-09 14:53:04 UTC,2023-11-07 23:01:07 UTC,research,,https://static.inaturalist.org/photos/326635731/medium.jpg,,,2,0,FALSE,3,"Okanogan - Wenatchee National Forest, Leavenworth, WA, US",48.06441383,-120.7321617,4,,,,4,,open,,subalpine larch,Larix lyallii,subalpine larch,Plantae,69848
186855610,10/8/23,2023-10-08 18:56:44 UTC,America/Vancouver,3865489,Mady Hart,2023-10-09 15:05:45 UTC,2023-12-01 03:17:03 UTC,research,,https://static.inaturalist.org/photos/326638414/medium.jpg,,,3,1,FALSE,3,"E.C. Manning Park, Okanagan-Similkameen, BC, CA",49.01493055,-120.8325717,4,,,,4,,open,,subalpine larch,Larix lyallii,subalpine larch,Plantae,69848
186948189,10/8/23,2023-10-08 20:50:00 UTC,Pacific Time (US & Canada),104905,Joan Septembre,2023-10-10 03:12:46 UTC,2023-10-10 15:16:04 UTC,research,CC-BY-NC-ND,https://static.inaturalist.org/photos/326822898/medium.jpg,,,1,0,FALSE,,"Chelan County, WA, USA",48.50406473,-120.7678092,130,,,,130,,open,,subalpine larch,Larix lyallii,subalpine larch,Plantae,69848
186956671,10/9/23,2023-10-09 21:45:39 UTC,America/Edmonton,1448507,Jenny Feick,2023-10-10 04:40:27 UTC,2023-10-12 04:26:50 UTC,research,CC-BY-NC,https://inaturalist-open-data.s3.amazonaws.com/photos/326839458/medium.jpg,,,1,0,FALSE,3,"Kootenay National Park, East Kootenay, BC, CA",51.05799167,-115.963425,7,,,,7,,open,,subalpine larch,Larix lyallii,subalpine larch,Plantae,69848
186956682,10/9/23,2023-10-09 21:39:46 UTC,America/Edmonton,1448507,Jenny Feick,2023-10-10 04:40:39 UTC,2023-10-12 04:25:59 UTC,research,CC-BY-NC,https://inaturalist-open-data.s3.amazonaws.com/photos/326839488/medium.jpg,,,1,0,FALSE,3,"Kootenay National Park, East Kootenay, BC, CA",51.05925283,-115.9652383,19,,,,19,,open,,subalpine larch,Larix lyallii,subalpine larch,Plantae,69848
186956706,10/9/23,2023-10-09 21:35:31 UTC,America/Edmonton,1448507,Jenny Feick,2023-10-10 04:41:06 UTC,2023-10-12 04:25:36 UTC,research,CC-BY-NC,https://inaturalist-open-data.s3.amazonaws.com/photos/326839540/medium.jpg,,,1,0,FALSE,3,"Kootenay National Park, East Kootenay, BC, CA",51.05952783,-115.966055,11,,,,11,,open,,subalpine larch,Larix lyallii,subalpine larch,Plantae,69848
187194855,10/10/23,2023-10-10 23:16:00 UTC,Pacific Time (US & Canada),6922972,,2023-10-12 01:43:22 UTC,2023-10-22 18:44:51 UTC,research,CC-BY-NC,https://inaturalist-open-data.s3.amazonaws.com/photos/327314109/medium.jpeg,,,1,0,FALSE,2,"Chelan County, WA, USA",48.50871384,-120.7643523,14,,,,14,,open,gps,subalpine larch,Larix lyallii,subalpine larch,Plantae,69848
187199954,10/8/23,2023-10-08 18:14:00 UTC,America/Edmonton,430175,,2023-10-12 02:43:59 UTC,2024-05-06 23:15:32 UTC,research,CC-BY-NC,https://static.inaturalist.org/photos/327324134/medium.jpg,,,2,0,FALSE,,"East Kootenay, BC, Canada",51.06877114,-115.7902266,735,,,,735,,open,,subalpine larch,Larix lyallii,subalpine larch,Plantae,69848
187200303,9/25/23,2023-09-25 19:31:00 UTC,America/Edmonton,430175,,2023-10-12 02:48:07 UTC,2024-06-28 02:06:35 UTC,research,CC-BY-NC,https://static.inaturalist.org/photos/327324697/medium.jpg,,,2,0,FALSE,,"Improvement District No. 4, AB T0K, Canada",49.04104108,-113.959582,2614,,,,2614,,open,,subalpine larch,Larix lyallii,subalpine larch,Plantae,69848
187319234,9/17/23,2023-09-17 20:18:45 UTC,Mountain Time (US & Canada),7515478,,2023-10-13 01:51:45 UTC,2023-10-19 18:29:09 UTC,research,CC-BY-NC,https://inaturalist-open-data.s3.amazonaws.com/photos/327556265/medium.jpg,,,1,0,FALSE,3,"Beaverhead-Deerlodge National Forest, Anaconda, MT, US",45.96168833,-113.3746333,4,,,,4,,open,,subalpine larch,Larix lyallii,subalpine larch,Plantae,69848
187720243,10/8/23,2023-10-08 21:24:32 UTC,Pacific Time (US & Canada),2953207,Chris Law,2023-10-16 00:55:38 UTC,2023-12-01 02:47:59 UTC,research,CC-BY-NC,https://inaturalist-open-data.s3.amazonaws.com/photos/328353901/medium.jpeg,,,2,0,FALSE,2,"Chelan County, WA, USA",48.5041431,-120.7681239,,,,,,,open,gps,subalpine larch,Larix lyallii,subalpine larch,Plantae,69848
187736432,10/15/23,2023-10-15 21:38:43 UTC,America/Vancouver,5247865,,2023-10-16 03:08:49 UTC,2023-10-22 20:10:43 UTC,research,CC-BY-NC,https://inaturalist-open-data.s3.amazonaws.com/photos/328386346/medium.jpg,,,2,0,FALSE,3,"E.C. Manning Provincial Park, Okanagan-Similkameen, BC, CA",49.0139,-120.83242,8,,,,8,,open,,subalpine larch,Larix lyallii,subalpine larch,Plantae,69848
187746791,10/15/23,2023-10-15 22:04:55 UTC,America/Vancouver,104905,Joan Septembre,2023-10-16 05:18:29 UTC,2023-10-22 18:17:57 UTC,research,CC-BY-NC-ND,https://static.inaturalist.org/photos/328408213/medium.jpg,,,1,0,FALSE,3,"E.C. Manning Provincial Park, Fraser Valley, BC, CA",49.02343883,-120.8307117,11,,,,11,,open,,subalpine larch,Larix lyallii,subalpine larch,Plantae,69848
187747321,10/15/23,2023-10-15 18:54:57 UTC,America/Vancouver,104905,Joan Septembre,2023-10-16 05:25:29 UTC,2023-10-22 18:17:42 UTC,research,CC-BY-NC-ND,https://static.inaturalist.org/photos/328409219/medium.jpg,,,1,0,FALSE,3,"E.C. Manning Provincial Park, Fraser Valley, BC, CA",49.02346117,-120.8306967,12,,,,12,,open,,subalpine larch,Larix lyallii,subalpine larch,Plantae,69848
187831601,10/7/23,2023-10-07 23:29:00 UTC,America/Edmonton,705651,Mathis Natvik,2023-10-16 22:13:38 UTC,2024-06-28 02:06:32 UTC,research,,https://static.inaturalist.org/photos/328571462/medium.jpg,,,2,0,FALSE,,"Kananaskis, AB T0L, Canada",50.59730206,-114.9662672,2,,,,2,,open,,subalpine larch,Larix lyallii,subalpine larch,Plantae,69848
187831618,9/24/23,2023-09-24 23:04:00 UTC,America/Edmonton,705651,Mathis Natvik,2023-10-16 22:13:41 UTC,2023-10-18 01:23:53 UTC,research,,https://static.inaturalist.org/photos/328573002/medium.jpg,,,1,0,FALSE,,"East Kootenay, BC, Canada",50.57347516,-115.1008488,15,,,,15,,open,,subalpine larch,Larix lyallii,subalpine larch,Plantae,69848
187982386,10/17/23,2023-10-17 20:33:53 UTC,America/Vancouver,4981106,Shriya Chamarty,2023-10-18 03:25:42 UTC,2023-10-22 18:09:16 UTC,research,,https://static.inaturalist.org/photos/328872772/medium.jpg,,,1,0,FALSE,3,"E.C. Manning Park, Fraser Valley, BC, CA",49.0198445,-120.8318633,4,,,,4,,open,,subalpine larch,Larix lyallii,subalpine larch,Plantae,69848
188063129,9/25/23,2023-09-25 22:21:00 UTC,America/Edmonton,88044,BioBlitz,2023-10-18 20:28:28 UTC,2024-06-27 06:01:33 UTC,research,CC-BY-ND,https://inaturalist-open-data.s3.amazonaws.com/photos/329034559/medium.jpeg,,,1,0,FALSE,,"Improvement District No. 9, AB T0L, Canada",51.32117503,-116.2410213,280,,,,280,,open,,subalpine larch,Larix lyallii,subalpine larch,Plantae,69848
188079224,10/13/23,2023-10-13 19:09:24 UTC,Pacific Time (US & Canada),20806,Josh,2023-10-18 22:53:58 UTC,2023-10-19 01:03:16 UTC,research,CC-BY-NC,https://inaturalist-open-data.s3.amazonaws.com/photos/329068281/medium.jpg,,,1,0,FALSE,3,"Okanogan - Wenatchee National Forest, Leavenworth, WA, US",47.48876167,-120.83783,4,,,,4,,open,,subalpine larch,Larix lyallii,subalpine larch,Plantae,69848
188980763,10/16/22,2022-10-16 21:39:10 UTC,Pacific Time (US & Canada),350245,Mark Robinson,2023-10-26 06:26:06 UTC,2023-11-12 04:30:06 UTC,research,CC-BY-NC,https://inaturalist-open-data.s3.amazonaws.com/photos/330922167/medium.jpg,,,1,0,FALSE,3,"Okanogan - Wenatchee National Forest, Mazama, WA, US",48.51391167,-120.642975,51,,,,51,,open,,subalpine larch,Larix lyallii,subalpine larch,Plantae,69848
188980824,10/15/22,2022-10-15 22:11:42 UTC,Pacific Time (US & Canada),350245,Mark Robinson,2023-10-26 06:27:16 UTC,2023-11-12 04:30:03 UTC,research,CC-BY-NC,https://inaturalist-open-data.s3.amazonaws.com/photos/330922277/medium.jpg,,,1,0,FALSE,3,"Okanogan - Wenatchee National Forest, Tonasket, WA, US",48.66301333,-119.9402783,4,,,,4,,open,,subalpine larch,Larix lyallii,subalpine larch,Plantae,69848
188980904,10/15/22,2022-10-15 20:28:27 UTC,Pacific Time (US & Canada),350245,Mark Robinson,2023-10-26 06:28:47 UTC,2023-11-12 04:29:55 UTC,research,CC-BY-NC,https://inaturalist-open-data.s3.amazonaws.com/photos/330922451/medium.jpg,,,1,0,FALSE,3,"Okanogan - Wenatchee National Forest, Tonasket, WA, US",48.66311667,-119.94017,3,,,,3,,open,,subalpine larch,Larix lyallii,subalpine larch,Plantae,69848
189992768,7/8/22,2022-07-08 20:40:00 UTC,America/Edmonton,6611323,Rajan Rao,2023-11-04 20:34:06 UTC,2024-06-27 06:01:29 UTC,research,CC-BY-NC,https://inaturalist-open-data.s3.amazonaws.com/photos/332827692/medium.jpg,,,1,0,FALSE,,"Improvement District No. 9, AB T0L, Canada",51.41481796,-116.2429916,15,,,,15,,open,,subalpine larch,Larix lyallii,subalpine larch,Plantae,69848
190258037,9/30/23,2023-09-30 23:34:22 UTC,America/Vancouver,6841560,,2023-11-06 23:52:28 UTC,2023-11-07 07:36:05 UTC,research,CC-BY-NC,https://inaturalist-open-data.s3.amazonaws.com/photos/333473457/medium.jpg,,,1,0,FALSE,3,"E.C. Manning Park, Okanagan-Similkameen, BC, CA",49.02807274,-120.8178848,106,,,,106,,open,,subalpine larch,Larix lyallii,subalpine larch,Plantae,69848
190353035,10/6/23,2023-10-06 19:18:00 UTC,Pacific Time (US & Canada),256715,Kathryn True,2023-11-07 23:34:34 UTC,2023-11-12 03:14:58 UTC,research,,https://static.inaturalist.org/photos/333669911/medium.jpeg,,,1,0,FALSE,,"Chelan County, WA, USA",47.48874159,-120.8371753,61,,,,61,,open,,subalpine larch,Larix lyallii,subalpine larch,Plantae,69848
191411721,7/22/23,2023-07-22 21:35:00 UTC,America/Edmonton,1040988,Matthias Buck,2023-11-18 22:34:55 UTC,2024-06-28 02:06:16 UTC,research,CC-BY-NC,https://inaturalist-open-data.s3.amazonaws.com/photos/335784711/medium.jpeg,,In subalpine zone,1,0,FALSE,,"Waterton NP, Upper Rowe Lake",49.05125824,-114.0613663,20,,,,20,,open,,subalpine larch,Larix lyallii,subalpine larch,Plantae,69848
191616816,9/18/23,2023-09-18 19:29:00 UTC,America/Edmonton,3877739,Alexandra Laking,2023-11-20 21:54:31 UTC,2024-06-27 06:01:24 UTC,research,CC-BY-NC,https://inaturalist-open-data.s3.amazonaws.com/photos/336189328/medium.jpeg,,,1,0,FALSE,,"Improvement District No. 9, AB T0L, Canada",51.4120562,-116.2510018,193,,,,193,,open,,subalpine larch,Larix lyallii,subalpine larch,Plantae,69848
191616843,9/18/23,2023-09-18 21:24:00 UTC,America/Edmonton,3877739,Alexandra Laking,2023-11-20 21:54:36 UTC,2024-06-27 06:01:19 UTC,research,CC-BY-NC,https://inaturalist-open-data.s3.amazonaws.com/photos/336190439/medium.jpeg,,,1,0,FALSE,,"Improvement District No. 9, AB T0L, Canada",51.4127458,-116.2503656,75,,,,75,,open,,subalpine larch,Larix lyallii,subalpine larch,Plantae,69848
191616860,9/18/23,2023-09-18 22:31:00 UTC,America/Edmonton,3877739,Alexandra Laking,2023-11-20 21:54:41 UTC,2024-06-27 06:01:07 UTC,research,CC-BY-NC,https://inaturalist-open-data.s3.amazonaws.com/photos/336192684/medium.jpeg,,,1,0,FALSE,,"Improvement District No. 9, AB T0L, Canada",51.41588226,-116.2482491,294,,,,294,,open,,subalpine larch,Larix lyallii,subalpine larch,Plantae,69848
194392150,8/17/14,2014-08-17 15:33:00 UTC,Pacific Time (US & Canada),1106562,Mark Pollock,2023-12-20 00:29:23 UTC,2023-12-20 04:20:36 UTC,research,,https://static.inaturalist.org/photos/341688782/medium.jpeg,,,2,0,FALSE,,"Chelan County, WA, USA",48.509011,-120.758505,800,,,,800,,open,,subalpine larch,Larix lyallii,subalpine larch,Plantae,69848
194863282,10/11/08,2008-10-11 15:24:00 UTC,Pacific Time (US & Canada),1106562,Mark Pollock,2023-12-26 03:24:59 UTC,2023-12-26 17:59:46 UTC,research,,https://static.inaturalist.org/photos/342648161/medium.jpg,,,1,0,FALSE,,"Chelan County, WA, USA",47.487643,-120.835752,5000,,,,5000,,open,,subalpine larch,Larix lyallii,subalpine larch,Plantae,69848
194865776,8/14/08,2008-08-14 16:06:00 UTC,America/Edmonton,1106562,Mark Pollock,2023-12-26 04:16:24 UTC,2023-12-26 14:18:29 UTC,research,,https://static.inaturalist.org/photos/342653232/medium.jpg,,,1,0,FALSE,,"East Kootenay, BC, Canada",50.739239,-116.764518,300,,,,300,,open,,subalpine larch,Larix lyallii,subalpine larch,Plantae,69848
195346851,12/29/23,2023-12-29 18:07:57 UTC,America/Edmonton,1781642,Caleb Catto,2023-12-31 06:47:54 UTC,2024-06-27 06:01:01 UTC,research,CC-BY,https://inaturalist-open-data.s3.amazonaws.com/photos/343637760/medium.jpg,,,1,0,FALSE,3,"Lake Louise Ski Resort & Summer Gondola, Improvement District No. 9 Banff, AB, CA",51.43625222,-116.1076093,43,,,,43,,open,,subalpine larch,Larix lyallii,subalpine larch,Plantae,69848
195346876,12/29/23,2023-12-29 19:05:56 UTC,America/Edmonton,1781642,Caleb Catto,2023-12-31 06:48:15 UTC,2024-06-27 06:00:56 UTC,research,CC-BY,https://inaturalist-open-data.s3.amazonaws.com/photos/343637796/medium.jpg,,,1,0,FALSE,3,"Banff National Park, Improvement District No. 9 Banff, AB, CA",51.46689214,-116.1513645,22,,,,22,,open,,subalpine larch,Larix lyallii,subalpine larch,Plantae,69848
195346939,12/30/23,2023-12-30 21:49:47 UTC,America/Edmonton,1781642,Caleb Catto,2023-12-31 06:49:04 UTC,2024-06-27 06:00:52 UTC,research,CC-BY,https://inaturalist-open-data.s3.amazonaws.com/photos/343637867/medium.jpg,,,1,0,FALSE,3,"Banff National Park, Improvement District No. 9 Banff, AB, CA",51.45968667,-116.1465917,144,,,,144,,open,,subalpine larch,Larix lyallii,subalpine larch,Plantae,69848
196243249,9/25/10,2010-09-25 21:15:00 UTC,America/Vancouver,2980912,Drew Brayshaw,2024-01-10 01:12:27 UTC,2024-03-11 01:36:42 UTC,research,CC-BY-NC-SA,https://inaturalist-open-data.s3.amazonaws.com/photos/345447507/medium.jpeg,3bros2010,,1,0,FALSE,,"Okanagan-Similkameen, BC, Canada",49.17689833,-120.7736933,31,,,,31,,open,,subalpine larch,Larix lyallii,subalpine larch,Plantae,69848
196319523,10/2/19,2019-10-02 21:28:18 UTC,America/Vancouver,2787296,Taylor Justason,2024-01-11 01:53:49 UTC,2024-01-11 03:43:12 UTC,research,CC-BY-NC,https://inaturalist-open-data.s3.amazonaws.com/photos/345600054/medium.jpg,,,2,0,FALSE,3,"Cathedral Park, Okanagan-Similkameen, BC, CA",49.04587429,-120.1924355,26,,,,26,,open,,subalpine larch,Larix lyallii,subalpine larch,Plantae,69848
196405004,8/26/22,2022-08-26 17:51:15 UTC,Pacific Time (US & Canada),7627712,,2024-01-12 05:22:29 UTC,2024-01-12 06:14:19 UTC,research,CC-BY-NC,https://inaturalist-open-data.s3.amazonaws.com/photos/345778345/medium.jpg,,,1,0,FALSE,3,"Okanogan - Wenatchee National Forest, Marblemount, WA, US",48.51008333,-120.7662583,4,,,,4,,open,,subalpine larch,Larix lyallii,subalpine larch,Plantae,69848
196843676,9/21/23,2023-09-21 14:59:00 UTC,Pacific Time (US & Canada),1657037,Christopher J. Earle,2024-01-16 15:33:13 UTC,2024-01-17 00:17:57 UTC,research,CC-BY-NC,https://inaturalist-open-data.s3.amazonaws.com/photos/346538683/medium.jpg,"Autumn-color, foliage, in-habitat, seed-cone",,1,0,FALSE,,"Okanogan County, WA, USA",48.63249004,-120.4034373,,,,,,,open,,subalpine larch,Larix lyallii,subalpine larch,Plantae,69848
196896864,7/1/23,2023-07-01 14:56:00 UTC,Pacific Time (US & Canada),2165875,Toby Orzano,2024-01-17 06:21:11 UTC,2024-01-17 07:06:02 UTC,research,,https://static.inaturalist.org/photos/346645851/medium.jpg,,,2,0,FALSE,,"Pasayten Wilderness, WA, USA",48.97420592,-120.151146,2,,,,2,,open,,subalpine larch,Larix lyallii,subalpine larch,Plantae,69848
197019789,9/30/23,2023-09-30 18:14:56 UTC,Pacific Time (US & Canada),5639435,Sam Beaumont,2024-01-18 22:29:30 UTC,2024-01-19 03:17:56 UTC,research,CC-BY,https://inaturalist-open-data.s3.amazonaws.com/photos/346897050/medium.jpg,,,1,0,FALSE,3,"Okanogan - Wenatchee National Forest, Marblemount, WA, US",48.55213,-120.7091217,5,,,,5,,open,,Larix lyallii,Larix lyallii,subalpine larch,Plantae,69848
197019796,9/30/23,2023-09-30 18:17:37 UTC,Pacific Time (US & Canada),5639435,Sam Beaumont,2024-01-18 22:29:42 UTC,2024-01-19 03:17:48 UTC,research,CC-BY,https://inaturalist-open-data.s3.amazonaws.com/photos/346897071/medium.jpg,,,1,0,FALSE,3,"Okanogan - Wenatchee National Forest, Marblemount, WA, US",48.55032,-120.7091917,5,,,,5,,open,,Larix lyallii,Larix lyallii,subalpine larch,Plantae,69848
197020257,9/30/23,2023-09-30 18:21:26 UTC,Pacific Time (US & Canada),5639435,Sam Beaumont,2024-01-18 22:36:44 UTC,2024-01-19 03:17:14 UTC,research,CC-BY,https://inaturalist-open-data.s3.amazonaws.com/photos/346898044/medium.jpg,,,1,0,FALSE,3,"Okanogan - Wenatchee National Forest, Marblemount, WA, US",48.55188833,-120.7062833,10,,,,10,,open,,Larix lyallii,Larix lyallii,subalpine larch,Plantae,69848
197020271,9/30/23,2023-09-30 18:22:30 UTC,Pacific Time (US & Canada),5639435,Sam Beaumont,2024-01-18 22:36:59 UTC,2024-01-19 03:17:04 UTC,research,CC-BY,https://inaturalist-open-data.s3.amazonaws.com/photos/346898069/medium.jpg,,,1,0,FALSE,3,"Okanogan - Wenatchee National Forest, Marblemount, WA, US",48.55112,-120.7066633,10,,,,10,,open,,Larix lyallii,Larix lyallii,subalpine larch,Plantae,69848
197020280,9/30/23,2023-09-30 18:22:35 UTC,Pacific Time (US & Canada),5639435,Sam Beaumont,2024-01-18 22:37:10 UTC,2024-01-19 03:16:37 UTC,research,CC-BY,https://inaturalist-open-data.s3.amazonaws.com/photos/346898093/medium.jpg,,,1,0,FALSE,3,"Okanogan - Wenatchee National Forest, Marblemount, WA, US",48.55112,-120.7066633,10,,,,10,,open,,Larix lyallii,Larix lyallii,subalpine larch,Plantae,69848
197037179,9/30/23,2023-09-30 18:28:11 UTC,Pacific Time (US & Canada),5639435,Sam Beaumont,2024-01-19 03:37:39 UTC,2024-01-19 05:32:05 UTC,research,CC-BY,https://inaturalist-open-data.s3.amazonaws.com/photos/346933398/medium.jpg,,,1,0,FALSE,3,"Okanogan - Wenatchee National Forest, Marblemount, WA, US",48.553405,-120.7056967,5,,,,5,,open,,Larix lyallii,Larix lyallii,subalpine larch,Plantae,69848
197037242,9/30/23,2023-09-30 18:30:20 UTC,Pacific Time (US & Canada),5639435,Sam Beaumont,2024-01-19 03:38:07 UTC,2024-01-19 05:31:27 UTC,research,CC-BY,https://inaturalist-open-data.s3.amazonaws.com/photos/346933470/medium.jpg,,,1,0,FALSE,3,"Okanogan - Wenatchee National Forest, Marblemount, WA, US",48.55295333,-120.704955,5,,,,5,,open,,Larix lyallii,Larix lyallii,subalpine larch,Plantae,69848
197037244,9/30/23,2023-09-30 18:33:28 UTC,Pacific Time (US & Canada),5639435,Sam Beaumont,2024-01-19 03:38:14 UTC,2024-01-19 05:31:21 UTC,research,CC-BY,https://inaturalist-open-data.s3.amazonaws.com/photos/346933491/medium.jpg,,,1,0,FALSE,3,"Okanogan - Wenatchee National Forest, Marblemount, WA, US",48.55328,-120.70437,5,,,,5,,open,,Larix lyallii,Larix lyallii,subalpine larch,Plantae,69848
197037565,9/30/23,2023-09-30 18:34:05 UTC,Pacific Time (US & Canada),5639435,Sam Beaumont,2024-01-19 03:47:09 UTC,2024-01-19 05:30:45 UTC,research,CC-BY,https://inaturalist-open-data.s3.amazonaws.com/photos/346934495/medium.jpg,,,1,0,FALSE,3,"Okanogan - Wenatchee National Forest, Marblemount, WA, US",48.55363833,-120.70423,5,,,,5,,open,,Larix lyallii,Larix lyallii,subalpine larch,Plantae,69848
197037582,9/30/23,2023-09-30 18:36:32 UTC,Pacific Time (US & Canada),5639435,Sam Beaumont,2024-01-19 03:47:27 UTC,2024-01-19 05:30:43 UTC,research,CC-BY,https://inaturalist-open-data.s3.amazonaws.com/photos/346934778/medium.jpg,,,1,0,FALSE,3,"Okanogan - Wenatchee National Forest, Marblemount, WA, US",48.55477167,-120.7045283,5,,,,5,,open,,Larix lyallii,Larix lyallii,subalpine larch,Plantae,69848
197037599,9/30/23,2023-09-30 18:36:59 UTC,Pacific Time (US & Canada),5639435,Sam Beaumont,2024-01-19 03:48:09 UTC,2024-01-19 05:30:16 UTC,research,CC-BY,https://inaturalist-open-data.s3.amazonaws.com/photos/346934589/medium.jpg,,,1,0,FALSE,3,"Okanogan - Wenatchee National Forest, Marblemount, WA, US",48.55483333,-120.704925,5,,,,5,,open,,Larix lyallii,Larix lyallii,subalpine larch,Plantae,69848
197037670,9/30/23,2023-09-30 18:37:30 UTC,Pacific Time (US & Canada),5639435,Sam Beaumont,2024-01-19 03:48:59 UTC,2024-01-19 05:30:11 UTC,research,CC-BY,https://inaturalist-open-data.s3.amazonaws.com/photos/346934703/medium.jpg,,,1,0,FALSE,3,"Okanogan - Wenatchee National Forest, Marblemount, WA, US",48.55480333,-120.7054133,5,,,,5,,open,,Larix lyallii,Larix lyallii,subalpine larch,Plantae,69848
197037967,9/30/23,2023-09-30 18:39:46 UTC,Pacific Time (US & Canada),5639435,Sam Beaumont,2024-01-19 03:53:16 UTC,2024-01-19 05:30:01 UTC,research,CC-BY,https://inaturalist-open-data.s3.amazonaws.com/photos/346935100/medium.jpg,,,1,0,FALSE,3,"Okanogan - Wenatchee National Forest, Marblemount, WA, US",48.55533333,-120.704155,5,,,,5,,open,,Larix lyallii,Larix lyallii,subalpine larch,Plantae,69848
197037991,9/30/23,2023-09-30 18:41:01 UTC,Pacific Time (US & Canada),5639435,Sam Beaumont,2024-01-19 03:53:28 UTC,2024-01-19 05:29:58 UTC,research,CC-BY,https://inaturalist-open-data.s3.amazonaws.com/photos/346935182/medium.jpg,,,1,0,FALSE,3,"Okanogan - Wenatchee National Forest, Marblemount, WA, US",48.55558,-120.70327,5,,,,5,,open,,Larix lyallii,Larix lyallii,subalpine larch,Plantae,69848
197038357,9/30/23,2023-09-30 18:41:16 UTC,Pacific Time (US & Canada),5639435,Sam Beaumont,2024-01-19 03:58:50 UTC,2024-01-19 05:29:21 UTC,research,CC-BY,https://inaturalist-open-data.s3.amazonaws.com/photos/346935729/medium.jpg,,,1,0,FALSE,3,"Okanogan - Wenatchee National Forest, Marblemount, WA, US",48.55551667,-120.70317,5,,,,5,,open,,Larix lyallii,Larix lyallii,subalpine larch,Plantae,69848
197038397,9/30/23,2023-09-30 18:45:27 UTC,Pacific Time (US & Canada),5639435,Sam Beaumont,2024-01-19 03:59:08 UTC,2024-01-19 05:29:18 UTC,research,CC-BY,https://inaturalist-open-data.s3.amazonaws.com/photos/346935749/medium.jpg,,,1,0,FALSE,3,"Okanogan - Wenatchee National Forest, Mazama, WA, US",48.55494667,-120.700195,5,,,,5,,open,,Larix lyallii,Larix lyallii,subalpine larch,Plantae,69848
197038660,9/30/23,2023-09-30 18:48:18 UTC,Pacific Time (US & Canada),5639435,Sam Beaumont,2024-01-19 04:03:50 UTC,2024-01-19 05:29:13 UTC,research,CC-BY,https://inaturalist-open-data.s3.amazonaws.com/photos/346936241/medium.jpg,,,1,0,FALSE,3,"Okanogan - Wenatchee National Forest, Mazama, WA, US",48.55595833,-120.6987083,5,,,,5,,open,,Larix lyallii,Larix lyallii,subalpine larch,Plantae,69848
197038665,9/30/23,2023-09-30 18:59:40 UTC,Pacific Time (US & Canada),5639435,Sam Beaumont,2024-01-19 04:04:08 UTC,2024-01-19 05:28:54 UTC,research,CC-BY,https://inaturalist-open-data.s3.amazonaws.com/photos/346936262/medium.jpg,,,1,0,FALSE,3,"Okanogan - Wenatchee National Forest, Mazama, WA, US",48.557645,-120.6962667,5,,,,5,,open,,Larix lyallii,Larix lyallii,subalpine larch,Plantae,69848
197038940,9/30/23,2023-09-30 19:05:54 UTC,Pacific Time (US & Canada),5639435,Sam Beaumont,2024-01-19 04:09:29 UTC,2024-01-19 05:28:18 UTC,research,CC-BY,https://inaturalist-open-data.s3.amazonaws.com/photos/346936998/medium.jpg,,,1,0,FALSE,3,"Okanogan - Wenatchee National Forest, Mazama, WA, US",48.558075,-120.6911383,5,,,,5,,open,,Larix lyallii,Larix lyallii,subalpine larch,Plantae,69848
197039094,9/30/23,2023-09-30 19:08:05 UTC,Pacific Time (US & Canada),5639435,Sam Beaumont,2024-01-19 04:13:47 UTC,2024-01-19 05:27:28 UTC,research,CC-BY,https://inaturalist-open-data.s3.amazonaws.com/photos/346937563/medium.jpg,,,1,0,FALSE,3,"Okanogan - Wenatchee National Forest, Mazama, WA, US",48.55746333,-120.6896883,5,,,,5,,open,,Larix lyallii,Larix lyallii,subalpine larch,Plantae,69848
197039100,9/30/23,2023-09-30 19:08:07 UTC,Pacific Time (US & Canada),5639435,Sam Beaumont,2024-01-19 04:13:59 UTC,2024-01-19 05:27:25 UTC,research,CC-BY,https://inaturalist-open-data.s3.amazonaws.com/photos/346937583/medium.jpg,,,1,0,FALSE,3,"Okanogan - Wenatchee National Forest, Mazama, WA, US",48.55746333,-120.6896883,5,,,,5,,open,,Larix lyallii,Larix lyallii,subalpine larch,Plantae,69848
197039107,9/30/23,2023-09-30 19:08:09 UTC,Pacific Time (US & Canada),5639435,Sam Beaumont,2024-01-19 04:14:08 UTC,2024-01-19 05:27:11 UTC,research,CC-BY,https://inaturalist-open-data.s3.amazonaws.com/photos/346937606/medium.jpg,,,1,0,FALSE,3,"Okanogan - Wenatchee National Forest, Mazama, WA, US",48.55746333,-120.6896833,5,,,,5,,open,,Larix lyallii,Larix lyallii,subalpine larch,Plantae,69848
197039350,9/30/23,2023-09-30 19:08:39 UTC,Pacific Time (US & Canada),5639435,Sam Beaumont,2024-01-19 04:17:31 UTC,2024-01-19 05:26:58 UTC,research,CC-BY,https://inaturalist-open-data.s3.amazonaws.com/photos/346937895/medium.jpg,,,1,0,FALSE,3,"Okanogan - Wenatchee National Forest, Mazama, WA, US",48.55778,-120.689605,5,,,,5,,open,,Larix lyallii,Larix lyallii,subalpine larch,Plantae,69848
197040309,9/30/23,2023-09-30 19:12:01 UTC,Pacific Time (US & Canada),5639435,Sam Beaumont,2024-01-19 04:36:59 UTC,2024-01-19 05:26:57 UTC,research,CC-BY,https://inaturalist-open-data.s3.amazonaws.com/photos/346939781/medium.jpg,,,1,0,FALSE,3,"Okanogan - Wenatchee National Forest, Mazama, WA, US",48.559995,-120.6904833,5,,,,5,,open,,Larix lyallii,Larix lyallii,subalpine larch,Plantae,69848
197040641,9/30/23,2023-09-30 19:15:02 UTC,Pacific Time (US & Canada),5639435,Sam Beaumont,2024-01-19 04:43:40 UTC,2024-01-19 05:26:52 UTC,research,CC-BY,https://inaturalist-open-data.s3.amazonaws.com/photos/346940378/medium.jpg,,Background,1,0,FALSE,3,"Okanogan - Wenatchee National Forest, Mazama, WA, US",48.561845,-120.6889717,5,,,,5,,open,,Larix lyallii,Larix lyallii,subalpine larch,Plantae,69848
197040646,9/30/23,2023-09-30 19:15:03 UTC,Pacific Time (US & Canada),5639435,Sam Beaumont,2024-01-19 04:43:50 UTC,2024-01-19 05:26:50 UTC,research,CC-BY,https://inaturalist-open-data.s3.amazonaws.com/photos/346940393/medium.jpg,,,1,0,FALSE,3,"Okanogan - Wenatchee National Forest, Mazama, WA, US",48.56185333,-120.6889717,5,,,,5,,open,,Larix lyallii,Larix lyallii,subalpine larch,Plantae,69848
197040654,9/30/23,2023-09-30 19:15:05 UTC,Pacific Time (US & Canada),5639435,Sam Beaumont,2024-01-19 04:43:59 UTC,2024-01-19 05:26:48 UTC,research,CC-BY,https://inaturalist-open-data.s3.amazonaws.com/photos/346940415/medium.jpg,,,1,0,FALSE,3,"Okanogan - Wenatchee National Forest, Mazama, WA, US",48.56184667,-120.68898,5,,,,5,,open,,Larix lyallii,Larix lyallii,subalpine larch,Plantae,69848
197040657,9/30/23,2023-09-30 19:17:03 UTC,Pacific Time (US & Canada),5639435,Sam Beaumont,2024-01-19 04:44:09 UTC,2024-01-19 05:26:45 UTC,research,CC-BY,https://inaturalist-open-data.s3.amazonaws.com/photos/346940429/medium.jpg,,,1,0,FALSE,3,"Okanogan - Wenatchee National Forest, Mazama, WA, US",48.56300333,-120.6879883,5,,,,5,,open,,Larix lyallii,Larix lyallii,subalpine larch,Plantae,69848
197040672,9/30/23,2023-09-30 19:22:51 UTC,Pacific Time (US & Canada),5639435,Sam Beaumont,2024-01-19 04:44:42 UTC,2024-01-19 18:18:18 UTC,research,CC-BY,https://inaturalist-open-data.s3.amazonaws.com/photos/346940484/medium.jpg,,,2,0,FALSE,3,"Okanogan - Wenatchee National Forest, Mazama, WA, US",48.56561333,-120.6854783,5,,,,5,,open,,Larix lyallii,Larix lyallii,subalpine larch,Plantae,69848
197069409,9/30/23,2023-09-30 19:24:26 UTC,Pacific Time (US & Canada),5639435,Sam Beaumont,2024-01-19 16:21:22 UTC,2024-01-19 18:18:09 UTC,research,CC-BY,https://inaturalist-open-data.s3.amazonaws.com/photos/346999447/medium.jpg,,,1,0,FALSE,3,"Okanogan - Wenatchee National Forest, Mazama, WA, US",48.56627167,-120.6857133,5,,,,5,,open,,Larix lyallii,Larix lyallii,subalpine larch,Plantae,69848
197069461,9/30/23,2023-09-30 19:25:21 UTC,Pacific Time (US & Canada),5639435,Sam Beaumont,2024-01-19 16:21:49 UTC,2024-01-19 18:17:36 UTC,research,CC-BY,https://inaturalist-open-data.s3.amazonaws.com/photos/346999517/medium.jpg,,Background,1,0,FALSE,3,"Okanogan - Wenatchee National Forest, Mazama, WA, US",48.56669667,-120.68612,5,,,,5,,open,,Larix lyallii,Larix lyallii,subalpine larch,Plantae,69848
197069805,9/30/23,2023-09-30 19:31:02 UTC,Pacific Time (US & Canada),5639435,Sam Beaumont,2024-01-19 16:26:44 UTC,2024-01-19 18:16:44 UTC,research,CC-BY,https://inaturalist-open-data.s3.amazonaws.com/photos/347000140/medium.jpg,,,1,0,FALSE,3,"Okanogan - Wenatchee National Forest, Mazama, WA, US",48.56746333,-120.6858283,5,,,,5,,open,,Larix lyallii,Larix lyallii,subalpine larch,Plantae,69848
197069814,9/30/23,2023-09-30 19:31:54 UTC,Pacific Time (US & Canada),5639435,Sam Beaumont,2024-01-19 16:26:59 UTC,2024-01-19 18:16:13 UTC,research,CC-BY,https://inaturalist-open-data.s3.amazonaws.com/photos/347000175/medium.jpg,,,1,0,FALSE,3,"Okanogan - Wenatchee National Forest, Mazama, WA, US",48.56788833,-120.6861033,5,,,,5,,open,,Larix lyallii,Larix lyallii,subalpine larch,Plantae,69848
197069826,9/30/23,2023-09-30 19:33:52 UTC,Pacific Time (US & Canada),5639435,Sam Beaumont,2024-01-19 16:27:10 UTC,2024-01-19 18:16:03 UTC,research,CC-BY,https://inaturalist-open-data.s3.amazonaws.com/photos/347000197/medium.jpg,,,1,0,FALSE,3,"Okanogan - Wenatchee National Forest, Mazama, WA, US",48.56878667,-120.68643,5,,,,5,,open,,Larix lyallii,Larix lyallii,subalpine larch,Plantae,69848
197070070,9/30/23,2023-09-30 19:34:55 UTC,Pacific Time (US & Canada),5639435,Sam Beaumont,2024-01-19 16:32:42 UTC,2024-01-19 18:15:54 UTC,research,CC-BY,https://inaturalist-open-data.s3.amazonaws.com/photos/347000825/medium.jpg,,,1,0,FALSE,3,"Okanogan - Wenatchee National Forest, Marblemount, WA, US",48.569545,-120.6865783,5,,,,5,,open,,Larix lyallii,Larix lyallii,subalpine larch,Plantae,69848
197070388,9/30/23,2023-09-30 19:52:55 UTC,Pacific Time (US & Canada),5639435,Sam Beaumont,2024-01-19 16:37:20 UTC,2024-01-19 18:14:15 UTC,research,CC-BY,https://inaturalist-open-data.s3.amazonaws.com/photos/347001754/medium.jpg,,,1,0,FALSE,3,"Okanogan - Wenatchee National Forest, Marblemount, WA, US",48.57059667,-120.6867533,50,,,,50,,open,,Larix lyallii,Larix lyallii,subalpine larch,Plantae,69848
197071003,9/30/23,2023-09-30 19:53:00 UTC,Pacific Time (US & Canada),5639435,Sam Beaumont,2024-01-19 16:46:22 UTC,2024-01-19 18:14:06 UTC,research,CC-BY,https://inaturalist-open-data.s3.amazonaws.com/photos/347002525/medium.jpg,,,1,0,FALSE,3,"Okanogan - Wenatchee National Forest, Mazama, WA, US",48.57050333,-120.6865833,5,,,,5,,open,,Larix lyallii,Larix lyallii,subalpine larch,Plantae,69848
197080533,9/30/23,2023-09-30 21:00:01 UTC,Pacific Time (US & Canada),5639435,Sam Beaumont,2024-01-19 19:22:03 UTC,2024-01-19 19:22:52 UTC,research,CC-BY,https://inaturalist-open-data.s3.amazonaws.com/photos/347020942/medium.jpg,,,1,0,FALSE,3,"Okanogan - Wenatchee National Forest, Marblemount, WA, US",48.58783,-120.7147917,30,,,,30,,open,,Larix lyallii,Larix lyallii,subalpine larch,Plantae,69848
197081085,9/30/23,2023-09-30 21:12:30 UTC,Pacific Time (US & Canada),5639435,Sam Beaumont,2024-01-19 19:31:10 UTC,2024-01-19 19:32:58 UTC,research,CC-BY,https://inaturalist-open-data.s3.amazonaws.com/photos/347022007/medium.jpg,,,1,0,FALSE,3,"Okanogan - Wenatchee National Forest, Marblemount, WA, US",48.59010333,-120.7188117,5,,,,5,,open,,Larix lyallii,Larix lyallii,subalpine larch,Plantae,69848
197081092,9/30/23,2023-09-30 21:13:28 UTC,Pacific Time (US & Canada),5639435,Sam Beaumont,2024-01-19 19:31:17 UTC,2024-01-19 19:32:57 UTC,research,CC-BY,https://inaturalist-open-data.s3.amazonaws.com/photos/347022013/medium.jpg,,,1,0,FALSE,3,"Okanogan - Wenatchee National Forest, Marblemount, WA, US",48.59051333,-120.7191467,5,,,,5,,open,,Larix lyallii,Larix lyallii,subalpine larch,Plantae,69848
197081163,9/30/23,2023-09-30 21:14:58 UTC,Pacific Time (US & Canada),5639435,Sam Beaumont,2024-01-19 19:31:44 UTC,2024-01-19 19:32:52 UTC,research,CC-BY,https://inaturalist-open-data.s3.amazonaws.com/photos/347022075/medium.jpg,,,1,0,FALSE,3,"Okanogan - Wenatchee National Forest, Marblemount, WA, US",48.59109167,-120.7200083,5,,,,5,,open,,Larix lyallii,Larix lyallii,subalpine larch,Plantae,69848
197180063,1/19/24,2024-01-19 19:14:19 UTC,America/Edmonton,3637268,Jon Reberlio,2024-01-20 23:44:25 UTC,2024-06-28 02:06:01 UTC,research,,https://static.inaturalist.org/photos/347219594/medium.jpeg,,,1,0,FALSE,2,"Exshaw, AB T0L 2C0, Canada",50.7234309,-115.2543487,,,,,,,open,gps,subalpine larch,Larix lyallii,subalpine larch,Plantae,69848
197239877,9/30/23,2023-09-30 21:18:06 UTC,Pacific Time (US & Canada),5639435,Sam Beaumont,2024-01-21 17:42:12 UTC,2024-01-21 22:24:56 UTC,research,CC-BY,https://inaturalist-open-data.s3.amazonaws.com/photos/347341029/medium.jpg,,,1,0,FALSE,3,"Okanogan - Wenatchee National Forest, Marblemount, WA, US",48.59247167,-120.72107,5,,,,5,,open,,Larix lyallii,Larix lyallii,subalpine larch,Plantae,69848
197239882,9/30/23,2023-09-30 21:19:31 UTC,Pacific Time (US & Canada),5639435,Sam Beaumont,2024-01-21 17:42:21 UTC,2024-01-21 22:24:51 UTC,research,CC-BY,https://inaturalist-open-data.s3.amazonaws.com/photos/347341053/medium.jpg,,,1,0,FALSE,3,"Okanogan - Wenatchee National Forest, Marblemount, WA, US",48.592475,-120.721955,5,,,,5,,open,,Larix lyallii,Larix lyallii,subalpine larch,Plantae,69848
197239888,9/30/23,2023-09-30 21:19:37 UTC,Pacific Time (US & Canada),5639435,Sam Beaumont,2024-01-21 17:42:29 UTC,2024-01-21 22:24:48 UTC,research,CC-BY,https://inaturalist-open-data.s3.amazonaws.com/photos/347341080/medium.jpg,,,1,0,FALSE,3,"Okanogan - Wenatchee National Forest, Marblemount, WA, US",48.59248,-120.721895,5,,,,5,,open,,Larix lyallii,Larix lyallii,subalpine larch,Plantae,69848
197263802,9/30/23,2023-09-30 21:19:45 UTC,Pacific Time (US & Canada),5639435,Sam Beaumont,2024-01-21 22:49:30 UTC,2024-01-22 03:51:58 UTC,research,CC-BY,https://inaturalist-open-data.s3.amazonaws.com/photos/347388208/medium.jpg,,,1,0,FALSE,3,"Okanogan - Wenatchee National Forest, Marblemount, WA, US",48.59246333,-120.7219,5,,,,5,,open,,Larix lyallii,Larix lyallii,subalpine larch,Plantae,69848
197263811,9/30/23,2023-09-30 21:26:56 UTC,Pacific Time (US & Canada),5639435,Sam Beaumont,2024-01-21 22:49:39 UTC,2024-01-22 03:51:57 UTC,research,CC-BY,https://inaturalist-open-data.s3.amazonaws.com/photos/347388242/medium.jpg,,,1,0,FALSE,3,"Okanogan - Wenatchee National Forest, Marblemount, WA, US",48.591305,-120.72242,50,,,,50,,open,,Larix lyallii,Larix lyallii,subalpine larch,Plantae,69848
197263818,9/30/23,2023-09-30 21:27:02 UTC,Pacific Time (US & Canada),5639435,Sam Beaumont,2024-01-21 22:49:47 UTC,2024-01-22 03:51:55 UTC,research,CC-BY,https://inaturalist-open-data.s3.amazonaws.com/photos/347388262/medium.jpg,,,1,0,FALSE,3,"Okanogan - Wenatchee National Forest, Marblemount, WA, US",48.591305,-120.72242,50,,,,50,,open,,Larix lyallii,Larix lyallii,subalpine larch,Plantae,69848
197263826,9/30/23,2023-09-30 21:33:48 UTC,Pacific Time (US & Canada),5639435,Sam Beaumont,2024-01-21 22:49:58 UTC,2024-01-22 03:51:51 UTC,research,CC-BY,https://inaturalist-open-data.s3.amazonaws.com/photos/347388285/medium.jpg,,,1,0,FALSE,3,"Okanogan - Wenatchee National Forest, Marblemount, WA, US",48.59227,-120.72245,5,,,,5,,open,,Larix lyallii,Larix lyallii,subalpine larch,Plantae,69848
197263835,9/30/23,2023-09-30 21:36:21 UTC,Pacific Time (US & Canada),5639435,Sam Beaumont,2024-01-21 22:50:06 UTC,2024-01-22 03:51:47 UTC,research,CC-BY,https://inaturalist-open-data.s3.amazonaws.com/photos/347388316/medium.jpg,,,1,0,FALSE,3,"Okanogan - Wenatchee National Forest, Marblemount, WA, US",48.59205333,-120.7234117,10,,,,10,,open,,Larix lyallii,Larix lyallii,subalpine larch,Plantae,69848
197264063,9/30/23,2023-09-30 22:02:30 UTC,Pacific Time (US & Canada),5639435,Sam Beaumont,2024-01-21 22:53:04 UTC,2024-01-22 03:51:45 UTC,research,CC-BY,https://inaturalist-open-data.s3.amazonaws.com/photos/347388968/medium.jpg,,Foreground,1,0,FALSE,3,"Okanogan - Wenatchee National Forest, Marblemount, WA, US",48.58868833,-120.7166283,5,,,,5,,open,,Larix lyallii,Larix lyallii,subalpine larch,Plantae,69848
197264393,9/30/23,2023-09-30 23:14:03 UTC,Pacific Time (US & Canada),5639435,Sam Beaumont,2024-01-21 22:57:32 UTC,2024-01-22 03:48:52 UTC,research,CC-BY,https://inaturalist-open-data.s3.amazonaws.com/photos/347389834/medium.jpg,,,1,0,FALSE,3,"Okanogan - Wenatchee National Forest, Marblemount, WA, US",48.56836667,-120.6864167,5,,,,5,,open,,Larix lyallii,Larix lyallii,subalpine larch,Plantae,69848
197264405,9/30/23,2023-09-30 23:16:28 UTC,Pacific Time (US & Canada),5639435,Sam Beaumont,2024-01-21 22:57:40 UTC,2024-01-22 03:48:50 UTC,research,CC-BY,https://inaturalist-open-data.s3.amazonaws.com/photos/347389858/medium.jpg,,,1,0,FALSE,3,"Okanogan - Wenatchee National Forest, Mazama, WA, US",48.56745333,-120.6857533,5,,,,5,,open,,Larix lyallii,Larix lyallii,subalpine larch,Plantae,69848
197264422,9/30/23,2023-09-30 23:16:29 UTC,Pacific Time (US & Canada),5639435,Sam Beaumont,2024-01-21 22:57:49 UTC,2024-01-22 03:48:47 UTC,research,CC-BY,https://inaturalist-open-data.s3.amazonaws.com/photos/347389880/medium.jpg,,,1,0,FALSE,3,"Okanogan - Wenatchee National Forest, Mazama, WA, US",48.56747,-120.685775,5,,,,5,,open,,Larix lyallii,Larix lyallii,subalpine larch,Plantae,69848
197264871,9/30/23,2023-09-30 23:27:37 UTC,Pacific Time (US & Canada),5639435,Sam Beaumont,2024-01-21 23:03:32 UTC,2024-01-22 03:48:27 UTC,research,CC-BY,https://inaturalist-open-data.s3.amazonaws.com/photos/347390805/medium.jpg,,,1,0,FALSE,3,"Okanogan - Wenatchee National Forest, Mazama, WA, US",48.565905,-120.684905,5,,,,5,,open,,Larix lyallii,Larix lyallii,subalpine larch,Plantae,69848
197264885,9/30/23,2023-09-30 23:28:46 UTC,Pacific Time (US & Canada),5639435,Sam Beaumont,2024-01-21 23:03:39 UTC,2024-01-22 03:47:21 UTC,research,CC-BY,https://inaturalist-open-data.s3.amazonaws.com/photos/347390830/medium.jpg,,,1,0,FALSE,3,"Okanogan - Wenatchee National Forest, Mazama, WA, US",48.56558333,-120.6856167,5,,,,5,,open,,Larix lyallii,Larix lyallii,subalpine larch,Plantae,69848
197265161,9/30/23,2023-09-30 23:29:29 UTC,Pacific Time (US & Canada),5639435,Sam Beaumont,2024-01-21 23:07:26 UTC,2024-01-22 03:47:18 UTC,research,CC-BY,https://inaturalist-open-data.s3.amazonaws.com/photos/347391543/medium.jpg,,,1,0,FALSE,3,"Okanogan - Wenatchee National Forest, Mazama, WA, US",48.56529167,-120.68605,5,,,,5,,open,,Larix lyallii,Larix lyallii,subalpine larch,Plantae,69848
197265208,9/30/23,2023-09-30 23:31:10 UTC,Pacific Time (US & Canada),5639435,Sam Beaumont,2024-01-21 23:07:59 UTC,2024-01-22 03:46:47 UTC,research,CC-BY,https://inaturalist-open-data.s3.amazonaws.com/photos/347391613/medium.jpg,,,1,0,FALSE,3,"Okanogan - Wenatchee National Forest, Marblemount, WA, US",48.56448667,-120.6870717,5,,,,5,,open,,Larix lyallii,Larix lyallii,subalpine larch,Plantae,69848
197265431,9/30/23,2023-09-30 23:58:22 UTC,Pacific Time (US & Canada),5639435,Sam Beaumont,2024-01-21 23:11:29 UTC,2024-01-22 03:44:56 UTC,research,CC-BY,https://inaturalist-open-data.s3.amazonaws.com/photos/347392132/medium.jpg,,,1,0,FALSE,3,"Okanogan - Wenatchee National Forest, Marblemount, WA, US",48.55552167,-120.70143,5,,,,5,,open,,Larix lyallii,Larix lyallii,subalpine larch,Plantae,69848
197265438,9/30/23,2023-10-01 00:10:23 UTC,Pacific Time (US & Canada),5639435,Sam Beaumont,2024-01-21 23:11:38 UTC,2024-01-22 03:44:54 UTC,research,CC-BY,https://inaturalist-open-data.s3.amazonaws.com/photos/347392153/medium.jpg,,Left,1,0,FALSE,3,"Okanogan - Wenatchee National Forest, Marblemount, WA, US",48.55200833,-120.7044533,5,,,,5,,open,,Larix lyallii,Larix lyallii,subalpine larch,Plantae,69848
197363018,8/2/15,2015-08-03 03:09:00 UTC,America/Vancouver,3396573,Steve Ansell,2024-01-23 04:15:26 UTC,2024-01-23 13:40:25 UTC,research,CC-BY-NC,https://inaturalist-open-data.s3.amazonaws.com/photos/347588863/medium.jpeg,,,1,0,FALSE,,"Okanagan-Similkameen, BC, Canada",49.06399114,-120.2061802,15,,,,15,,open,,subalpine larch,Larix lyallii,subalpine larch,Plantae,69848
197363815,8/3/15,2015-08-03 13:37:00 UTC,America/Vancouver,3396573,Steve Ansell,2024-01-23 04:33:45 UTC,2024-01-28 05:11:00 UTC,research,CC-BY-NC,https://inaturalist-open-data.s3.amazonaws.com/photos/347590710/medium.jpeg,,,2,0,FALSE,,"Okanagan-Similkameen, BC, Canada",49.05981886,-120.2037101,15,,,,15,,open,,subalpine larch,Larix lyallii,subalpine larch,Plantae,69848
197363986,8/3/15,2015-08-03 13:40:00 UTC,America/Vancouver,3396573,Steve Ansell,2024-01-23 04:37:05 UTC,2024-01-23 13:37:33 UTC,research,CC-BY-NC,https://inaturalist-open-data.s3.amazonaws.com/photos/347590971/medium.jpeg,,,2,0,FALSE,,"Okanagan-Similkameen, BC, Canada",49.0591798,-120.2055472,15,,,,15,,open,,subalpine larch,Larix lyallii,subalpine larch,Plantae,69848
197500179,8/3/15,2015-08-03 23:19:00 UTC,America/Vancouver,3396573,Steve Ansell,2024-01-25 00:35:39 UTC,2024-01-27 02:40:06 UTC,research,CC-BY-NC,https://inaturalist-open-data.s3.amazonaws.com/photos/347867974/medium.jpeg,,,1,0,FALSE,,"Okanagan-Similkameen, BC, Canada",49.06371616,-120.2037132,15,,,,15,,open,,subalpine larch,Larix lyallii,subalpine larch,Plantae,69848
197501388,8/4/15,2015-08-04 14:14:00 UTC,America/Vancouver,3396573,Steve Ansell,2024-01-25 00:57:43 UTC,2024-01-25 01:49:24 UTC,research,CC-BY-NC,https://inaturalist-open-data.s3.amazonaws.com/photos/347870403/medium.jpeg,,,1,0,FALSE,,"Okanagan-Similkameen, BC, Canada",49.04035761,-120.1918982,15,,,,15,,open,,subalpine larch,Larix lyallii,subalpine larch,Plantae,69848
197501422,8/4/15,2015-08-04 14:19:00 UTC,America/Vancouver,3396573,Steve Ansell,2024-01-25 00:58:31 UTC,2024-01-25 02:08:23 UTC,research,CC-BY-NC,https://inaturalist-open-data.s3.amazonaws.com/photos/347870479/medium.jpeg,,,1,0,FALSE,,"Okanagan-Similkameen, BC, Canada",49.04374358,-120.1920341,15,,,,15,,open,,subalpine larch,Larix lyallii,subalpine larch,Plantae,69848
198120462,7/15/23,2023-07-15 22:02:53 UTC,Pacific Time (US & Canada),6688023,Lucas Lochner Bravo,2024-02-01 08:58:27 UTC,2024-02-01 15:48:02 UTC,research,CC-BY-NC,https://inaturalist-open-data.s3.amazonaws.com/photos/349119643/medium.jpg,,,1,0,FALSE,3,"Okanogan - Wenatchee National Forest, Twisp, WA, US",48.24738667,-120.3391583,10,,,,10,,open,,subalpine larch,Larix lyallii,subalpine larch,Plantae,69848
199603967,2/17/24,2024-02-17 21:41:05 UTC,Mountain Time (US & Canada),3344711,Brian Smithers,2024-02-17 21:41:40 UTC,2024-02-24 15:31:40 UTC,research,,https://static.inaturalist.org/photos/352029492/medium.jpeg,,,1,0,FALSE,2,"Anaconda, MT 59711, USA",46.27354017,-113.1752982,8,,,,8,,open,,subalpine larch,Larix lyallii,subalpine larch,Plantae,69848
199699505,2/18/24,2024-02-18 18:03:02 UTC,America/Edmonton,7806453,Mackenzie Brush,2024-02-18 18:23:26 UTC,2024-02-21 18:25:16 UTC,research,,https://static.inaturalist.org/photos/352215761/medium.jpeg,,,1,0,FALSE,2,"Invermere, BC V0A 1K5, Canada",50.43244136,-116.2048956,8,,,,8,,open,,subalpine larch,Larix lyallii,subalpine larch,Plantae,69848
200489876,2/25/24,2024-02-25 21:02:45 UTC,America/Edmonton,461068,Lola Bird,2024-02-26 06:06:40 UTC,2024-06-27 06:00:46 UTC,research,,https://static.inaturalist.org/photos/353740273/medium.jpg,,,1,0,FALSE,3,"Lake Louise Ski Resort & Summer Gondola, Improvement District No. 9 Banff, AB, CA",51.45063333,-116.1335528,4,,,,4,,open,,subalpine larch,Larix lyallii,subalpine larch,Plantae,69848
203384809,10/8/23,2023-10-08 19:54:20 UTC,Pacific Time (US & Canada),7858103,,2024-03-21 19:23:23 UTC,2024-03-22 01:52:00 UTC,research,CC-BY-NC,https://inaturalist-open-data.s3.amazonaws.com/photos/359334868/medium.jpg,,to larch or not to larch,1,0,FALSE,3,"Okanogan - Wenatchee National Forest, Leavenworth, WA, US",48.508125,-120.6722033,53,,,,53,,open,,subalpine larch,Larix lyallii,subalpine larch,Plantae,69848
206807312,4/10/24,2024-04-10 21:35:40 UTC,Pacific Time (US & Canada),804493,,2024-04-12 17:20:08 UTC,2024-06-24 00:11:00 UTC,research,CC-BY-NC,https://inaturalist-open-data.s3.amazonaws.com/photos/365734594/medium.jpeg,,,2,0,FALSE,2,"Leavenworth, WA 98826, USA",47.4793434,-120.7935175,,,,,,,open,gps,subalpine larch,Larix lyallii,subalpine larch,Plantae,69848
215465012,9/30/23,2023-09-30 20:16:00 UTC,Pacific Time (US & Canada),1816805,Peter Zika,2024-05-13 10:11:17 UTC,2024-05-14 04:35:22 UTC,research,CC-BY-NC,https://inaturalist-open-data.s3.amazonaws.com/photos/380944225/medium.jpeg,,,1,0,FALSE,,"Pacific Crest Trail near Harts Pass, Whatcom County, Washington, USA",48.73247222,-120.6758806,4,,,,4,,open,,subalpine larch,Larix lyallii,subalpine larch,Plantae,69848
215465013,9/30/23,2023-09-30 19:09:00 UTC,Pacific Time (US & Canada),1816805,Peter Zika,2024-05-13 10:11:17 UTC,2024-05-14 04:35:18 UTC,research,CC-BY-NC,https://inaturalist-open-data.s3.amazonaws.com/photos/380944228/medium.jpeg,,,1,0,FALSE,,"Pacific Crest Trail near Harts Pass, Whatcom County, Washington, USA",48.732475,-120.6758722,4,,,,4,,open,,subalpine larch,Larix lyallii,subalpine larch,Plantae,69848
215465014,9/30/23,2023-09-30 22:37:00 UTC,Pacific Time (US & Canada),1816805,Peter Zika,2024-05-13 10:11:17 UTC,2024-05-13 12:41:10 UTC,research,CC-BY-NC,https://inaturalist-open-data.s3.amazonaws.com/photos/380944224/medium.jpeg,,,1,0,FALSE,,"Pacific Crest Trail near Harts Pass, Whatcom County, Washington, USA",48.73253333,-120.67585,10,,,,10,,open,,subalpine larch,Larix lyallii,subalpine larch,Plantae,69848
217625708,3/5/11,2011-03-06 07:05:00 UTC,Pacific Time (US & Canada),7599631,Josiah Chase,2024-05-23 03:17:37 UTC,2024-06-22 21:43:37 UTC,research,CC-BY-NC,https://inaturalist-open-data.s3.amazonaws.com/photos/385017638/medium.jpeg,,,1,0,FALSE,,"Whatcom County, WA, USA",48.72298738,-120.662856,50,,,,50,,open,,subalpine larch,Larix lyallii,subalpine larch,Plantae,69848
225372106,6/22/24,2024-06-22 20:25:40 UTC,Pacific Time (US & Canada),1510020,Aaron Wells,2024-06-26 19:57:18 UTC,2024-06-27 15:59:12 UTC,research,CC-BY-NC,https://inaturalist-open-data.s3.amazonaws.com/photos/399567287/medium.jpg,,,1,0,FALSE,3,"Okanogan - Wenatchee National Forest, Loomis, WA, US",48.71395333,-120.5586383,4,,,,4,,open,,subalpine larch,Larix lyallii,subalpine larch,Plantae,69848
226591153,7/1/24,2024-07-01 16:21:28 UTC,America/Vancouver,134551,Ryan Durand,2024-07-02 01:51:20 UTC,2024-07-10 03:29:55 UTC,research,CC-BY-NC,https://inaturalist-open-data.s3.amazonaws.com/photos/401884168/medium.jpg,,,1,0,FALSE,3,"E.C. Manning Park, Okanagan-Similkameen, BC, CA",49.10529717,-120.758955,4,,,,4,,open,,subalpine larch,Larix lyallii,subalpine larch,Plantae,69848
226703102,6/26/24,2024-06-26 19:01:11 UTC,America/Edmonton,6448460,,2024-07-02 16:03:35 UTC,2024-07-02 18:05:12 UTC,research,CC-BY-NC,https://inaturalist-open-data.s3.amazonaws.com/photos/402091318/medium.jpg,,,1,0,FALSE,3,"Banff National Park, Improvement District No. 9 Banff, AB, CA",51.41781167,-116.2418667,8,,,,8,,open,,subalpine larch,Larix lyallii,subalpine larch,Plantae,69848
228170136,7/3/24,2024-07-03 23:43:26 UTC,Pacific Time (US & Canada),8338245,Jon,2024-07-09 03:41:34 UTC,2024-07-10 19:20:11 UTC,research,,https://static.inaturalist.org/photos/404868534/medium.jpeg,,6000'-6500' elevation ,1,0,FALSE,2,"Leavenworth, WA 98826, USA",47.48247718,-120.7802592,41,,,,41,,open,gps,subalpine larch,Larix lyallii,subalpine larch,Plantae,69848